UF,feriados,feriado,nota,data,cidade_uf,lat,lon
TO,25/12/2025 - Natal,Natal,,2025-12-25,Ponte Alta do Tocantins - TO,-12.088669,-46.4776274
TO,20/11/2025 - Consciência Negra,Consciência Negra,,2025-11-20,Ponte Alta do Tocantins - TO,-12.088669,-46.4776274
TO,15/11/2025 - Proclamação da República,Proclamação da República,,2025-11-15,Ponte Alta do Tocantins - TO,-12.088669,-46.4776274
TO,02/11/2025 - Dia de Finados,Dia de Finados,,2025-11-02,Ponte Alta do Tocantins - TO,-12.088669,-46.4776274
TO,12/10/2025 - Nossa Senhora Aparecida,Nossa Senhora Aparecida,,2025-10-12,Ponte Alta do Tocantins - TO,-12.088669,-46.4776274
TO,05/10/2025 - Aniversário de Tocantins,Aniversário de Tocantins,,2025-10-05,Ponte Alta do Tocantins - TO,-12.088669,-46.4776274
TO,08/09/2025 - Padroeira de Tocantins,Padroeira de Tocantins,,2025-09-08,Ponte Alta do Tocantins - TO,-12.088669,-46.4776274
TO,07/09/2025 - Independência do Brasil,Independência do Brasil,,2025-09-07,Ponte Alta do Tocantins - TO,-12.088669,-46.4776274
TO,01/05/2025 - Dia do Trabalho,Dia do Trabalho,,2025-05-01,Ponte Alta do Tocantins - TO,-12.088669,-46.4776274
TO,21/04/2025 - Dia de Tiradentes,Dia de Tiradentes,,2025-04-21,Ponte Alta do Tocantins - TO,-12.088669,-46.4776274
TO,18/04/2025 - Sexta-Feira Santa,Sexta-Feira Santa,,2025-04-18,Ponte Alta do Tocantins - TO,-12.088669,-46.4776274
TO,01/01/2025 - Ano Novo,Ano Novo,,2025-01-01,Ponte Alta do Tocantins - TO,-12.088669,-46.4776274
TO,25/12/2025 - Natal,Natal,,2025-12-25,Novo Alegre - TO,-12.915134,-46.5740939
TO,15/11/2025 - Proclamação da República,Proclamação da República,,2025-11-15,Novo Alegre - TO,-12.915134,-46.5740939
TO,02/11/2025 - Dia de Finados,Dia de Finados,,2025-11-02,Novo Alegre - TO,-12.915134,-46.5740939
TO,12/10/2025 - Nossa Senhora Aparecida,Nossa Senhora Aparecida,,2025-10-12,Novo Alegre - TO,-12.915134,-46.5740939
TO,05/10/2025 - Aniversário de Tocantins,Aniversário de Tocantins,,2025-10-05,Novo Alegre - TO,-12.915134,-46.5740939
TO,08/09/2025 - Padroeira de Tocantins,Padroeira de Tocantins,,2025-09-08,Novo Alegre - TO,-12.915134,-46.5740939
TO,07/09/2025 - Independência do Brasil,Independência do Brasil,,2025-09-07,Novo Alegre - TO,-12.915134,-46.5740939
TO,01/05/2025 - Dia do Trabalho,Dia do Trabalho,,2025-05-01,Novo Alegre - TO,-12.915134,-46.5740939
TO,21/04/2025 - Dia de Tiradentes,Dia de Tiradentes,,2025-04-21,Novo Alegre - TO,-12.915134,-46.5740939
TO,18/04/2025 - Sexta-Feira Santa,Sexta-Feira Santa,,2025-04-18,Novo Alegre - TO,-12.915134,-46.5740939
TO,01/01/2025 - Ano Novo,Ano Novo,,2025-01-01,Novo Alegre - TO,-12.915134,-46.5740939
TO,25/12/2025 - Natal,Natal,,2025-12-25,Novo Jardim - TO,-11.8199253,-46.6254107
TO,15/11/2025 - Proclamação da República,Proclamação da República,,2025-11-15,Novo Jardim - TO,-11.8199253,-46.6254107
TO,02/11/2025 - Dia de Finados,Dia de Finados,,2025-11-02,Novo Jardim - TO,-11.8199253,-46.6254107
TO,12/10/2025 - Nossa Senhora Aparecida,Nossa Senhora Aparecida,,2025-10-12,Novo Jardim - TO,-11.8199253,-46.6254107
TO,05/10/2025 - Aniversário de Tocantins,Aniversário de Tocantins,,2025-10-05,Novo Jardim - TO,-11.8199253,-46.6254107
TO,08/09/2025 - Padroeira de Tocantins,Padroeira de Tocantins,,2025-09-08,Novo Jardim - TO,-11.8199253,-46.6254107
TO,07/09/2025 - Independência do Brasil,Independência do Brasil,,2025-09-07,Novo Jardim - TO,-11.8199253,-46.6254107
TO,01/05/2025 - Dia do Trabalho,Dia do Trabalho,,2025-05-01,Novo Jardim - TO,-11.8199253,-46.6254107
TO,21/04/2025 - Dia de Tiradentes,Dia de Tiradentes,,2025-04-21,Novo Jardim - TO,-11.8199253,-46.6254107
TO,18/04/2025 - Sexta-Feira Santa,Sexta-Feira Santa,,2025-04-18,Novo Jardim - TO,-11.8199253,-46.6254107
TO,01/01/2025 - Ano Novo,Ano Novo,,2025-01-01,Novo Jardim - TO,-11.8199253,-46.6254107
TO,25/12/2025 - Natal,Natal,,2025-12-25,Palmas - TO,-10.2918921,-48.3591819
TO,15/11/2025 - Proclamação da República,Proclamação da República,,2025-11-15,Palmas - TO,-10.2918921,-48.3591819
TO,02/11/2025 -  Dia de Finados, Dia de Finados,,2025-11-02,Palmas - TO,-10.2918921,-48.3591819
TO,02/11/2025 - Dia de Finados,Dia de Finados,,2025-11-02,Palmas - TO,-10.2918921,-48.3591819
TO,12/10/2025 - Nossa Senhora Aparecida,Nossa Senhora Aparecida,,2025-10-12,Palmas - TO,-10.2918921,-48.3591819
TO,05/10/2025 - Aniversário de Tocantins,Aniversário de Tocantins,,2025-10-05,Palmas - TO,-10.2918921,-48.3591819
TO,08/09/2025 - Padroeira de Tocantins,Padroeira de Tocantins,,2025-09-08,Palmas - TO,-10.2918921,-48.3591819
TO,07/09/2025 - Independência do Brasil,Independência do Brasil,,2025-09-07,Palmas - TO,-10.2918921,-48.3591819
TO,20/05/2025 - Aniversário de Palmas,Aniversário de Palmas,,2025-05-20,Palmas - TO,-10.2918921,-48.3591819
TO,01/05/2025 - Dia do Trabalho,Dia do Trabalho,,2025-05-01,Palmas - TO,-10.2918921,-48.3591819
TO,21/04/2025 - Dia de Tiradentes,Dia de Tiradentes,,2025-04-21,Palmas - TO,-10.2918921,-48.3591819
TO,18/04/2025 - Sexta-feira Santa,Sexta-feira Santa,,2025-04-18,Palmas - TO,-10.2918921,-48.3591819
TO,18/04/2025 - Sexta-Feira Santa,Sexta-Feira Santa,,2025-04-18,Palmas - TO,-10.2918921,-48.3591819
TO,19/03/2025 - São José,São José,,2025-03-19,Palmas - TO,-10.2918921,-48.3591819
TO,01/01/2025 - Ano Novo,Ano Novo,,2025-01-01,Palmas - TO,-10.2918921,-48.3591819
TO,25/12/2025 - Natal,Natal,,2025-12-25,Palmeirante - TO,-7.8579518,-47.9287615
TO,15/11/2025 - Proclamação da República,Proclamação da República,,2025-11-15,Palmeirante - TO,-7.8579518,-47.9287615
TO,02/11/2025 - Dia de Finados,Dia de Finados,,2025-11-02,Palmeirante - TO,-7.8579518,-47.9287615
TO,12/10/2025 - Nossa Senhora Aparecida,Nossa Senhora Aparecida,,2025-10-12,Palmeirante - TO,-7.8579518,-47.9287615
TO,05/10/2025 - Aniversário de Tocantins,Aniversário de Tocantins,,2025-10-05,Palmeirante - TO,-7.8579518,-47.9287615
TO,08/09/2025 - Padroeira de Tocantins,Padroeira de Tocantins,,2025-09-08,Palmeirante - TO,-7.8579518,-47.9287615
TO,07/09/2025 - Independência do Brasil,Independência do Brasil,,2025-09-07,Palmeirante - TO,-7.8579518,-47.9287615
TO,01/05/2025 - Dia do Trabalho,Dia do Trabalho,,2025-05-01,Palmeirante - TO,-7.8579518,-47.9287615
TO,21/04/2025 - Dia de Tiradentes,Dia de Tiradentes,,2025-04-21,Palmeirante - TO,-7.8579518,-47.9287615
TO,18/04/2025 - Sexta-Feira Santa,Sexta-Feira Santa,,2025-04-18,Palmeirante - TO,-7.8579518,-47.9287615
TO,01/01/2025 - Ano Novo,Ano Novo,,2025-01-01,Palmeirante - TO,-7.8579518,-47.9287615
TO,25/12/2025 - Natal,Natal,,2025-12-25,Palmeiras do Tocantins - TO,-6.6096035,-47.546399
TO,15/11/2025 - Proclamação da República,Proclamação da República,,2025-11-15,Palmeiras do Tocantins - TO,-6.6096035,-47.546399
TO,02/11/2025 - Dia de Finados,Dia de Finados,,2025-11-02,Palmeiras do Tocantins - TO,-6.6096035,-47.546399
TO,12/10/2025 - Nossa Senhora Aparecida,Nossa Senhora Aparecida,,2025-10-12,Palmeiras do Tocantins - TO,-6.6096035,-47.546399
TO,05/10/2025 - Aniversário de Tocantins,Aniversário de Tocantins,,2025-10-05,Palmeiras do Tocantins - TO,-6.6096035,-47.546399
TO,08/09/2025 - Padroeira de Tocantins,Padroeira de Tocantins,,2025-09-08,Palmeiras do Tocantins - TO,-6.6096035,-47.546399
TO,07/09/2025 - Independência do Brasil,Independência do Brasil,,2025-09-07,Palmeiras do Tocantins - TO,-6.6096035,-47.546399
TO,01/05/2025 - Dia do Trabalho,Dia do Trabalho,,2025-05-01,Palmeiras do Tocantins - TO,-6.6096035,-47.546399
TO,21/04/2025 - Dia de Tiradentes,Dia de Tiradentes,,2025-04-21,Palmeiras do Tocantins - TO,-6.6096035,-47.546399
TO,18/04/2025 - Sexta-Feira Santa,Sexta-Feira Santa,,2025-04-18,Palmeiras do Tocantins - TO,-6.6096035,-47.546399
TO,01/01/2025 - Ano Novo,Ano Novo,,2025-01-01,Palmeiras do Tocantins - TO,-6.6096035,-47.546399
TO,25/12/2025 - Natal,Natal,,2025-12-25,Pedro Afonso - TO,-8.9924346,-48.1759067
TO,15/11/2025 - Proclamação da República,Proclamação da República,,2025-11-15,Pedro Afonso - TO,-8.9924346,-48.1759067
TO,02/11/2025 - Dia de Finados,Dia de Finados,,2025-11-02,Pedro Afonso - TO,-8.9924346,-48.1759067
TO,12/10/2025 - Nossa Senhora Aparecida,Nossa Senhora Aparecida,,2025-10-12,Pedro Afonso - TO,-8.9924346,-48.1759067
TO,05/10/2025 - Aniversário de Tocantins,Aniversário de Tocantins,,2025-10-05,Pedro Afonso - TO,-8.9924346,-48.1759067
TO,08/09/2025 - Padroeira de Tocantins,Padroeira de Tocantins,,2025-09-08,Pedro Afonso - TO,-8.9924346,-48.1759067
TO,07/09/2025 - Independência do Brasil,Independência do Brasil,,2025-09-07,Pedro Afonso - TO,-8.9924346,-48.1759067
TO,15/07/2025 - Feriado Municipal,Feriado Municipal,,2025-07-15,Pedro Afonso - TO,-8.9924346,-48.1759067
TO,29/06/2025 - Feriado Municipal,Feriado Municipal,,2025-06-29,Pedro Afonso - TO,-8.9924346,-48.1759067
TO,01/05/2025 - Dia do Trabalho,Dia do Trabalho,,2025-05-01,Pedro Afonso - TO,-8.9924346,-48.1759067
TO,21/04/2025 - Dia de Tiradentes,Dia de Tiradentes,,2025-04-21,Pedro Afonso - TO,-8.9924346,-48.1759067
TO,18/04/2025 - Sexta-Feira Santa,Sexta-Feira Santa,,2025-04-18,Pedro Afonso - TO,-8.9924346,-48.1759067
TO,01/01/2025 - Ano Novo,Ano Novo,,2025-01-01,Pedro Afonso - TO,-8.9924346,-48.1759067
TO,25/12/2025 - Natal,Natal,,2025-12-25,Peixe - TO,-12.0317483,-48.5378767
TO,15/11/2025 - Proclamação da República,Proclamação da República,,2025-11-15,Peixe - TO,-12.0317483,-48.5378767
TO,02/11/2025 - Dia de Finados,Dia de Finados,,2025-11-02,Peixe - TO,-12.0317483,-48.5378767
TO,12/10/2025 - Nossa Senhora Aparecida,Nossa Senhora Aparecida,,2025-10-12,Peixe - TO,-12.0317483,-48.5378767
TO,05/10/2025 - Aniversário de Tocantins,Aniversário de Tocantins,,2025-10-05,Peixe - TO,-12.0317483,-48.5378767
TO,08/09/2025 - Padroeira de Tocantins,Padroeira de Tocantins,,2025-09-08,Peixe - TO,-12.0317483,-48.5378767
TO,07/09/2025 - Independência do Brasil,Independência do Brasil,,2025-09-07,Peixe - TO,-12.0317483,-48.5378767
TO,15/08/2025 - Feriado Municipal,Feriado Municipal,,2025-08-15,Peixe - TO,-12.0317483,-48.5378767
TO,20/06/2025 - Feriado Municipal,Feriado Municipal,,2025-06-20,Peixe - TO,-12.0317483,-48.5378767
TO,01/05/2025 - Dia do Trabalho,Dia do Trabalho,,2025-05-01,Peixe - TO,-12.0317483,-48.5378767
TO,21/04/2025 - Dia de Tiradentes,Dia de Tiradentes,,2025-04-21,Peixe - TO,-12.0317483,-48.5378767
TO,18/04/2025 - Sexta-Feira Santa,Sexta-Feira Santa,,2025-04-18,Peixe - TO,-12.0317483,-48.5378767
TO,01/01/2025 - Ano Novo,Ano Novo,,2025-01-01,Peixe - TO,-12.0317483,-48.5378767
TO,25/12/2025 - Natal,Natal,,2025-12-25,Pequizeiro - TO,-8.5969264,-48.931545
TO,15/11/2025 - Proclamação da República,Proclamação da República,,2025-11-15,Pequizeiro - TO,-8.5969264,-48.931545
TO,02/11/2025 - Dia de Finados,Dia de Finados,,2025-11-02,Pequizeiro - TO,-8.5969264,-48.931545
TO,12/10/2025 - Nossa Senhora Aparecida,Nossa Senhora Aparecida,,2025-10-12,Pequizeiro - TO,-8.5969264,-48.931545
TO,05/10/2025 - Aniversário de Tocantins,Aniversário de Tocantins,,2025-10-05,Pequizeiro - TO,-8.5969264,-48.931545
TO,08/09/2025 - Padroeira de Tocantins,Padroeira de Tocantins,,2025-09-08,Pequizeiro - TO,-8.5969264,-48.931545
TO,07/09/2025 - Independência do Brasil,Independência do Brasil,,2025-09-07,Pequizeiro - TO,-8.5969264,-48.931545
TO,01/05/2025 - Dia do Trabalho,Dia do Trabalho,,2025-05-01,Pequizeiro - TO,-8.5969264,-48.931545
TO,21/04/2025 - Dia de Tiradentes,Dia de Tiradentes,,2025-04-21,Pequizeiro - TO,-8.5969264,-48.931545
TO,18/04/2025 - Sexta-Feira Santa,Sexta-Feira Santa,,2025-04-18,Pequizeiro - TO,-8.5969264,-48.931545
TO,01/01/2025 - Ano Novo,Ano Novo,,2025-01-01,Pequizeiro - TO,-8.5969264,-48.931545
TO,25/12/2025 - Natal,Natal,,2025-12-25,Pindorama do Tocantins - TO,-11.131074,-47.57263
TO,15/11/2025 - Proclamação da República,Proclamação da República,,2025-11-15,Pindorama do Tocantins - TO,-11.131074,-47.57263
TO,02/11/2025 - Dia de Finados,Dia de Finados,,2025-11-02,Pindorama do Tocantins - TO,-11.131074,-47.57263
TO,12/10/2025 - Nossa Senhora Aparecida,Nossa Senhora Aparecida,,2025-10-12,Pindorama do Tocantins - TO,-11.131074,-47.57263
TO,05/10/2025 - Aniversário de Tocantins,Aniversário de Tocantins,,2025-10-05,Pindorama do Tocantins - TO,-11.131074,-47.57263
TO,08/09/2025 - Padroeira de Tocantins,Padroeira de Tocantins,,2025-09-08,Pindorama do Tocantins - TO,-11.131074,-47.57263
TO,07/09/2025 - Independência do Brasil,Independência do Brasil,,2025-09-07,Pindorama do Tocantins - TO,-11.131074,-47.57263
TO,01/05/2025 - Dia do Trabalho,Dia do Trabalho,,2025-05-01,Pindorama do Tocantins - TO,-11.131074,-47.57263
TO,21/04/2025 - Dia de Tiradentes,Dia de Tiradentes,,2025-04-21,Pindorama do Tocantins - TO,-11.131074,-47.57263
TO,18/04/2025 - Sexta-Feira Santa,Sexta-Feira Santa,,2025-04-18,Pindorama do Tocantins - TO,-11.131074,-47.57263
TO,01/01/2025 - Ano Novo,Ano Novo,,2025-01-01,Pindorama do Tocantins - TO,-11.131074,-47.57263
TO,25/12/2025 - Natal,Natal,,2025-12-25,Novo Acordo - TO,-9.964658,-47.6762804
TO,15/11/2025 - Proclamação da República,Proclamação da República,,2025-11-15,Novo Acordo - TO,-9.964658,-47.6762804
TO,02/11/2025 - Dia de Finados,Dia de Finados,,2025-11-02,Novo Acordo - TO,-9.964658,-47.6762804
TO,12/10/2025 - Nossa Senhora Aparecida,Nossa Senhora Aparecida,,2025-10-12,Novo Acordo - TO,-9.964658,-47.6762804
TO,05/10/2025 - Aniversário de Tocantins,Aniversário de Tocantins,,2025-10-05,Novo Acordo - TO,-9.964658,-47.6762804
TO,08/09/2025 - Padroeira de Tocantins,Padroeira de Tocantins,,2025-09-08,Novo Acordo - TO,-9.964658,-47.6762804
TO,07/09/2025 - Independência do Brasil,Independência do Brasil,,2025-09-07,Novo Acordo - TO,-9.964658,-47.6762804
TO,01/05/2025 - Dia do Trabalho,Dia do Trabalho,,2025-05-01,Novo Acordo - TO,-9.964658,-47.6762804
TO,21/04/2025 - Dia de Tiradentes,Dia de Tiradentes,,2025-04-21,Novo Acordo - TO,-9.964658,-47.6762804
TO,18/04/2025 - Sexta-Feira Santa,Sexta-Feira Santa,,2025-04-18,Novo Acordo - TO,-9.964658,-47.6762804
TO,01/01/2025 - Ano Novo,Ano Novo,,2025-01-01,Novo Acordo - TO,-9.964658,-47.6762804
TO,25/12/2025 - Natal,Natal,,2025-12-25,Nova Olinda - TO,-7.631712,-48.425232
TO,15/11/2025 - Proclamação da República,Proclamação da República,,2025-11-15,Nova Olinda - TO,-7.631712,-48.425232
TO,02/11/2025 - Dia de Finados,Dia de Finados,,2025-11-02,Nova Olinda - TO,-7.631712,-48.425232
TO,12/10/2025 - Nossa Senhora Aparecida,Nossa Senhora Aparecida,,2025-10-12,Nova Olinda - TO,-7.631712,-48.425232
TO,05/10/2025 - Aniversário de Tocantins,Aniversário de Tocantins,,2025-10-05,Nova Olinda - TO,-7.631712,-48.425232
TO,08/09/2025 - Padroeira de Tocantins,Padroeira de Tocantins,,2025-09-08,Nova Olinda - TO,-7.631712,-48.425232
TO,07/09/2025 - Independência do Brasil,Independência do Brasil,,2025-09-07,Nova Olinda - TO,-7.631712,-48.425232
TO,01/05/2025 - Dia do Trabalho,Dia do Trabalho,,2025-05-01,Nova Olinda - TO,-7.631712,-48.425232
TO,21/04/2025 - Dia de Tiradentes,Dia de Tiradentes,,2025-04-21,Nova Olinda - TO,-7.631712,-48.425232
TO,18/04/2025 - Sexta-Feira Santa,Sexta-Feira Santa,,2025-04-18,Nova Olinda - TO,-7.631712,-48.425232
TO,01/01/2025 - Ano Novo,Ano Novo,,2025-01-01,Nova Olinda - TO,-7.631712,-48.425232
TO,25/12/2025 - Natal,Natal,,2025-12-25,Ponte Alta do Bom Jesus - TO,-12.088669,-46.4776274
TO,15/11/2025 - Proclamação da República,Proclamação da República,,2025-11-15,Ponte Alta do Bom Jesus - TO,-12.088669,-46.4776274
TO,02/11/2025 - Dia de Finados,Dia de Finados,,2025-11-02,Ponte Alta do Bom Jesus - TO,-12.088669,-46.4776274
TO,12/10/2025 - Nossa Senhora Aparecida,Nossa Senhora Aparecida,,2025-10-12,Ponte Alta do Bom Jesus - TO,-12.088669,-46.4776274
TO,05/10/2025 - Aniversário de Tocantins,Aniversário de Tocantins,,2025-10-05,Ponte Alta do Bom Jesus - TO,-12.088669,-46.4776274
TO,08/09/2025 - Padroeira de Tocantins,Padroeira de Tocantins,,2025-09-08,Ponte Alta do Bom Jesus - TO,-12.088669,-46.4776274
TO,07/09/2025 - Independência do Brasil,Independência do Brasil,,2025-09-07,Ponte Alta do Bom Jesus - TO,-12.088669,-46.4776274
TO,01/05/2025 - Dia do Trabalho,Dia do Trabalho,,2025-05-01,Ponte Alta do Bom Jesus - TO,-12.088669,-46.4776274
TO,21/04/2025 - Dia de Tiradentes,Dia de Tiradentes,,2025-04-21,Ponte Alta do Bom Jesus - TO,-12.088669,-46.4776274
TO,18/04/2025 - Sexta-Feira Santa,Sexta-Feira Santa,,2025-04-18,Ponte Alta do Bom Jesus - TO,-12.088669,-46.4776274
TO,01/01/2025 - Ano Novo,Ano Novo,,2025-01-01,Ponte Alta do Bom Jesus - TO,-12.088669,-46.4776274
TO,25/12/2025 - Natal,Natal,,2025-12-25,Juarina - TO,-8.1194209,-49.0967459
TO,15/11/2025 - Proclamação da República,Proclamação da República,,2025-11-15,Juarina - TO,-8.1194209,-49.0967459
TO,02/11/2025 - Dia de Finados,Dia de Finados,,2025-11-02,Juarina - TO,-8.1194209,-49.0967459
TO,12/10/2025 - Nossa Senhora Aparecida,Nossa Senhora Aparecida,,2025-10-12,Juarina - TO,-8.1194209,-49.0967459
TO,05/10/2025 - Aniversário de Tocantins,Aniversário de Tocantins,,2025-10-05,Juarina - TO,-8.1194209,-49.0967459
TO,08/09/2025 - Padroeira de Tocantins,Padroeira de Tocantins,,2025-09-08,Juarina - TO,-8.1194209,-49.0967459
TO,07/09/2025 - Independência do Brasil,Independência do Brasil,,2025-09-07,Juarina - TO,-8.1194209,-49.0967459
TO,01/05/2025 - Dia do Trabalho,Dia do Trabalho,,2025-05-01,Juarina - TO,-8.1194209,-49.0967459
TO,21/04/2025 - Dia de Tiradentes,Dia de Tiradentes,,2025-04-21,Juarina - TO,-8.1194209,-49.0967459
TO,18/04/2025 - Sexta-Feira Santa,Sexta-Feira Santa,,2025-04-18,Juarina - TO,-8.1194209,-49.0967459
TO,01/01/2025 - Ano Novo,Ano Novo,,2025-01-01,Juarina - TO,-8.1194209,-49.0967459
TO,25/12/2025 - Natal,Natal,,2025-12-25,Lagoa do Tocantins - TO,-10.2967881,-47.566253
TO,15/11/2025 - Proclamação da República,Proclamação da República,,2025-11-15,Lagoa do Tocantins - TO,-10.2967881,-47.566253
TO,02/11/2025 - Dia de Finados,Dia de Finados,,2025-11-02,Lagoa do Tocantins - TO,-10.2967881,-47.566253
TO,12/10/2025 - Nossa Senhora Aparecida,Nossa Senhora Aparecida,,2025-10-12,Lagoa do Tocantins - TO,-10.2967881,-47.566253
TO,05/10/2025 - Aniversário de Tocantins,Aniversário de Tocantins,,2025-10-05,Lagoa do Tocantins - TO,-10.2967881,-47.566253
TO,08/09/2025 - Padroeira de Tocantins,Padroeira de Tocantins,,2025-09-08,Lagoa do Tocantins - TO,-10.2967881,-47.566253
TO,07/09/2025 - Independência do Brasil,Independência do Brasil,,2025-09-07,Lagoa do Tocantins - TO,-10.2967881,-47.566253
TO,01/05/2025 - Dia do Trabalho,Dia do Trabalho,,2025-05-01,Lagoa do Tocantins - TO,-10.2967881,-47.566253
TO,21/04/2025 - Dia de Tiradentes,Dia de Tiradentes,,2025-04-21,Lagoa do Tocantins - TO,-10.2967881,-47.566253
TO,18/04/2025 - Sexta-Feira Santa,Sexta-Feira Santa,,2025-04-18,Lagoa do Tocantins - TO,-10.2967881,-47.566253
TO,01/01/2025 - Ano Novo,Ano Novo,,2025-01-01,Lagoa do Tocantins - TO,-10.2967881,-47.566253
TO,25/12/2025 - Natal,Natal,,2025-12-25,Lajeado - TO,-29.4647393,-51.9904432
TO,15/11/2025 - Proclamação da República,Proclamação da República,,2025-11-15,Lajeado - TO,-29.4647393,-51.9904432
TO,02/11/2025 - Dia de Finados,Dia de Finados,,2025-11-02,Lajeado - TO,-29.4647393,-51.9904432
TO,12/10/2025 - Nossa Senhora Aparecida,Nossa Senhora Aparecida,,2025-10-12,Lajeado - TO,-29.4647393,-51.9904432
TO,05/10/2025 - Aniversário de Tocantins,Aniversário de Tocantins,,2025-10-05,Lajeado - TO,-29.4647393,-51.9904432
TO,08/09/2025 - Padroeira de Tocantins,Padroeira de Tocantins,,2025-09-08,Lajeado - TO,-29.4647393,-51.9904432
TO,07/09/2025 - Independência do Brasil,Independência do Brasil,,2025-09-07,Lajeado - TO,-29.4647393,-51.9904432
TO,01/05/2025 - Dia do Trabalho,Dia do Trabalho,,2025-05-01,Lajeado - TO,-29.4647393,-51.9904432
TO,21/04/2025 - Dia de Tiradentes,Dia de Tiradentes,,2025-04-21,Lajeado - TO,-29.4647393,-51.9904432
TO,18/04/2025 - Sexta-Feira Santa,Sexta-Feira Santa,,2025-04-18,Lajeado - TO,-29.4647393,-51.9904432
TO,01/01/2025 - Ano Novo,Ano Novo,,2025-01-01,Lajeado - TO,-29.4647393,-51.9904432
TO,25/12/2025 - Natal,Natal,,2025-12-25,Lavandeira - TO,-12.7887924,-46.5073198
TO,15/11/2025 - Proclamação da República,Proclamação da República,,2025-11-15,Lavandeira - TO,-12.7887924,-46.5073198
TO,02/11/2025 - Dia de Finados,Dia de Finados,,2025-11-02,Lavandeira - TO,-12.7887924,-46.5073198
TO,12/10/2025 - Nossa Senhora Aparecida,Nossa Senhora Aparecida,,2025-10-12,Lavandeira - TO,-12.7887924,-46.5073198
TO,05/10/2025 - Aniversário de Tocantins,Aniversário de Tocantins,,2025-10-05,Lavandeira - TO,-12.7887924,-46.5073198
TO,08/09/2025 - Padroeira de Tocantins,Padroeira de Tocantins,,2025-09-08,Lavandeira - TO,-12.7887924,-46.5073198
TO,07/09/2025 - Independência do Brasil,Independência do Brasil,,2025-09-07,Lavandeira - TO,-12.7887924,-46.5073198
TO,01/05/2025 - Dia do Trabalho,Dia do Trabalho,,2025-05-01,Lavandeira - TO,-12.7887924,-46.5073198
TO,21/04/2025 - Dia de Tiradentes,Dia de Tiradentes,,2025-04-21,Lavandeira - TO,-12.7887924,-46.5073198
TO,18/04/2025 - Sexta-Feira Santa,Sexta-Feira Santa,,2025-04-18,Lavandeira - TO,-12.7887924,-46.5073198
TO,01/01/2025 - Ano Novo,Ano Novo,,2025-01-01,Lavandeira - TO,-12.7887924,-46.5073198
TO,25/12/2025 - Natal,Natal,,2025-12-25,Lizarda - TO,-9.5955336,-46.675218
TO,15/11/2025 - Proclamação da República,Proclamação da República,,2025-11-15,Lizarda - TO,-9.5955336,-46.675218
TO,02/11/2025 - Dia de Finados,Dia de Finados,,2025-11-02,Lizarda - TO,-9.5955336,-46.675218
TO,12/10/2025 - Nossa Senhora Aparecida,Nossa Senhora Aparecida,,2025-10-12,Lizarda - TO,-9.5955336,-46.675218
TO,05/10/2025 - Aniversário de Tocantins,Aniversário de Tocantins,,2025-10-05,Lizarda - TO,-9.5955336,-46.675218
TO,08/09/2025 - Padroeira de Tocantins,Padroeira de Tocantins,,2025-09-08,Lizarda - TO,-9.5955336,-46.675218
TO,07/09/2025 - Independência do Brasil,Independência do Brasil,,2025-09-07,Lizarda - TO,-9.5955336,-46.675218
TO,01/05/2025 - Dia do Trabalho,Dia do Trabalho,,2025-05-01,Lizarda - TO,-9.5955336,-46.675218
TO,21/04/2025 - Dia de Tiradentes,Dia de Tiradentes,,2025-04-21,Lizarda - TO,-9.5955336,-46.675218
TO,18/04/2025 - Sexta-Feira Santa,Sexta-Feira Santa,,2025-04-18,Lizarda - TO,-9.5955336,-46.675218
TO,01/01/2025 - Ano Novo,Ano Novo,,2025-01-01,Lizarda - TO,-9.5955336,-46.675218
TO,25/12/2025 - Natal,Natal,,2025-12-25,Mateiros - TO,-10.546192,-46.4182896
TO,15/11/2025 - Proclamação da República,Proclamação da República,,2025-11-15,Mateiros - TO,-10.546192,-46.4182896
TO,02/11/2025 - Dia de Finados,Dia de Finados,,2025-11-02,Mateiros - TO,-10.546192,-46.4182896
TO,12/10/2025 - Nossa Senhora Aparecida,Nossa Senhora Aparecida,,2025-10-12,Mateiros - TO,-10.546192,-46.4182896
TO,05/10/2025 - Aniversário de Tocantins,Aniversário de Tocantins,,2025-10-05,Mateiros - TO,-10.546192,-46.4182896
TO,08/09/2025 - Padroeira de Tocantins,Padroeira de Tocantins,,2025-09-08,Mateiros - TO,-10.546192,-46.4182896
TO,07/09/2025 - Independência do Brasil,Independência do Brasil,,2025-09-07,Mateiros - TO,-10.546192,-46.4182896
TO,01/05/2025 - Dia do Trabalho,Dia do Trabalho,,2025-05-01,Mateiros - TO,-10.546192,-46.4182896
TO,21/04/2025 - Dia de Tiradentes,Dia de Tiradentes,,2025-04-21,Mateiros - TO,-10.546192,-46.4182896
TO,18/04/2025 - Sexta-Feira Santa,Sexta-Feira Santa,,2025-04-18,Mateiros - TO,-10.546192,-46.4182896
TO,01/01/2025 - Ano Novo,Ano Novo,,2025-01-01,Mateiros - TO,-10.546192,-46.4182896
TO,25/12/2025 - Natal,Natal,,2025-12-25,Miracema do Tocantins - TO,-9.5616975,-48.3900277
TO,20/11/2025 - Dia da Consciência Negra,Dia da Consciência Negra,,2025-11-20,Miracema do Tocantins - TO,-9.5616975,-48.3900277
TO,15/11/2025 - Proclamação da República,Proclamação da República,,2025-11-15,Miracema do Tocantins - TO,-9.5616975,-48.3900277
TO,02/11/2025 - Dia de Finados,Dia de Finados,,2025-11-02,Miracema do Tocantins - TO,-9.5616975,-48.3900277
TO,12/10/2025 - Nossa Senhora Aparecida,Nossa Senhora Aparecida,,2025-10-12,Miracema do Tocantins - TO,-9.5616975,-48.3900277
TO,05/10/2025 - Aniversário de Tocantins,Aniversário de Tocantins,,2025-10-05,Miracema do Tocantins - TO,-9.5616975,-48.3900277
TO,"01/10/2025 -  Dia de Santa Teresinha do Menino Jesus, Padroeira do Município"," Dia de Santa Teresinha do Menino Jesus, Padroeira do Município",,2025-10-01,Miracema do Tocantins - TO,-9.5616975,-48.3900277
TO,08/09/2025 - Padroeira de Tocantins,Padroeira de Tocantins,,2025-09-08,Miracema do Tocantins - TO,-9.5616975,-48.3900277
TO,07/09/2025 - Independência do Brasil,Independência do Brasil,,2025-09-07,Miracema do Tocantins - TO,-9.5616975,-48.3900277
TO,25/08/2025 - Feriado Municipal,Feriado Municipal,,2025-08-25,Miracema do Tocantins - TO,-9.5616975,-48.3900277
TO,25/06/2025 - Feriado Municipal,Feriado Municipal,,2025-06-25,Miracema do Tocantins - TO,-9.5616975,-48.3900277
TO,01/05/2025 - Dia do Trabalho,Dia do Trabalho,,2025-05-01,Miracema do Tocantins - TO,-9.5616975,-48.3900277
TO,21/04/2025 - Dia de Tiradentes,Dia de Tiradentes,,2025-04-21,Miracema do Tocantins - TO,-9.5616975,-48.3900277
TO,18/04/2025 - Sexta-Feira Santa,Sexta-Feira Santa,,2025-04-18,Miracema do Tocantins - TO,-9.5616975,-48.3900277
TO,01/01/2025 - Ano Novo,Ano Novo,,2025-01-01,Miracema do Tocantins - TO,-9.5616975,-48.3900277
TO,25/12/2025 - Natal,Natal,,2025-12-25,Miranorte - TO,-9.5371695,-48.5909787
TO,15/11/2025 - Proclamação da República,Proclamação da República,,2025-11-15,Miranorte - TO,-9.5371695,-48.5909787
TO,08/11/2025 - Feriado Municipal,Feriado Municipal,,2025-11-08,Miranorte - TO,-9.5371695,-48.5909787
TO,02/11/2025 - Dia de Finados,Dia de Finados,,2025-11-02,Miranorte - TO,-9.5371695,-48.5909787
TO,12/10/2025 - Nossa Senhora Aparecida,Nossa Senhora Aparecida,,2025-10-12,Miranorte - TO,-9.5371695,-48.5909787
TO,05/10/2025 - Aniversário de Tocantins,Aniversário de Tocantins,,2025-10-05,Miranorte - TO,-9.5371695,-48.5909787
TO,08/09/2025 - Padroeira de Tocantins,Padroeira de Tocantins,,2025-09-08,Miranorte - TO,-9.5371695,-48.5909787
TO,07/09/2025 - Independência do Brasil,Independência do Brasil,,2025-09-07,Miranorte - TO,-9.5371695,-48.5909787
TO,13/06/2025 - Dia de Santo Antônio,Dia de Santo Antônio,,2025-06-13,Miranorte - TO,-9.5371695,-48.5909787
TO,01/05/2025 - Dia do Trabalho,Dia do Trabalho,,2025-05-01,Miranorte - TO,-9.5371695,-48.5909787
TO,21/04/2025 - Dia de Tiradentes,Dia de Tiradentes,,2025-04-21,Miranorte - TO,-9.5371695,-48.5909787
TO,18/04/2025 - Sexta-Feira Santa,Sexta-Feira Santa,,2025-04-18,Miranorte - TO,-9.5371695,-48.5909787
TO,01/01/2025 - Ano Novo,Ano Novo,,2025-01-01,Miranorte - TO,-9.5371695,-48.5909787
TO,25/12/2025 - Natal,Natal,,2025-12-25,Monte do Carmo - TO,-10.7647456,-48.1121813
TO,15/11/2025 - Proclamação da República,Proclamação da República,,2025-11-15,Monte do Carmo - TO,-10.7647456,-48.1121813
TO,02/11/2025 - Dia de Finados,Dia de Finados,,2025-11-02,Monte do Carmo - TO,-10.7647456,-48.1121813
TO,12/10/2025 - Nossa Senhora Aparecida,Nossa Senhora Aparecida,,2025-10-12,Monte do Carmo - TO,-10.7647456,-48.1121813
TO,05/10/2025 - Aniversário de Tocantins,Aniversário de Tocantins,,2025-10-05,Monte do Carmo - TO,-10.7647456,-48.1121813
TO,08/09/2025 - Padroeira de Tocantins,Padroeira de Tocantins,,2025-09-08,Monte do Carmo - TO,-10.7647456,-48.1121813
TO,07/09/2025 - Independência do Brasil,Independência do Brasil,,2025-09-07,Monte do Carmo - TO,-10.7647456,-48.1121813
TO,01/05/2025 - Dia do Trabalho,Dia do Trabalho,,2025-05-01,Monte do Carmo - TO,-10.7647456,-48.1121813
TO,21/04/2025 - Dia de Tiradentes,Dia de Tiradentes,,2025-04-21,Monte do Carmo - TO,-10.7647456,-48.1121813
TO,18/04/2025 - Sexta-Feira Santa,Sexta-Feira Santa,,2025-04-18,Monte do Carmo - TO,-10.7647456,-48.1121813
TO,01/01/2025 - Ano Novo,Ano Novo,,2025-01-01,Monte do Carmo - TO,-10.7647456,-48.1121813
TO,25/12/2025 - Natal,Natal,,2025-12-25,Monte Santo do Tocantins - TO,-10.0051944,-48.9927531
TO,15/11/2025 - Proclamação da República,Proclamação da República,,2025-11-15,Monte Santo do Tocantins - TO,-10.0051944,-48.9927531
TO,02/11/2025 - Dia de Finados,Dia de Finados,,2025-11-02,Monte Santo do Tocantins - TO,-10.0051944,-48.9927531
TO,12/10/2025 - Nossa Senhora Aparecida,Nossa Senhora Aparecida,,2025-10-12,Monte Santo do Tocantins - TO,-10.0051944,-48.9927531
TO,05/10/2025 - Aniversário de Tocantins,Aniversário de Tocantins,,2025-10-05,Monte Santo do Tocantins - TO,-10.0051944,-48.9927531
TO,08/09/2025 - Padroeira de Tocantins,Padroeira de Tocantins,,2025-09-08,Monte Santo do Tocantins - TO,-10.0051944,-48.9927531
TO,07/09/2025 - Independência do Brasil,Independência do Brasil,,2025-09-07,Monte Santo do Tocantins - TO,-10.0051944,-48.9927531
TO,01/05/2025 - Dia do Trabalho,Dia do Trabalho,,2025-05-01,Monte Santo do Tocantins - TO,-10.0051944,-48.9927531
TO,21/04/2025 - Dia de Tiradentes,Dia de Tiradentes,,2025-04-21,Monte Santo do Tocantins - TO,-10.0051944,-48.9927531
TO,18/04/2025 - Sexta-Feira Santa,Sexta-Feira Santa,,2025-04-18,Monte Santo do Tocantins - TO,-10.0051944,-48.9927531
TO,01/01/2025 - Ano Novo,Ano Novo,,2025-01-01,Monte Santo do Tocantins - TO,-10.0051944,-48.9927531
TO,25/12/2025 - Natal,Natal,,2025-12-25,Natividade - TO,-11.613585,-47.7467147
TO,15/11/2025 - Proclamação da República,Proclamação da República,,2025-11-15,Natividade - TO,-11.613585,-47.7467147
TO,02/11/2025 - Dia de Finados,Dia de Finados,,2025-11-02,Natividade - TO,-11.613585,-47.7467147
TO,12/10/2025 - Nossa Senhora Aparecida,Nossa Senhora Aparecida,,2025-10-12,Natividade - TO,-11.613585,-47.7467147
TO,05/10/2025 - Aniversário de Tocantins,Aniversário de Tocantins,,2025-10-05,Natividade - TO,-11.613585,-47.7467147
TO,08/09/2025 - Padroeira de Tocantins,Padroeira de Tocantins,,2025-09-08,Natividade - TO,-11.613585,-47.7467147
TO,07/09/2025 - Independência do Brasil,Independência do Brasil,,2025-09-07,Natividade - TO,-11.613585,-47.7467147
TO,16/08/2025 - Feriado Municipal,Feriado Municipal,,2025-08-16,Natividade - TO,-11.613585,-47.7467147
TO,15/08/2025 - Feriado Municipal,Feriado Municipal,,2025-08-15,Natividade - TO,-11.613585,-47.7467147
TO,01/06/2025 - Feriado Municipal,Feriado Municipal,,2025-06-01,Natividade - TO,-11.613585,-47.7467147
TO,01/05/2025 - Dia do Trabalho,Dia do Trabalho,,2025-05-01,Natividade - TO,-11.613585,-47.7467147
TO,21/04/2025 - Dia de Tiradentes,Dia de Tiradentes,,2025-04-21,Natividade - TO,-11.613585,-47.7467147
TO,18/04/2025 - Sexta-Feira Santa,Sexta-Feira Santa,,2025-04-18,Natividade - TO,-11.613585,-47.7467147
TO,01/01/2025 - Ano Novo,Ano Novo,,2025-01-01,Natividade - TO,-11.613585,-47.7467147
TO,25/12/2025 - Natal,Natal,,2025-12-25,Pium - TO,-10.05205,-49.766445
TO,15/11/2025 - Proclamação da República,Proclamação da República,,2025-11-15,Pium - TO,-10.05205,-49.766445
TO,02/11/2025 - Dia de Finados,Dia de Finados,,2025-11-02,Pium - TO,-10.05205,-49.766445
TO,12/10/2025 - Nossa Senhora Aparecida,Nossa Senhora Aparecida,,2025-10-12,Pium - TO,-10.05205,-49.766445
TO,05/10/2025 - Aniversário de Tocantins,Aniversário de Tocantins,,2025-10-05,Pium - TO,-10.05205,-49.766445
TO,08/09/2025 - Padroeira de Tocantins,Padroeira de Tocantins,,2025-09-08,Pium - TO,-10.05205,-49.766445
TO,07/09/2025 - Independência do Brasil,Independência do Brasil,,2025-09-07,Pium - TO,-10.05205,-49.766445
TO,01/05/2025 - Dia do Trabalho,Dia do Trabalho,,2025-05-01,Pium - TO,-10.05205,-49.766445
TO,21/04/2025 - Dia de Tiradentes,Dia de Tiradentes,,2025-04-21,Pium - TO,-10.05205,-49.766445
TO,18/04/2025 - Sexta-Feira Santa,Sexta-Feira Santa,,2025-04-18,Pium - TO,-10.05205,-49.766445
TO,01/01/2025 - Ano Novo,Ano Novo,,2025-01-01,Pium - TO,-10.05205,-49.766445
TO,25/12/2025 - Natal,Natal,,2025-12-25,Porto Alegre do Tocantins - TO,-11.6070802,-47.052627
TO,15/11/2025 - Proclamação da República,Proclamação da República,,2025-11-15,Porto Alegre do Tocantins - TO,-11.6070802,-47.052627
TO,02/11/2025 - Dia de Finados,Dia de Finados,,2025-11-02,Porto Alegre do Tocantins - TO,-11.6070802,-47.052627
TO,12/10/2025 - Nossa Senhora Aparecida,Nossa Senhora Aparecida,,2025-10-12,Porto Alegre do Tocantins - TO,-11.6070802,-47.052627
TO,05/10/2025 - Aniversário de Tocantins,Aniversário de Tocantins,,2025-10-05,Porto Alegre do Tocantins - TO,-11.6070802,-47.052627
TO,08/09/2025 - Padroeira de Tocantins,Padroeira de Tocantins,,2025-09-08,Porto Alegre do Tocantins - TO,-11.6070802,-47.052627
TO,07/09/2025 - Independência do Brasil,Independência do Brasil,,2025-09-07,Porto Alegre do Tocantins - TO,-11.6070802,-47.052627
TO,01/05/2025 - Dia do Trabalho,Dia do Trabalho,,2025-05-01,Porto Alegre do Tocantins - TO,-11.6070802,-47.052627
TO,21/04/2025 - Dia de Tiradentes,Dia de Tiradentes,,2025-04-21,Porto Alegre do Tocantins - TO,-11.6070802,-47.052627
TO,18/04/2025 - Sexta-Feira Santa,Sexta-Feira Santa,,2025-04-18,Porto Alegre do Tocantins - TO,-11.6070802,-47.052627
TO,01/01/2025 - Ano Novo,Ano Novo,,2025-01-01,Porto Alegre do Tocantins - TO,-11.6070802,-47.052627
TO,25/12/2025 - Natal,Natal,,2025-12-25,Sucupira - TO,-11.9879241,-48.9117044
TO,15/11/2025 - Proclamação da República,Proclamação da República,,2025-11-15,Sucupira - TO,-11.9879241,-48.9117044
TO,02/11/2025 - Dia de Finados,Dia de Finados,,2025-11-02,Sucupira - TO,-11.9879241,-48.9117044
TO,12/10/2025 - Nossa Senhora Aparecida,Nossa Senhora Aparecida,,2025-10-12,Sucupira - TO,-11.9879241,-48.9117044
TO,05/10/2025 - Aniversário de Tocantins,Aniversário de Tocantins,,2025-10-05,Sucupira - TO,-11.9879241,-48.9117044
TO,08/09/2025 - Padroeira de Tocantins,Padroeira de Tocantins,,2025-09-08,Sucupira - TO,-11.9879241,-48.9117044
TO,07/09/2025 - Independência do Brasil,Independência do Brasil,,2025-09-07,Sucupira - TO,-11.9879241,-48.9117044
TO,01/05/2025 - Dia do Trabalho,Dia do Trabalho,,2025-05-01,Sucupira - TO,-11.9879241,-48.9117044
TO,21/04/2025 - Dia de Tiradentes,Dia de Tiradentes,,2025-04-21,Sucupira - TO,-11.9879241,-48.9117044
TO,18/04/2025 - Sexta-Feira Santa,Sexta-Feira Santa,,2025-04-18,Sucupira - TO,-11.9879241,-48.9117044
TO,01/01/2025 - Ano Novo,Ano Novo,,2025-01-01,Sucupira - TO,-11.9879241,-48.9117044
TO,25/12/2025 - Natal,Natal,,2025-12-25,Taguatinga - TO,-12.4051488,-46.436328
TO,15/11/2025 - Proclamação da República,Proclamação da República,,2025-11-15,Taguatinga - TO,-12.4051488,-46.436328
TO,02/11/2025 - Dia de Finados,Dia de Finados,,2025-11-02,Taguatinga - TO,-12.4051488,-46.436328
TO,12/10/2025 - Nossa Senhora Aparecida,Nossa Senhora Aparecida,,2025-10-12,Taguatinga - TO,-12.4051488,-46.436328
TO,05/10/2025 - Aniversário de Tocantins,Aniversário de Tocantins,,2025-10-05,Taguatinga - TO,-12.4051488,-46.436328
TO,08/09/2025 - Padroeira de Tocantins,Padroeira de Tocantins,,2025-09-08,Taguatinga - TO,-12.4051488,-46.436328
TO,07/09/2025 - Independência do Brasil,Independência do Brasil,,2025-09-07,Taguatinga - TO,-12.4051488,-46.436328
TO,10/06/2025 - Feriado Municipal,Feriado Municipal,,2025-06-10,Taguatinga - TO,-12.4051488,-46.436328
TO,01/05/2025 - Dia do Trabalho,Dia do Trabalho,,2025-05-01,Taguatinga - TO,-12.4051488,-46.436328
TO,21/04/2025 - Dia de Tiradentes,Dia de Tiradentes,,2025-04-21,Taguatinga - TO,-12.4051488,-46.436328
TO,18/04/2025 - Sexta-Feira Santa,Sexta-Feira Santa,,2025-04-18,Taguatinga - TO,-12.4051488,-46.436328
TO,01/01/2025 - Ano Novo,Ano Novo,,2025-01-01,Taguatinga - TO,-12.4051488,-46.436328
TO,25/12/2025 - Natal,Natal,,2025-12-25,Taipas do Tocantins - TO,-12.193349,-46.9918003
TO,15/11/2025 - Proclamação da República,Proclamação da República,,2025-11-15,Taipas do Tocantins - TO,-12.193349,-46.9918003
TO,02/11/2025 - Dia de Finados,Dia de Finados,,2025-11-02,Taipas do Tocantins - TO,-12.193349,-46.9918003
TO,12/10/2025 - Nossa Senhora Aparecida,Nossa Senhora Aparecida,,2025-10-12,Taipas do Tocantins - TO,-12.193349,-46.9918003
TO,05/10/2025 - Aniversário de Tocantins,Aniversário de Tocantins,,2025-10-05,Taipas do Tocantins - TO,-12.193349,-46.9918003
TO,08/09/2025 - Padroeira de Tocantins,Padroeira de Tocantins,,2025-09-08,Taipas do Tocantins - TO,-12.193349,-46.9918003
TO,07/09/2025 - Independência do Brasil,Independência do Brasil,,2025-09-07,Taipas do Tocantins - TO,-12.193349,-46.9918003
TO,01/05/2025 - Dia do Trabalho,Dia do Trabalho,,2025-05-01,Taipas do Tocantins - TO,-12.193349,-46.9918003
TO,21/04/2025 - Dia de Tiradentes,Dia de Tiradentes,,2025-04-21,Taipas do Tocantins - TO,-12.193349,-46.9918003
TO,18/04/2025 - Sexta-Feira Santa,Sexta-Feira Santa,,2025-04-18,Taipas do Tocantins - TO,-12.193349,-46.9918003
TO,01/01/2025 - Ano Novo,Ano Novo,,2025-01-01,Taipas do Tocantins - TO,-12.193349,-46.9918003
TO,25/12/2025 - Natal,Natal,,2025-12-25,Tupirama - TO,-8.9746528,-48.1887392
TO,15/11/2025 - Proclamação da República,Proclamação da República,,2025-11-15,Tupirama - TO,-8.9746528,-48.1887392
TO,02/11/2025 - Dia de Finados,Dia de Finados,,2025-11-02,Tupirama - TO,-8.9746528,-48.1887392
TO,12/10/2025 - Nossa Senhora Aparecida,Nossa Senhora Aparecida,,2025-10-12,Tupirama - TO,-8.9746528,-48.1887392
TO,05/10/2025 - Aniversário de Tocantins,Aniversário de Tocantins,,2025-10-05,Tupirama - TO,-8.9746528,-48.1887392
TO,08/09/2025 - Padroeira de Tocantins,Padroeira de Tocantins,,2025-09-08,Tupirama - TO,-8.9746528,-48.1887392
TO,07/09/2025 - Independência do Brasil,Independência do Brasil,,2025-09-07,Tupirama - TO,-8.9746528,-48.1887392
TO,01/05/2025 - Dia do Trabalho,Dia do Trabalho,,2025-05-01,Tupirama - TO,-8.9746528,-48.1887392
TO,21/04/2025 - Dia de Tiradentes,Dia de Tiradentes,,2025-04-21,Tupirama - TO,-8.9746528,-48.1887392
TO,18/04/2025 - Sexta-Feira Santa,Sexta-Feira Santa,,2025-04-18,Tupirama - TO,-8.9746528,-48.1887392
TO,01/01/2025 - Ano Novo,Ano Novo,,2025-01-01,Tupirama - TO,-8.9746528,-48.1887392
TO,25/12/2025 - Natal,Natal,,2025-12-25,Tupiratins - TO,-8.3996247,-48.1299635
TO,15/11/2025 - Proclamação da República,Proclamação da República,,2025-11-15,Tupiratins - TO,-8.3996247,-48.1299635
TO,02/11/2025 - Dia de Finados,Dia de Finados,,2025-11-02,Tupiratins - TO,-8.3996247,-48.1299635
TO,12/10/2025 - Nossa Senhora Aparecida,Nossa Senhora Aparecida,,2025-10-12,Tupiratins - TO,-8.3996247,-48.1299635
TO,05/10/2025 - Aniversário de Tocantins,Aniversário de Tocantins,,2025-10-05,Tupiratins - TO,-8.3996247,-48.1299635
TO,08/09/2025 - Padroeira de Tocantins,Padroeira de Tocantins,,2025-09-08,Tupiratins - TO,-8.3996247,-48.1299635
TO,07/09/2025 - Independência do Brasil,Independência do Brasil,,2025-09-07,Tupiratins - TO,-8.3996247,-48.1299635
TO,01/05/2025 - Dia do Trabalho,Dia do Trabalho,,2025-05-01,Tupiratins - TO,-8.3996247,-48.1299635
TO,21/04/2025 - Dia de Tiradentes,Dia de Tiradentes,,2025-04-21,Tupiratins - TO,-8.3996247,-48.1299635
TO,18/04/2025 - Sexta-Feira Santa,Sexta-Feira Santa,,2025-04-18,Tupiratins - TO,-8.3996247,-48.1299635
TO,01/01/2025 - Ano Novo,Ano Novo,,2025-01-01,Tupiratins - TO,-8.3996247,-48.1299635
TO,25/12/2025 - Natal,Natal,,2025-12-25,Porto Nacional - TO,-10.7019786,-48.4110952
TO,20/11/2025 - Dia da Consciência Negra,Dia da Consciência Negra,,2025-11-20,Porto Nacional - TO,-10.7019786,-48.4110952
TO,15/11/2025 - Proclamação da República,Proclamação da República,,2025-11-15,Porto Nacional - TO,-10.7019786,-48.4110952
TO,02/11/2025 - Dia de Finados,Dia de Finados,,2025-11-02,Porto Nacional - TO,-10.7019786,-48.4110952
TO,12/10/2025 - Nossa Senhora Aparecida,Nossa Senhora Aparecida,,2025-10-12,Porto Nacional - TO,-10.7019786,-48.4110952
TO,05/10/2025 - Aniversário de Tocantins,Aniversário de Tocantins,,2025-10-05,Porto Nacional - TO,-10.7019786,-48.4110952
TO,24/09/2025 - Feriado Municipal,Feriado Municipal,,2025-09-24,Porto Nacional - TO,-10.7019786,-48.4110952
TO,08/09/2025 - Padroeira de Tocantins,Padroeira de Tocantins,,2025-09-08,Porto Nacional - TO,-10.7019786,-48.4110952
TO,07/09/2025 - Independência do Brasil,Independência do Brasil,,2025-09-07,Porto Nacional - TO,-10.7019786,-48.4110952
TO,13/07/2025 - Feriado Municipal,Feriado Municipal,,2025-07-13,Porto Nacional - TO,-10.7019786,-48.4110952
TO,01/05/2025 - Dia do Trabalho,Dia do Trabalho,,2025-05-01,Porto Nacional - TO,-10.7019786,-48.4110952
TO,21/04/2025 - Dia de Tiradentes,Dia de Tiradentes,,2025-04-21,Porto Nacional - TO,-10.7019786,-48.4110952
TO,18/04/2025 - Sexta-Feira Santa,Sexta-Feira Santa,,2025-04-18,Porto Nacional - TO,-10.7019786,-48.4110952
TO,01/01/2025 - Ano Novo,Ano Novo,,2025-01-01,Porto Nacional - TO,-10.7019786,-48.4110952
TO,25/12/2025 - Natal,Natal,,2025-12-25,Santa Terezinha do Tocantins - TO,-6.4356048,-47.673061
TO,15/11/2025 - Proclamação da República,Proclamação da República,,2025-11-15,Santa Terezinha do Tocantins - TO,-6.4356048,-47.673061
TO,02/11/2025 - Dia de Finados,Dia de Finados,,2025-11-02,Santa Terezinha do Tocantins - TO,-6.4356048,-47.673061
TO,12/10/2025 - Nossa Senhora Aparecida,Nossa Senhora Aparecida,,2025-10-12,Santa Terezinha do Tocantins - TO,-6.4356048,-47.673061
TO,05/10/2025 - Aniversário de Tocantins,Aniversário de Tocantins,,2025-10-05,Santa Terezinha do Tocantins - TO,-6.4356048,-47.673061
TO,08/09/2025 - Padroeira de Tocantins,Padroeira de Tocantins,,2025-09-08,Santa Terezinha do Tocantins - TO,-6.4356048,-47.673061
TO,07/09/2025 - Independência do Brasil,Independência do Brasil,,2025-09-07,Santa Terezinha do Tocantins - TO,-6.4356048,-47.673061
TO,01/05/2025 - Dia do Trabalho,Dia do Trabalho,,2025-05-01,Santa Terezinha do Tocantins - TO,-6.4356048,-47.673061
TO,21/04/2025 - Dia de Tiradentes,Dia de Tiradentes,,2025-04-21,Santa Terezinha do Tocantins - TO,-6.4356048,-47.673061
TO,18/04/2025 - Sexta-Feira Santa,Sexta-Feira Santa,,2025-04-18,Santa Terezinha do Tocantins - TO,-6.4356048,-47.673061
TO,01/01/2025 - Ano Novo,Ano Novo,,2025-01-01,Santa Terezinha do Tocantins - TO,-6.4356048,-47.673061
TO,25/12/2025 - Natal,Natal,,2025-12-25,Praia Norte - TO,-29.346085,-49.7360748
TO,15/11/2025 - Proclamação da República,Proclamação da República,,2025-11-15,Praia Norte - TO,-29.346085,-49.7360748
TO,02/11/2025 - Dia de Finados,Dia de Finados,,2025-11-02,Praia Norte - TO,-29.346085,-49.7360748
TO,12/10/2025 - Nossa Senhora Aparecida,Nossa Senhora Aparecida,,2025-10-12,Praia Norte - TO,-29.346085,-49.7360748
TO,05/10/2025 - Aniversário de Tocantins,Aniversário de Tocantins,,2025-10-05,Praia Norte - TO,-29.346085,-49.7360748
TO,08/09/2025 - Padroeira de Tocantins,Padroeira de Tocantins,,2025-09-08,Praia Norte - TO,-29.346085,-49.7360748
TO,07/09/2025 - Independência do Brasil,Independência do Brasil,,2025-09-07,Praia Norte - TO,-29.346085,-49.7360748
TO,01/05/2025 - Dia do Trabalho,Dia do Trabalho,,2025-05-01,Praia Norte - TO,-29.346085,-49.7360748
TO,21/04/2025 - Dia de Tiradentes,Dia de Tiradentes,,2025-04-21,Praia Norte - TO,-29.346085,-49.7360748
TO,18/04/2025 - Sexta-Feira Santa,Sexta-Feira Santa,,2025-04-18,Praia Norte - TO,-29.346085,-49.7360748
TO,01/01/2025 - Ano Novo,Ano Novo,,2025-01-01,Praia Norte - TO,-29.346085,-49.7360748
TO,25/12/2025 - Natal,Natal,,2025-12-25,Presidente Kennedy - TO,-27.3565568,-53.3968768
TO,15/11/2025 - Proclamação da República,Proclamação da República,,2025-11-15,Presidente Kennedy - TO,-27.3565568,-53.3968768
TO,02/11/2025 - Dia de Finados,Dia de Finados,,2025-11-02,Presidente Kennedy - TO,-27.3565568,-53.3968768
TO,12/10/2025 - Nossa Senhora Aparecida,Nossa Senhora Aparecida,,2025-10-12,Presidente Kennedy - TO,-27.3565568,-53.3968768
TO,05/10/2025 - Aniversário de Tocantins,Aniversário de Tocantins,,2025-10-05,Presidente Kennedy - TO,-27.3565568,-53.3968768
TO,08/09/2025 - Padroeira de Tocantins,Padroeira de Tocantins,,2025-09-08,Presidente Kennedy - TO,-27.3565568,-53.3968768
TO,07/09/2025 - Independência do Brasil,Independência do Brasil,,2025-09-07,Presidente Kennedy - TO,-27.3565568,-53.3968768
TO,01/05/2025 - Dia do Trabalho,Dia do Trabalho,,2025-05-01,Presidente Kennedy - TO,-27.3565568,-53.3968768
TO,21/04/2025 - Dia de Tiradentes,Dia de Tiradentes,,2025-04-21,Presidente Kennedy - TO,-27.3565568,-53.3968768
TO,18/04/2025 - Sexta-Feira Santa,Sexta-Feira Santa,,2025-04-18,Presidente Kennedy - TO,-27.3565568,-53.3968768
TO,01/01/2025 - Ano Novo,Ano Novo,,2025-01-01,Presidente Kennedy - TO,-27.3565568,-53.3968768
TO,25/12/2025 - Natal,Natal,,2025-12-25,Pugmil - TO,-10.4255161,-48.8969824
TO,15/11/2025 - Proclamação da República,Proclamação da República,,2025-11-15,Pugmil - TO,-10.4255161,-48.8969824
TO,02/11/2025 - Dia de Finados,Dia de Finados,,2025-11-02,Pugmil - TO,-10.4255161,-48.8969824
TO,12/10/2025 - Nossa Senhora Aparecida,Nossa Senhora Aparecida,,2025-10-12,Pugmil - TO,-10.4255161,-48.8969824
TO,05/10/2025 - Aniversário de Tocantins,Aniversário de Tocantins,,2025-10-05,Pugmil - TO,-10.4255161,-48.8969824
TO,08/09/2025 - Padroeira de Tocantins,Padroeira de Tocantins,,2025-09-08,Pugmil - TO,-10.4255161,-48.8969824
TO,07/09/2025 - Independência do Brasil,Independência do Brasil,,2025-09-07,Pugmil - TO,-10.4255161,-48.8969824
TO,01/05/2025 - Dia do Trabalho,Dia do Trabalho,,2025-05-01,Pugmil - TO,-10.4255161,-48.8969824
TO,21/04/2025 - Dia de Tiradentes,Dia de Tiradentes,,2025-04-21,Pugmil - TO,-10.4255161,-48.8969824
TO,18/04/2025 - Sexta-Feira Santa,Sexta-Feira Santa,,2025-04-18,Pugmil - TO,-10.4255161,-48.8969824
TO,01/01/2025 - Ano Novo,Ano Novo,,2025-01-01,Pugmil - TO,-10.4255161,-48.8969824
TO,25/12/2025 - Natal,Natal,,2025-12-25,Riachinho - TO,-6.4426372,-48.137969
TO,15/11/2025 - Proclamação da República,Proclamação da República,,2025-11-15,Riachinho - TO,-6.4426372,-48.137969
TO,02/11/2025 - Dia de Finados,Dia de Finados,,2025-11-02,Riachinho - TO,-6.4426372,-48.137969
TO,12/10/2025 - Nossa Senhora Aparecida,Nossa Senhora Aparecida,,2025-10-12,Riachinho - TO,-6.4426372,-48.137969
TO,05/10/2025 - Aniversário de Tocantins,Aniversário de Tocantins,,2025-10-05,Riachinho - TO,-6.4426372,-48.137969
TO,08/09/2025 - Padroeira de Tocantins,Padroeira de Tocantins,,2025-09-08,Riachinho - TO,-6.4426372,-48.137969
TO,07/09/2025 - Independência do Brasil,Independência do Brasil,,2025-09-07,Riachinho - TO,-6.4426372,-48.137969
TO,01/05/2025 - Dia do Trabalho,Dia do Trabalho,,2025-05-01,Riachinho - TO,-6.4426372,-48.137969
TO,21/04/2025 - Dia de Tiradentes,Dia de Tiradentes,,2025-04-21,Riachinho - TO,-6.4426372,-48.137969
TO,18/04/2025 - Sexta-Feira Santa,Sexta-Feira Santa,,2025-04-18,Riachinho - TO,-6.4426372,-48.137969
TO,01/01/2025 - Ano Novo,Ano Novo,,2025-01-01,Riachinho - TO,-6.4426372,-48.137969
TO,25/12/2025 - Natal,Natal,,2025-12-25,Rio dos Bois - TO,-9.3412231,-48.5349207
TO,15/11/2025 - Proclamação da República,Proclamação da República,,2025-11-15,Rio dos Bois - TO,-9.3412231,-48.5349207
TO,02/11/2025 - Dia de Finados,Dia de Finados,,2025-11-02,Rio dos Bois - TO,-9.3412231,-48.5349207
TO,12/10/2025 - Nossa Senhora Aparecida,Nossa Senhora Aparecida,,2025-10-12,Rio dos Bois - TO,-9.3412231,-48.5349207
TO,05/10/2025 - Aniversário de Tocantins,Aniversário de Tocantins,,2025-10-05,Rio dos Bois - TO,-9.3412231,-48.5349207
TO,08/09/2025 - Padroeira de Tocantins,Padroeira de Tocantins,,2025-09-08,Rio dos Bois - TO,-9.3412231,-48.5349207
TO,07/09/2025 - Independência do Brasil,Independência do Brasil,,2025-09-07,Rio dos Bois - TO,-9.3412231,-48.5349207
TO,01/05/2025 - Dia do Trabalho,Dia do Trabalho,,2025-05-01,Rio dos Bois - TO,-9.3412231,-48.5349207
TO,21/04/2025 - Dia de Tiradentes,Dia de Tiradentes,,2025-04-21,Rio dos Bois - TO,-9.3412231,-48.5349207
TO,18/04/2025 - Sexta-Feira Santa,Sexta-Feira Santa,,2025-04-18,Rio dos Bois - TO,-9.3412231,-48.5349207
TO,01/01/2025 - Ano Novo,Ano Novo,,2025-01-01,Rio dos Bois - TO,-9.3412231,-48.5349207
TO,25/12/2025 - Natal,Natal,,2025-12-25,Rio Sono - TO,-9.3442508,-47.8998831
TO,15/11/2025 - Proclamação da República,Proclamação da República,,2025-11-15,Rio Sono - TO,-9.3442508,-47.8998831
TO,02/11/2025 - Dia de Finados,Dia de Finados,,2025-11-02,Rio Sono - TO,-9.3442508,-47.8998831
TO,12/10/2025 - Nossa Senhora Aparecida,Nossa Senhora Aparecida,,2025-10-12,Rio Sono - TO,-9.3442508,-47.8998831
TO,05/10/2025 - Aniversário de Tocantins,Aniversário de Tocantins,,2025-10-05,Rio Sono - TO,-9.3442508,-47.8998831
TO,08/09/2025 - Padroeira de Tocantins,Padroeira de Tocantins,,2025-09-08,Rio Sono - TO,-9.3442508,-47.8998831
TO,07/09/2025 - Independência do Brasil,Independência do Brasil,,2025-09-07,Rio Sono - TO,-9.3442508,-47.8998831
TO,01/05/2025 - Dia do Trabalho,Dia do Trabalho,,2025-05-01,Rio Sono - TO,-9.3442508,-47.8998831
TO,21/04/2025 - Dia de Tiradentes,Dia de Tiradentes,,2025-04-21,Rio Sono - TO,-9.3442508,-47.8998831
TO,18/04/2025 - Sexta-Feira Santa,Sexta-Feira Santa,,2025-04-18,Rio Sono - TO,-9.3442508,-47.8998831
TO,01/01/2025 - Ano Novo,Ano Novo,,2025-01-01,Rio Sono - TO,-9.3442508,-47.8998831
TO,25/12/2025 - Natal,Natal,,2025-12-25,Sampaio - TO,-5.3554547,-47.8750473
TO,15/11/2025 - Proclamação da República,Proclamação da República,,2025-11-15,Sampaio - TO,-5.3554547,-47.8750473
TO,02/11/2025 - Dia de Finados,Dia de Finados,,2025-11-02,Sampaio - TO,-5.3554547,-47.8750473
TO,12/10/2025 - Nossa Senhora Aparecida,Nossa Senhora Aparecida,,2025-10-12,Sampaio - TO,-5.3554547,-47.8750473
TO,05/10/2025 - Aniversário de Tocantins,Aniversário de Tocantins,,2025-10-05,Sampaio - TO,-5.3554547,-47.8750473
TO,08/09/2025 - Padroeira de Tocantins,Padroeira de Tocantins,,2025-09-08,Sampaio - TO,-5.3554547,-47.8750473
TO,07/09/2025 - Independência do Brasil,Independência do Brasil,,2025-09-07,Sampaio - TO,-5.3554547,-47.8750473
TO,01/05/2025 - Dia do Trabalho,Dia do Trabalho,,2025-05-01,Sampaio - TO,-5.3554547,-47.8750473
TO,21/04/2025 - Dia de Tiradentes,Dia de Tiradentes,,2025-04-21,Sampaio - TO,-5.3554547,-47.8750473
TO,18/04/2025 - Sexta-Feira Santa,Sexta-Feira Santa,,2025-04-18,Sampaio - TO,-5.3554547,-47.8750473
TO,01/01/2025 - Ano Novo,Ano Novo,,2025-01-01,Sampaio - TO,-5.3554547,-47.8750473
TO,25/12/2025 - Natal,Natal,,2025-12-25,Santa Maria do Tocantins - TO,-8.7752144,-47.7482956
TO,15/11/2025 - Proclamação da República,Proclamação da República,,2025-11-15,Santa Maria do Tocantins - TO,-8.7752144,-47.7482956
TO,02/11/2025 - Dia de Finados,Dia de Finados,,2025-11-02,Santa Maria do Tocantins - TO,-8.7752144,-47.7482956
TO,12/10/2025 - Nossa Senhora Aparecida,Nossa Senhora Aparecida,,2025-10-12,Santa Maria do Tocantins - TO,-8.7752144,-47.7482956
TO,05/10/2025 - Aniversário de Tocantins,Aniversário de Tocantins,,2025-10-05,Santa Maria do Tocantins - TO,-8.7752144,-47.7482956
TO,08/09/2025 - Padroeira de Tocantins,Padroeira de Tocantins,,2025-09-08,Santa Maria do Tocantins - TO,-8.7752144,-47.7482956
TO,07/09/2025 - Independência do Brasil,Independência do Brasil,,2025-09-07,Santa Maria do Tocantins - TO,-8.7752144,-47.7482956
TO,01/05/2025 - Dia do Trabalho,Dia do Trabalho,,2025-05-01,Santa Maria do Tocantins - TO,-8.7752144,-47.7482956
TO,21/04/2025 - Dia de Tiradentes,Dia de Tiradentes,,2025-04-21,Santa Maria do Tocantins - TO,-8.7752144,-47.7482956
TO,18/04/2025 - Sexta-Feira Santa,Sexta-Feira Santa,,2025-04-18,Santa Maria do Tocantins - TO,-8.7752144,-47.7482956
TO,01/01/2025 - Ano Novo,Ano Novo,,2025-01-01,Santa Maria do Tocantins - TO,-8.7752144,-47.7482956
TO,25/12/2025 - Natal,Natal,,2025-12-25,Santa Rita do Tocantins - TO,-10.8643623,-48.9082979
TO,15/11/2025 - Proclamação da República,Proclamação da República,,2025-11-15,Santa Rita do Tocantins - TO,-10.8643623,-48.9082979
TO,02/11/2025 - Dia de Finados,Dia de Finados,,2025-11-02,Santa Rita do Tocantins - TO,-10.8643623,-48.9082979
TO,12/10/2025 - Nossa Senhora Aparecida,Nossa Senhora Aparecida,,2025-10-12,Santa Rita do Tocantins - TO,-10.8643623,-48.9082979
TO,05/10/2025 - Aniversário de Tocantins,Aniversário de Tocantins,,2025-10-05,Santa Rita do Tocantins - TO,-10.8643623,-48.9082979
TO,08/09/2025 - Padroeira de Tocantins,Padroeira de Tocantins,,2025-09-08,Santa Rita do Tocantins - TO,-10.8643623,-48.9082979
TO,07/09/2025 - Independência do Brasil,Independência do Brasil,,2025-09-07,Santa Rita do Tocantins - TO,-10.8643623,-48.9082979
TO,01/05/2025 - Dia do Trabalho,Dia do Trabalho,,2025-05-01,Santa Rita do Tocantins - TO,-10.8643623,-48.9082979
TO,21/04/2025 - Dia de Tiradentes,Dia de Tiradentes,,2025-04-21,Santa Rita do Tocantins - TO,-10.8643623,-48.9082979
TO,18/04/2025 - Sexta-Feira Santa,Sexta-Feira Santa,,2025-04-18,Santa Rita do Tocantins - TO,-10.8643623,-48.9082979
TO,01/01/2025 - Ano Novo,Ano Novo,,2025-01-01,Santa Rita do Tocantins - TO,-10.8643623,-48.9082979
TO,25/12/2025 - Natal,Natal,,2025-12-25,Santa Rosa do Tocantins - TO,-11.447392,-48.121627
TO,15/11/2025 - Proclamação da República,Proclamação da República,,2025-11-15,Santa Rosa do Tocantins - TO,-11.447392,-48.121627
TO,02/11/2025 - Dia de Finados,Dia de Finados,,2025-11-02,Santa Rosa do Tocantins - TO,-11.447392,-48.121627
TO,12/10/2025 - Nossa Senhora Aparecida,Nossa Senhora Aparecida,,2025-10-12,Santa Rosa do Tocantins - TO,-11.447392,-48.121627
TO,05/10/2025 - Aniversário de Tocantins,Aniversário de Tocantins,,2025-10-05,Santa Rosa do Tocantins - TO,-11.447392,-48.121627
TO,08/09/2025 - Padroeira de Tocantins,Padroeira de Tocantins,,2025-09-08,Santa Rosa do Tocantins - TO,-11.447392,-48.121627
TO,07/09/2025 - Independência do Brasil,Independência do Brasil,,2025-09-07,Santa Rosa do Tocantins - TO,-11.447392,-48.121627
TO,01/05/2025 - Dia do Trabalho,Dia do Trabalho,,2025-05-01,Santa Rosa do Tocantins - TO,-11.447392,-48.121627
TO,21/04/2025 - Dia de Tiradentes,Dia de Tiradentes,,2025-04-21,Santa Rosa do Tocantins - TO,-11.447392,-48.121627
TO,18/04/2025 - Sexta-Feira Santa,Sexta-Feira Santa,,2025-04-18,Santa Rosa do Tocantins - TO,-11.447392,-48.121627
TO,01/01/2025 - Ano Novo,Ano Novo,,2025-01-01,Santa Rosa do Tocantins - TO,-11.447392,-48.121627
TO,25/12/2025 - Natal,Natal,,2025-12-25,Santa Tereza do Tocantins - TO,-10.2816205,-47.8091871
TO,15/11/2025 - Proclamação da República,Proclamação da República,,2025-11-15,Santa Tereza do Tocantins - TO,-10.2816205,-47.8091871
TO,02/11/2025 - Dia de Finados,Dia de Finados,,2025-11-02,Santa Tereza do Tocantins - TO,-10.2816205,-47.8091871
TO,12/10/2025 - Nossa Senhora Aparecida,Nossa Senhora Aparecida,,2025-10-12,Santa Tereza do Tocantins - TO,-10.2816205,-47.8091871
TO,05/10/2025 - Aniversário de Tocantins,Aniversário de Tocantins,,2025-10-05,Santa Tereza do Tocantins - TO,-10.2816205,-47.8091871
TO,08/09/2025 - Padroeira de Tocantins,Padroeira de Tocantins,,2025-09-08,Santa Tereza do Tocantins - TO,-10.2816205,-47.8091871
TO,07/09/2025 - Independência do Brasil,Independência do Brasil,,2025-09-07,Santa Tereza do Tocantins - TO,-10.2816205,-47.8091871
TO,01/05/2025 - Dia do Trabalho,Dia do Trabalho,,2025-05-01,Santa Tereza do Tocantins - TO,-10.2816205,-47.8091871
TO,21/04/2025 - Dia de Tiradentes,Dia de Tiradentes,,2025-04-21,Santa Tereza do Tocantins - TO,-10.2816205,-47.8091871
TO,18/04/2025 - Sexta-Feira Santa,Sexta-Feira Santa,,2025-04-18,Santa Tereza do Tocantins - TO,-10.2816205,-47.8091871
TO,01/01/2025 - Ano Novo,Ano Novo,,2025-01-01,Santa Tereza do Tocantins - TO,-10.2816205,-47.8091871
TO,25/12/2025 - Natal,Natal,,2025-12-25,Itapiratins - TO,-8.383008,-48.1039821
TO,15/11/2025 - Proclamação da República,Proclamação da República,,2025-11-15,Itapiratins - TO,-8.383008,-48.1039821
TO,02/11/2025 - Dia de Finados,Dia de Finados,,2025-11-02,Itapiratins - TO,-8.383008,-48.1039821
TO,12/10/2025 - Nossa Senhora Aparecida,Nossa Senhora Aparecida,,2025-10-12,Itapiratins - TO,-8.383008,-48.1039821
TO,05/10/2025 - Aniversário de Tocantins,Aniversário de Tocantins,,2025-10-05,Itapiratins - TO,-8.383008,-48.1039821
TO,08/09/2025 - Padroeira de Tocantins,Padroeira de Tocantins,,2025-09-08,Itapiratins - TO,-8.383008,-48.1039821
TO,07/09/2025 - Independência do Brasil,Independência do Brasil,,2025-09-07,Itapiratins - TO,-8.383008,-48.1039821
TO,01/05/2025 - Dia do Trabalho,Dia do Trabalho,,2025-05-01,Itapiratins - TO,-8.383008,-48.1039821
TO,21/04/2025 - Dia de Tiradentes,Dia de Tiradentes,,2025-04-21,Itapiratins - TO,-8.383008,-48.1039821
TO,18/04/2025 - Sexta-Feira Santa,Sexta-Feira Santa,,2025-04-18,Itapiratins - TO,-8.383008,-48.1039821
TO,01/01/2025 - Ano Novo,Ano Novo,,2025-01-01,Itapiratins - TO,-8.383008,-48.1039821
TO,25/12/2025 - Natal,Natal,,2025-12-25,Cariri do Tocantins - TO,-11.801547,-49.1213044
TO,15/11/2025 - Proclamação da República,Proclamação da República,,2025-11-15,Cariri do Tocantins - TO,-11.801547,-49.1213044
TO,02/11/2025 - Dia de Finados,Dia de Finados,,2025-11-02,Cariri do Tocantins - TO,-11.801547,-49.1213044
TO,12/10/2025 - Nossa Senhora Aparecida,Nossa Senhora Aparecida,,2025-10-12,Cariri do Tocantins - TO,-11.801547,-49.1213044
TO,05/10/2025 - Aniversário de Tocantins,Aniversário de Tocantins,,2025-10-05,Cariri do Tocantins - TO,-11.801547,-49.1213044
TO,08/09/2025 - Padroeira de Tocantins,Padroeira de Tocantins,,2025-09-08,Cariri do Tocantins - TO,-11.801547,-49.1213044
TO,07/09/2025 - Independência do Brasil,Independência do Brasil,,2025-09-07,Cariri do Tocantins - TO,-11.801547,-49.1213044
TO,01/05/2025 - Dia do Trabalho,Dia do Trabalho,,2025-05-01,Cariri do Tocantins - TO,-11.801547,-49.1213044
TO,21/04/2025 - Dia de Tiradentes,Dia de Tiradentes,,2025-04-21,Cariri do Tocantins - TO,-11.801547,-49.1213044
TO,18/04/2025 - Sexta-Feira Santa,Sexta-Feira Santa,,2025-04-18,Cariri do Tocantins - TO,-11.801547,-49.1213044
TO,01/01/2025 - Ano Novo,Ano Novo,,2025-01-01,Cariri do Tocantins - TO,-11.801547,-49.1213044
TO,25/12/2025 - Natal,Natal,,2025-12-25,Cachoeirinha - TO,-29.9500282,-51.108922
TO,15/11/2025 - Proclamação da República,Proclamação da República,,2025-11-15,Cachoeirinha - TO,-29.9500282,-51.108922
TO,02/11/2025 - Dia de Finados,Dia de Finados,,2025-11-02,Cachoeirinha - TO,-29.9500282,-51.108922
TO,12/10/2025 - Nossa Senhora Aparecida,Nossa Senhora Aparecida,,2025-10-12,Cachoeirinha - TO,-29.9500282,-51.108922
TO,05/10/2025 - Aniversário de Tocantins,Aniversário de Tocantins,,2025-10-05,Cachoeirinha - TO,-29.9500282,-51.108922
TO,08/09/2025 - Padroeira de Tocantins,Padroeira de Tocantins,,2025-09-08,Cachoeirinha - TO,-29.9500282,-51.108922
TO,07/09/2025 - Independência do Brasil,Independência do Brasil,,2025-09-07,Cachoeirinha - TO,-29.9500282,-51.108922
TO,01/05/2025 - Dia do Trabalho,Dia do Trabalho,,2025-05-01,Cachoeirinha - TO,-29.9500282,-51.108922
TO,21/04/2025 - Dia de Tiradentes,Dia de Tiradentes,,2025-04-21,Cachoeirinha - TO,-29.9500282,-51.108922
TO,18/04/2025 - Sexta-Feira Santa,Sexta-Feira Santa,,2025-04-18,Cachoeirinha - TO,-29.9500282,-51.108922
TO,01/01/2025 - Ano Novo,Ano Novo,,2025-01-01,Cachoeirinha - TO,-29.9500282,-51.108922
TO,25/12/2025 - Natal,Natal,,2025-12-25,Buriti do Tocantins - TO,-5.31694,-48.222216
TO,15/11/2025 - Proclamação da República,Proclamação da República,,2025-11-15,Buriti do Tocantins - TO,-5.31694,-48.222216
TO,02/11/2025 - Dia de Finados,Dia de Finados,,2025-11-02,Buriti do Tocantins - TO,-5.31694,-48.222216
TO,12/10/2025 - Nossa Senhora Aparecida,Nossa Senhora Aparecida,,2025-10-12,Buriti do Tocantins - TO,-5.31694,-48.222216
TO,05/10/2025 - Aniversário de Tocantins,Aniversário de Tocantins,,2025-10-05,Buriti do Tocantins - TO,-5.31694,-48.222216
TO,08/09/2025 - Padroeira de Tocantins,Padroeira de Tocantins,,2025-09-08,Buriti do Tocantins - TO,-5.31694,-48.222216
TO,07/09/2025 - Independência do Brasil,Independência do Brasil,,2025-09-07,Buriti do Tocantins - TO,-5.31694,-48.222216
TO,01/05/2025 - Dia do Trabalho,Dia do Trabalho,,2025-05-01,Buriti do Tocantins - TO,-5.31694,-48.222216
TO,21/04/2025 - Dia de Tiradentes,Dia de Tiradentes,,2025-04-21,Buriti do Tocantins - TO,-5.31694,-48.222216
TO,18/04/2025 - Sexta-Feira Santa,Sexta-Feira Santa,,2025-04-18,Buriti do Tocantins - TO,-5.31694,-48.222216
TO,01/01/2025 - Ano Novo,Ano Novo,,2025-01-01,Buriti do Tocantins - TO,-5.31694,-48.222216
TO,25/12/2025 - Natal,Natal,,2025-12-25,Bom Jesus do Tocantins - TO,-12.088669,-46.4776274
TO,15/11/2025 - Proclamação da República,Proclamação da República,,2025-11-15,Bom Jesus do Tocantins - TO,-12.088669,-46.4776274
TO,02/11/2025 - Dia de Finados,Dia de Finados,,2025-11-02,Bom Jesus do Tocantins - TO,-12.088669,-46.4776274
TO,12/10/2025 - Nossa Senhora Aparecida,Nossa Senhora Aparecida,,2025-10-12,Bom Jesus do Tocantins - TO,-12.088669,-46.4776274
TO,05/10/2025 - Aniversário de Tocantins,Aniversário de Tocantins,,2025-10-05,Bom Jesus do Tocantins - TO,-12.088669,-46.4776274
TO,08/09/2025 - Padroeira de Tocantins,Padroeira de Tocantins,,2025-09-08,Bom Jesus do Tocantins - TO,-12.088669,-46.4776274
TO,07/09/2025 - Independência do Brasil,Independência do Brasil,,2025-09-07,Bom Jesus do Tocantins - TO,-12.088669,-46.4776274
TO,01/05/2025 - Dia do Trabalho,Dia do Trabalho,,2025-05-01,Bom Jesus do Tocantins - TO,-12.088669,-46.4776274
TO,21/04/2025 - Dia de Tiradentes,Dia de Tiradentes,,2025-04-21,Bom Jesus do Tocantins - TO,-12.088669,-46.4776274
TO,18/04/2025 - Sexta-Feira Santa,Sexta-Feira Santa,,2025-04-18,Bom Jesus do Tocantins - TO,-12.088669,-46.4776274
TO,01/01/2025 - Ano Novo,Ano Novo,,2025-01-01,Bom Jesus do Tocantins - TO,-12.088669,-46.4776274
TO,25/12/2025 - Natal,Natal,,2025-12-25,Barra do Ouro - TO,-7.7113784,-47.6743925
TO,15/11/2025 - Proclamação da República,Proclamação da República,,2025-11-15,Barra do Ouro - TO,-7.7113784,-47.6743925
TO,02/11/2025 - Dia de Finados,Dia de Finados,,2025-11-02,Barra do Ouro - TO,-7.7113784,-47.6743925
TO,12/10/2025 - Nossa Senhora Aparecida,Nossa Senhora Aparecida,,2025-10-12,Barra do Ouro - TO,-7.7113784,-47.6743925
TO,05/10/2025 - Aniversário de Tocantins,Aniversário de Tocantins,,2025-10-05,Barra do Ouro - TO,-7.7113784,-47.6743925
TO,08/09/2025 - Padroeira de Tocantins,Padroeira de Tocantins,,2025-09-08,Barra do Ouro - TO,-7.7113784,-47.6743925
TO,07/09/2025 - Independência do Brasil,Independência do Brasil,,2025-09-07,Barra do Ouro - TO,-7.7113784,-47.6743925
TO,01/05/2025 - Dia do Trabalho,Dia do Trabalho,,2025-05-01,Barra do Ouro - TO,-7.7113784,-47.6743925
TO,21/04/2025 - Dia de Tiradentes,Dia de Tiradentes,,2025-04-21,Barra do Ouro - TO,-7.7113784,-47.6743925
TO,18/04/2025 - Sexta-Feira Santa,Sexta-Feira Santa,,2025-04-18,Barra do Ouro - TO,-7.7113784,-47.6743925
TO,01/01/2025 - Ano Novo,Ano Novo,,2025-01-01,Barra do Ouro - TO,-7.7113784,-47.6743925
TO,25/12/2025 - Natal,Natal,,2025-12-25,Bandeirantes do Tocantins - TO,-7.7635698,-48.579148
TO,15/11/2025 - Proclamação da República,Proclamação da República,,2025-11-15,Bandeirantes do Tocantins - TO,-7.7635698,-48.579148
TO,02/11/2025 - Dia de Finados,Dia de Finados,,2025-11-02,Bandeirantes do Tocantins - TO,-7.7635698,-48.579148
TO,12/10/2025 - Nossa Senhora Aparecida,Nossa Senhora Aparecida,,2025-10-12,Bandeirantes do Tocantins - TO,-7.7635698,-48.579148
TO,05/10/2025 - Aniversário de Tocantins,Aniversário de Tocantins,,2025-10-05,Bandeirantes do Tocantins - TO,-7.7635698,-48.579148
TO,08/09/2025 - Padroeira de Tocantins,Padroeira de Tocantins,,2025-09-08,Bandeirantes do Tocantins - TO,-7.7635698,-48.579148
TO,07/09/2025 - Independência do Brasil,Independência do Brasil,,2025-09-07,Bandeirantes do Tocantins - TO,-7.7635698,-48.579148
TO,01/05/2025 - Dia do Trabalho,Dia do Trabalho,,2025-05-01,Bandeirantes do Tocantins - TO,-7.7635698,-48.579148
TO,21/04/2025 - Dia de Tiradentes,Dia de Tiradentes,,2025-04-21,Bandeirantes do Tocantins - TO,-7.7635698,-48.579148
TO,18/04/2025 - Sexta-Feira Santa,Sexta-Feira Santa,,2025-04-18,Bandeirantes do Tocantins - TO,-7.7635698,-48.579148
TO,01/01/2025 - Ano Novo,Ano Novo,,2025-01-01,Bandeirantes do Tocantins - TO,-7.7635698,-48.579148
TO,25/12/2025 - Natal,Natal,,2025-12-25,Aurora do Tocantins - TO,-12.71045,-46.407604
TO,15/11/2025 - Proclamação da República,Proclamação da República,,2025-11-15,Aurora do Tocantins - TO,-12.71045,-46.407604
TO,02/11/2025 - Dia de Finados,Dia de Finados,,2025-11-02,Aurora do Tocantins - TO,-12.71045,-46.407604
TO,12/10/2025 - Nossa Senhora Aparecida,Nossa Senhora Aparecida,,2025-10-12,Aurora do Tocantins - TO,-12.71045,-46.407604
TO,05/10/2025 - Aniversário de Tocantins,Aniversário de Tocantins,,2025-10-05,Aurora do Tocantins - TO,-12.71045,-46.407604
TO,08/09/2025 - Padroeira de Tocantins,Padroeira de Tocantins,,2025-09-08,Aurora do Tocantins - TO,-12.71045,-46.407604
TO,07/09/2025 - Independência do Brasil,Independência do Brasil,,2025-09-07,Aurora do Tocantins - TO,-12.71045,-46.407604
TO,01/05/2025 - Dia do Trabalho,Dia do Trabalho,,2025-05-01,Aurora do Tocantins - TO,-12.71045,-46.407604
TO,21/04/2025 - Dia de Tiradentes,Dia de Tiradentes,,2025-04-21,Aurora do Tocantins - TO,-12.71045,-46.407604
TO,18/04/2025 - Sexta-Feira Santa,Sexta-Feira Santa,,2025-04-18,Aurora do Tocantins - TO,-12.71045,-46.407604
TO,01/01/2025 - Ano Novo,Ano Novo,,2025-01-01,Aurora do Tocantins - TO,-12.71045,-46.407604
TO,25/12/2025 - Natal,Natal,,2025-12-25,Arraias - TO,-12.9287788,-46.9437231
TO,20/11/2025 - Dia da Consciência Negra,Dia da Consciência Negra,,2025-11-20,Arraias - TO,-12.9287788,-46.9437231
TO,15/11/2025 - Proclamação da República,Proclamação da República,,2025-11-15,Arraias - TO,-12.9287788,-46.9437231
TO,02/11/2025 - Dia de Finados,Dia de Finados,,2025-11-02,Arraias - TO,-12.9287788,-46.9437231
TO,12/10/2025 - Nossa Senhora Aparecida,Nossa Senhora Aparecida,,2025-10-12,Arraias - TO,-12.9287788,-46.9437231
TO,05/10/2025 - Aniversário de Tocantins,Aniversário de Tocantins,,2025-10-05,Arraias - TO,-12.9287788,-46.9437231
TO,08/09/2025 - Padroeira de Tocantins,Padroeira de Tocantins,,2025-09-08,Arraias - TO,-12.9287788,-46.9437231
TO,07/09/2025 - Independência do Brasil,Independência do Brasil,,2025-09-07,Arraias - TO,-12.9287788,-46.9437231
TO,01/08/2025 - Feriado Municipal,Feriado Municipal,,2025-08-01,Arraias - TO,-12.9287788,-46.9437231
TO,01/05/2025 - Dia do Trabalho,Dia do Trabalho,,2025-05-01,Arraias - TO,-12.9287788,-46.9437231
TO,21/04/2025 - Dia de Tiradentes,Dia de Tiradentes,,2025-04-21,Arraias - TO,-12.9287788,-46.9437231
TO,18/04/2025 - Sexta-Feira Santa,Sexta-Feira Santa,,2025-04-18,Arraias - TO,-12.9287788,-46.9437231
TO,20/01/2025 - Feriado Municipal,Feriado Municipal,,2025-01-20,Arraias - TO,-12.9287788,-46.9437231
TO,01/01/2025 - Ano Novo,Ano Novo,,2025-01-01,Arraias - TO,-12.9287788,-46.9437231
TO,25/12/2025 - Natal,Natal,,2025-12-25,Arapoema - TO,-7.6572968,-49.0636996
TO,15/11/2025 - Proclamação da República,Proclamação da República,,2025-11-15,Arapoema - TO,-7.6572968,-49.0636996
TO,07/11/2025 - Feriado Municipal,Feriado Municipal,,2025-11-07,Arapoema - TO,-7.6572968,-49.0636996
TO,02/11/2025 - Dia de Finados,Dia de Finados,,2025-11-02,Arapoema - TO,-7.6572968,-49.0636996
TO,12/10/2025 - Nossa Senhora Aparecida,Nossa Senhora Aparecida,,2025-10-12,Arapoema - TO,-7.6572968,-49.0636996
TO,05/10/2025 - Aniversário de Tocantins,Aniversário de Tocantins,,2025-10-05,Arapoema - TO,-7.6572968,-49.0636996
TO,08/09/2025 - Padroeira de Tocantins,Padroeira de Tocantins,,2025-09-08,Arapoema - TO,-7.6572968,-49.0636996
TO,07/09/2025 - Independência do Brasil,Independência do Brasil,,2025-09-07,Arapoema - TO,-7.6572968,-49.0636996
TO,01/05/2025 - Dia do Trabalho,Dia do Trabalho,,2025-05-01,Arapoema - TO,-7.6572968,-49.0636996
TO,21/04/2025 - Dia de Tiradentes,Dia de Tiradentes,,2025-04-21,Arapoema - TO,-7.6572968,-49.0636996
TO,18/04/2025 - Sexta-Feira Santa,Sexta-Feira Santa,,2025-04-18,Arapoema - TO,-7.6572968,-49.0636996
TO,01/01/2025 - Ano Novo,Ano Novo,,2025-01-01,Arapoema - TO,-7.6572968,-49.0636996
TO,25/12/2025 - Natal,Natal,,2025-12-25,Araguatins - TO,-5.6497172,-48.1051003
TO,15/11/2025 - Proclamação da República,Proclamação da República,,2025-11-15,Araguatins - TO,-5.6497172,-48.1051003
TO,02/11/2025 - Dia de Finados,Dia de Finados,,2025-11-02,Araguatins - TO,-5.6497172,-48.1051003
TO,12/10/2025 - Nossa Senhora Aparecida,Nossa Senhora Aparecida,,2025-10-12,Araguatins - TO,-5.6497172,-48.1051003
TO,05/10/2025 - Aniversário de Tocantins,Aniversário de Tocantins,,2025-10-05,Araguatins - TO,-5.6497172,-48.1051003
TO,08/09/2025 - Padroeira de Tocantins,Padroeira de Tocantins,,2025-09-08,Araguatins - TO,-5.6497172,-48.1051003
TO,07/09/2025 - Independência do Brasil,Independência do Brasil,,2025-09-07,Araguatins - TO,-5.6497172,-48.1051003
TO,15/08/2025 - Feriado Municipal,Feriado Municipal,,2025-08-15,Araguatins - TO,-5.6497172,-48.1051003
TO,09/06/2025 - Feriado Municipal,Feriado Municipal,,2025-06-09,Araguatins - TO,-5.6497172,-48.1051003
TO,01/05/2025 - Dia do Trabalho,Dia do Trabalho,,2025-05-01,Araguatins - TO,-5.6497172,-48.1051003
TO,21/04/2025 - Dia de Tiradentes,Dia de Tiradentes,,2025-04-21,Araguatins - TO,-5.6497172,-48.1051003
TO,18/04/2025 - Sexta-Feira Santa,Sexta-Feira Santa,,2025-04-18,Araguatins - TO,-5.6497172,-48.1051003
TO,01/01/2025 - Ano Novo,Ano Novo,,2025-01-01,Araguatins - TO,-5.6497172,-48.1051003
TO,25/12/2025 - Natal,Natal,,2025-12-25,Itaguatins - TO,-5.7696766,-47.4815382
TO,15/11/2025 - Proclamação da República,Proclamação da República,,2025-11-15,Itaguatins - TO,-5.7696766,-47.4815382
TO,02/11/2025 - Dia de Finados,Dia de Finados,,2025-11-02,Itaguatins - TO,-5.7696766,-47.4815382
TO,12/10/2025 - Nossa Senhora Aparecida,Nossa Senhora Aparecida,,2025-10-12,Itaguatins - TO,-5.7696766,-47.4815382
TO,05/10/2025 - Aniversário de Tocantins,Aniversário de Tocantins,,2025-10-05,Itaguatins - TO,-5.7696766,-47.4815382
TO,08/09/2025 - Padroeira de Tocantins,Padroeira de Tocantins,,2025-09-08,Itaguatins - TO,-5.7696766,-47.4815382
TO,07/09/2025 - Independência do Brasil,Independência do Brasil,,2025-09-07,Itaguatins - TO,-5.7696766,-47.4815382
TO,01/05/2025 - Dia do Trabalho,Dia do Trabalho,,2025-05-01,Itaguatins - TO,-5.7696766,-47.4815382
TO,21/04/2025 - Dia de Tiradentes,Dia de Tiradentes,,2025-04-21,Itaguatins - TO,-5.7696766,-47.4815382
TO,18/04/2025 - Sexta-Feira Santa,Sexta-Feira Santa,,2025-04-18,Itaguatins - TO,-5.7696766,-47.4815382
TO,01/01/2025 - Ano Novo,Ano Novo,,2025-01-01,Itaguatins - TO,-5.7696766,-47.4815382
TO,25/12/2025 - Natal,Natal,,2025-12-25,Araguacema - TO,-9.0015655,-49.4566382
TO,15/11/2025 - Proclamação da República,Proclamação da República,,2025-11-15,Araguacema - TO,-9.0015655,-49.4566382
TO,02/11/2025 - Dia de Finados,Dia de Finados,,2025-11-02,Araguacema - TO,-9.0015655,-49.4566382
TO,12/10/2025 - Nossa Senhora Aparecida,Nossa Senhora Aparecida,,2025-10-12,Araguacema - TO,-9.0015655,-49.4566382
TO,05/10/2025 - Aniversário de Tocantins,Aniversário de Tocantins,,2025-10-05,Araguacema - TO,-9.0015655,-49.4566382
TO,08/09/2025 - Padroeira de Tocantins,Padroeira de Tocantins,,2025-09-08,Araguacema - TO,-9.0015655,-49.4566382
TO,07/09/2025 - Independência do Brasil,Independência do Brasil,,2025-09-07,Araguacema - TO,-9.0015655,-49.4566382
TO,01/05/2025 - Dia do Trabalho,Dia do Trabalho,,2025-05-01,Araguacema - TO,-9.0015655,-49.4566382
TO,21/04/2025 - Dia de Tiradentes,Dia de Tiradentes,,2025-04-21,Araguacema - TO,-9.0015655,-49.4566382
TO,18/04/2025 - Sexta-Feira Santa,Sexta-Feira Santa,,2025-04-18,Araguacema - TO,-9.0015655,-49.4566382
TO,01/01/2025 - Ano Novo,Ano Novo,,2025-01-01,Araguacema - TO,-9.0015655,-49.4566382
TO,25/12/2025 - Natal,Natal,,2025-12-25,Aragominas - TO,-7.1654101,-48.525488
TO,15/11/2025 - Proclamação da República,Proclamação da República,,2025-11-15,Aragominas - TO,-7.1654101,-48.525488
TO,02/11/2025 - Dia de Finados,Dia de Finados,,2025-11-02,Aragominas - TO,-7.1654101,-48.525488
TO,12/10/2025 - Nossa Senhora Aparecida,Nossa Senhora Aparecida,,2025-10-12,Aragominas - TO,-7.1654101,-48.525488
TO,05/10/2025 - Aniversário de Tocantins,Aniversário de Tocantins,,2025-10-05,Aragominas - TO,-7.1654101,-48.525488
TO,08/09/2025 - Padroeira de Tocantins,Padroeira de Tocantins,,2025-09-08,Aragominas - TO,-7.1654101,-48.525488
TO,07/09/2025 - Independência do Brasil,Independência do Brasil,,2025-09-07,Aragominas - TO,-7.1654101,-48.525488
TO,01/05/2025 - Dia do Trabalho,Dia do Trabalho,,2025-05-01,Aragominas - TO,-7.1654101,-48.525488
TO,21/04/2025 - Dia de Tiradentes,Dia de Tiradentes,,2025-04-21,Aragominas - TO,-7.1654101,-48.525488
TO,18/04/2025 - Sexta-Feira Santa,Sexta-Feira Santa,,2025-04-18,Aragominas - TO,-7.1654101,-48.525488
TO,01/01/2025 - Ano Novo,Ano Novo,,2025-01-01,Aragominas - TO,-7.1654101,-48.525488
TO,25/12/2025 - Natal,Natal,,2025-12-25,Aparecida do Rio Negro - TO,-9.9513491,-47.9773786
TO,15/11/2025 - Proclamação da República,Proclamação da República,,2025-11-15,Aparecida do Rio Negro - TO,-9.9513491,-47.9773786
TO,02/11/2025 - Dia de Finados,Dia de Finados,,2025-11-02,Aparecida do Rio Negro - TO,-9.9513491,-47.9773786
TO,12/10/2025 - Nossa Senhora Aparecida,Nossa Senhora Aparecida,,2025-10-12,Aparecida do Rio Negro - TO,-9.9513491,-47.9773786
TO,05/10/2025 - Aniversário de Tocantins,Aniversário de Tocantins,,2025-10-05,Aparecida do Rio Negro - TO,-9.9513491,-47.9773786
TO,08/09/2025 - Padroeira de Tocantins,Padroeira de Tocantins,,2025-09-08,Aparecida do Rio Negro - TO,-9.9513491,-47.9773786
TO,07/09/2025 - Independência do Brasil,Independência do Brasil,,2025-09-07,Aparecida do Rio Negro - TO,-9.9513491,-47.9773786
TO,01/05/2025 - Dia do Trabalho,Dia do Trabalho,,2025-05-01,Aparecida do Rio Negro - TO,-9.9513491,-47.9773786
TO,21/04/2025 - Dia de Tiradentes,Dia de Tiradentes,,2025-04-21,Aparecida do Rio Negro - TO,-9.9513491,-47.9773786
TO,18/04/2025 - Sexta-Feira Santa,Sexta-Feira Santa,,2025-04-18,Aparecida do Rio Negro - TO,-9.9513491,-47.9773786
TO,01/01/2025 - Ano Novo,Ano Novo,,2025-01-01,Aparecida do Rio Negro - TO,-9.9513491,-47.9773786
TO,25/12/2025 - Natal,Natal,,2025-12-25,Angico - TO,-6.3893733,-47.8656722
TO,15/11/2025 - Proclamação da República,Proclamação da República,,2025-11-15,Angico - TO,-6.3893733,-47.8656722
TO,02/11/2025 - Dia de Finados,Dia de Finados,,2025-11-02,Angico - TO,-6.3893733,-47.8656722
TO,12/10/2025 - Nossa Senhora Aparecida,Nossa Senhora Aparecida,,2025-10-12,Angico - TO,-6.3893733,-47.8656722
TO,05/10/2025 - Aniversário de Tocantins,Aniversário de Tocantins,,2025-10-05,Angico - TO,-6.3893733,-47.8656722
TO,08/09/2025 - Padroeira de Tocantins,Padroeira de Tocantins,,2025-09-08,Angico - TO,-6.3893733,-47.8656722
TO,07/09/2025 - Independência do Brasil,Independência do Brasil,,2025-09-07,Angico - TO,-6.3893733,-47.8656722
TO,01/05/2025 - Dia do Trabalho,Dia do Trabalho,,2025-05-01,Angico - TO,-6.3893733,-47.8656722
TO,21/04/2025 - Dia de Tiradentes,Dia de Tiradentes,,2025-04-21,Angico - TO,-6.3893733,-47.8656722
TO,18/04/2025 - Sexta-Feira Santa,Sexta-Feira Santa,,2025-04-18,Angico - TO,-6.3893733,-47.8656722
TO,01/01/2025 - Ano Novo,Ano Novo,,2025-01-01,Angico - TO,-6.3893733,-47.8656722
TO,25/12/2025 - Natal,Natal,,2025-12-25,Alvorada - TO,-12.478465,-49.124926
TO,15/11/2025 - Proclamação da República,Proclamação da República,,2025-11-15,Alvorada - TO,-12.478465,-49.124926
TO,02/11/2025 - Dia de Finados,Dia de Finados,,2025-11-02,Alvorada - TO,-12.478465,-49.124926
TO,12/10/2025 - Nossa Senhora Aparecida,Nossa Senhora Aparecida,,2025-10-12,Alvorada - TO,-12.478465,-49.124926
TO,05/10/2025 - Aniversário de Tocantins,Aniversário de Tocantins,,2025-10-05,Alvorada - TO,-12.478465,-49.124926
TO,08/09/2025 - Padroeira de Tocantins,Padroeira de Tocantins,,2025-09-08,Alvorada - TO,-12.478465,-49.124926
TO,07/09/2025 - Independência do Brasil,Independência do Brasil,,2025-09-07,Alvorada - TO,-12.478465,-49.124926
TO,01/05/2025 - Dia do Trabalho,Dia do Trabalho,,2025-05-01,Alvorada - TO,-12.478465,-49.124926
TO,21/04/2025 - Dia de Tiradentes,Dia de Tiradentes,,2025-04-21,Alvorada - TO,-12.478465,-49.124926
TO,18/04/2025 - Sexta-Feira Santa,Sexta-Feira Santa,,2025-04-18,Alvorada - TO,-12.478465,-49.124926
TO,01/01/2025 - Ano Novo,Ano Novo,,2025-01-01,Alvorada - TO,-12.478465,-49.124926
TO,25/12/2025 - Natal,Natal,,2025-12-25,Almas - TO,-11.5681309,-47.1702803
TO,10/12/2025 - Feriado Municipal,Feriado Municipal,,2025-12-10,Almas - TO,-11.5681309,-47.1702803
TO,15/11/2025 - Proclamação da República,Proclamação da República,,2025-11-15,Almas - TO,-11.5681309,-47.1702803
TO,14/11/2025 - Feriado Municipal,Feriado Municipal,,2025-11-14,Almas - TO,-11.5681309,-47.1702803
TO,02/11/2025 - Dia de Finados,Dia de Finados,,2025-11-02,Almas - TO,-11.5681309,-47.1702803
TO,12/10/2025 - Nossa Senhora Aparecida,Nossa Senhora Aparecida,,2025-10-12,Almas - TO,-11.5681309,-47.1702803
TO,05/10/2025 - Aniversário de Tocantins,Aniversário de Tocantins,,2025-10-05,Almas - TO,-11.5681309,-47.1702803
TO,08/09/2025 - Padroeira de Tocantins,Padroeira de Tocantins,,2025-09-08,Almas - TO,-11.5681309,-47.1702803
TO,07/09/2025 - Independência do Brasil,Independência do Brasil,,2025-09-07,Almas - TO,-11.5681309,-47.1702803
TO,18/05/2025 - Feriado Municipal,Feriado Municipal,,2025-05-18,Almas - TO,-11.5681309,-47.1702803
TO,17/05/2025 - Feriado Municipal,Feriado Municipal,,2025-05-17,Almas - TO,-11.5681309,-47.1702803
TO,01/05/2025 - Dia do Trabalho,Dia do Trabalho,,2025-05-01,Almas - TO,-11.5681309,-47.1702803
TO,21/04/2025 - Dia de Tiradentes,Dia de Tiradentes,,2025-04-21,Almas - TO,-11.5681309,-47.1702803
TO,18/04/2025 - Sexta-Feira Santa,Sexta-Feira Santa,,2025-04-18,Almas - TO,-11.5681309,-47.1702803
TO,01/01/2025 - Ano Novo,Ano Novo,,2025-01-01,Almas - TO,-11.5681309,-47.1702803
TO,25/12/2025 - Natal,Natal,,2025-12-25,Campos Lindos - TO,-7.9740597,-46.8023881
TO,15/11/2025 - Proclamação da República,Proclamação da República,,2025-11-15,Campos Lindos - TO,-7.9740597,-46.8023881
TO,02/11/2025 - Dia de Finados,Dia de Finados,,2025-11-02,Campos Lindos - TO,-7.9740597,-46.8023881
TO,12/10/2025 - Nossa Senhora Aparecida,Nossa Senhora Aparecida,,2025-10-12,Campos Lindos - TO,-7.9740597,-46.8023881
TO,05/10/2025 - Aniversário de Tocantins,Aniversário de Tocantins,,2025-10-05,Campos Lindos - TO,-7.9740597,-46.8023881
TO,08/09/2025 - Padroeira de Tocantins,Padroeira de Tocantins,,2025-09-08,Campos Lindos - TO,-7.9740597,-46.8023881
TO,07/09/2025 - Independência do Brasil,Independência do Brasil,,2025-09-07,Campos Lindos - TO,-7.9740597,-46.8023881
TO,01/05/2025 - Dia do Trabalho,Dia do Trabalho,,2025-05-01,Campos Lindos - TO,-7.9740597,-46.8023881
TO,21/04/2025 - Dia de Tiradentes,Dia de Tiradentes,,2025-04-21,Campos Lindos - TO,-7.9740597,-46.8023881
TO,18/04/2025 - Sexta-Feira Santa,Sexta-Feira Santa,,2025-04-18,Campos Lindos - TO,-7.9740597,-46.8023881
TO,01/01/2025 - Ano Novo,Ano Novo,,2025-01-01,Campos Lindos - TO,-7.9740597,-46.8023881
TO,25/12/2025 - Natal,Natal,,2025-12-25,Carrasco Bonito - TO,-5.3205734,-48.0376667
TO,15/11/2025 - Proclamação da República,Proclamação da República,,2025-11-15,Carrasco Bonito - TO,-5.3205734,-48.0376667
TO,02/11/2025 - Dia de Finados,Dia de Finados,,2025-11-02,Carrasco Bonito - TO,-5.3205734,-48.0376667
TO,12/10/2025 - Nossa Senhora Aparecida,Nossa Senhora Aparecida,,2025-10-12,Carrasco Bonito - TO,-5.3205734,-48.0376667
TO,05/10/2025 - Aniversário de Tocantins,Aniversário de Tocantins,,2025-10-05,Carrasco Bonito - TO,-5.3205734,-48.0376667
TO,08/09/2025 - Padroeira de Tocantins,Padroeira de Tocantins,,2025-09-08,Carrasco Bonito - TO,-5.3205734,-48.0376667
TO,07/09/2025 - Independência do Brasil,Independência do Brasil,,2025-09-07,Carrasco Bonito - TO,-5.3205734,-48.0376667
TO,01/05/2025 - Dia do Trabalho,Dia do Trabalho,,2025-05-01,Carrasco Bonito - TO,-5.3205734,-48.0376667
TO,21/04/2025 - Dia de Tiradentes,Dia de Tiradentes,,2025-04-21,Carrasco Bonito - TO,-5.3205734,-48.0376667
TO,18/04/2025 - Sexta-Feira Santa,Sexta-Feira Santa,,2025-04-18,Carrasco Bonito - TO,-5.3205734,-48.0376667
TO,01/01/2025 - Ano Novo,Ano Novo,,2025-01-01,Carrasco Bonito - TO,-5.3205734,-48.0376667
TO,25/12/2025 - Natal,Natal,,2025-12-25,Ipueiras - TO,-11.2408008,-48.4438878
TO,15/11/2025 - Proclamação da República,Proclamação da República,,2025-11-15,Ipueiras - TO,-11.2408008,-48.4438878
TO,02/11/2025 - Dia de Finados,Dia de Finados,,2025-11-02,Ipueiras - TO,-11.2408008,-48.4438878
TO,12/10/2025 - Nossa Senhora Aparecida,Nossa Senhora Aparecida,,2025-10-12,Ipueiras - TO,-11.2408008,-48.4438878
TO,05/10/2025 - Aniversário de Tocantins,Aniversário de Tocantins,,2025-10-05,Ipueiras - TO,-11.2408008,-48.4438878
TO,08/09/2025 - Padroeira de Tocantins,Padroeira de Tocantins,,2025-09-08,Ipueiras - TO,-11.2408008,-48.4438878
TO,07/09/2025 - Independência do Brasil,Independência do Brasil,,2025-09-07,Ipueiras - TO,-11.2408008,-48.4438878
TO,01/05/2025 - Dia do Trabalho,Dia do Trabalho,,2025-05-01,Ipueiras - TO,-11.2408008,-48.4438878
TO,21/04/2025 - Dia de Tiradentes,Dia de Tiradentes,,2025-04-21,Ipueiras - TO,-11.2408008,-48.4438878
TO,18/04/2025 - Sexta-Feira Santa,Sexta-Feira Santa,,2025-04-18,Ipueiras - TO,-11.2408008,-48.4438878
TO,01/01/2025 - Ano Novo,Ano Novo,,2025-01-01,Ipueiras - TO,-11.2408008,-48.4438878
TO,25/12/2025 - Natal,Natal,,2025-12-25,Gurupi - TO,-11.736883,-49.0693812
TO,30/11/2025 - Feriado Municipal,Feriado Municipal,,2025-11-30,Gurupi - TO,-11.736883,-49.0693812
TO,15/11/2025 - Proclamação da República,Proclamação da República,,2025-11-15,Gurupi - TO,-11.736883,-49.0693812
TO,14/11/2025 - Aniversário,Aniversário,,2025-11-14,Gurupi - TO,-11.736883,-49.0693812
TO,02/11/2025 - Dia de Finados,Dia de Finados,,2025-11-02,Gurupi - TO,-11.736883,-49.0693812
TO,12/10/2025 - Nossa Senhora Aparecida,Nossa Senhora Aparecida,,2025-10-12,Gurupi - TO,-11.736883,-49.0693812
TO,05/10/2025 - Aniversário de Tocantins,Aniversário de Tocantins,,2025-10-05,Gurupi - TO,-11.736883,-49.0693812
TO,27/09/2025 - Dia do Evangélico,Dia do Evangélico,,2025-09-27,Gurupi - TO,-11.736883,-49.0693812
TO,08/09/2025 - Padroeira de Tocantins,Padroeira de Tocantins,,2025-09-08,Gurupi - TO,-11.736883,-49.0693812
TO,07/09/2025 - Independência do Brasil,Independência do Brasil,,2025-09-07,Gurupi - TO,-11.736883,-49.0693812
TO,13/06/2025 - Padroeiro,Padroeiro,,2025-06-13,Gurupi - TO,-11.736883,-49.0693812
TO,01/05/2025 - Dia do Trabalho,Dia do Trabalho,,2025-05-01,Gurupi - TO,-11.736883,-49.0693812
TO,21/04/2025 - Dia de Tiradentes,Dia de Tiradentes,,2025-04-21,Gurupi - TO,-11.736883,-49.0693812
TO,18/04/2025 - Sexta-Feira Santa,Sexta-Feira Santa,,2025-04-18,Gurupi - TO,-11.736883,-49.0693812
TO,01/01/2025 - Ano Novo,Ano Novo,,2025-01-01,Gurupi - TO,-11.736883,-49.0693812
TO,25/12/2025 - Natal,Natal,,2025-12-25,Goiatins - TO,-7.7132054,-47.3154841
TO,15/11/2025 - Proclamação da República,Proclamação da República,,2025-11-15,Goiatins - TO,-7.7132054,-47.3154841
TO,02/11/2025 - Dia de Finados,Dia de Finados,,2025-11-02,Goiatins - TO,-7.7132054,-47.3154841
TO,12/10/2025 - Nossa Senhora Aparecida,Nossa Senhora Aparecida,,2025-10-12,Goiatins - TO,-7.7132054,-47.3154841
TO,05/10/2025 - Aniversário de Tocantins,Aniversário de Tocantins,,2025-10-05,Goiatins - TO,-7.7132054,-47.3154841
TO,08/09/2025 - Padroeira de Tocantins,Padroeira de Tocantins,,2025-09-08,Goiatins - TO,-7.7132054,-47.3154841
TO,07/09/2025 - Independência do Brasil,Independência do Brasil,,2025-09-07,Goiatins - TO,-7.7132054,-47.3154841
TO,01/05/2025 - Dia do Trabalho,Dia do Trabalho,,2025-05-01,Goiatins - TO,-7.7132054,-47.3154841
TO,21/04/2025 - Dia de Tiradentes,Dia de Tiradentes,,2025-04-21,Goiatins - TO,-7.7132054,-47.3154841
TO,18/04/2025 - Sexta-Feira Santa,Sexta-Feira Santa,,2025-04-18,Goiatins - TO,-7.7132054,-47.3154841
TO,01/01/2025 - Ano Novo,Ano Novo,,2025-01-01,Goiatins - TO,-7.7132054,-47.3154841
TO,25/12/2025 - Natal,Natal,,2025-12-25,Formoso do Araguaia - TO,-11.8059989,-49.5257153
TO,15/11/2025 - Proclamação da República,Proclamação da República,,2025-11-15,Formoso do Araguaia - TO,-11.8059989,-49.5257153
TO,02/11/2025 - Dia de Finados,Dia de Finados,,2025-11-02,Formoso do Araguaia - TO,-11.8059989,-49.5257153
TO,12/10/2025 - Nossa Senhora Aparecida,Nossa Senhora Aparecida,,2025-10-12,Formoso do Araguaia - TO,-11.8059989,-49.5257153
TO,05/10/2025 - Aniversário de Tocantins,Aniversário de Tocantins,,2025-10-05,Formoso do Araguaia - TO,-11.8059989,-49.5257153
TO,08/09/2025 - Padroeira de Tocantins,Padroeira de Tocantins,,2025-09-08,Formoso do Araguaia - TO,-11.8059989,-49.5257153
TO,07/09/2025 - Independência do Brasil,Independência do Brasil,,2025-09-07,Formoso do Araguaia - TO,-11.8059989,-49.5257153
TO,23/08/2025 - Feriado Municipal,Feriado Municipal,,2025-08-23,Formoso do Araguaia - TO,-11.8059989,-49.5257153
TO,24/06/2025 - Feriado Municipal,Feriado Municipal,,2025-06-24,Formoso do Araguaia - TO,-11.8059989,-49.5257153
TO,01/05/2025 - Dia do Trabalho,Dia do Trabalho,,2025-05-01,Formoso do Araguaia - TO,-11.8059989,-49.5257153
TO,21/04/2025 - Dia de Tiradentes,Dia de Tiradentes,,2025-04-21,Formoso do Araguaia - TO,-11.8059989,-49.5257153
TO,18/04/2025 - Sexta-Feira Santa,Sexta-Feira Santa,,2025-04-18,Formoso do Araguaia - TO,-11.8059989,-49.5257153
TO,01/01/2025 - Ano Novo,Ano Novo,,2025-01-01,Formoso do Araguaia - TO,-11.8059989,-49.5257153
TO,25/12/2025 - Natal,Natal,,2025-12-25,Esperantina - TO,-5.3658232,-48.5368181
TO,15/11/2025 - Proclamação da República,Proclamação da República,,2025-11-15,Esperantina - TO,-5.3658232,-48.5368181
TO,02/11/2025 - Dia de Finados,Dia de Finados,,2025-11-02,Esperantina - TO,-5.3658232,-48.5368181
TO,12/10/2025 - Nossa Senhora Aparecida,Nossa Senhora Aparecida,,2025-10-12,Esperantina - TO,-5.3658232,-48.5368181
TO,05/10/2025 - Aniversário de Tocantins,Aniversário de Tocantins,,2025-10-05,Esperantina - TO,-5.3658232,-48.5368181
TO,08/09/2025 - Padroeira de Tocantins,Padroeira de Tocantins,,2025-09-08,Esperantina - TO,-5.3658232,-48.5368181
TO,07/09/2025 - Independência do Brasil,Independência do Brasil,,2025-09-07,Esperantina - TO,-5.3658232,-48.5368181
TO,01/05/2025 - Dia do Trabalho,Dia do Trabalho,,2025-05-01,Esperantina - TO,-5.3658232,-48.5368181
TO,21/04/2025 - Dia de Tiradentes,Dia de Tiradentes,,2025-04-21,Esperantina - TO,-5.3658232,-48.5368181
TO,18/04/2025 - Sexta-Feira Santa,Sexta-Feira Santa,,2025-04-18,Esperantina - TO,-5.3658232,-48.5368181
TO,01/01/2025 - Ano Novo,Ano Novo,,2025-01-01,Esperantina - TO,-5.3658232,-48.5368181
TO,25/12/2025 - Natal,Natal,,2025-12-25,Goianorte - TO,-8.77017,-48.936772
TO,15/11/2025 - Proclamação da República,Proclamação da República,,2025-11-15,Goianorte - TO,-8.77017,-48.936772
TO,02/11/2025 - Dia de Finados,Dia de Finados,,2025-11-02,Goianorte - TO,-8.77017,-48.936772
TO,12/10/2025 - Nossa Senhora Aparecida,Nossa Senhora Aparecida,,2025-10-12,Goianorte - TO,-8.77017,-48.936772
TO,05/10/2025 - Aniversário de Tocantins,Aniversário de Tocantins,,2025-10-05,Goianorte - TO,-8.77017,-48.936772
TO,08/09/2025 - Padroeira de Tocantins,Padroeira de Tocantins,,2025-09-08,Goianorte - TO,-8.77017,-48.936772
TO,07/09/2025 - Independência do Brasil,Independência do Brasil,,2025-09-07,Goianorte - TO,-8.77017,-48.936772
TO,01/05/2025 - Dia do Trabalho,Dia do Trabalho,,2025-05-01,Goianorte - TO,-8.77017,-48.936772
TO,21/04/2025 - Dia de Tiradentes,Dia de Tiradentes,,2025-04-21,Goianorte - TO,-8.77017,-48.936772
TO,18/04/2025 - Sexta-Feira Santa,Sexta-Feira Santa,,2025-04-18,Goianorte - TO,-8.77017,-48.936772
TO,01/01/2025 - Ano Novo,Ano Novo,,2025-01-01,Goianorte - TO,-8.77017,-48.936772
TO,25/12/2025 - Natal,Natal,,2025-12-25,Chapada de Areia - TO,-10.1417377,-49.1781853
TO,15/11/2025 - Proclamação da República,Proclamação da República,,2025-11-15,Chapada de Areia - TO,-10.1417377,-49.1781853
TO,02/11/2025 - Dia de Finados,Dia de Finados,,2025-11-02,Chapada de Areia - TO,-10.1417377,-49.1781853
TO,12/10/2025 - Nossa Senhora Aparecida,Nossa Senhora Aparecida,,2025-10-12,Chapada de Areia - TO,-10.1417377,-49.1781853
TO,05/10/2025 - Aniversário de Tocantins,Aniversário de Tocantins,,2025-10-05,Chapada de Areia - TO,-10.1417377,-49.1781853
TO,08/09/2025 - Padroeira de Tocantins,Padroeira de Tocantins,,2025-09-08,Chapada de Areia - TO,-10.1417377,-49.1781853
TO,07/09/2025 - Independência do Brasil,Independência do Brasil,,2025-09-07,Chapada de Areia - TO,-10.1417377,-49.1781853
TO,01/05/2025 - Dia do Trabalho,Dia do Trabalho,,2025-05-01,Chapada de Areia - TO,-10.1417377,-49.1781853
TO,21/04/2025 - Dia de Tiradentes,Dia de Tiradentes,,2025-04-21,Chapada de Areia - TO,-10.1417377,-49.1781853
TO,18/04/2025 - Sexta-Feira Santa,Sexta-Feira Santa,,2025-04-18,Chapada de Areia - TO,-10.1417377,-49.1781853
TO,01/01/2025 - Ano Novo,Ano Novo,,2025-01-01,Chapada de Areia - TO,-10.1417377,-49.1781853
TO,25/12/2025 - Natal,Natal,,2025-12-25,Combinado - TO,-12.8136581,-46.5461041
TO,15/11/2025 - Proclamação da República,Proclamação da República,,2025-11-15,Combinado - TO,-12.8136581,-46.5461041
TO,02/11/2025 - Dia de Finados,Dia de Finados,,2025-11-02,Combinado - TO,-12.8136581,-46.5461041
TO,12/10/2025 - Nossa Senhora Aparecida,Nossa Senhora Aparecida,,2025-10-12,Combinado - TO,-12.8136581,-46.5461041
TO,05/10/2025 - Aniversário de Tocantins,Aniversário de Tocantins,,2025-10-05,Combinado - TO,-12.8136581,-46.5461041
TO,08/09/2025 - Padroeira de Tocantins,Padroeira de Tocantins,,2025-09-08,Combinado - TO,-12.8136581,-46.5461041
TO,07/09/2025 - Independência do Brasil,Independência do Brasil,,2025-09-07,Combinado - TO,-12.8136581,-46.5461041
TO,01/06/2025 - Feriado Municipal,Feriado Municipal,,2025-06-01,Combinado - TO,-12.8136581,-46.5461041
TO,01/05/2025 - Dia do Trabalho,Dia do Trabalho,,2025-05-01,Combinado - TO,-12.8136581,-46.5461041
TO,21/04/2025 - Dia de Tiradentes,Dia de Tiradentes,,2025-04-21,Combinado - TO,-12.8136581,-46.5461041
TO,18/04/2025 - Sexta-Feira Santa,Sexta-Feira Santa,,2025-04-18,Combinado - TO,-12.8136581,-46.5461041
TO,01/01/2025 - Ano Novo,Ano Novo,,2025-01-01,Combinado - TO,-12.8136581,-46.5461041
TO,25/12/2025 - Natal,Natal,,2025-12-25,Chapada da Natividade - TO,-11.613585,-47.7467147
TO,15/11/2025 - Proclamação da República,Proclamação da República,,2025-11-15,Chapada da Natividade - TO,-11.613585,-47.7467147
TO,02/11/2025 - Dia de Finados,Dia de Finados,,2025-11-02,Chapada da Natividade - TO,-11.613585,-47.7467147
TO,12/10/2025 - Nossa Senhora Aparecida,Nossa Senhora Aparecida,,2025-10-12,Chapada da Natividade - TO,-11.613585,-47.7467147
TO,05/10/2025 - Aniversário de Tocantins,Aniversário de Tocantins,,2025-10-05,Chapada da Natividade - TO,-11.613585,-47.7467147
TO,08/09/2025 - Padroeira de Tocantins,Padroeira de Tocantins,,2025-09-08,Chapada da Natividade - TO,-11.613585,-47.7467147
TO,07/09/2025 - Independência do Brasil,Independência do Brasil,,2025-09-07,Chapada da Natividade - TO,-11.613585,-47.7467147
TO,01/05/2025 - Dia do Trabalho,Dia do Trabalho,,2025-05-01,Chapada da Natividade - TO,-11.613585,-47.7467147
TO,21/04/2025 - Dia de Tiradentes,Dia de Tiradentes,,2025-04-21,Chapada da Natividade - TO,-11.613585,-47.7467147
TO,18/04/2025 - Sexta-Feira Santa,Sexta-Feira Santa,,2025-04-18,Chapada da Natividade - TO,-11.613585,-47.7467147
TO,01/01/2025 - Ano Novo,Ano Novo,,2025-01-01,Chapada da Natividade - TO,-11.613585,-47.7467147
TO,25/12/2025 - Natal,Natal,,2025-12-25,Caseara - TO,-9.2752635,-49.9549385
TO,15/11/2025 - Proclamação da República,Proclamação da República,,2025-11-15,Caseara - TO,-9.2752635,-49.9549385
TO,02/11/2025 - Dia de Finados,Dia de Finados,,2025-11-02,Caseara - TO,-9.2752635,-49.9549385
TO,12/10/2025 - Nossa Senhora Aparecida,Nossa Senhora Aparecida,,2025-10-12,Caseara - TO,-9.2752635,-49.9549385
TO,05/10/2025 - Aniversário de Tocantins,Aniversário de Tocantins,,2025-10-05,Caseara - TO,-9.2752635,-49.9549385
TO,08/09/2025 - Padroeira de Tocantins,Padroeira de Tocantins,,2025-09-08,Caseara - TO,-9.2752635,-49.9549385
TO,07/09/2025 - Independência do Brasil,Independência do Brasil,,2025-09-07,Caseara - TO,-9.2752635,-49.9549385
TO,01/05/2025 - Dia do Trabalho,Dia do Trabalho,,2025-05-01,Caseara - TO,-9.2752635,-49.9549385
TO,21/04/2025 - Dia de Tiradentes,Dia de Tiradentes,,2025-04-21,Caseara - TO,-9.2752635,-49.9549385
TO,18/04/2025 - Sexta-Feira Santa,Sexta-Feira Santa,,2025-04-18,Caseara - TO,-9.2752635,-49.9549385
TO,01/01/2025 - Ano Novo,Ano Novo,,2025-01-01,Caseara - TO,-9.2752635,-49.9549385
TO,25/12/2025 - Natal,Natal,,2025-12-25,Colinas do Tocantins - TO,-8.0651206,-48.469509
TO,15/11/2025 - Proclamação da República,Proclamação da República,,2025-11-15,Colinas do Tocantins - TO,-8.0651206,-48.469509
TO,02/11/2025 - Dia de Finados,Dia de Finados,,2025-11-02,Colinas do Tocantins - TO,-8.0651206,-48.469509
TO,31/10/2025 - Feriado Municipal,Feriado Municipal,,2025-10-31,Colinas do Tocantins - TO,-8.0651206,-48.469509
TO,12/10/2025 - Nossa Senhora Aparecida,Nossa Senhora Aparecida,,2025-10-12,Colinas do Tocantins - TO,-8.0651206,-48.469509
TO,05/10/2025 - Aniversário de Tocantins,Aniversário de Tocantins,,2025-10-05,Colinas do Tocantins - TO,-8.0651206,-48.469509
TO,08/09/2025 - Padroeira de Tocantins,Padroeira de Tocantins,,2025-09-08,Colinas do Tocantins - TO,-8.0651206,-48.469509
TO,07/09/2025 - Independência do Brasil,Independência do Brasil,,2025-09-07,Colinas do Tocantins - TO,-8.0651206,-48.469509
TO,01/05/2025 - Dia do Trabalho,Dia do Trabalho,,2025-05-01,Colinas do Tocantins - TO,-8.0651206,-48.469509
TO,21/04/2025 - Dia de Tiradentes,Dia de Tiradentes,,2025-04-21,Colinas do Tocantins - TO,-8.0651206,-48.469509
TO,18/04/2025 - Sexta-Feira Santa,Sexta-Feira Santa,,2025-04-18,Colinas do Tocantins - TO,-8.0651206,-48.469509
TO,01/01/2025 - Ano Novo,Ano Novo,,2025-01-01,Colinas do Tocantins - TO,-8.0651206,-48.469509
SP,25/12/2025 - Natal,Natal,,2025-12-25,Itapira - SP,-22.4480126,-46.8098036
SP,15/11/2025 - Proclamação da República,Proclamação da República,,2025-11-15,Itapira - SP,-22.4480126,-46.8098036
SP,02/11/2025 - Dia de Finados,Dia de Finados,,2025-11-02,Itapira - SP,-22.4480126,-46.8098036
SP,24/10/2025 - Aniversário,Aniversário,,2025-10-24,Itapira - SP,-22.4480126,-46.8098036
SP,12/10/2025 - Nossa Senhora Aparecida,Nossa Senhora Aparecida,,2025-10-12,Itapira - SP,-22.4480126,-46.8098036
SP,08/09/2025 - N. Sra. da Penha,N. Sra. da Penha,,2025-09-08,Itapira - SP,-22.4480126,-46.8098036
SP,07/09/2025 - Independência do Brasil,Independência do Brasil,,2025-09-07,Itapira - SP,-22.4480126,-46.8098036
SP,09/07/2025 - Revolução Constitucionalista,Revolução Constitucionalista,,2025-07-09,Itapira - SP,-22.4480126,-46.8098036
SP,19/06/2025 - Corpus Christi,Corpus Christi,,2025-06-19,Itapira - SP,-22.4480126,-46.8098036
SP,13/05/2025 - São Benedito,São Benedito,,2025-05-13,Itapira - SP,-22.4480126,-46.8098036
SP,01/05/2025 - Dia do Trabalho,Dia do Trabalho,,2025-05-01,Itapira - SP,-22.4480126,-46.8098036
SP,21/04/2025 - Dia de Tiradentes,Dia de Tiradentes,,2025-04-21,Itapira - SP,-22.4480126,-46.8098036
SP,18/04/2025 - Paixão de Cristo,Paixão de Cristo,,2025-04-18,Itapira - SP,-22.4480126,-46.8098036
SP,18/04/2025 - Sexta-Feira Santa,Sexta-Feira Santa,,2025-04-18,Itapira - SP,-22.4480126,-46.8098036
SP,01/01/2025 - Ano Novo,Ano Novo,,2025-01-01,Itapira - SP,-22.4480126,-46.8098036
SP,25/12/2025 - Natal,Natal,,2025-12-25,Itapevi - SP,-23.5093603,-46.9549323
SP,20/11/2025 - Dia da Consciência Negra,Dia da Consciência Negra,,2025-11-20,Itapevi - SP,-23.5093603,-46.9549323
SP,15/11/2025 - Proclamação da República,Proclamação da República,,2025-11-15,Itapevi - SP,-23.5093603,-46.9549323
SP,02/11/2025 - Dia de Finados,Dia de Finados,,2025-11-02,Itapevi - SP,-23.5093603,-46.9549323
SP,28/10/2025 - Padroeiro,Padroeiro,,2025-10-28,Itapevi - SP,-23.5093603,-46.9549323
SP,12/10/2025 - Nossa Senhora Aparecida,Nossa Senhora Aparecida,,2025-10-12,Itapevi - SP,-23.5093603,-46.9549323
SP,07/09/2025 - Independência do Brasil,Independência do Brasil,,2025-09-07,Itapevi - SP,-23.5093603,-46.9549323
SP,09/07/2025 - Revolução Constitucionalista,Revolução Constitucionalista,,2025-07-09,Itapevi - SP,-23.5093603,-46.9549323
SP,19/06/2025 - Corpus Christi,Corpus Christi,,2025-06-19,Itapevi - SP,-23.5093603,-46.9549323
SP,01/05/2025 - Dia do Trabalho,Dia do Trabalho,,2025-05-01,Itapevi - SP,-23.5093603,-46.9549323
SP,21/04/2025 - Dia de Tiradentes,Dia de Tiradentes,,2025-04-21,Itapevi - SP,-23.5093603,-46.9549323
SP,18/04/2025 - Sexta-feira da Paixão,Sexta-feira da Paixão,,2025-04-18,Itapevi - SP,-23.5093603,-46.9549323
SP,18/04/2025 - Sexta-Feira Santa,Sexta-Feira Santa,,2025-04-18,Itapevi - SP,-23.5093603,-46.9549323
SP,18/02/2025 - Aniversário,Aniversário,,2025-02-18,Itapevi - SP,-23.5093603,-46.9549323
SP,01/01/2025 - Ano Novo,Ano Novo,,2025-01-01,Itapevi - SP,-23.5093603,-46.9549323
SP,25/12/2025 - Natal,Natal,,2025-12-25,Itapeva - SP,-23.9929528,-48.8738052
SP,15/11/2025 - Proclamação da República,Proclamação da República,,2025-11-15,Itapeva - SP,-23.9929528,-48.8738052
SP,02/11/2025 - Dia de Finados,Dia de Finados,,2025-11-02,Itapeva - SP,-23.9929528,-48.8738052
SP,12/10/2025 - Nossa Senhora Aparecida,Nossa Senhora Aparecida,,2025-10-12,Itapeva - SP,-23.9929528,-48.8738052
SP,20/09/2025 - Feriado Municipal,Feriado Municipal,,2025-09-20,Itapeva - SP,-23.9929528,-48.8738052
SP,07/09/2025 - Independência do Brasil,Independência do Brasil,,2025-09-07,Itapeva - SP,-23.9929528,-48.8738052
SP,26/07/2025 - Feriado Municipal,Feriado Municipal,,2025-07-26,Itapeva - SP,-23.9929528,-48.8738052
SP,09/07/2025 - Revolução Constitucionalista,Revolução Constitucionalista,,2025-07-09,Itapeva - SP,-23.9929528,-48.8738052
SP,01/05/2025 - Dia do Trabalho,Dia do Trabalho,,2025-05-01,Itapeva - SP,-23.9929528,-48.8738052
SP,21/04/2025 - Dia de Tiradentes,Dia de Tiradentes,,2025-04-21,Itapeva - SP,-23.9929528,-48.8738052
SP,18/04/2025 - Sexta-Feira Santa,Sexta-Feira Santa,,2025-04-18,Itapeva - SP,-23.9929528,-48.8738052
SP,01/01/2025 - Ano Novo,Ano Novo,,2025-01-01,Itapeva - SP,-23.9929528,-48.8738052
SP,25/12/2025 - Natal,Natal,,2025-12-25,Itapetininga - SP,-23.5777192,-48.0214548
SP,15/11/2025 - Proclamação da República,Proclamação da República,,2025-11-15,Itapetininga - SP,-23.5777192,-48.0214548
SP,05/11/2025 - Aniversário,Aniversário,,2025-11-05,Itapetininga - SP,-23.5777192,-48.0214548
SP,02/11/2025 - Dia de Finados,Dia de Finados,,2025-11-02,Itapetininga - SP,-23.5777192,-48.0214548
SP,12/10/2025 - Nossa Senhora Aparecida,Nossa Senhora Aparecida,,2025-10-12,Itapetininga - SP,-23.5777192,-48.0214548
SP,07/09/2025 - Independência do Brasil,Independência do Brasil,,2025-09-07,Itapetininga - SP,-23.5777192,-48.0214548
SP,09/07/2025 - Revolução Constitucionalista,Revolução Constitucionalista,,2025-07-09,Itapetininga - SP,-23.5777192,-48.0214548
SP,19/06/2025 - Corpus Christi,Corpus Christi,,2025-06-19,Itapetininga - SP,-23.5777192,-48.0214548
SP,01/05/2025 - Dia do Trabalho,Dia do Trabalho,,2025-05-01,Itapetininga - SP,-23.5777192,-48.0214548
SP,21/04/2025 - Dia de Tiradentes,Dia de Tiradentes,,2025-04-21,Itapetininga - SP,-23.5777192,-48.0214548
SP,18/04/2025 - Sexta-feira Santa,Sexta-feira Santa,,2025-04-18,Itapetininga - SP,-23.5777192,-48.0214548
SP,18/04/2025 - Sexta-Feira Santa,Sexta-Feira Santa,,2025-04-18,Itapetininga - SP,-23.5777192,-48.0214548
SP,01/01/2025 - Ano Novo,Ano Novo,,2025-01-01,Itapetininga - SP,-23.5777192,-48.0214548
SP,25/12/2025 - Natal,Natal,,2025-12-25,Itapecerica da Serra - SP,-23.6953921,-46.825329
SP,20/11/2025 - Dia da Consciência Negra,Dia da Consciência Negra,,2025-11-20,Itapecerica da Serra - SP,-23.6953921,-46.825329
SP,15/11/2025 - Proclamação da República,Proclamação da República,,2025-11-15,Itapecerica da Serra - SP,-23.6953921,-46.825329
SP,02/11/2025 - Dia de Finados,Dia de Finados,,2025-11-02,Itapecerica da Serra - SP,-23.6953921,-46.825329
SP,12/10/2025 - Nossa Senhora Aparecida,Nossa Senhora Aparecida,,2025-10-12,Itapecerica da Serra - SP,-23.6953921,-46.825329
SP,07/09/2025 - Independência do Brasil,Independência do Brasil,,2025-09-07,Itapecerica da Serra - SP,-23.6953921,-46.825329
SP,09/07/2025 - Revolução Constitucionalista,Revolução Constitucionalista,,2025-07-09,Itapecerica da Serra - SP,-23.6953921,-46.825329
SP,08/05/2025 - Feriado Municipal,Feriado Municipal,,2025-05-08,Itapecerica da Serra - SP,-23.6953921,-46.825329
SP,01/05/2025 - Dia do Trabalho,Dia do Trabalho,,2025-05-01,Itapecerica da Serra - SP,-23.6953921,-46.825329
SP,21/04/2025 - Dia de Tiradentes,Dia de Tiradentes,,2025-04-21,Itapecerica da Serra - SP,-23.6953921,-46.825329
SP,18/04/2025 - Sexta-Feira Santa,Sexta-Feira Santa,,2025-04-18,Itapecerica da Serra - SP,-23.6953921,-46.825329
SP,01/01/2025 - Ano Novo,Ano Novo,,2025-01-01,Itapecerica da Serra - SP,-23.6953921,-46.825329
SP,25/12/2025 - Natal,Natal,,2025-12-25,Itaporanga - SP,-23.7066252,-49.4895934
SP,15/11/2025 - Proclamação da República,Proclamação da República,,2025-11-15,Itaporanga - SP,-23.7066252,-49.4895934
SP,02/11/2025 - Dia de Finados,Dia de Finados,,2025-11-02,Itaporanga - SP,-23.7066252,-49.4895934
SP,12/10/2025 - Nossa Senhora Aparecida,Nossa Senhora Aparecida,,2025-10-12,Itaporanga - SP,-23.7066252,-49.4895934
SP,07/09/2025 - Independência do Brasil,Independência do Brasil,,2025-09-07,Itaporanga - SP,-23.7066252,-49.4895934
SP,21/08/2025 - Feriado Municipal,Feriado Municipal,,2025-08-21,Itaporanga - SP,-23.7066252,-49.4895934
SP,09/07/2025 - Revolução Constitucionalista,Revolução Constitucionalista,,2025-07-09,Itaporanga - SP,-23.7066252,-49.4895934
SP,24/06/2025 - Feriado Municipal,Feriado Municipal,,2025-06-24,Itaporanga - SP,-23.7066252,-49.4895934
SP,01/05/2025 - Dia do Trabalho,Dia do Trabalho,,2025-05-01,Itaporanga - SP,-23.7066252,-49.4895934
SP,21/04/2025 - Dia de Tiradentes,Dia de Tiradentes,,2025-04-21,Itaporanga - SP,-23.7066252,-49.4895934
SP,18/04/2025 - Sexta-Feira Santa,Sexta-Feira Santa,,2025-04-18,Itaporanga - SP,-23.7066252,-49.4895934
SP,06/03/2025 - Feriado Municipal,Feriado Municipal,,2025-03-06,Itaporanga - SP,-23.7066252,-49.4895934
SP,01/01/2025 - Ano Novo,Ano Novo,,2025-01-01,Itaporanga - SP,-23.7066252,-49.4895934
SP,25/12/2025 - Natal,Natal,,2025-12-25,Itaoca - SP,-22.9804436,-47.0248477
SP,15/11/2025 - Proclamação da República,Proclamação da República,,2025-11-15,Itaoca - SP,-22.9804436,-47.0248477
SP,02/11/2025 - Dia de Finados,Dia de Finados,,2025-11-02,Itaoca - SP,-22.9804436,-47.0248477
SP,12/10/2025 - Nossa Senhora Aparecida,Nossa Senhora Aparecida,,2025-10-12,Itaoca - SP,-22.9804436,-47.0248477
SP,07/09/2025 - Independência do Brasil,Independência do Brasil,,2025-09-07,Itaoca - SP,-22.9804436,-47.0248477
SP,09/07/2025 - Revolução Constitucionalista,Revolução Constitucionalista,,2025-07-09,Itaoca - SP,-22.9804436,-47.0248477
SP,01/05/2025 - Dia do Trabalho,Dia do Trabalho,,2025-05-01,Itaoca - SP,-22.9804436,-47.0248477
SP,21/04/2025 - Dia de Tiradentes,Dia de Tiradentes,,2025-04-21,Itaoca - SP,-22.9804436,-47.0248477
SP,18/04/2025 - Sexta-Feira Santa,Sexta-Feira Santa,,2025-04-18,Itaoca - SP,-22.9804436,-47.0248477
SP,01/01/2025 - Ano Novo,Ano Novo,,2025-01-01,Itaoca - SP,-22.9804436,-47.0248477
SP,25/12/2025 - Natal,Natal,,2025-12-25,Itatiba - SP,-23.0978173,-46.8412392
SP,20/11/2025 - Dia da Consciência Negra,Dia da Consciência Negra,,2025-11-20,Itatiba - SP,-23.0978173,-46.8412392
SP,15/11/2025 - Proclamação da República,Proclamação da República,,2025-11-15,Itatiba - SP,-23.0978173,-46.8412392
SP,02/11/2025 - Dia de Finados,Dia de Finados,,2025-11-02,Itatiba - SP,-23.0978173,-46.8412392
SP,12/10/2025 - Nossa Senhora Aparecida,Nossa Senhora Aparecida,,2025-10-12,Itatiba - SP,-23.0978173,-46.8412392
SP,08/09/2025 - Feriado Municipal,Feriado Municipal,,2025-09-08,Itatiba - SP,-23.0978173,-46.8412392
SP,07/09/2025 - Independência do Brasil,Independência do Brasil,,2025-09-07,Itatiba - SP,-23.0978173,-46.8412392
SP,09/07/2025 - Revolução Constitucionalista,Revolução Constitucionalista,,2025-07-09,Itatiba - SP,-23.0978173,-46.8412392
SP,01/05/2025 - Dia do Trabalho,Dia do Trabalho,,2025-05-01,Itatiba - SP,-23.0978173,-46.8412392
SP,21/04/2025 - Dia de Tiradentes,Dia de Tiradentes,,2025-04-21,Itatiba - SP,-23.0978173,-46.8412392
SP,18/04/2025 - Sexta-Feira Santa,Sexta-Feira Santa,,2025-04-18,Itatiba - SP,-23.0978173,-46.8412392
SP,01/01/2025 - Ano Novo,Ano Novo,,2025-01-01,Itatiba - SP,-23.0978173,-46.8412392
SP,25/12/2025 - Natal,Natal,,2025-12-25,Itapura - SP,-22.8930583,-47.0610457
SP,08/12/2025 - Feriado Municipal,Feriado Municipal,,2025-12-08,Itapura - SP,-22.8930583,-47.0610457
SP,15/11/2025 - Proclamação da República,Proclamação da República,,2025-11-15,Itapura - SP,-22.8930583,-47.0610457
SP,02/11/2025 - Dia de Finados,Dia de Finados,,2025-11-02,Itapura - SP,-22.8930583,-47.0610457
SP,12/10/2025 - Nossa Senhora Aparecida,Nossa Senhora Aparecida,,2025-10-12,Itapura - SP,-22.8930583,-47.0610457
SP,07/09/2025 - Independência do Brasil,Independência do Brasil,,2025-09-07,Itapura - SP,-22.8930583,-47.0610457
SP,09/07/2025 - Revolução Constitucionalista,Revolução Constitucionalista,,2025-07-09,Itapura - SP,-22.8930583,-47.0610457
SP,01/05/2025 - Dia do Trabalho,Dia do Trabalho,,2025-05-01,Itapura - SP,-22.8930583,-47.0610457
SP,21/04/2025 - Dia de Tiradentes,Dia de Tiradentes,,2025-04-21,Itapura - SP,-22.8930583,-47.0610457
SP,18/04/2025 - Sexta-Feira Santa,Sexta-Feira Santa,,2025-04-18,Itapura - SP,-22.8930583,-47.0610457
SP,21/03/2025 - Feriado Municipal,Feriado Municipal,,2025-03-21,Itapura - SP,-22.8930583,-47.0610457
SP,01/01/2025 - Ano Novo,Ano Novo,,2025-01-01,Itapura - SP,-22.8930583,-47.0610457
SP,25/12/2025 - Natal,Natal,,2025-12-25,Itaquaquecetuba - SP,-23.4902787,-46.3401544
SP,20/11/2025 - Consciência Negra,Consciência Negra,,2025-11-20,Itaquaquecetuba - SP,-23.4902787,-46.3401544
SP,15/11/2025 - Proclamação da República,Proclamação da República,,2025-11-15,Itaquaquecetuba - SP,-23.4902787,-46.3401544
SP,02/11/2025 - Dia de Finados,Dia de Finados,,2025-11-02,Itaquaquecetuba - SP,-23.4902787,-46.3401544
SP,12/10/2025 - Nossa Senhora Aparecida,Nossa Senhora Aparecida,,2025-10-12,Itaquaquecetuba - SP,-23.4902787,-46.3401544
SP,08/09/2025 - Aniversário da Cidade,Aniversário da Cidade,,2025-09-08,Itaquaquecetuba - SP,-23.4902787,-46.3401544
SP,07/09/2025 - Independência do Brasil,Independência do Brasil,,2025-09-07,Itaquaquecetuba - SP,-23.4902787,-46.3401544
SP,09/07/2025 - Revolução Constitucionalista,Revolução Constitucionalista,,2025-07-09,Itaquaquecetuba - SP,-23.4902787,-46.3401544
SP,19/06/2025 - Corpus Christi,Corpus Christi,,2025-06-19,Itaquaquecetuba - SP,-23.4902787,-46.3401544
SP,01/05/2025 - Dia do Trabalho,Dia do Trabalho,,2025-05-01,Itaquaquecetuba - SP,-23.4902787,-46.3401544
SP,21/04/2025 - Dia de Tiradentes,Dia de Tiradentes,,2025-04-21,Itaquaquecetuba - SP,-23.4902787,-46.3401544
SP,18/04/2025 - Sexta-Feira Santa,Sexta-Feira Santa,,2025-04-18,Itaquaquecetuba - SP,-23.4902787,-46.3401544
SP,18/04/2025 - Sexta-Feira Santa,Sexta-Feira Santa,,2025-04-18,Itaquaquecetuba - SP,-23.4902787,-46.3401544
SP,01/01/2025 - Ano Novo,Ano Novo,,2025-01-01,Itaquaquecetuba - SP,-23.4902787,-46.3401544
SP,25/12/2025 - Natal,Natal,,2025-12-25,Itariri - SP,-24.2900711,-47.176151
SP,15/11/2025 - Proclamação da República,Proclamação da República,,2025-11-15,Itariri - SP,-24.2900711,-47.176151
SP,02/11/2025 - Dia de Finados,Dia de Finados,,2025-11-02,Itariri - SP,-24.2900711,-47.176151
SP,12/10/2025 - Nossa Senhora Aparecida,Nossa Senhora Aparecida,,2025-10-12,Itariri - SP,-24.2900711,-47.176151
SP,08/09/2025 - Feriado Municipal,Feriado Municipal,,2025-09-08,Itariri - SP,-24.2900711,-47.176151
SP,07/09/2025 - Independência do Brasil,Independência do Brasil,,2025-09-07,Itariri - SP,-24.2900711,-47.176151
SP,09/07/2025 - Revolução Constitucionalista,Revolução Constitucionalista,,2025-07-09,Itariri - SP,-24.2900711,-47.176151
SP,01/05/2025 - Dia do Trabalho,Dia do Trabalho,,2025-05-01,Itariri - SP,-24.2900711,-47.176151
SP,21/04/2025 - Dia de Tiradentes,Dia de Tiradentes,,2025-04-21,Itariri - SP,-24.2900711,-47.176151
SP,18/04/2025 - Sexta-Feira Santa,Sexta-Feira Santa,,2025-04-18,Itariri - SP,-24.2900711,-47.176151
SP,09/04/2025 - Feriado Municipal,Feriado Municipal,,2025-04-09,Itariri - SP,-24.2900711,-47.176151
SP,01/01/2025 - Ano Novo,Ano Novo,,2025-01-01,Itariri - SP,-24.2900711,-47.176151
SP,25/12/2025 - Natal,Natal,,2025-12-25,Itatinga - SP,-23.4392782,-47.3883803
SP,15/11/2025 - Proclamação da República,Proclamação da República,,2025-11-15,Itatinga - SP,-23.4392782,-47.3883803
SP,02/11/2025 - Finados,Finados,,2025-11-02,Itatinga - SP,-23.4392782,-47.3883803
SP,02/11/2025 - Dia de Finados,Dia de Finados,,2025-11-02,Itatinga - SP,-23.4392782,-47.3883803
SP,12/10/2025 - Nossa Senhora Aparecida,Nossa Senhora Aparecida,,2025-10-12,Itatinga - SP,-23.4392782,-47.3883803
SP,07/09/2025 - Independência do Brasil,Independência do Brasil,,2025-09-07,Itatinga - SP,-23.4392782,-47.3883803
SP,24/07/2025 - Aniversário da Cidade,Aniversário da Cidade,,2025-07-24,Itatinga - SP,-23.4392782,-47.3883803
SP,09/07/2025 - Revolução Constitucionalista,Revolução Constitucionalista,,2025-07-09,Itatinga - SP,-23.4392782,-47.3883803
SP,19/06/2025 - Corpus Christi,Corpus Christi,,2025-06-19,Itatinga - SP,-23.4392782,-47.3883803
SP,01/05/2025 - Dia do Trabalho,Dia do Trabalho,,2025-05-01,Itatinga - SP,-23.4392782,-47.3883803
SP,21/04/2025 - Dia de Tiradentes,Dia de Tiradentes,,2025-04-21,Itatinga - SP,-23.4392782,-47.3883803
SP,18/04/2025 - Sexta-Feira Santa,Sexta-Feira Santa,,2025-04-18,Itatinga - SP,-23.4392782,-47.3883803
SP,18/04/2025 - Sexta-Feira Santa,Sexta-Feira Santa,,2025-04-18,Itatinga - SP,-23.4392782,-47.3883803
SP,01/01/2025 - Ano Novo,Ano Novo,,2025-01-01,Itatinga - SP,-23.4392782,-47.3883803
SP,25/12/2025 - Natal,Natal,,2025-12-25,Itirapina - SP,-22.2539543,-47.819141
SP,20/11/2025 - Dia da Consciência Negra,Dia da Consciência Negra,,2025-11-20,Itirapina - SP,-22.2539543,-47.819141
SP,15/11/2025 - Proclamação da República,Proclamação da República,,2025-11-15,Itirapina - SP,-22.2539543,-47.819141
SP,02/11/2025 - Dia de Finados,Dia de Finados,,2025-11-02,Itirapina - SP,-22.2539543,-47.819141
SP,12/10/2025 - Nossa Senhora Aparecida,Nossa Senhora Aparecida,,2025-10-12,Itirapina - SP,-22.2539543,-47.819141
SP,07/09/2025 - Independência do Brasil,Independência do Brasil,,2025-09-07,Itirapina - SP,-22.2539543,-47.819141
SP,09/07/2025 - Revolução Constitucionalista,Revolução Constitucionalista,,2025-07-09,Itirapina - SP,-22.2539543,-47.819141
SP,13/06/2025 - Dia de Santo Antônio,Dia de Santo Antônio,,2025-06-13,Itirapina - SP,-22.2539543,-47.819141
SP,01/05/2025 - Dia do Trabalho,Dia do Trabalho,,2025-05-01,Itirapina - SP,-22.2539543,-47.819141
SP,21/04/2025 - Dia de Tiradentes,Dia de Tiradentes,,2025-04-21,Itirapina - SP,-22.2539543,-47.819141
SP,18/04/2025 - Sexta-Feira Santa,Sexta-Feira Santa,,2025-04-18,Itirapina - SP,-22.2539543,-47.819141
SP,25/03/2025 - Feriado Municipal,Feriado Municipal,,2025-03-25,Itirapina - SP,-22.2539543,-47.819141
SP,01/01/2025 - Ano Novo,Ano Novo,,2025-01-01,Itirapina - SP,-22.2539543,-47.819141
SP,25/12/2025 - Natal,Natal,,2025-12-25,Itobi - SP,-21.730853,-46.9743
SP,15/11/2025 - Proclamação da República,Proclamação da República,,2025-11-15,Itobi - SP,-21.730853,-46.9743
SP,02/11/2025 - Dia de Finados,Dia de Finados,,2025-11-02,Itobi - SP,-21.730853,-46.9743
SP,12/10/2025 - Nossa Senhora Aparecida,Nossa Senhora Aparecida,,2025-10-12,Itobi - SP,-21.730853,-46.9743
SP,15/09/2025 - N. Sra. das Dores,N. Sra. das Dores,,2025-09-15,Itobi - SP,-21.730853,-46.9743
SP,07/09/2025 - Independência do Brasil,Independência do Brasil,,2025-09-07,Itobi - SP,-21.730853,-46.9743
SP,27/08/2025 - Aniversário,Aniversário,,2025-08-27,Itobi - SP,-21.730853,-46.9743
SP,09/07/2025 - Revolução Constitucionalista,Revolução Constitucionalista,,2025-07-09,Itobi - SP,-21.730853,-46.9743
SP,19/06/2025 - Corpus Christi,Corpus Christi,,2025-06-19,Itobi - SP,-21.730853,-46.9743
SP,01/05/2025 - Dia do Trabalho,Dia do Trabalho,,2025-05-01,Itobi - SP,-21.730853,-46.9743
SP,21/04/2025 - Dia de Tiradentes,Dia de Tiradentes,,2025-04-21,Itobi - SP,-21.730853,-46.9743
SP,18/04/2025 - Sexta-Feira Santa,Sexta-Feira Santa,,2025-04-18,Itobi - SP,-21.730853,-46.9743
SP,18/02/2025 - Emancipação,Emancipação,,2025-02-18,Itobi - SP,-21.730853,-46.9743
SP,01/01/2025 - Ano Novo,Ano Novo,,2025-01-01,Itobi - SP,-21.730853,-46.9743
SP,25/12/2025 - Natal,Natal,,2025-12-25,Itajobi - SP,-21.3151508,-49.0519853
SP,15/11/2025 - Proclamação da República,Proclamação da República,,2025-11-15,Itajobi - SP,-21.3151508,-49.0519853
SP,02/11/2025 - Dia de Finados,Dia de Finados,,2025-11-02,Itajobi - SP,-21.3151508,-49.0519853
SP,12/10/2025 - Nossa Senhora Aparecida,Nossa Senhora Aparecida,,2025-10-12,Itajobi - SP,-21.3151508,-49.0519853
SP,07/09/2025 - Independência do Brasil,Independência do Brasil,,2025-09-07,Itajobi - SP,-21.3151508,-49.0519853
SP,09/07/2025 - Revolução Constitucionalista,Revolução Constitucionalista,,2025-07-09,Itajobi - SP,-21.3151508,-49.0519853
SP,01/05/2025 - Dia do Trabalho,Dia do Trabalho,,2025-05-01,Itajobi - SP,-21.3151508,-49.0519853
SP,21/04/2025 - Dia de Tiradentes,Dia de Tiradentes,,2025-04-21,Itajobi - SP,-21.3151508,-49.0519853
SP,18/04/2025 - Sexta-Feira Santa,Sexta-Feira Santa,,2025-04-18,Itajobi - SP,-21.3151508,-49.0519853
SP,04/04/2025 - Feriado Municipal,Feriado Municipal,,2025-04-04,Itajobi - SP,-21.3151508,-49.0519853
SP,19/03/2025 - São José,São José,,2025-03-19,Itajobi - SP,-21.3151508,-49.0519853
SP,01/01/2025 - Ano Novo,Ano Novo,,2025-01-01,Itajobi - SP,-21.3151508,-49.0519853
SP,25/12/2025 - Natal,Natal,,2025-12-25,Itaju - SP,-21.9816841,-48.8046536
SP,15/11/2025 - Proclamação da República,Proclamação da República,,2025-11-15,Itaju - SP,-21.9816841,-48.8046536
SP,02/11/2025 - Dia de Finados,Dia de Finados,,2025-11-02,Itaju - SP,-21.9816841,-48.8046536
SP,12/10/2025 - Nossa Senhora Aparecida,Nossa Senhora Aparecida,,2025-10-12,Itaju - SP,-21.9816841,-48.8046536
SP,07/09/2025 - Independência do Brasil,Independência do Brasil,,2025-09-07,Itaju - SP,-21.9816841,-48.8046536
SP,15/08/2025 - Feriado Municipal,Feriado Municipal,,2025-08-15,Itaju - SP,-21.9816841,-48.8046536
SP,09/07/2025 - Revolução Constitucionalista,Revolução Constitucionalista,,2025-07-09,Itaju - SP,-21.9816841,-48.8046536
SP,01/05/2025 - Dia do Trabalho,Dia do Trabalho,,2025-05-01,Itaju - SP,-21.9816841,-48.8046536
SP,21/04/2025 - Dia de Tiradentes,Dia de Tiradentes,,2025-04-21,Itaju - SP,-21.9816841,-48.8046536
SP,18/04/2025 - Sexta-Feira Santa,Sexta-Feira Santa,,2025-04-18,Itaju - SP,-21.9816841,-48.8046536
SP,20/01/2025 - Feriado Municipal,Feriado Municipal,,2025-01-20,Itaju - SP,-21.9816841,-48.8046536
SP,01/01/2025 - Ano Novo,Ano Novo,,2025-01-01,Itaju - SP,-21.9816841,-48.8046536
SP,25/12/2025 - Natal,Natal,,2025-12-25,Ilhabela - SP,-23.8316822,-45.3919449
SP,20/11/2025 - Dia da Consciência Negra,Dia da Consciência Negra,,2025-11-20,Ilhabela - SP,-23.8316822,-45.3919449
SP,15/11/2025 - Proclamação da República,Proclamação da República,,2025-11-15,Ilhabela - SP,-23.8316822,-45.3919449
SP,02/11/2025 - Dia de Finados,Dia de Finados,,2025-11-02,Ilhabela - SP,-23.8316822,-45.3919449
SP,12/10/2025 - Nossa Senhora Aparecida,Nossa Senhora Aparecida,,2025-10-12,Ilhabela - SP,-23.8316822,-45.3919449
SP,07/09/2025 - Independência do Brasil,Independência do Brasil,,2025-09-07,Ilhabela - SP,-23.8316822,-45.3919449
SP,03/09/2025 - Feriado Municipal,Feriado Municipal,,2025-09-03,Ilhabela - SP,-23.8316822,-45.3919449
SP,09/07/2025 - Revolução Constitucionalista,Revolução Constitucionalista,,2025-07-09,Ilhabela - SP,-23.8316822,-45.3919449
SP,19/06/2025 - Corpus Christi,Corpus Christi,,2025-06-19,Ilhabela - SP,-23.8316822,-45.3919449
SP,01/05/2025 - Dia do Trabalho,Dia do Trabalho,,2025-05-01,Ilhabela - SP,-23.8316822,-45.3919449
SP,21/04/2025 - Dia de Tiradentes,Dia de Tiradentes,,2025-04-21,Ilhabela - SP,-23.8316822,-45.3919449
SP,18/04/2025 - Sexta-Feira Santa,Sexta-Feira Santa,,2025-04-18,Ilhabela - SP,-23.8316822,-45.3919449
SP,18/04/2025 - Sexta-Feira Santa,Sexta-Feira Santa,,2025-04-18,Ilhabela - SP,-23.8316822,-45.3919449
SP,02/02/2025 - Feriado Municipal,Feriado Municipal,,2025-02-02,Ilhabela - SP,-23.8316822,-45.3919449
SP,01/01/2025 - Ano Novo,Ano Novo,,2025-01-01,Ilhabela - SP,-23.8316822,-45.3919449
SP,25/12/2025 - Natal,Natal,,2025-12-25,Itupeva - SP,-23.1675493,-47.052952
SP,20/11/2025 - Consciência Negra,Consciência Negra,,2025-11-20,Itupeva - SP,-23.1675493,-47.052952
SP,15/11/2025 - Proclamação da República,Proclamação da República,,2025-11-15,Itupeva - SP,-23.1675493,-47.052952
SP,02/11/2025 - Dia de Finados,Dia de Finados,,2025-11-02,Itupeva - SP,-23.1675493,-47.052952
SP,12/10/2025 - Nossa Senhora Aparecida,Nossa Senhora Aparecida,,2025-10-12,Itupeva - SP,-23.1675493,-47.052952
SP,07/09/2025 - Independência do Brasil,Independência do Brasil,,2025-09-07,Itupeva - SP,-23.1675493,-47.052952
SP,09/07/2025 - Revolução Constitucionalista,Revolução Constitucionalista,,2025-07-09,Itupeva - SP,-23.1675493,-47.052952
SP,19/06/2025 - Corpus Christi,Corpus Christi,,2025-06-19,Itupeva - SP,-23.1675493,-47.052952
SP,01/05/2025 - Dia do Trabalho,Dia do Trabalho,,2025-05-01,Itupeva - SP,-23.1675493,-47.052952
SP,21/04/2025 - Dia de Tiradentes,Dia de Tiradentes,,2025-04-21,Itupeva - SP,-23.1675493,-47.052952
SP,18/04/2025 - Sexta-Feira Santa,Sexta-Feira Santa,,2025-04-18,Itupeva - SP,-23.1675493,-47.052952
SP,18/04/2025 - Sexta-Feira Santa,Sexta-Feira Santa,,2025-04-18,Itupeva - SP,-23.1675493,-47.052952
SP,20/01/2025 - São Sebastião,São Sebastião,,2025-01-20,Itupeva - SP,-23.1675493,-47.052952
SP,01/01/2025 - Ano Novo,Ano Novo,,2025-01-01,Itupeva - SP,-23.1675493,-47.052952
SP,25/12/2025 - Natal,Natal,,2025-12-25,Ipaussu - SP,-23.0544285,-49.6264306
SP,15/11/2025 - Proclamação da República,Proclamação da República,,2025-11-15,Ipaussu - SP,-23.0544285,-49.6264306
SP,02/11/2025 - Dia de Finados,Dia de Finados,,2025-11-02,Ipaussu - SP,-23.0544285,-49.6264306
SP,12/10/2025 - Nossa Senhora Aparecida,Nossa Senhora Aparecida,,2025-10-12,Ipaussu - SP,-23.0544285,-49.6264306
SP,20/09/2025 - Feriado Municipal,Feriado Municipal,,2025-09-20,Ipaussu - SP,-23.0544285,-49.6264306
SP,07/09/2025 - Independência do Brasil,Independência do Brasil,,2025-09-07,Ipaussu - SP,-23.0544285,-49.6264306
SP,06/08/2025 - Feriado Municipal,Feriado Municipal,,2025-08-06,Ipaussu - SP,-23.0544285,-49.6264306
SP,09/07/2025 - Revolução Constitucionalista,Revolução Constitucionalista,,2025-07-09,Ipaussu - SP,-23.0544285,-49.6264306
SP,01/05/2025 - Dia do Trabalho,Dia do Trabalho,,2025-05-01,Ipaussu - SP,-23.0544285,-49.6264306
SP,21/04/2025 - Dia de Tiradentes,Dia de Tiradentes,,2025-04-21,Ipaussu - SP,-23.0544285,-49.6264306
SP,18/04/2025 - Sexta-Feira Santa,Sexta-Feira Santa,,2025-04-18,Ipaussu - SP,-23.0544285,-49.6264306
SP,01/01/2025 - Ano Novo,Ano Novo,,2025-01-01,Ipaussu - SP,-23.0544285,-49.6264306
SP,25/12/2025 - Natal,Natal,,2025-12-25,Indiana - SP,-22.1748508,-51.2534615
SP,15/11/2025 - Proclamação da República,Proclamação da República,,2025-11-15,Indiana - SP,-22.1748508,-51.2534615
SP,02/11/2025 - Dia de Finados,Dia de Finados,,2025-11-02,Indiana - SP,-22.1748508,-51.2534615
SP,12/10/2025 - Nossa Senhora Aparecida,Nossa Senhora Aparecida,,2025-10-12,Indiana - SP,-22.1748508,-51.2534615
SP,07/09/2025 - Independência do Brasil,Independência do Brasil,,2025-09-07,Indiana - SP,-22.1748508,-51.2534615
SP,09/07/2025 - Revolução Constitucionalista,Revolução Constitucionalista,,2025-07-09,Indiana - SP,-22.1748508,-51.2534615
SP,01/05/2025 - Dia do Trabalho,Dia do Trabalho,,2025-05-01,Indiana - SP,-22.1748508,-51.2534615
SP,21/04/2025 - Dia de Tiradentes,Dia de Tiradentes,,2025-04-21,Indiana - SP,-22.1748508,-51.2534615
SP,18/04/2025 - Sexta-Feira Santa,Sexta-Feira Santa,,2025-04-18,Indiana - SP,-22.1748508,-51.2534615
SP,17/03/2025 - Feriado Municipal,Feriado Municipal,,2025-03-17,Indiana - SP,-22.1748508,-51.2534615
SP,01/01/2025 - Ano Novo,Ano Novo,,2025-01-01,Indiana - SP,-22.1748508,-51.2534615
SP,25/12/2025 - Natal,Natal,,2025-12-25,Indaiatuba - SP,-23.0633353,-47.1381008
SP,15/11/2025 - Proclamação da República,Proclamação da República,,2025-11-15,Indaiatuba - SP,-23.0633353,-47.1381008
SP,02/11/2025 - Dia de Finados,Dia de Finados,,2025-11-02,Indaiatuba - SP,-23.0633353,-47.1381008
SP,12/10/2025 - Nossa Senhora Aparecida,Nossa Senhora Aparecida,,2025-10-12,Indaiatuba - SP,-23.0633353,-47.1381008
SP,07/09/2025 - Independência do Brasil,Independência do Brasil,,2025-09-07,Indaiatuba - SP,-23.0633353,-47.1381008
SP,09/07/2025 - Revolução Constitucionalista,Revolução Constitucionalista,,2025-07-09,Indaiatuba - SP,-23.0633353,-47.1381008
SP,01/05/2025 - Dia do Trabalho,Dia do Trabalho,,2025-05-01,Indaiatuba - SP,-23.0633353,-47.1381008
SP,21/04/2025 - Dia de Tiradentes,Dia de Tiradentes,,2025-04-21,Indaiatuba - SP,-23.0633353,-47.1381008
SP,18/04/2025 - Sexta-Feira Santa,Sexta-Feira Santa,,2025-04-18,Indaiatuba - SP,-23.0633353,-47.1381008
SP,02/02/2025 - Feriado Municipal,Feriado Municipal,,2025-02-02,Indaiatuba - SP,-23.0633353,-47.1381008
SP,01/01/2025 - Ano Novo,Ano Novo,,2025-01-01,Indaiatuba - SP,-23.0633353,-47.1381008
SP,25/12/2025 - Natal,Natal,,2025-12-25,Ilha Solteira - SP,-20.4205701,-51.3348673
SP,20/11/2025 - Consciência Negra,Consciência Negra,,2025-11-20,Ilha Solteira - SP,-20.4205701,-51.3348673
SP,15/11/2025 - Proclamação da República,Proclamação da República,,2025-11-15,Ilha Solteira - SP,-20.4205701,-51.3348673
SP,02/11/2025 - Dia de Finados,Dia de Finados,,2025-11-02,Ilha Solteira - SP,-20.4205701,-51.3348673
SP,12/10/2025 - Nossa Senhora Aparecida,Nossa Senhora Aparecida,,2025-10-12,Ilha Solteira - SP,-20.4205701,-51.3348673
SP,04/10/2025 - S. Francisco de Assis,S. Francisco de Assis,,2025-10-04,Ilha Solteira - SP,-20.4205701,-51.3348673
SP,07/09/2025 - Independência do Brasil,Independência do Brasil,,2025-09-07,Ilha Solteira - SP,-20.4205701,-51.3348673
SP,09/07/2025 - Revolução Constitucionalista,Revolução Constitucionalista,,2025-07-09,Ilha Solteira - SP,-20.4205701,-51.3348673
SP,01/05/2025 - Dia do Trabalho,Dia do Trabalho,,2025-05-01,Ilha Solteira - SP,-20.4205701,-51.3348673
SP,21/04/2025 - Dia de Tiradentes,Dia de Tiradentes,,2025-04-21,Ilha Solteira - SP,-20.4205701,-51.3348673
SP,18/04/2025 - Sexta-Feira Santa,Sexta-Feira Santa,,2025-04-18,Ilha Solteira - SP,-20.4205701,-51.3348673
SP,01/01/2025 - Ano Novo,Ano Novo,,2025-01-01,Ilha Solteira - SP,-20.4205701,-51.3348673
SP,25/12/2025 - Natal,Natal,,2025-12-25,Ilha Comprida - SP,-24.8366976,-47.7007145
SP,08/12/2025 - Imaculada Conceição,Imaculada Conceição,,2025-12-08,Ilha Comprida - SP,-24.8366976,-47.7007145
SP,15/11/2025 - Proclamação da República,Proclamação da República,,2025-11-15,Ilha Comprida - SP,-24.8366976,-47.7007145
SP,02/11/2025 - Dia de Finados,Dia de Finados,,2025-11-02,Ilha Comprida - SP,-24.8366976,-47.7007145
SP,27/10/2025 - Emancipação do município,Emancipação do município,,2025-10-27,Ilha Comprida - SP,-24.8366976,-47.7007145
SP,12/10/2025 - Nossa Senhora Aparecida,Nossa Senhora Aparecida,,2025-10-12,Ilha Comprida - SP,-24.8366976,-47.7007145
SP,07/09/2025 - Independência do Brasil,Independência do Brasil,,2025-09-07,Ilha Comprida - SP,-24.8366976,-47.7007145
SP,09/07/2025 - Revolução Constitucionalista,Revolução Constitucionalista,,2025-07-09,Ilha Comprida - SP,-24.8366976,-47.7007145
SP,19/06/2025 - Corpus Christi,Corpus Christi,,2025-06-19,Ilha Comprida - SP,-24.8366976,-47.7007145
SP,01/05/2025 - Dia do Trabalho,Dia do Trabalho,,2025-05-01,Ilha Comprida - SP,-24.8366976,-47.7007145
SP,21/04/2025 - Dia de Tiradentes,Dia de Tiradentes,,2025-04-21,Ilha Comprida - SP,-24.8366976,-47.7007145
SP,18/04/2025 - Sexta-feira da Paixão,Sexta-feira da Paixão,,2025-04-18,Ilha Comprida - SP,-24.8366976,-47.7007145
SP,18/04/2025 - Sexta-Feira Santa,Sexta-Feira Santa,,2025-04-18,Ilha Comprida - SP,-24.8366976,-47.7007145
SP,01/01/2025 - Ano Novo,Ano Novo,,2025-01-01,Ilha Comprida - SP,-24.8366976,-47.7007145
SP,25/12/2025 - Natal,Natal,,2025-12-25,Iguape - SP,-24.7007998,-47.5636226
SP,03/12/2025 - Feriado Municipal,Feriado Municipal,,2025-12-03,Iguape - SP,-24.7007998,-47.5636226
SP,15/11/2025 - Proclamação da República,Proclamação da República,,2025-11-15,Iguape - SP,-24.7007998,-47.5636226
SP,02/11/2025 - Dia de Finados,Dia de Finados,,2025-11-02,Iguape - SP,-24.7007998,-47.5636226
SP,12/10/2025 - Nossa Senhora Aparecida,Nossa Senhora Aparecida,,2025-10-12,Iguape - SP,-24.7007998,-47.5636226
SP,07/09/2025 - Independência do Brasil,Independência do Brasil,,2025-09-07,Iguape - SP,-24.7007998,-47.5636226
SP,06/08/2025 - Feriado Municipal,Feriado Municipal,,2025-08-06,Iguape - SP,-24.7007998,-47.5636226
SP,05/08/2025 - Feriado Municipal,Feriado Municipal,,2025-08-05,Iguape - SP,-24.7007998,-47.5636226
SP,09/07/2025 - Revolução Constitucionalista,Revolução Constitucionalista,,2025-07-09,Iguape - SP,-24.7007998,-47.5636226
SP,01/05/2025 - Dia do Trabalho,Dia do Trabalho,,2025-05-01,Iguape - SP,-24.7007998,-47.5636226
SP,21/04/2025 - Dia de Tiradentes,Dia de Tiradentes,,2025-04-21,Iguape - SP,-24.7007998,-47.5636226
SP,18/04/2025 - Sexta-Feira Santa,Sexta-Feira Santa,,2025-04-18,Iguape - SP,-24.7007998,-47.5636226
SP,06/01/2025 - Feriado Municipal,Feriado Municipal,,2025-01-06,Iguape - SP,-24.7007998,-47.5636226
SP,01/01/2025 - Ano Novo,Ano Novo,,2025-01-01,Iguape - SP,-24.7007998,-47.5636226
SP,25/12/2025 - Natal,Natal,,2025-12-25,Igarapava - SP,-20.0435577,-47.7595686
SP,15/11/2025 - Proclamação da República,Proclamação da República,,2025-11-15,Igarapava - SP,-20.0435577,-47.7595686
SP,02/11/2025 - Dia de Finados,Dia de Finados,,2025-11-02,Igarapava - SP,-20.0435577,-47.7595686
SP,12/10/2025 - Nossa Senhora Aparecida,Nossa Senhora Aparecida,,2025-10-12,Igarapava - SP,-20.0435577,-47.7595686
SP,07/09/2025 - Independência do Brasil,Independência do Brasil,,2025-09-07,Igarapava - SP,-20.0435577,-47.7595686
SP,15/08/2025 - Feriado Municipal,Feriado Municipal,,2025-08-15,Igarapava - SP,-20.0435577,-47.7595686
SP,09/07/2025 - Revolução Constitucionalista,Revolução Constitucionalista,,2025-07-09,Igarapava - SP,-20.0435577,-47.7595686
SP,22/05/2025 - Feriado Municipal,Feriado Municipal,,2025-05-22,Igarapava - SP,-20.0435577,-47.7595686
SP,01/05/2025 - Dia do Trabalho,Dia do Trabalho,,2025-05-01,Igarapava - SP,-20.0435577,-47.7595686
SP,21/04/2025 - Dia de Tiradentes,Dia de Tiradentes,,2025-04-21,Igarapava - SP,-20.0435577,-47.7595686
SP,18/04/2025 - Sexta-Feira Santa,Sexta-Feira Santa,,2025-04-18,Igarapava - SP,-20.0435577,-47.7595686
SP,01/01/2025 - Ano Novo,Ano Novo,,2025-01-01,Igarapava - SP,-20.0435577,-47.7595686
SP,31/12/2025 - Feriado Municipal,Feriado Municipal,,2025-12-31,Iporanga - SP,-23.4561389,-47.4017678
SP,25/12/2025 - Natal,Natal,,2025-12-25,Iporanga - SP,-23.4561389,-47.4017678
SP,15/11/2025 - Proclamação da República,Proclamação da República,,2025-11-15,Iporanga - SP,-23.4561389,-47.4017678
SP,02/11/2025 - Dia de Finados,Dia de Finados,,2025-11-02,Iporanga - SP,-23.4561389,-47.4017678
SP,12/10/2025 - Nossa Senhora Aparecida,Nossa Senhora Aparecida,,2025-10-12,Iporanga - SP,-23.4561389,-47.4017678
SP,07/09/2025 - Independência do Brasil,Independência do Brasil,,2025-09-07,Iporanga - SP,-23.4561389,-47.4017678
SP,26/07/2025 - Feriado Municipal,Feriado Municipal,,2025-07-26,Iporanga - SP,-23.4561389,-47.4017678
SP,09/07/2025 - Revolução Constitucionalista,Revolução Constitucionalista,,2025-07-09,Iporanga - SP,-23.4561389,-47.4017678
SP,01/05/2025 - Dia do Trabalho,Dia do Trabalho,,2025-05-01,Iporanga - SP,-23.4561389,-47.4017678
SP,21/04/2025 - Dia de Tiradentes,Dia de Tiradentes,,2025-04-21,Iporanga - SP,-23.4561389,-47.4017678
SP,18/04/2025 - Sexta-Feira Santa,Sexta-Feira Santa,,2025-04-18,Iporanga - SP,-23.4561389,-47.4017678
SP,12/01/2025 - Feriado Municipal,Feriado Municipal,,2025-01-12,Iporanga - SP,-23.4561389,-47.4017678
SP,01/01/2025 - Ano Novo,Ano Novo,,2025-01-01,Iporanga - SP,-23.4561389,-47.4017678
SP,25/12/2025 - Natal,Natal,,2025-12-25,Irapuru - SP,-21.5691828,-51.3494606
SP,20/11/2025 - Dia da Consciência Negra,Dia da Consciência Negra,,2025-11-20,Irapuru - SP,-21.5691828,-51.3494606
SP,15/11/2025 - Proclamação da República,Proclamação da República,,2025-11-15,Irapuru - SP,-21.5691828,-51.3494606
SP,02/11/2025 - Dia de Finados,Dia de Finados,,2025-11-02,Irapuru - SP,-21.5691828,-51.3494606
SP,12/10/2025 - Nossa Senhora Aparecida,Nossa Senhora Aparecida,,2025-10-12,Irapuru - SP,-21.5691828,-51.3494606
SP,07/09/2025 - Independência do Brasil,Independência do Brasil,,2025-09-07,Irapuru - SP,-21.5691828,-51.3494606
SP,09/07/2025 - Revolução Constitucionalista,Revolução Constitucionalista,,2025-07-09,Irapuru - SP,-21.5691828,-51.3494606
SP,06/05/2025 - Feriado Municipal,Feriado Municipal,,2025-05-06,Irapuru - SP,-21.5691828,-51.3494606
SP,01/05/2025 - Dia do Trabalho,Dia do Trabalho,,2025-05-01,Irapuru - SP,-21.5691828,-51.3494606
SP,21/04/2025 - Dia de Tiradentes,Dia de Tiradentes,,2025-04-21,Irapuru - SP,-21.5691828,-51.3494606
SP,18/04/2025 - Sexta-Feira Santa,Sexta-Feira Santa,,2025-04-18,Irapuru - SP,-21.5691828,-51.3494606
SP,03/01/2025 - Feriado Municipal,Feriado Municipal,,2025-01-03,Irapuru - SP,-21.5691828,-51.3494606
SP,01/01/2025 - Ano Novo,Ano Novo,,2025-01-01,Irapuru - SP,-21.5691828,-51.3494606
SP,25/12/2025 - Natal,Natal,,2025-12-25,Itu - SP,-22.9474967,-47.0725933
SP,20/11/2025 - Consciência Negra,Consciência Negra,,2025-11-20,Itu - SP,-22.9474967,-47.0725933
SP,15/11/2025 - Proclamação da República,Proclamação da República,,2025-11-15,Itu - SP,-22.9474967,-47.0725933
SP,02/11/2025 - Dia de Finados,Dia de Finados,,2025-11-02,Itu - SP,-22.9474967,-47.0725933
SP,12/10/2025 - Nossa Senhora Aparecida,Nossa Senhora Aparecida,,2025-10-12,Itu - SP,-22.9474967,-47.0725933
SP,07/09/2025 - Independência do Brasil,Independência do Brasil,,2025-09-07,Itu - SP,-22.9474967,-47.0725933
SP,09/07/2025 - Revolução Constitucionalista,Revolução Constitucionalista,,2025-07-09,Itu - SP,-22.9474967,-47.0725933
SP,19/06/2025 - Corpus Christi,Corpus Christi,,2025-06-19,Itu - SP,-22.9474967,-47.0725933
SP,01/05/2025 - Dia do Trabalho,Dia do Trabalho,,2025-05-01,Itu - SP,-22.9474967,-47.0725933
SP,21/04/2025 - Dia de Tiradentes,Dia de Tiradentes,,2025-04-21,Itu - SP,-22.9474967,-47.0725933
SP,18/04/2025 - Sexta-feira Santa,Sexta-feira Santa,,2025-04-18,Itu - SP,-22.9474967,-47.0725933
SP,18/04/2025 - Sexta-Feira Santa,Sexta-Feira Santa,,2025-04-18,Itu - SP,-22.9474967,-47.0725933
SP,02/02/2025 - Padroeira e Aniversário,Padroeira e Aniversário,,2025-02-02,Itu - SP,-22.9474967,-47.0725933
SP,01/01/2025 - Ano Novo,Ano Novo,,2025-01-01,Itu - SP,-22.9474967,-47.0725933
SP,25/12/2025 - Natal,Natal,,2025-12-25,Ituverava - SP,-20.3365522,-47.7826041
SP,15/11/2025 - Proclamação da República,Proclamação da República,,2025-11-15,Ituverava - SP,-20.3365522,-47.7826041
SP,02/11/2025 - Dia de Finados,Dia de Finados,,2025-11-02,Ituverava - SP,-20.3365522,-47.7826041
SP,12/10/2025 - Nossa Senhora Aparecida,Nossa Senhora Aparecida,,2025-10-12,Ituverava - SP,-20.3365522,-47.7826041
SP,07/09/2025 - Independência do Brasil,Independência do Brasil,,2025-09-07,Ituverava - SP,-20.3365522,-47.7826041
SP,16/07/2025 - Feriado Municipal,Feriado Municipal,,2025-07-16,Ituverava - SP,-20.3365522,-47.7826041
SP,09/07/2025 - Revolução Constitucionalista,Revolução Constitucionalista,,2025-07-09,Ituverava - SP,-20.3365522,-47.7826041
SP,01/05/2025 - Dia do Trabalho,Dia do Trabalho,,2025-05-01,Ituverava - SP,-20.3365522,-47.7826041
SP,21/04/2025 - Dia de Tiradentes,Dia de Tiradentes,,2025-04-21,Ituverava - SP,-20.3365522,-47.7826041
SP,18/04/2025 - Sexta-Feira Santa,Sexta-Feira Santa,,2025-04-18,Ituverava - SP,-20.3365522,-47.7826041
SP,10/03/2025 - Feriado Municipal,Feriado Municipal,,2025-03-10,Ituverava - SP,-20.3365522,-47.7826041
SP,01/01/2025 - Ano Novo,Ano Novo,,2025-01-01,Ituverava - SP,-20.3365522,-47.7826041
SP,25/12/2025 - Natal,Natal,,2025-12-25,Lourdes - SP,-20.9672545,-50.224966
SP,15/11/2025 - Proclamação da República,Proclamação da República,,2025-11-15,Lourdes - SP,-20.9672545,-50.224966
SP,02/11/2025 - Dia de Finados,Dia de Finados,,2025-11-02,Lourdes - SP,-20.9672545,-50.224966
SP,12/10/2025 - Nossa Senhora Aparecida,Nossa Senhora Aparecida,,2025-10-12,Lourdes - SP,-20.9672545,-50.224966
SP,07/09/2025 - Independência do Brasil,Independência do Brasil,,2025-09-07,Lourdes - SP,-20.9672545,-50.224966
SP,09/07/2025 - Revolução Constitucionalista,Revolução Constitucionalista,,2025-07-09,Lourdes - SP,-20.9672545,-50.224966
SP,01/05/2025 - Dia do Trabalho,Dia do Trabalho,,2025-05-01,Lourdes - SP,-20.9672545,-50.224966
SP,21/04/2025 - Dia de Tiradentes,Dia de Tiradentes,,2025-04-21,Lourdes - SP,-20.9672545,-50.224966
SP,18/04/2025 - Sexta-Feira Santa,Sexta-Feira Santa,,2025-04-18,Lourdes - SP,-20.9672545,-50.224966
SP,01/01/2025 - Ano Novo,Ano Novo,,2025-01-01,Lourdes - SP,-20.9672545,-50.224966
SP,25/12/2025 - Natal,Natal,,2025-12-25,Lavrinhas - SP,-22.5125473,-44.8948142
SP,15/11/2025 - Proclamação da República,Proclamação da República,,2025-11-15,Lavrinhas - SP,-22.5125473,-44.8948142
SP,02/11/2025 - Dia de Finados,Dia de Finados,,2025-11-02,Lavrinhas - SP,-22.5125473,-44.8948142
SP,12/10/2025 - Nossa Senhora Aparecida,Nossa Senhora Aparecida,,2025-10-12,Lavrinhas - SP,-22.5125473,-44.8948142
SP,07/09/2025 - Independência do Brasil,Independência do Brasil,,2025-09-07,Lavrinhas - SP,-22.5125473,-44.8948142
SP,09/07/2025 - Revolução Constitucionalista,Revolução Constitucionalista,,2025-07-09,Lavrinhas - SP,-22.5125473,-44.8948142
SP,27/06/2025 - Feriado Municipal,Feriado Municipal,,2025-06-27,Lavrinhas - SP,-22.5125473,-44.8948142
SP,01/05/2025 - Dia do Trabalho,Dia do Trabalho,,2025-05-01,Lavrinhas - SP,-22.5125473,-44.8948142
SP,21/04/2025 - Dia de Tiradentes,Dia de Tiradentes,,2025-04-21,Lavrinhas - SP,-22.5125473,-44.8948142
SP,18/04/2025 - Sexta-Feira Santa,Sexta-Feira Santa,,2025-04-18,Lavrinhas - SP,-22.5125473,-44.8948142
SP,20/01/2025 - Feriado Municipal,Feriado Municipal,,2025-01-20,Lavrinhas - SP,-22.5125473,-44.8948142
SP,01/01/2025 - Ano Novo,Ano Novo,,2025-01-01,Lavrinhas - SP,-22.5125473,-44.8948142
SP,25/12/2025 - Natal,Natal,,2025-12-25,Leme - SP,-22.1627338,-47.2615619
SP,20/11/2025 - Consciência Negra,Consciência Negra,,2025-11-20,Leme - SP,-22.1627338,-47.2615619
SP,15/11/2025 - Proclamação da República,Proclamação da República,,2025-11-15,Leme - SP,-22.1627338,-47.2615619
SP,02/11/2025 - Dia de Finados,Dia de Finados,,2025-11-02,Leme - SP,-22.1627338,-47.2615619
SP,12/10/2025 - Nossa Senhora Aparecida,Nossa Senhora Aparecida,,2025-10-12,Leme - SP,-22.1627338,-47.2615619
SP,07/09/2025 - Independência do Brasil,Independência do Brasil,,2025-09-07,Leme - SP,-22.1627338,-47.2615619
SP,29/08/2025 - Dia da cidade,Dia da cidade,,2025-08-29,Leme - SP,-22.1627338,-47.2615619
SP,09/07/2025 - Revolução Constitucionalista,Revolução Constitucionalista,,2025-07-09,Leme - SP,-22.1627338,-47.2615619
SP,19/06/2025 - Corpus Christi,Corpus Christi,,2025-06-19,Leme - SP,-22.1627338,-47.2615619
SP,17/06/2025 - Dia de São Manoel,Dia de São Manoel,,2025-06-17,Leme - SP,-22.1627338,-47.2615619
SP,01/05/2025 - Dia do Trabalho,Dia do Trabalho,,2025-05-01,Leme - SP,-22.1627338,-47.2615619
SP,21/04/2025 - Dia de Tiradentes,Dia de Tiradentes,,2025-04-21,Leme - SP,-22.1627338,-47.2615619
SP,18/04/2025 - Sexta-feira da Paixão,Sexta-feira da Paixão,,2025-04-18,Leme - SP,-22.1627338,-47.2615619
SP,18/04/2025 - Sexta-Feira Santa,Sexta-Feira Santa,,2025-04-18,Leme - SP,-22.1627338,-47.2615619
SP,01/01/2025 - Ano Novo,Ano Novo,,2025-01-01,Leme - SP,-22.1627338,-47.2615619
SP,25/12/2025 - Natal,Natal,,2025-12-25,Limeira - SP,-22.5491704,-47.4114475
SP,20/11/2025 - Dia da Consciência Negra,Dia da Consciência Negra,,2025-11-20,Limeira - SP,-22.5491704,-47.4114475
SP,15/11/2025 - Proclamação da República,Proclamação da República,,2025-11-15,Limeira - SP,-22.5491704,-47.4114475
SP,02/11/2025 - Dia de Finados,Dia de Finados,,2025-11-02,Limeira - SP,-22.5491704,-47.4114475
SP,12/10/2025 - Nossa Senhora Aparecida,Nossa Senhora Aparecida,,2025-10-12,Limeira - SP,-22.5491704,-47.4114475
SP,15/09/2025 - Feriado Municipal,Feriado Municipal,,2025-09-15,Limeira - SP,-22.5491704,-47.4114475
SP,07/09/2025 - Independência do Brasil,Independência do Brasil,,2025-09-07,Limeira - SP,-22.5491704,-47.4114475
SP,09/07/2025 - Revolução Constitucionalista,Revolução Constitucionalista,,2025-07-09,Limeira - SP,-22.5491704,-47.4114475
SP,01/05/2025 - Dia do Trabalho,Dia do Trabalho,,2025-05-01,Limeira - SP,-22.5491704,-47.4114475
SP,21/04/2025 - Dia de Tiradentes,Dia de Tiradentes,,2025-04-21,Limeira - SP,-22.5491704,-47.4114475
SP,18/04/2025 - Sexta-Feira Santa,Sexta-Feira Santa,,2025-04-18,Limeira - SP,-22.5491704,-47.4114475
SP,01/01/2025 - Ano Novo,Ano Novo,,2025-01-01,Limeira - SP,-22.5491704,-47.4114475
SP,25/12/2025 - Natal,Natal,,2025-12-25,Lins - SP,-22.1245319,-51.1776009
SP,15/11/2025 - Proclamação da República,Proclamação da República,,2025-11-15,Lins - SP,-22.1245319,-51.1776009
SP,02/11/2025 - Dia de Finados,Dia de Finados,,2025-11-02,Lins - SP,-22.1245319,-51.1776009
SP,12/10/2025 - Nossa Senhora Aparecida,Nossa Senhora Aparecida,,2025-10-12,Lins - SP,-22.1245319,-51.1776009
SP,07/09/2025 - Independência do Brasil,Independência do Brasil,,2025-09-07,Lins - SP,-22.1245319,-51.1776009
SP,09/07/2025 - Revolução Constitucionalista,Revolução Constitucionalista,,2025-07-09,Lins - SP,-22.1245319,-51.1776009
SP,19/06/2025 - Corpus Christi,Corpus Christi,,2025-06-19,Lins - SP,-22.1245319,-51.1776009
SP,13/06/2025 - Padroeiro,Padroeiro,,2025-06-13,Lins - SP,-22.1245319,-51.1776009
SP,01/05/2025 - Dia do Trabalho,Dia do Trabalho,,2025-05-01,Lins - SP,-22.1245319,-51.1776009
SP,21/04/2025 - Aniversário,Aniversário,,2025-04-21,Lins - SP,-22.1245319,-51.1776009
SP,21/04/2025 - Dia de Tiradentes,Dia de Tiradentes,,2025-04-21,Lins - SP,-22.1245319,-51.1776009
SP,18/04/2025 - Sexta-feira da Paixão,Sexta-feira da Paixão,,2025-04-18,Lins - SP,-22.1245319,-51.1776009
SP,18/04/2025 - Sexta-Feira Santa,Sexta-Feira Santa,,2025-04-18,Lins - SP,-22.1245319,-51.1776009
SP,04/03/2025 - Carnaval,Carnaval,,2025-03-04,Lins - SP,-22.1245319,-51.1776009
SP,01/01/2025 - Ano Novo,Ano Novo,,2025-01-01,Lins - SP,-22.1245319,-51.1776009
SP,25/12/2025 - Natal,Natal,,2025-12-25,Lorena - SP,-22.7335265,-45.1018071
SP,15/11/2025 - Proclamação da República,Proclamação da República,,2025-11-15,Lorena - SP,-22.7335265,-45.1018071
SP,14/11/2025 - Feriado Municipal,Feriado Municipal,,2025-11-14,Lorena - SP,-22.7335265,-45.1018071
SP,02/11/2025 - Dia de Finados,Dia de Finados,,2025-11-02,Lorena - SP,-22.7335265,-45.1018071
SP,12/10/2025 - Nossa Senhora Aparecida,Nossa Senhora Aparecida,,2025-10-12,Lorena - SP,-22.7335265,-45.1018071
SP,07/09/2025 - Independência do Brasil,Independência do Brasil,,2025-09-07,Lorena - SP,-22.7335265,-45.1018071
SP,15/08/2025 - Feriado Municipal,Feriado Municipal,,2025-08-15,Lorena - SP,-22.7335265,-45.1018071
SP,09/07/2025 - Revolução Constitucionalista,Revolução Constitucionalista,,2025-07-09,Lorena - SP,-22.7335265,-45.1018071
SP,01/05/2025 - Dia do Trabalho,Dia do Trabalho,,2025-05-01,Lorena - SP,-22.7335265,-45.1018071
SP,21/04/2025 - Dia de Tiradentes,Dia de Tiradentes,,2025-04-21,Lorena - SP,-22.7335265,-45.1018071
SP,18/04/2025 - Sexta-Feira Santa,Sexta-Feira Santa,,2025-04-18,Lorena - SP,-22.7335265,-45.1018071
SP,01/01/2025 - Ano Novo,Ano Novo,,2025-01-01,Lorena - SP,-22.7335265,-45.1018071
SP,25/12/2025 - Natal,Natal,,2025-12-25,Mairinque - SP,-23.5597511,-47.200425
SP,20/11/2025 - Dia da Consciência Negra,Dia da Consciência Negra,,2025-11-20,Mairinque - SP,-23.5597511,-47.200425
SP,15/11/2025 - Proclamação da República,Proclamação da República,,2025-11-15,Mairinque - SP,-23.5597511,-47.200425
SP,02/11/2025 - Dia de Finados,Dia de Finados,,2025-11-02,Mairinque - SP,-23.5597511,-47.200425
SP,12/10/2025 - Nossa Senhora Aparecida,Nossa Senhora Aparecida,,2025-10-12,Mairinque - SP,-23.5597511,-47.200425
SP,07/09/2025 - Independência do Brasil,Independência do Brasil,,2025-09-07,Mairinque - SP,-23.5597511,-47.200425
SP,09/07/2025 - Revolução Constitucionalista,Revolução Constitucionalista,,2025-07-09,Mairinque - SP,-23.5597511,-47.200425
SP,01/05/2025 - Dia do Trabalho,Dia do Trabalho,,2025-05-01,Mairinque - SP,-23.5597511,-47.200425
SP,21/04/2025 - Dia de Tiradentes,Dia de Tiradentes,,2025-04-21,Mairinque - SP,-23.5597511,-47.200425
SP,18/04/2025 - Sexta-Feira Santa,Sexta-Feira Santa,,2025-04-18,Mairinque - SP,-23.5597511,-47.200425
SP,19/03/2025 - São José,São José,,2025-03-19,Mairinque - SP,-23.5597511,-47.200425
SP,01/01/2025 - Ano Novo,Ano Novo,,2025-01-01,Mairinque - SP,-23.5597511,-47.200425
SP,25/12/2025 - Natal,Natal,,2025-12-25,Louveira - SP,-23.08639,-46.95056
SP,20/11/2025 - Consciência Negra,Consciência Negra,,2025-11-20,Louveira - SP,-23.08639,-46.95056
SP,15/11/2025 - Proclamação da República,Proclamação da República,,2025-11-15,Louveira - SP,-23.08639,-46.95056
SP,02/11/2025 - Dia de Finados,Dia de Finados,,2025-11-02,Louveira - SP,-23.08639,-46.95056
SP,12/10/2025 - Nossa Senhora Aparecida,Nossa Senhora Aparecida,,2025-10-12,Louveira - SP,-23.08639,-46.95056
SP,07/09/2025 - Independência do Brasil,Independência do Brasil,,2025-09-07,Louveira - SP,-23.08639,-46.95056
SP,09/07/2025 - Revolução Constitucionalista,Revolução Constitucionalista,,2025-07-09,Louveira - SP,-23.08639,-46.95056
SP,19/06/2025 - Corpus Christi,Corpus Christi,,2025-06-19,Louveira - SP,-23.08639,-46.95056
SP,01/05/2025 - Dia do Trabalho,Dia do Trabalho,,2025-05-01,Louveira - SP,-23.08639,-46.95056
SP,21/04/2025 - Dia de Tiradentes,Dia de Tiradentes,,2025-04-21,Louveira - SP,-23.08639,-46.95056
SP,18/04/2025 - Sexta-feira da Paixão,Sexta-feira da Paixão,,2025-04-18,Louveira - SP,-23.08639,-46.95056
SP,18/04/2025 - Sexta-Feira Santa,Sexta-Feira Santa,,2025-04-18,Louveira - SP,-23.08639,-46.95056
SP,21/03/2025 - Aniversário da cidade,Aniversário da cidade,,2025-03-21,Louveira - SP,-23.08639,-46.95056
SP,20/01/2025 - Dia do padroeiro,Dia do padroeiro,,2025-01-20,Louveira - SP,-23.08639,-46.95056
SP,01/01/2025 - Ano Novo,Ano Novo,,2025-01-01,Louveira - SP,-23.08639,-46.95056
SP,25/12/2025 - Natal,Natal,,2025-12-25,Jaborandi - SP,-20.6921079,-48.4144076
SP,15/11/2025 - Proclamação da República,Proclamação da República,,2025-11-15,Jaborandi - SP,-20.6921079,-48.4144076
SP,02/11/2025 - Dia de Finados,Dia de Finados,,2025-11-02,Jaborandi - SP,-20.6921079,-48.4144076
SP,12/10/2025 - Nossa Senhora Aparecida,Nossa Senhora Aparecida,,2025-10-12,Jaborandi - SP,-20.6921079,-48.4144076
SP,29/09/2025 - Feriado Municipal,Feriado Municipal,,2025-09-29,Jaborandi - SP,-20.6921079,-48.4144076
SP,07/09/2025 - Independência do Brasil,Independência do Brasil,,2025-09-07,Jaborandi - SP,-20.6921079,-48.4144076
SP,09/07/2025 - Revolução Constitucionalista,Revolução Constitucionalista,,2025-07-09,Jaborandi - SP,-20.6921079,-48.4144076
SP,01/05/2025 - Dia do Trabalho,Dia do Trabalho,,2025-05-01,Jaborandi - SP,-20.6921079,-48.4144076
SP,21/04/2025 - Dia de Tiradentes,Dia de Tiradentes,,2025-04-21,Jaborandi - SP,-20.6921079,-48.4144076
SP,18/04/2025 - Sexta-Feira Santa,Sexta-Feira Santa,,2025-04-18,Jaborandi - SP,-20.6921079,-48.4144076
SP,18/03/2025 - Feriado Municipal,Feriado Municipal,,2025-03-18,Jaborandi - SP,-20.6921079,-48.4144076
SP,01/01/2025 - Ano Novo,Ano Novo,,2025-01-01,Jaborandi - SP,-20.6921079,-48.4144076
SP,25/12/2025 - Natal,Natal,,2025-12-25,Macatuba - SP,-22.5194304,-48.7175702
SP,15/11/2025 - Proclamação da República,Proclamação da República,,2025-11-15,Macatuba - SP,-22.5194304,-48.7175702
SP,02/11/2025 - Dia de Finados,Dia de Finados,,2025-11-02,Macatuba - SP,-22.5194304,-48.7175702
SP,12/10/2025 - Nossa Senhora Aparecida,Nossa Senhora Aparecida,,2025-10-12,Macatuba - SP,-22.5194304,-48.7175702
SP,07/09/2025 - Independência do Brasil,Independência do Brasil,,2025-09-07,Macatuba - SP,-22.5194304,-48.7175702
SP,09/07/2025 - Revolução Constitucionalista,Revolução Constitucionalista,,2025-07-09,Macatuba - SP,-22.5194304,-48.7175702
SP,13/06/2025 - Dia de Santo Antônio,Dia de Santo Antônio,,2025-06-13,Macatuba - SP,-22.5194304,-48.7175702
SP,01/05/2025 - Dia do Trabalho,Dia do Trabalho,,2025-05-01,Macatuba - SP,-22.5194304,-48.7175702
SP,21/04/2025 - Dia de Tiradentes,Dia de Tiradentes,,2025-04-21,Macatuba - SP,-22.5194304,-48.7175702
SP,18/04/2025 - Sexta-Feira Santa,Sexta-Feira Santa,,2025-04-18,Macatuba - SP,-22.5194304,-48.7175702
SP,01/01/2025 - Ano Novo,Ano Novo,,2025-01-01,Macatuba - SP,-22.5194304,-48.7175702
SP,25/12/2025 - Natal,Natal,,2025-12-25,Macaubal - SP,-20.8071616,-49.9648439
SP,08/12/2025 - Feriado Municipal,Feriado Municipal,,2025-12-08,Macaubal - SP,-20.8071616,-49.9648439
SP,15/11/2025 - Proclamação da República,Proclamação da República,,2025-11-15,Macaubal - SP,-20.8071616,-49.9648439
SP,02/11/2025 - Dia de Finados,Dia de Finados,,2025-11-02,Macaubal - SP,-20.8071616,-49.9648439
SP,12/10/2025 - Nossa Senhora Aparecida,Nossa Senhora Aparecida,,2025-10-12,Macaubal - SP,-20.8071616,-49.9648439
SP,07/09/2025 - Independência do Brasil,Independência do Brasil,,2025-09-07,Macaubal - SP,-20.8071616,-49.9648439
SP,09/07/2025 - Revolução Constitucionalista,Revolução Constitucionalista,,2025-07-09,Macaubal - SP,-20.8071616,-49.9648439
SP,02/05/2025 - Feriado Municipal,Feriado Municipal,,2025-05-02,Macaubal - SP,-20.8071616,-49.9648439
SP,01/05/2025 - Dia do Trabalho,Dia do Trabalho,,2025-05-01,Macaubal - SP,-20.8071616,-49.9648439
SP,21/04/2025 - Dia de Tiradentes,Dia de Tiradentes,,2025-04-21,Macaubal - SP,-20.8071616,-49.9648439
SP,18/04/2025 - Sexta-Feira Santa,Sexta-Feira Santa,,2025-04-18,Macaubal - SP,-20.8071616,-49.9648439
SP,02/04/2025 - Feriado Municipal,Feriado Municipal,,2025-04-02,Macaubal - SP,-20.8071616,-49.9648439
SP,01/01/2025 - Ano Novo,Ano Novo,,2025-01-01,Macaubal - SP,-20.8071616,-49.9648439
SP,25/12/2025 - Natal,Natal,,2025-12-25,Laranjal Paulista - SP,-23.0526393,-47.8377379
SP,15/11/2025 - Proclamação da República,Proclamação da República,,2025-11-15,Laranjal Paulista - SP,-23.0526393,-47.8377379
SP,02/11/2025 - Dia de Finados,Dia de Finados,,2025-11-02,Laranjal Paulista - SP,-23.0526393,-47.8377379
SP,12/10/2025 - Nossa Senhora Aparecida,Nossa Senhora Aparecida,,2025-10-12,Laranjal Paulista - SP,-23.0526393,-47.8377379
SP,10/10/2025 - Aniversário do Município,Aniversário do Município,,2025-10-10,Laranjal Paulista - SP,-23.0526393,-47.8377379
SP,07/09/2025 - Independência do Brasil,Independência do Brasil,,2025-09-07,Laranjal Paulista - SP,-23.0526393,-47.8377379
SP,09/07/2025 - Revolução Constitucionalista,Revolução Constitucionalista,,2025-07-09,Laranjal Paulista - SP,-23.0526393,-47.8377379
SP,24/06/2025 - Feriado Municipal,Feriado Municipal,,2025-06-24,Laranjal Paulista - SP,-23.0526393,-47.8377379
SP,01/05/2025 - Dia do Trabalho,Dia do Trabalho,,2025-05-01,Laranjal Paulista - SP,-23.0526393,-47.8377379
SP,21/04/2025 - Dia de Tiradentes,Dia de Tiradentes,,2025-04-21,Laranjal Paulista - SP,-23.0526393,-47.8377379
SP,18/04/2025 - Sexta-Feira Santa,Sexta-Feira Santa,,2025-04-18,Laranjal Paulista - SP,-23.0526393,-47.8377379
SP,01/01/2025 - Ano Novo,Ano Novo,,2025-01-01,Laranjal Paulista - SP,-23.0526393,-47.8377379
SP,25/12/2025 - Natal,Natal,,2025-12-25,Lagoinha - SP,-23.5597511,-47.200425
SP,23/12/2025 - Feriado Municipal,Feriado Municipal,,2025-12-23,Lagoinha - SP,-23.5597511,-47.200425
SP,08/12/2025 - Feriado Municipal,Feriado Municipal,,2025-12-08,Lagoinha - SP,-23.5597511,-47.200425
SP,15/11/2025 - Proclamação da República,Proclamação da República,,2025-11-15,Lagoinha - SP,-23.5597511,-47.200425
SP,02/11/2025 - Dia de Finados,Dia de Finados,,2025-11-02,Lagoinha - SP,-23.5597511,-47.200425
SP,12/10/2025 - Nossa Senhora Aparecida,Nossa Senhora Aparecida,,2025-10-12,Lagoinha - SP,-23.5597511,-47.200425
SP,07/09/2025 - Independência do Brasil,Independência do Brasil,,2025-09-07,Lagoinha - SP,-23.5597511,-47.200425
SP,09/07/2025 - Revolução Constitucionalista,Revolução Constitucionalista,,2025-07-09,Lagoinha - SP,-23.5597511,-47.200425
SP,01/05/2025 - Dia do Trabalho,Dia do Trabalho,,2025-05-01,Lagoinha - SP,-23.5597511,-47.200425
SP,21/04/2025 - Dia de Tiradentes,Dia de Tiradentes,,2025-04-21,Lagoinha - SP,-23.5597511,-47.200425
SP,18/04/2025 - Sexta-Feira Santa,Sexta-Feira Santa,,2025-04-18,Lagoinha - SP,-23.5597511,-47.200425
SP,01/01/2025 - Ano Novo,Ano Novo,,2025-01-01,Lagoinha - SP,-23.5597511,-47.200425
SP,25/12/2025 - Natal,Natal,,2025-12-25,Juquitiba - SP,-23.932346,-47.0714217
SP,20/11/2025 - Dia da Consciência Negra,Dia da Consciência Negra,,2025-11-20,Juquitiba - SP,-23.932346,-47.0714217
SP,15/11/2025 - Proclamação da República,Proclamação da República,,2025-11-15,Juquitiba - SP,-23.932346,-47.0714217
SP,02/11/2025 - Dia de Finados,Dia de Finados,,2025-11-02,Juquitiba - SP,-23.932346,-47.0714217
SP,12/10/2025 - Nossa Senhora Aparecida,Nossa Senhora Aparecida,,2025-10-12,Juquitiba - SP,-23.932346,-47.0714217
SP,15/09/2025 - Feriado Municipal,Feriado Municipal,,2025-09-15,Juquitiba - SP,-23.932346,-47.0714217
SP,07/09/2025 - Independência do Brasil,Independência do Brasil,,2025-09-07,Juquitiba - SP,-23.932346,-47.0714217
SP,09/07/2025 - Revolução Constitucionalista,Revolução Constitucionalista,,2025-07-09,Juquitiba - SP,-23.932346,-47.0714217
SP,01/05/2025 - Dia do Trabalho,Dia do Trabalho,,2025-05-01,Juquitiba - SP,-23.932346,-47.0714217
SP,21/04/2025 - Dia de Tiradentes,Dia de Tiradentes,,2025-04-21,Juquitiba - SP,-23.932346,-47.0714217
SP,18/04/2025 - Sexta-Feira Santa,Sexta-Feira Santa,,2025-04-18,Juquitiba - SP,-23.932346,-47.0714217
SP,28/03/2025 - Feriado Municipal,Feriado Municipal,,2025-03-28,Juquitiba - SP,-23.932346,-47.0714217
SP,01/01/2025 - Ano Novo,Ano Novo,,2025-01-01,Juquitiba - SP,-23.932346,-47.0714217
SP,25/12/2025 - Natal,Natal,,2025-12-25,Jaboticabal - SP,-21.2639671,-48.3533772
SP,15/11/2025 - Proclamação da República,Proclamação da República,,2025-11-15,Jaboticabal - SP,-21.2639671,-48.3533772
SP,02/11/2025 - Finados,Finados,,2025-11-02,Jaboticabal - SP,-21.2639671,-48.3533772
SP,02/11/2025 - Dia de Finados,Dia de Finados,,2025-11-02,Jaboticabal - SP,-21.2639671,-48.3533772
SP,12/10/2025 - Nossa Senhora Aparecida,Nossa Senhora Aparecida,,2025-10-12,Jaboticabal - SP,-21.2639671,-48.3533772
SP,07/09/2025 - Independência do Brasil,Independência do Brasil,,2025-09-07,Jaboticabal - SP,-21.2639671,-48.3533772
SP,16/07/2025 - Padroeira,Padroeira,,2025-07-16,Jaboticabal - SP,-21.2639671,-48.3533772
SP,09/07/2025 - Revolução Constitucionalista,Revolução Constitucionalista,,2025-07-09,Jaboticabal - SP,-21.2639671,-48.3533772
SP,19/06/2025 - Corpus Christi,Corpus Christi,,2025-06-19,Jaboticabal - SP,-21.2639671,-48.3533772
SP,01/05/2025 - Dia do Trabalho,Dia do Trabalho,,2025-05-01,Jaboticabal - SP,-21.2639671,-48.3533772
SP,21/04/2025 - Dia de Tiradentes,Dia de Tiradentes,,2025-04-21,Jaboticabal - SP,-21.2639671,-48.3533772
SP,18/04/2025 - Sexta-feira Santa,Sexta-feira Santa,,2025-04-18,Jaboticabal - SP,-21.2639671,-48.3533772
SP,18/04/2025 - Sexta-Feira Santa,Sexta-Feira Santa,,2025-04-18,Jaboticabal - SP,-21.2639671,-48.3533772
SP,01/01/2025 - Ano Novo,Ano Novo,,2025-01-01,Jaboticabal - SP,-21.2639671,-48.3533772
SP,25/12/2025 - Natal,Natal,,2025-12-25,Jaci - SP,-20.8844434,-49.5710544
SP,15/11/2025 - Proclamação da República,Proclamação da República,,2025-11-15,Jaci - SP,-20.8844434,-49.5710544
SP,02/11/2025 - Dia de Finados,Dia de Finados,,2025-11-02,Jaci - SP,-20.8844434,-49.5710544
SP,12/10/2025 - Nossa Senhora Aparecida,Nossa Senhora Aparecida,,2025-10-12,Jaci - SP,-20.8844434,-49.5710544
SP,25/09/2025 - Feriado Municipal,Feriado Municipal,,2025-09-25,Jaci - SP,-20.8844434,-49.5710544
SP,07/09/2025 - Independência do Brasil,Independência do Brasil,,2025-09-07,Jaci - SP,-20.8844434,-49.5710544
SP,09/07/2025 - Revolução Constitucionalista,Revolução Constitucionalista,,2025-07-09,Jaci - SP,-20.8844434,-49.5710544
SP,01/05/2025 - Dia do Trabalho,Dia do Trabalho,,2025-05-01,Jaci - SP,-20.8844434,-49.5710544
SP,21/04/2025 - Dia de Tiradentes,Dia de Tiradentes,,2025-04-21,Jaci - SP,-20.8844434,-49.5710544
SP,18/04/2025 - Sexta-Feira Santa,Sexta-Feira Santa,,2025-04-18,Jaci - SP,-20.8844434,-49.5710544
SP,04/04/2025 - Feriado Municipal,Feriado Municipal,,2025-04-04,Jaci - SP,-20.8844434,-49.5710544
SP,01/01/2025 - Ano Novo,Ano Novo,,2025-01-01,Jaci - SP,-20.8844434,-49.5710544
SP,25/12/2025 - Natal,Natal,,2025-12-25,Jacupiranga - SP,-24.7009118,-48.0040093
SP,08/12/2025 - Feriado Municipal,Feriado Municipal,,2025-12-08,Jacupiranga - SP,-24.7009118,-48.0040093
SP,15/11/2025 - Proclamação da República,Proclamação da República,,2025-11-15,Jacupiranga - SP,-24.7009118,-48.0040093
SP,02/11/2025 - Dia de Finados,Dia de Finados,,2025-11-02,Jacupiranga - SP,-24.7009118,-48.0040093
SP,12/10/2025 - Nossa Senhora Aparecida,Nossa Senhora Aparecida,,2025-10-12,Jacupiranga - SP,-24.7009118,-48.0040093
SP,07/09/2025 - Independência do Brasil,Independência do Brasil,,2025-09-07,Jacupiranga - SP,-24.7009118,-48.0040093
SP,09/07/2025 - Revolução Constitucionalista,Revolução Constitucionalista,,2025-07-09,Jacupiranga - SP,-24.7009118,-48.0040093
SP,29/06/2025 - Feriado Municipal,Feriado Municipal,,2025-06-29,Jacupiranga - SP,-24.7009118,-48.0040093
SP,23/06/2025 - Feriado Municipal,Feriado Municipal,,2025-06-23,Jacupiranga - SP,-24.7009118,-48.0040093
SP,01/05/2025 - Dia do Trabalho,Dia do Trabalho,,2025-05-01,Jacupiranga - SP,-24.7009118,-48.0040093
SP,21/04/2025 - Dia de Tiradentes,Dia de Tiradentes,,2025-04-21,Jacupiranga - SP,-24.7009118,-48.0040093
SP,18/04/2025 - Sexta-Feira Santa,Sexta-Feira Santa,,2025-04-18,Jacupiranga - SP,-24.7009118,-48.0040093
SP,01/01/2025 - Ano Novo,Ano Novo,,2025-01-01,Jacupiranga - SP,-24.7009118,-48.0040093
SP,25/12/2025 - Natal,Natal,,2025-12-25,Jales - SP,-20.2650581,-50.5415405
SP,15/11/2025 - Proclamação da República,Proclamação da República,,2025-11-15,Jales - SP,-20.2650581,-50.5415405
SP,02/11/2025 - Dia de Finados,Dia de Finados,,2025-11-02,Jales - SP,-20.2650581,-50.5415405
SP,12/10/2025 - Nossa Senhora Aparecida,Nossa Senhora Aparecida,,2025-10-12,Jales - SP,-20.2650581,-50.5415405
SP,07/09/2025 - Independência do Brasil,Independência do Brasil,,2025-09-07,Jales - SP,-20.2650581,-50.5415405
SP,15/08/2025 - Feriado Municipal,Feriado Municipal,,2025-08-15,Jales - SP,-20.2650581,-50.5415405
SP,09/07/2025 - Revolução Constitucionalista,Revolução Constitucionalista,,2025-07-09,Jales - SP,-20.2650581,-50.5415405
SP,01/05/2025 - Dia do Trabalho,Dia do Trabalho,,2025-05-01,Jales - SP,-20.2650581,-50.5415405
SP,21/04/2025 - Dia de Tiradentes,Dia de Tiradentes,,2025-04-21,Jales - SP,-20.2650581,-50.5415405
SP,18/04/2025 - Sexta-Feira Santa,Sexta-Feira Santa,,2025-04-18,Jales - SP,-20.2650581,-50.5415405
SP,15/04/2025 - Feriado Municipal,Feriado Municipal,,2025-04-15,Jales - SP,-20.2650581,-50.5415405
SP,01/01/2025 - Ano Novo,Ano Novo,,2025-01-01,Jales - SP,-20.2650581,-50.5415405
SP,25/12/2025 - Natal,Natal,,2025-12-25,Jambeiro - SP,-23.2568477,-45.6917668
SP,20/11/2025 - Dia da Consciência Negra,Dia da Consciência Negra,,2025-11-20,Jambeiro - SP,-23.2568477,-45.6917668
SP,15/11/2025 - Proclamação da República,Proclamação da República,,2025-11-15,Jambeiro - SP,-23.2568477,-45.6917668
SP,02/11/2025 - Dia de Finados,Dia de Finados,,2025-11-02,Jambeiro - SP,-23.2568477,-45.6917668
SP,12/10/2025 - Nossa Senhora Aparecida,Nossa Senhora Aparecida,,2025-10-12,Jambeiro - SP,-23.2568477,-45.6917668
SP,15/09/2025 - Feriado Municipal,Feriado Municipal,,2025-09-15,Jambeiro - SP,-23.2568477,-45.6917668
SP,07/09/2025 - Independência do Brasil,Independência do Brasil,,2025-09-07,Jambeiro - SP,-23.2568477,-45.6917668
SP,09/07/2025 - Revolução Constitucionalista,Revolução Constitucionalista,,2025-07-09,Jambeiro - SP,-23.2568477,-45.6917668
SP,01/05/2025 - Dia do Trabalho,Dia do Trabalho,,2025-05-01,Jambeiro - SP,-23.2568477,-45.6917668
SP,21/04/2025 - Dia de Tiradentes,Dia de Tiradentes,,2025-04-21,Jambeiro - SP,-23.2568477,-45.6917668
SP,18/04/2025 - Sexta-Feira Santa,Sexta-Feira Santa,,2025-04-18,Jambeiro - SP,-23.2568477,-45.6917668
SP,30/03/2025 - Feriado Municipal,Feriado Municipal,,2025-03-30,Jambeiro - SP,-23.2568477,-45.6917668
SP,01/01/2025 - Ano Novo,Ano Novo,,2025-01-01,Jambeiro - SP,-23.2568477,-45.6917668
SP,25/12/2025 - Natal,Natal,,2025-12-25,Jandira - SP,-23.5217186,-46.9274298
SP,08/12/2025 - Feriado Municipal,Feriado Municipal,,2025-12-08,Jandira - SP,-23.5217186,-46.9274298
SP,20/11/2025 - Dia da Consciência Negra,Dia da Consciência Negra,,2025-11-20,Jandira - SP,-23.5217186,-46.9274298
SP,15/11/2025 - Proclamação da República,Proclamação da República,,2025-11-15,Jandira - SP,-23.5217186,-46.9274298
SP,02/11/2025 - Dia de Finados,Dia de Finados,,2025-11-02,Jandira - SP,-23.5217186,-46.9274298
SP,12/10/2025 - Nossa Senhora Aparecida,Nossa Senhora Aparecida,,2025-10-12,Jandira - SP,-23.5217186,-46.9274298
SP,07/09/2025 - Independência do Brasil,Independência do Brasil,,2025-09-07,Jandira - SP,-23.5217186,-46.9274298
SP,09/07/2025 - Revolução Constitucionalista,Revolução Constitucionalista,,2025-07-09,Jandira - SP,-23.5217186,-46.9274298
SP,01/05/2025 - Dia do Trabalho,Dia do Trabalho,,2025-05-01,Jandira - SP,-23.5217186,-46.9274298
SP,21/04/2025 - Dia de Tiradentes,Dia de Tiradentes,,2025-04-21,Jandira - SP,-23.5217186,-46.9274298
SP,18/04/2025 - Sexta-Feira Santa,Sexta-Feira Santa,,2025-04-18,Jandira - SP,-23.5217186,-46.9274298
SP,01/01/2025 - Ano Novo,Ano Novo,,2025-01-01,Jandira - SP,-23.5217186,-46.9274298
SP,25/12/2025 - Natal,Natal,,2025-12-25,Jarinu - SP,-23.003364,-46.7100952
SP,20/11/2025 - Dia da Consciência Negra,Dia da Consciência Negra,,2025-11-20,Jarinu - SP,-23.003364,-46.7100952
SP,15/11/2025 - Proclamação da República,Proclamação da República,,2025-11-15,Jarinu - SP,-23.003364,-46.7100952
SP,02/11/2025 - Dia de Finados,Dia de Finados,,2025-11-02,Jarinu - SP,-23.003364,-46.7100952
SP,12/10/2025 - Nossa Senhora Aparecida,Nossa Senhora Aparecida,,2025-10-12,Jarinu - SP,-23.003364,-46.7100952
SP,07/09/2025 - Independência do Brasil,Independência do Brasil,,2025-09-07,Jarinu - SP,-23.003364,-46.7100952
SP,16/07/2025 - Feriado Municipal,Feriado Municipal,,2025-07-16,Jarinu - SP,-23.003364,-46.7100952
SP,09/07/2025 - Revolução Constitucionalista,Revolução Constitucionalista,,2025-07-09,Jarinu - SP,-23.003364,-46.7100952
SP,01/05/2025 - Dia do Trabalho,Dia do Trabalho,,2025-05-01,Jarinu - SP,-23.003364,-46.7100952
SP,21/04/2025 - Dia de Tiradentes,Dia de Tiradentes,,2025-04-21,Jarinu - SP,-23.003364,-46.7100952
SP,18/04/2025 - Sexta-Feira Santa,Sexta-Feira Santa,,2025-04-18,Jarinu - SP,-23.003364,-46.7100952
SP,17/04/2025 - Feriado Municipal,Feriado Municipal,,2025-04-17,Jarinu - SP,-23.003364,-46.7100952
SP,01/01/2025 - Ano Novo,Ano Novo,,2025-01-01,Jarinu - SP,-23.003364,-46.7100952
SP,25/12/2025 - Natal,Natal,,2025-12-25,Jeriquara - SP,-20.3102459,-47.5896932
SP,20/11/2025 - Dia da Consciência Negra,Dia da Consciência Negra,,2025-11-20,Jeriquara - SP,-20.3102459,-47.5896932
SP,15/11/2025 - Proclamação da República,Proclamação da República,,2025-11-15,Jeriquara - SP,-20.3102459,-47.5896932
SP,02/11/2025 - Dia de Finados,Dia de Finados,,2025-11-02,Jeriquara - SP,-20.3102459,-47.5896932
SP,12/10/2025 - Nossa Senhora Aparecida,Nossa Senhora Aparecida,,2025-10-12,Jeriquara - SP,-20.3102459,-47.5896932
SP,07/09/2025 - Independência do Brasil,Independência do Brasil,,2025-09-07,Jeriquara - SP,-20.3102459,-47.5896932
SP,09/07/2025 - Revolução Constitucionalista,Revolução Constitucionalista,,2025-07-09,Jeriquara - SP,-20.3102459,-47.5896932
SP,01/05/2025 - Dia do Trabalho,Dia do Trabalho,,2025-05-01,Jeriquara - SP,-20.3102459,-47.5896932
SP,21/04/2025 - Dia de Tiradentes,Dia de Tiradentes,,2025-04-21,Jeriquara - SP,-20.3102459,-47.5896932
SP,18/04/2025 - Sexta-Feira Santa,Sexta-Feira Santa,,2025-04-18,Jeriquara - SP,-20.3102459,-47.5896932
SP,07/04/2025 - Feriado Municipal,Feriado Municipal,,2025-04-07,Jeriquara - SP,-20.3102459,-47.5896932
SP,20/01/2025 - Feriado Municipal,Feriado Municipal,,2025-01-20,Jeriquara - SP,-20.3102459,-47.5896932
SP,01/01/2025 - Ano Novo,Ano Novo,,2025-01-01,Jeriquara - SP,-20.3102459,-47.5896932
SP,25/12/2025 - Natal,Natal,,2025-12-25,Jumirim - SP,-23.0846251,-47.7869926
SP,15/11/2025 - Proclamação da República,Proclamação da República,,2025-11-15,Jumirim - SP,-23.0846251,-47.7869926
SP,02/11/2025 - Dia de Finados,Dia de Finados,,2025-11-02,Jumirim - SP,-23.0846251,-47.7869926
SP,12/10/2025 - Nossa Senhora Aparecida,Nossa Senhora Aparecida,,2025-10-12,Jumirim - SP,-23.0846251,-47.7869926
SP,07/09/2025 - Independência do Brasil,Independência do Brasil,,2025-09-07,Jumirim - SP,-23.0846251,-47.7869926
SP,06/08/2025 - Feriado Municipal,Feriado Municipal,,2025-08-06,Jumirim - SP,-23.0846251,-47.7869926
SP,09/07/2025 - Revolução Constitucionalista,Revolução Constitucionalista,,2025-07-09,Jumirim - SP,-23.0846251,-47.7869926
SP,21/05/2025 - Feriado Municipal,Feriado Municipal,,2025-05-21,Jumirim - SP,-23.0846251,-47.7869926
SP,01/05/2025 - Dia do Trabalho,Dia do Trabalho,,2025-05-01,Jumirim - SP,-23.0846251,-47.7869926
SP,21/04/2025 - Dia de Tiradentes,Dia de Tiradentes,,2025-04-21,Jumirim - SP,-23.0846251,-47.7869926
SP,18/04/2025 - Sexta-Feira Santa,Sexta-Feira Santa,,2025-04-18,Jumirim - SP,-23.0846251,-47.7869926
SP,01/01/2025 - Ano Novo,Ano Novo,,2025-01-01,Jumirim - SP,-23.0846251,-47.7869926
SP,25/12/2025 - Natal,Natal,,2025-12-25,Borborema - SP,-21.6210873,-49.0737506
SP,20/11/2025 - Dia da Consciência Negra,Dia da Consciência Negra,,2025-11-20,Borborema - SP,-21.6210873,-49.0737506
SP,15/11/2025 - Proclamação da República,Proclamação da República,,2025-11-15,Borborema - SP,-21.6210873,-49.0737506
SP,02/11/2025 - Dia de Finados,Dia de Finados,,2025-11-02,Borborema - SP,-21.6210873,-49.0737506
SP,12/10/2025 - Nossa Senhora Aparecida,Nossa Senhora Aparecida,,2025-10-12,Borborema - SP,-21.6210873,-49.0737506
SP,07/09/2025 - Independência do Brasil,Independência do Brasil,,2025-09-07,Borborema - SP,-21.6210873,-49.0737506
SP,09/07/2025 - Revolução Constitucionalista,Revolução Constitucionalista,,2025-07-09,Borborema - SP,-21.6210873,-49.0737506
SP,01/05/2025 - Dia do Trabalho,Dia do Trabalho,,2025-05-01,Borborema - SP,-21.6210873,-49.0737506
SP,21/04/2025 - Dia de Tiradentes,Dia de Tiradentes,,2025-04-21,Borborema - SP,-21.6210873,-49.0737506
SP,18/04/2025 - Sexta-Feira Santa,Sexta-Feira Santa,,2025-04-18,Borborema - SP,-21.6210873,-49.0737506
SP,21/03/2025 - Feriado Municipal,Feriado Municipal,,2025-03-21,Borborema - SP,-21.6210873,-49.0737506
SP,20/01/2025 - Feriado Municipal,Feriado Municipal,,2025-01-20,Borborema - SP,-21.6210873,-49.0737506
SP,01/01/2025 - Ano Novo,Ano Novo,,2025-01-01,Borborema - SP,-21.6210873,-49.0737506
SP,25/12/2025 - Natal,Natal,,2025-12-25,Boituva - SP,-22.7099923,-47.6204439
SP,15/11/2025 - Proclamação da República,Proclamação da República,,2025-11-15,Boituva - SP,-22.7099923,-47.6204439
SP,02/11/2025 - Dia de Finados,Dia de Finados,,2025-11-02,Boituva - SP,-22.7099923,-47.6204439
SP,12/10/2025 - Nossa Senhora Aparecida,Nossa Senhora Aparecida,,2025-10-12,Boituva - SP,-22.7099923,-47.6204439
SP,07/09/2025 - Independência do Brasil,Independência do Brasil,,2025-09-07,Boituva - SP,-22.7099923,-47.6204439
SP,06/09/2025 - Feriado Municipal,Feriado Municipal,,2025-09-06,Boituva - SP,-22.7099923,-47.6204439
SP,16/08/2025 - Feriado Municipal,Feriado Municipal,,2025-08-16,Boituva - SP,-22.7099923,-47.6204439
SP,09/07/2025 - Revolução Constitucionalista,Revolução Constitucionalista,,2025-07-09,Boituva - SP,-22.7099923,-47.6204439
SP,01/05/2025 - Dia do Trabalho,Dia do Trabalho,,2025-05-01,Boituva - SP,-22.7099923,-47.6204439
SP,21/04/2025 - Dia de Tiradentes,Dia de Tiradentes,,2025-04-21,Boituva - SP,-22.7099923,-47.6204439
SP,18/04/2025 - Sexta-Feira Santa,Sexta-Feira Santa,,2025-04-18,Boituva - SP,-22.7099923,-47.6204439
SP,01/01/2025 - Ano Novo,Ano Novo,,2025-01-01,Boituva - SP,-22.7099923,-47.6204439
SP,25/12/2025 - Natal,Natal,,2025-12-25,Bofete - SP,-23.1019554,-48.2610535
SP,20/11/2025 - Dia da Consciência Negra - Lei no 1.914 de 04 de dezembro de 2007,Dia da Consciência Negra,Lei no 1.914 de 04 de dezembro de 2007,2025-11-20,Bofete - SP,-23.1019554,-48.2610535
SP,15/11/2025 - Proclamação da República,Proclamação da República,,2025-11-15,Bofete - SP,-23.1019554,-48.2610535
SP,02/11/2025 - Dia de Finados,Dia de Finados,,2025-11-02,Bofete - SP,-23.1019554,-48.2610535
SP,12/10/2025 - Nossa Senhora Aparecida,Nossa Senhora Aparecida,,2025-10-12,Bofete - SP,-23.1019554,-48.2610535
SP,09/09/2025 - Feriado Municipal,Feriado Municipal,,2025-09-09,Bofete - SP,-23.1019554,-48.2610535
SP,07/09/2025 - Independência do Brasil,Independência do Brasil,,2025-09-07,Bofete - SP,-23.1019554,-48.2610535
SP,09/07/2025 - Revolução Constitucionalista,Revolução Constitucionalista,,2025-07-09,Bofete - SP,-23.1019554,-48.2610535
SP,01/05/2025 - Dia do Trabalho,Dia do Trabalho,,2025-05-01,Bofete - SP,-23.1019554,-48.2610535
SP,21/04/2025 - Dia de Tiradentes,Dia de Tiradentes,,2025-04-21,Bofete - SP,-23.1019554,-48.2610535
SP,18/04/2025 - Sexta-Feira Santa,Sexta-Feira Santa,,2025-04-18,Bofete - SP,-23.1019554,-48.2610535
SP,01/01/2025 - Ano Novo,Ano Novo,,2025-01-01,Bofete - SP,-23.1019554,-48.2610535
SP,25/12/2025 - Natal,Natal,,2025-12-25,Bocaina - SP,-23.6865552,-46.4512849
SP,08/12/2025 - Nossa Sra. Conceição,Nossa Sra. Conceição,,2025-12-08,Bocaina - SP,-23.6865552,-46.4512849
SP,15/11/2025 - Proclamação da República,Proclamação da República,,2025-11-15,Bocaina - SP,-23.6865552,-46.4512849
SP,02/11/2025 - Dia de Finados,Dia de Finados,,2025-11-02,Bocaina - SP,-23.6865552,-46.4512849
SP,12/10/2025 - Nossa Senhora Aparecida,Nossa Senhora Aparecida,,2025-10-12,Bocaina - SP,-23.6865552,-46.4512849
SP,07/09/2025 - Independência do Brasil,Independência do Brasil,,2025-09-07,Bocaina - SP,-23.6865552,-46.4512849
SP,09/07/2025 - Revolução Constitucionalista,Revolução Constitucionalista,,2025-07-09,Bocaina - SP,-23.6865552,-46.4512849
SP,24/06/2025 - Feriado Municipal,Feriado Municipal,,2025-06-24,Bocaina - SP,-23.6865552,-46.4512849
SP,01/05/2025 - Dia do Trabalho,Dia do Trabalho,,2025-05-01,Bocaina - SP,-23.6865552,-46.4512849
SP,21/04/2025 - Dia de Tiradentes,Dia de Tiradentes,,2025-04-21,Bocaina - SP,-23.6865552,-46.4512849
SP,18/04/2025 - Sexta-Feira Santa,Sexta-Feira Santa,,2025-04-18,Bocaina - SP,-23.6865552,-46.4512849
SP,01/01/2025 - Ano Novo,Ano Novo,,2025-01-01,Bocaina - SP,-23.6865552,-46.4512849
SP,25/12/2025 - Natal,Natal,,2025-12-25,Biritiba Mirim - SP,-23.5838735,-46.0122538
SP,15/11/2025 - Proclamação da República,Proclamação da República,,2025-11-15,Biritiba Mirim - SP,-23.5838735,-46.0122538
SP,02/11/2025 - Dia de Finados,Dia de Finados,,2025-11-02,Biritiba Mirim - SP,-23.5838735,-46.0122538
SP,12/10/2025 - Nossa Senhora Aparecida,Nossa Senhora Aparecida,,2025-10-12,Biritiba Mirim - SP,-23.5838735,-46.0122538
SP,07/09/2025 - Independência do Brasil,Independência do Brasil,,2025-09-07,Biritiba Mirim - SP,-23.5838735,-46.0122538
SP,09/07/2025 - Revolução Constitucionalista,Revolução Constitucionalista,,2025-07-09,Biritiba Mirim - SP,-23.5838735,-46.0122538
SP,01/05/2025 - Dia do Trabalho,Dia do Trabalho,,2025-05-01,Biritiba Mirim - SP,-23.5838735,-46.0122538
SP,21/04/2025 - Dia de Tiradentes,Dia de Tiradentes,,2025-04-21,Biritiba Mirim - SP,-23.5838735,-46.0122538
SP,18/04/2025 - Sexta-Feira Santa,Sexta-Feira Santa,,2025-04-18,Biritiba Mirim - SP,-23.5838735,-46.0122538
SP,01/01/2025 - Ano Novo,Ano Novo,,2025-01-01,Biritiba Mirim - SP,-23.5838735,-46.0122538
SP,25/12/2025 - Natal,Natal,,2025-12-25,Birigui - SP,-21.2845003,-50.3393679
SP,08/12/2025 -  Nossa Sra da Conceição, Nossa Sra da Conceição,,2025-12-08,Birigui - SP,-21.2845003,-50.3393679
SP,15/11/2025 - Proclamação da República,Proclamação da República,,2025-11-15,Birigui - SP,-21.2845003,-50.3393679
SP,02/11/2025 - Dia de Finados,Dia de Finados,,2025-11-02,Birigui - SP,-21.2845003,-50.3393679
SP,12/10/2025 - Nossa Senhora Aparecida,Nossa Senhora Aparecida,,2025-10-12,Birigui - SP,-21.2845003,-50.3393679
SP,07/09/2025 - Independência do Brasil,Independência do Brasil,,2025-09-07,Birigui - SP,-21.2845003,-50.3393679
SP,09/07/2025 - Revolução Constitucionalista,Revolução Constitucionalista,,2025-07-09,Birigui - SP,-21.2845003,-50.3393679
SP,01/05/2025 - Dia do Trabalho,Dia do Trabalho,,2025-05-01,Birigui - SP,-21.2845003,-50.3393679
SP,21/04/2025 - Dia de Tiradentes,Dia de Tiradentes,,2025-04-21,Birigui - SP,-21.2845003,-50.3393679
SP,18/04/2025 - Sexta-Feira Santa,Sexta-Feira Santa,,2025-04-18,Birigui - SP,-21.2845003,-50.3393679
SP,01/01/2025 - Ano Novo,Ano Novo,,2025-01-01,Birigui - SP,-21.2845003,-50.3393679
SP,25/12/2025 - Natal,Natal,,2025-12-25,Bilac - SP,-21.3971858,-50.4653177
SP,15/11/2025 - Proclamação da República,Proclamação da República,,2025-11-15,Bilac - SP,-21.3971858,-50.4653177
SP,02/11/2025 - Dia de Finados,Dia de Finados,,2025-11-02,Bilac - SP,-21.3971858,-50.4653177
SP,12/10/2025 - Nossa Senhora Aparecida,Nossa Senhora Aparecida,,2025-10-12,Bilac - SP,-21.3971858,-50.4653177
SP,08/09/2025 - Feriado Municipal,Feriado Municipal,,2025-09-08,Bilac - SP,-21.3971858,-50.4653177
SP,07/09/2025 - Independência do Brasil,Independência do Brasil,,2025-09-07,Bilac - SP,-21.3971858,-50.4653177
SP,09/07/2025 - Revolução Constitucionalista,Revolução Constitucionalista,,2025-07-09,Bilac - SP,-21.3971858,-50.4653177
SP,01/05/2025 - Dia do Trabalho,Dia do Trabalho,,2025-05-01,Bilac - SP,-21.3971858,-50.4653177
SP,21/04/2025 - Dia de Tiradentes,Dia de Tiradentes,,2025-04-21,Bilac - SP,-21.3971858,-50.4653177
SP,18/04/2025 - Feriado Municipal,Feriado Municipal,,2025-04-18,Bilac - SP,-21.3971858,-50.4653177
SP,18/04/2025 - Sexta-Feira Santa,Sexta-Feira Santa,,2025-04-18,Bilac - SP,-21.3971858,-50.4653177
SP,01/01/2025 - Ano Novo,Ano Novo,,2025-01-01,Bilac - SP,-21.3971858,-50.4653177
SP,25/12/2025 - Natal,Natal,,2025-12-25,Bertioga - SP,-22.3718293,-46.9438281
SP,20/11/2025 - Consciência Negra,Consciência Negra,,2025-11-20,Bertioga - SP,-22.3718293,-46.9438281
SP,15/11/2025 - Proclamação da República,Proclamação da República,,2025-11-15,Bertioga - SP,-22.3718293,-46.9438281
SP,02/11/2025 - Dia de Finados,Dia de Finados,,2025-11-02,Bertioga - SP,-22.3718293,-46.9438281
SP,12/10/2025 - Nossa Senhora Aparecida,Nossa Senhora Aparecida,,2025-10-12,Bertioga - SP,-22.3718293,-46.9438281
SP,07/09/2025 - Independência do Brasil,Independência do Brasil,,2025-09-07,Bertioga - SP,-22.3718293,-46.9438281
SP,09/07/2025 - Revolução Constitucionalista,Revolução Constitucionalista,,2025-07-09,Bertioga - SP,-22.3718293,-46.9438281
SP,24/06/2025 - São João,São João,,2025-06-24,Bertioga - SP,-22.3718293,-46.9438281
SP,19/05/2025 - Emancipação,Emancipação,,2025-05-19,Bertioga - SP,-22.3718293,-46.9438281
SP,01/05/2025 - Dia do Trabalho,Dia do Trabalho,,2025-05-01,Bertioga - SP,-22.3718293,-46.9438281
SP,21/04/2025 - Dia de Tiradentes,Dia de Tiradentes,,2025-04-21,Bertioga - SP,-22.3718293,-46.9438281
SP,18/04/2025 - Sexta-Feira Santa,Sexta-Feira Santa,,2025-04-18,Bertioga - SP,-22.3718293,-46.9438281
SP,01/01/2025 - Ano Novo,Ano Novo,,2025-01-01,Bertioga - SP,-22.3718293,-46.9438281
SP,25/12/2025 - Natal,Natal,,2025-12-25,Bernardino de Campos - SP,-23.0140216,-49.4760724
SP,15/11/2025 - Proclamação da República,Proclamação da República,,2025-11-15,Bernardino de Campos - SP,-23.0140216,-49.4760724
SP,02/11/2025 - Dia de Finados,Dia de Finados,,2025-11-02,Bernardino de Campos - SP,-23.0140216,-49.4760724
SP,12/10/2025 - Nossa Senhora Aparecida,Nossa Senhora Aparecida,,2025-10-12,Bernardino de Campos - SP,-23.0140216,-49.4760724
SP,09/10/2025 - Aniversário do município,Aniversário do município,,2025-10-09,Bernardino de Campos - SP,-23.0140216,-49.4760724
SP,07/09/2025 - Independência do Brasil,Independência do Brasil,,2025-09-07,Bernardino de Campos - SP,-23.0140216,-49.4760724
SP,15/08/2025 - Feriado Municipal,Feriado Municipal,,2025-08-15,Bernardino de Campos - SP,-23.0140216,-49.4760724
SP,09/07/2025 - Revolução Constitucionalista,Revolução Constitucionalista,,2025-07-09,Bernardino de Campos - SP,-23.0140216,-49.4760724
SP,01/05/2025 - Dia do Trabalho,Dia do Trabalho,,2025-05-01,Bernardino de Campos - SP,-23.0140216,-49.4760724
SP,21/04/2025 - Dia de Tiradentes,Dia de Tiradentes,,2025-04-21,Bernardino de Campos - SP,-23.0140216,-49.4760724
SP,18/04/2025 - Sexta-Feira Santa,Sexta-Feira Santa,,2025-04-18,Bernardino de Campos - SP,-23.0140216,-49.4760724
SP,01/01/2025 - Ano Novo,Ano Novo,,2025-01-01,Bernardino de Campos - SP,-23.0140216,-49.4760724
SP,25/12/2025 - Natal,Natal,,2025-12-25,Bento de Abreu - SP,-21.7761107,-48.1765268
SP,20/11/2025 - Dia da Consciência Negra,Dia da Consciência Negra,,2025-11-20,Bento de Abreu - SP,-21.7761107,-48.1765268
SP,15/11/2025 - Proclamação da República,Proclamação da República,,2025-11-15,Bento de Abreu - SP,-21.7761107,-48.1765268
SP,02/11/2025 - Dia de Finados,Dia de Finados,,2025-11-02,Bento de Abreu - SP,-21.7761107,-48.1765268
SP,12/10/2025 - Nossa Senhora Aparecida,Nossa Senhora Aparecida,,2025-10-12,Bento de Abreu - SP,-21.7761107,-48.1765268
SP,07/09/2025 - Independência do Brasil,Independência do Brasil,,2025-09-07,Bento de Abreu - SP,-21.7761107,-48.1765268
SP,15/08/2025 - Feriado Municipal,Feriado Municipal,,2025-08-15,Bento de Abreu - SP,-21.7761107,-48.1765268
SP,09/07/2025 - Revolução Constitucionalista,Revolução Constitucionalista,,2025-07-09,Bento de Abreu - SP,-21.7761107,-48.1765268
SP,01/05/2025 - Dia do Trabalho,Dia do Trabalho,,2025-05-01,Bento de Abreu - SP,-21.7761107,-48.1765268
SP,21/04/2025 - Dia de Tiradentes,Dia de Tiradentes,,2025-04-21,Bento de Abreu - SP,-21.7761107,-48.1765268
SP,18/04/2025 - Sexta-Feira Santa,Sexta-Feira Santa,,2025-04-18,Bento de Abreu - SP,-21.7761107,-48.1765268
SP,27/03/2025 - Feriado Municipal,Feriado Municipal,,2025-03-27,Bento de Abreu - SP,-21.7761107,-48.1765268
SP,01/01/2025 - Ano Novo,Ano Novo,,2025-01-01,Bento de Abreu - SP,-21.7761107,-48.1765268
SP,25/12/2025 - Natal,Natal,,2025-12-25,Bebedouro - SP,-20.942381,-48.4968795
SP,15/11/2025 - Proclamação da República,Proclamação da República,,2025-11-15,Bebedouro - SP,-20.942381,-48.4968795
SP,02/11/2025 - Dia de Finados,Dia de Finados,,2025-11-02,Bebedouro - SP,-20.942381,-48.4968795
SP,12/10/2025 - Nossa Senhora Aparecida,Nossa Senhora Aparecida,,2025-10-12,Bebedouro - SP,-20.942381,-48.4968795
SP,07/09/2025 - Independência do Brasil,Independência do Brasil,,2025-09-07,Bebedouro - SP,-20.942381,-48.4968795
SP,09/07/2025 - Revolução Constitucionalista,Revolução Constitucionalista,,2025-07-09,Bebedouro - SP,-20.942381,-48.4968795
SP,24/06/2025 - Feriado Municipal,Feriado Municipal,,2025-06-24,Bebedouro - SP,-20.942381,-48.4968795
SP,03/05/2025 - Feriado Municipal,Feriado Municipal,,2025-05-03,Bebedouro - SP,-20.942381,-48.4968795
SP,01/05/2025 - Dia do Trabalho,Dia do Trabalho,,2025-05-01,Bebedouro - SP,-20.942381,-48.4968795
SP,21/04/2025 - Dia de Tiradentes,Dia de Tiradentes,,2025-04-21,Bebedouro - SP,-20.942381,-48.4968795
SP,18/04/2025 - Sexta-Feira Santa,Sexta-Feira Santa,,2025-04-18,Bebedouro - SP,-20.942381,-48.4968795
SP,01/01/2025 - Ano Novo,Ano Novo,,2025-01-01,Bebedouro - SP,-20.942381,-48.4968795
SP,25/12/2025 - Natal,Natal,,2025-12-25,Bauru - SP,-22.3146943,-49.0426495
SP,15/11/2025 - Proclamação da República,Proclamação da República,,2025-11-15,Bauru - SP,-22.3146943,-49.0426495
SP,02/11/2025 - Dia de Finados,Dia de Finados,,2025-11-02,Bauru - SP,-22.3146943,-49.0426495
SP,12/10/2025 - Nossa Senhora Aparecida,Nossa Senhora Aparecida,,2025-10-12,Bauru - SP,-22.3146943,-49.0426495
SP,07/09/2025 - Independência do Brasil,Independência do Brasil,,2025-09-07,Bauru - SP,-22.3146943,-49.0426495
SP,01/08/2025 - Aniversário,Aniversário,,2025-08-01,Bauru - SP,-22.3146943,-49.0426495
SP,09/07/2025 - Revolução Constitucionalista,Revolução Constitucionalista,,2025-07-09,Bauru - SP,-22.3146943,-49.0426495
SP,19/06/2025 - Corpus Christi,Corpus Christi,,2025-06-19,Bauru - SP,-22.3146943,-49.0426495
SP,01/05/2025 - Dia do Trabalho,Dia do Trabalho,,2025-05-01,Bauru - SP,-22.3146943,-49.0426495
SP,21/04/2025 - Dia de Tiradentes,Dia de Tiradentes,,2025-04-21,Bauru - SP,-22.3146943,-49.0426495
SP,18/04/2025 - Sexta-Feira Santa,Sexta-Feira Santa,,2025-04-18,Bauru - SP,-22.3146943,-49.0426495
SP,01/01/2025 - Ano Novo,Ano Novo,,2025-01-01,Bauru - SP,-22.3146943,-49.0426495
SP,25/12/2025 - Natal,Natal,,2025-12-25,Batatais - SP,-20.8898924,-47.5862388
SP,15/11/2025 - Proclamação da República,Proclamação da República,,2025-11-15,Batatais - SP,-20.8898924,-47.5862388
SP,02/11/2025 - Dia de Finados,Dia de Finados,,2025-11-02,Batatais - SP,-20.8898924,-47.5862388
SP,12/10/2025 - Nossa Senhora Aparecida,Nossa Senhora Aparecida,,2025-10-12,Batatais - SP,-20.8898924,-47.5862388
SP,07/09/2025 - Independência do Brasil,Independência do Brasil,,2025-09-07,Batatais - SP,-20.8898924,-47.5862388
SP,06/08/2025 - Feriado Municipal,Feriado Municipal,,2025-08-06,Batatais - SP,-20.8898924,-47.5862388
SP,09/07/2025 - Revolução Constitucionalista,Revolução Constitucionalista,,2025-07-09,Batatais - SP,-20.8898924,-47.5862388
SP,01/05/2025 - Dia do Trabalho,Dia do Trabalho,,2025-05-01,Batatais - SP,-20.8898924,-47.5862388
SP,21/04/2025 - Dia de Tiradentes,Dia de Tiradentes,,2025-04-21,Batatais - SP,-20.8898924,-47.5862388
SP,18/04/2025 - Sexta-Feira Santa,Sexta-Feira Santa,,2025-04-18,Batatais - SP,-20.8898924,-47.5862388
SP,14/03/2025 - Feriado Municipal,Feriado Municipal,,2025-03-14,Batatais - SP,-20.8898924,-47.5862388
SP,01/01/2025 - Ano Novo,Ano Novo,,2025-01-01,Batatais - SP,-20.8898924,-47.5862388
SP,25/12/2025 - Natal,Natal,,2025-12-25,Bastos - SP,-21.9263785,-50.7286184
SP,03/12/2025 - Feriado Municipal,Feriado Municipal,,2025-12-03,Bastos - SP,-21.9263785,-50.7286184
SP,15/11/2025 - Proclamação da República,Proclamação da República,,2025-11-15,Bastos - SP,-21.9263785,-50.7286184
SP,02/11/2025 - Dia de Finados,Dia de Finados,,2025-11-02,Bastos - SP,-21.9263785,-50.7286184
SP,12/10/2025 - Nossa Senhora Aparecida,Nossa Senhora Aparecida,,2025-10-12,Bastos - SP,-21.9263785,-50.7286184
SP,07/09/2025 - Independência do Brasil,Independência do Brasil,,2025-09-07,Bastos - SP,-21.9263785,-50.7286184
SP,09/07/2025 - Revolução Constitucionalista,Revolução Constitucionalista,,2025-07-09,Bastos - SP,-21.9263785,-50.7286184
SP,18/06/2025 - Feriado Municipal,Feriado Municipal,,2025-06-18,Bastos - SP,-21.9263785,-50.7286184
SP,01/05/2025 - Dia do Trabalho,Dia do Trabalho,,2025-05-01,Bastos - SP,-21.9263785,-50.7286184
SP,21/04/2025 - Dia de Tiradentes,Dia de Tiradentes,,2025-04-21,Bastos - SP,-21.9263785,-50.7286184
SP,18/04/2025 - Sexta-Feira Santa,Sexta-Feira Santa,,2025-04-18,Bastos - SP,-21.9263785,-50.7286184
SP,01/01/2025 - Ano Novo,Ano Novo,,2025-01-01,Bastos - SP,-21.9263785,-50.7286184
SP,25/12/2025 - Natal,Natal,,2025-12-25,Barueri - SP,-23.4978404,-46.9184537
SP,20/11/2025 - Consciência Negra,Consciência Negra,,2025-11-20,Barueri - SP,-23.4978404,-46.9184537
SP,15/11/2025 - Proclamação da República,Proclamação da República,,2025-11-15,Barueri - SP,-23.4978404,-46.9184537
SP,02/11/2025 - Dia de Finados,Dia de Finados,,2025-11-02,Barueri - SP,-23.4978404,-46.9184537
SP,12/10/2025 - Nossa Senhora Aparecida,Nossa Senhora Aparecida,,2025-10-12,Barueri - SP,-23.4978404,-46.9184537
SP,07/09/2025 - Independência do Brasil,Independência do Brasil,,2025-09-07,Barueri - SP,-23.4978404,-46.9184537
SP,09/07/2025 - Revolução Constitucionalista,Revolução Constitucionalista,,2025-07-09,Barueri - SP,-23.4978404,-46.9184537
SP,24/06/2025 - Padroeiro,Padroeiro,,2025-06-24,Barueri - SP,-23.4978404,-46.9184537
SP,19/06/2025 - Corpus Christi,Corpus Christi,,2025-06-19,Barueri - SP,-23.4978404,-46.9184537
SP,01/05/2025 - Dia do Trabalho,Dia do Trabalho,,2025-05-01,Barueri - SP,-23.4978404,-46.9184537
SP,21/04/2025 - Dia de Tiradentes,Dia de Tiradentes,,2025-04-21,Barueri - SP,-23.4978404,-46.9184537
SP,18/04/2025 - Sexta-Feira Santa,Sexta-Feira Santa,,2025-04-18,Barueri - SP,-23.4978404,-46.9184537
SP,01/01/2025 - Ano Novo,Ano Novo,,2025-01-01,Barueri - SP,-23.4978404,-46.9184537
SP,30/12/2025 - Feriado Municipal,Feriado Municipal,,2025-12-30,Barrinha - SP,-21.1924694,-48.1578207
SP,25/12/2025 - Natal,Natal,,2025-12-25,Barrinha - SP,-21.1924694,-48.1578207
SP,20/11/2025 - Dia da Consciência Negra,Dia da Consciência Negra,,2025-11-20,Barrinha - SP,-21.1924694,-48.1578207
SP,15/11/2025 - Proclamação da República,Proclamação da República,,2025-11-15,Barrinha - SP,-21.1924694,-48.1578207
SP,02/11/2025 - Dia de Finados,Dia de Finados,,2025-11-02,Barrinha - SP,-21.1924694,-48.1578207
SP,12/10/2025 - Nossa Senhora Aparecida,Nossa Senhora Aparecida,,2025-10-12,Barrinha - SP,-21.1924694,-48.1578207
SP,07/09/2025 - Independência do Brasil,Independência do Brasil,,2025-09-07,Barrinha - SP,-21.1924694,-48.1578207
SP,09/07/2025 - Revolução Constitucionalista,Revolução Constitucionalista,,2025-07-09,Barrinha - SP,-21.1924694,-48.1578207
SP,24/06/2025 - Feriado Municipal,Feriado Municipal,,2025-06-24,Barrinha - SP,-21.1924694,-48.1578207
SP,01/05/2025 - Dia do Trabalho,Dia do Trabalho,,2025-05-01,Barrinha - SP,-21.1924694,-48.1578207
SP,21/04/2025 - Dia de Tiradentes,Dia de Tiradentes,,2025-04-21,Barrinha - SP,-21.1924694,-48.1578207
SP,18/04/2025 - Sexta-Feira Santa,Sexta-Feira Santa,,2025-04-18,Barrinha - SP,-21.1924694,-48.1578207
SP,01/01/2025 - Ano Novo,Ano Novo,,2025-01-01,Barrinha - SP,-21.1924694,-48.1578207
SP,25/12/2025 - Natal,Natal,,2025-12-25,Barretos - SP,-20.4734151,-48.4879649
SP,20/11/2025 - Dia da Consciência Negra,Dia da Consciência Negra,,2025-11-20,Barretos - SP,-20.4734151,-48.4879649
SP,15/11/2025 - Proclamação da República,Proclamação da República,,2025-11-15,Barretos - SP,-20.4734151,-48.4879649
SP,02/11/2025 - Dia de Finados,Dia de Finados,,2025-11-02,Barretos - SP,-20.4734151,-48.4879649
SP,12/10/2025 - Nossa Senhora Aparecida,Nossa Senhora Aparecida,,2025-10-12,Barretos - SP,-20.4734151,-48.4879649
SP,07/09/2025 - Independência do Brasil,Independência do Brasil,,2025-09-07,Barretos - SP,-20.4734151,-48.4879649
SP,25/08/2025 - Feriado Municipal,Feriado Municipal,,2025-08-25,Barretos - SP,-20.4734151,-48.4879649
SP,09/07/2025 - Revolução Constitucionalista,Revolução Constitucionalista,,2025-07-09,Barretos - SP,-20.4734151,-48.4879649
SP,01/05/2025 - Dia do Trabalho,Dia do Trabalho,,2025-05-01,Barretos - SP,-20.4734151,-48.4879649
SP,21/04/2025 - Dia de Tiradentes,Dia de Tiradentes,,2025-04-21,Barretos - SP,-20.4734151,-48.4879649
SP,18/04/2025 - Sexta-Feira Santa,Sexta-Feira Santa,,2025-04-18,Barretos - SP,-20.4734151,-48.4879649
SP,01/01/2025 - Ano Novo,Ano Novo,,2025-01-01,Barretos - SP,-20.4734151,-48.4879649
SP,25/12/2025 - Natal,Natal,,2025-12-25,Barra do Turvo - SP,-24.756421,-48.5056942
SP,15/11/2025 - Proclamação da República,Proclamação da República,,2025-11-15,Barra do Turvo - SP,-24.756421,-48.5056942
SP,02/11/2025 - Dia de Finados,Dia de Finados,,2025-11-02,Barra do Turvo - SP,-24.756421,-48.5056942
SP,12/10/2025 - Nossa Senhora Aparecida,Nossa Senhora Aparecida,,2025-10-12,Barra do Turvo - SP,-24.756421,-48.5056942
SP,07/09/2025 - Independência do Brasil,Independência do Brasil,,2025-09-07,Barra do Turvo - SP,-24.756421,-48.5056942
SP,19/08/2025 - Feriado Municipal,Feriado Municipal,,2025-08-19,Barra do Turvo - SP,-24.756421,-48.5056942
SP,09/07/2025 - Revolução Constitucionalista,Revolução Constitucionalista,,2025-07-09,Barra do Turvo - SP,-24.756421,-48.5056942
SP,01/05/2025 - Dia do Trabalho,Dia do Trabalho,,2025-05-01,Barra do Turvo - SP,-24.756421,-48.5056942
SP,21/04/2025 - Dia de Tiradentes,Dia de Tiradentes,,2025-04-21,Barra do Turvo - SP,-24.756421,-48.5056942
SP,18/04/2025 - Sexta-Feira Santa,Sexta-Feira Santa,,2025-04-18,Barra do Turvo - SP,-24.756421,-48.5056942
SP,21/03/2025 - Feriado Municipal,Feriado Municipal,,2025-03-21,Barra do Turvo - SP,-24.756421,-48.5056942
SP,01/01/2025 - Ano Novo,Ano Novo,,2025-01-01,Barra do Turvo - SP,-24.756421,-48.5056942
SP,25/12/2025 - Natal,Natal,,2025-12-25,Barra Bonita - SP,-22.4795685,-48.5648897
SP,15/11/2025 - Proclamação da República,Proclamação da República,,2025-11-15,Barra Bonita - SP,-22.4795685,-48.5648897
SP,02/11/2025 - Dia de Finados,Dia de Finados,,2025-11-02,Barra Bonita - SP,-22.4795685,-48.5648897
SP,12/10/2025 - Nossa Senhora Aparecida,Nossa Senhora Aparecida,,2025-10-12,Barra Bonita - SP,-22.4795685,-48.5648897
SP,07/09/2025 - Independência do Brasil,Independência do Brasil,,2025-09-07,Barra Bonita - SP,-22.4795685,-48.5648897
SP,09/07/2025 - Revolução Constitucionalista,Revolução Constitucionalista,,2025-07-09,Barra Bonita - SP,-22.4795685,-48.5648897
SP,01/05/2025 - Dia do Trabalho,Dia do Trabalho,,2025-05-01,Barra Bonita - SP,-22.4795685,-48.5648897
SP,21/04/2025 - Dia de Tiradentes,Dia de Tiradentes,,2025-04-21,Barra Bonita - SP,-22.4795685,-48.5648897
SP,18/04/2025 - Sexta-Feira Santa,Sexta-Feira Santa,,2025-04-18,Barra Bonita - SP,-22.4795685,-48.5648897
SP,19/03/2025 - São José,São José,,2025-03-19,Barra Bonita - SP,-22.4795685,-48.5648897
SP,01/01/2025 - Ano Novo,Ano Novo,,2025-01-01,Barra Bonita - SP,-22.4795685,-48.5648897
SP,25/12/2025 - Natal,Natal,,2025-12-25,Bariri - SP,-22.0939133,-48.7415785
SP,15/11/2025 - Proclamação da República,Proclamação da República,,2025-11-15,Bariri - SP,-22.0939133,-48.7415785
SP,02/11/2025 - Dia de Finados,Dia de Finados,,2025-11-02,Bariri - SP,-22.0939133,-48.7415785
SP,12/10/2025 - Nossa Senhora Aparecida,Nossa Senhora Aparecida,,2025-10-12,Bariri - SP,-22.0939133,-48.7415785
SP,15/09/2025 - Feriado Municipal,Feriado Municipal,,2025-09-15,Bariri - SP,-22.0939133,-48.7415785
SP,07/09/2025 - Independência do Brasil,Independência do Brasil,,2025-09-07,Bariri - SP,-22.0939133,-48.7415785
SP,09/07/2025 - Revolução Constitucionalista,Revolução Constitucionalista,,2025-07-09,Bariri - SP,-22.0939133,-48.7415785
SP,16/06/2025 - Feriado Municipal,Feriado Municipal,,2025-06-16,Bariri - SP,-22.0939133,-48.7415785
SP,01/05/2025 - Dia do Trabalho,Dia do Trabalho,,2025-05-01,Bariri - SP,-22.0939133,-48.7415785
SP,21/04/2025 - Dia de Tiradentes,Dia de Tiradentes,,2025-04-21,Bariri - SP,-22.0939133,-48.7415785
SP,18/04/2025 - Sexta-Feira Santa,Sexta-Feira Santa,,2025-04-18,Bariri - SP,-22.0939133,-48.7415785
SP,01/01/2025 - Ano Novo,Ano Novo,,2025-01-01,Bariri - SP,-22.0939133,-48.7415785
SP,25/12/2025 - Natal,Natal,,2025-12-25,Barbosa - SP,-23.5632118,-46.619612
SP,20/11/2025 - Dia da Consciência Negra,Dia da Consciência Negra,,2025-11-20,Barbosa - SP,-23.5632118,-46.619612
SP,15/11/2025 - Proclamação da República,Proclamação da República,,2025-11-15,Barbosa - SP,-23.5632118,-46.619612
SP,02/11/2025 - Dia de Finados,Dia de Finados,,2025-11-02,Barbosa - SP,-23.5632118,-46.619612
SP,12/10/2025 - Nossa Senhora Aparecida,Nossa Senhora Aparecida,,2025-10-12,Barbosa - SP,-23.5632118,-46.619612
SP,07/09/2025 - Independência do Brasil,Independência do Brasil,,2025-09-07,Barbosa - SP,-23.5632118,-46.619612
SP,29/08/2025 - Feriado Municipal,Feriado Municipal,,2025-08-29,Barbosa - SP,-23.5632118,-46.619612
SP,09/07/2025 - Revolução Constitucionalista,Revolução Constitucionalista,,2025-07-09,Barbosa - SP,-23.5632118,-46.619612
SP,01/05/2025 - Dia do Trabalho,Dia do Trabalho,,2025-05-01,Barbosa - SP,-23.5632118,-46.619612
SP,21/04/2025 - Dia de Tiradentes,Dia de Tiradentes,,2025-04-21,Barbosa - SP,-23.5632118,-46.619612
SP,18/04/2025 - Sexta-Feira Santa,Sexta-Feira Santa,,2025-04-18,Barbosa - SP,-23.5632118,-46.619612
SP,31/01/2025 - Feriado Municipal,Feriado Municipal,,2025-01-31,Barbosa - SP,-23.5632118,-46.619612
SP,01/01/2025 - Ano Novo,Ano Novo,,2025-01-01,Barbosa - SP,-23.5632118,-46.619612
SP,25/12/2025 - Natal,Natal,,2025-12-25,Borebi - SP,-22.5700178,-48.9714871
SP,15/11/2025 - Proclamação da República,Proclamação da República,,2025-11-15,Borebi - SP,-22.5700178,-48.9714871
SP,02/11/2025 - Dia de Finados,Dia de Finados,,2025-11-02,Borebi - SP,-22.5700178,-48.9714871
SP,12/10/2025 - Nossa Senhora Aparecida,Nossa Senhora Aparecida,,2025-10-12,Borebi - SP,-22.5700178,-48.9714871
SP,07/09/2025 - Independência do Brasil,Independência do Brasil,,2025-09-07,Borebi - SP,-22.5700178,-48.9714871
SP,09/07/2025 - Revolução Constitucionalista,Revolução Constitucionalista,,2025-07-09,Borebi - SP,-22.5700178,-48.9714871
SP,01/05/2025 - Dia do Trabalho,Dia do Trabalho,,2025-05-01,Borebi - SP,-22.5700178,-48.9714871
SP,21/04/2025 - Dia de Tiradentes,Dia de Tiradentes,,2025-04-21,Borebi - SP,-22.5700178,-48.9714871
SP,18/04/2025 - Sexta-Feira Santa,Sexta-Feira Santa,,2025-04-18,Borebi - SP,-22.5700178,-48.9714871
SP,01/01/2025 - Ano Novo,Ano Novo,,2025-01-01,Borebi - SP,-22.5700178,-48.9714871
SP,25/12/2025 - Natal,Natal,,2025-12-25,Bananal - SP,-22.6498963,-44.2845437
SP,20/11/2025 - Dia da Consciência Negra,Dia da Consciência Negra,,2025-11-20,Bananal - SP,-22.6498963,-44.2845437
SP,15/11/2025 - Proclamação da República,Proclamação da República,,2025-11-15,Bananal - SP,-22.6498963,-44.2845437
SP,02/11/2025 - Dia de Finados,Dia de Finados,,2025-11-02,Bananal - SP,-22.6498963,-44.2845437
SP,12/10/2025 - Nossa Senhora Aparecida,Nossa Senhora Aparecida,,2025-10-12,Bananal - SP,-22.6498963,-44.2845437
SP,07/09/2025 - Independência do Brasil,Independência do Brasil,,2025-09-07,Bananal - SP,-22.6498963,-44.2845437
SP,06/08/2025 - Feriado Municipal,Feriado Municipal,,2025-08-06,Bananal - SP,-22.6498963,-44.2845437
SP,10/07/2025 - Feriado Municipal,Feriado Municipal,,2025-07-10,Bananal - SP,-22.6498963,-44.2845437
SP,09/07/2025 - Revolução Constitucionalista,Revolução Constitucionalista,,2025-07-09,Bananal - SP,-22.6498963,-44.2845437
SP,01/05/2025 - Dia do Trabalho,Dia do Trabalho,,2025-05-01,Bananal - SP,-22.6498963,-44.2845437
SP,21/04/2025 - Dia de Tiradentes,Dia de Tiradentes,,2025-04-21,Bananal - SP,-22.6498963,-44.2845437
SP,18/04/2025 - Sexta-Feira Santa,Sexta-Feira Santa,,2025-04-18,Bananal - SP,-22.6498963,-44.2845437
SP,01/01/2025 - Ano Novo,Ano Novo,,2025-01-01,Bananal - SP,-22.6498963,-44.2845437
SP,25/12/2025 - Natal,Natal,,2025-12-25,Botucatu - SP,-22.8762406,-48.4248649
SP,15/11/2025 - Proclamação da República,Proclamação da República,,2025-11-15,Botucatu - SP,-22.8762406,-48.4248649
SP,02/11/2025 - Dia de Finados,Dia de Finados,,2025-11-02,Botucatu - SP,-22.8762406,-48.4248649
SP,12/10/2025 - Nossa Senhora Aparecida,Nossa Senhora Aparecida,,2025-10-12,Botucatu - SP,-22.8762406,-48.4248649
SP,07/09/2025 - Independência do Brasil,Independência do Brasil,,2025-09-07,Botucatu - SP,-22.8762406,-48.4248649
SP,26/07/2025 - Dia de SantAnna,Dia de SantAnna,,2025-07-26,Botucatu - SP,-22.8762406,-48.4248649
SP,09/07/2025 - Revolução Constitucionalista,Revolução Constitucionalista,,2025-07-09,Botucatu - SP,-22.8762406,-48.4248649
SP,19/06/2025 - Corpus Christi,Corpus Christi,,2025-06-19,Botucatu - SP,-22.8762406,-48.4248649
SP,01/05/2025 - Dia do Trabalho,Dia do Trabalho,,2025-05-01,Botucatu - SP,-22.8762406,-48.4248649
SP,21/04/2025 - Dia de Tiradentes,Dia de Tiradentes,,2025-04-21,Botucatu - SP,-22.8762406,-48.4248649
SP,18/04/2025 - Sexta-Feira Santa,Sexta-Feira Santa,,2025-04-18,Botucatu - SP,-22.8762406,-48.4248649
SP,18/04/2025 - Sexta-Feira Santa,Sexta-Feira Santa,,2025-04-18,Botucatu - SP,-22.8762406,-48.4248649
SP,14/04/2025 - Aniversário da Cidade,Aniversário da Cidade,,2025-04-14,Botucatu - SP,-22.8762406,-48.4248649
SP,01/01/2025 - Ano Novo,Ano Novo,,2025-01-01,Botucatu - SP,-22.8762406,-48.4248649
SP,25/12/2025 - Natal,Natal,,2025-12-25,Campos Novos Paulista - SP,-22.601952,-49.998726
SP,15/11/2025 - Proclamação da República,Proclamação da República,,2025-11-15,Campos Novos Paulista - SP,-22.601952,-49.998726
SP,02/11/2025 - Dia de Finados,Dia de Finados,,2025-11-02,Campos Novos Paulista - SP,-22.601952,-49.998726
SP,12/10/2025 - Nossa Senhora Aparecida,Nossa Senhora Aparecida,,2025-10-12,Campos Novos Paulista - SP,-22.601952,-49.998726
SP,07/09/2025 - Independência do Brasil,Independência do Brasil,,2025-09-07,Campos Novos Paulista - SP,-22.601952,-49.998726
SP,09/07/2025 - Revolução Constitucionalista,Revolução Constitucionalista,,2025-07-09,Campos Novos Paulista - SP,-22.601952,-49.998726
SP,24/06/2025 - Feriado Municipal,Feriado Municipal,,2025-06-24,Campos Novos Paulista - SP,-22.601952,-49.998726
SP,01/05/2025 - Dia do Trabalho,Dia do Trabalho,,2025-05-01,Campos Novos Paulista - SP,-22.601952,-49.998726
SP,21/04/2025 - Dia de Tiradentes,Dia de Tiradentes,,2025-04-21,Campos Novos Paulista - SP,-22.601952,-49.998726
SP,18/04/2025 - Sexta-Feira Santa,Sexta-Feira Santa,,2025-04-18,Campos Novos Paulista - SP,-22.601952,-49.998726
SP,19/03/2025 - São José,São José,,2025-03-19,Campos Novos Paulista - SP,-22.601952,-49.998726
SP,10/03/2025 - Feriado Municipal,Feriado Municipal,,2025-03-10,Campos Novos Paulista - SP,-22.601952,-49.998726
SP,01/01/2025 - Ano Novo,Ano Novo,,2025-01-01,Campos Novos Paulista - SP,-22.601952,-49.998726
SP,25/12/2025 - Natal,Natal,,2025-12-25,Campo Limpo Paulista - SP,-23.2132063,-46.7810883
SP,15/11/2025 - Proclamação da República,Proclamação da República,,2025-11-15,Campo Limpo Paulista - SP,-23.2132063,-46.7810883
SP,02/11/2025 - Dia de Finados,Dia de Finados,,2025-11-02,Campo Limpo Paulista - SP,-23.2132063,-46.7810883
SP,12/10/2025 - Nossa Senhora Aparecida,Nossa Senhora Aparecida,,2025-10-12,Campo Limpo Paulista - SP,-23.2132063,-46.7810883
SP,07/10/2025 - Padroeira,Padroeira,,2025-10-07,Campo Limpo Paulista - SP,-23.2132063,-46.7810883
SP,07/09/2025 - Independência do Brasil,Independência do Brasil,,2025-09-07,Campo Limpo Paulista - SP,-23.2132063,-46.7810883
SP,09/07/2025 - Revolução Constitucionalista,Revolução Constitucionalista,,2025-07-09,Campo Limpo Paulista - SP,-23.2132063,-46.7810883
SP,19/06/2025 - Corpus Christi,Corpus Christi,,2025-06-19,Campo Limpo Paulista - SP,-23.2132063,-46.7810883
SP,01/05/2025 - Dia do Trabalho,Dia do Trabalho,,2025-05-01,Campo Limpo Paulista - SP,-23.2132063,-46.7810883
SP,21/04/2025 - Dia de Tiradentes,Dia de Tiradentes,,2025-04-21,Campo Limpo Paulista - SP,-23.2132063,-46.7810883
SP,18/04/2025 - Sexta-feira da Paixão,Sexta-feira da Paixão,,2025-04-18,Campo Limpo Paulista - SP,-23.2132063,-46.7810883
SP,18/04/2025 - Sexta-Feira Santa,Sexta-Feira Santa,,2025-04-18,Campo Limpo Paulista - SP,-23.2132063,-46.7810883
SP,21/03/2025 - Aniversário,Aniversário,,2025-03-21,Campo Limpo Paulista - SP,-23.2132063,-46.7810883
SP,01/01/2025 - Ano Novo,Ano Novo,,2025-01-01,Campo Limpo Paulista - SP,-23.2132063,-46.7810883
SP,25/12/2025 - Natal,Natal,,2025-12-25,Campinas - SP,-22.7964449,-47.1344781
SP,08/12/2025 - N. Sra da Conceição,N. Sra da Conceição,,2025-12-08,Campinas - SP,-22.7964449,-47.1344781
SP,20/11/2025 - Consciência Negra,Consciência Negra,,2025-11-20,Campinas - SP,-22.7964449,-47.1344781
SP,15/11/2025 - Proclamação da República,Proclamação da República,,2025-11-15,Campinas - SP,-22.7964449,-47.1344781
SP,02/11/2025 - Dia de Finados,Dia de Finados,,2025-11-02,Campinas - SP,-22.7964449,-47.1344781
SP,12/10/2025 - Nossa Senhora Aparecida,Nossa Senhora Aparecida,,2025-10-12,Campinas - SP,-22.7964449,-47.1344781
SP,07/09/2025 - Independência do Brasil,Independência do Brasil,,2025-09-07,Campinas - SP,-22.7964449,-47.1344781
SP,09/07/2025 - Revolução Constitucionalista,Revolução Constitucionalista,,2025-07-09,Campinas - SP,-22.7964449,-47.1344781
SP,19/06/2025 - Corpus Christi,Corpus Christi,,2025-06-19,Campinas - SP,-22.7964449,-47.1344781
SP,01/05/2025 - Dia do Trabalho,Dia do Trabalho,,2025-05-01,Campinas - SP,-22.7964449,-47.1344781
SP,21/04/2025 - Dia de Tiradentes,Dia de Tiradentes,,2025-04-21,Campinas - SP,-22.7964449,-47.1344781
SP,18/04/2025 - Sexta-feira Santa,Sexta-feira Santa,,2025-04-18,Campinas - SP,-22.7964449,-47.1344781
SP,18/04/2025 - Sexta-Feira Santa,Sexta-Feira Santa,,2025-04-18,Campinas - SP,-22.7964449,-47.1344781
SP,01/01/2025 - Ano Novo,Ano Novo,,2025-01-01,Campinas - SP,-22.7964449,-47.1344781
SP,25/12/2025 - Natal,Natal,,2025-12-25,Campina do Monte Alegre - SP,-23.5935653,-48.4801876
SP,15/11/2025 - Proclamação da República,Proclamação da República,,2025-11-15,Campina do Monte Alegre - SP,-23.5935653,-48.4801876
SP,02/11/2025 - Dia de Finados,Dia de Finados,,2025-11-02,Campina do Monte Alegre - SP,-23.5935653,-48.4801876
SP,12/10/2025 - Nossa Senhora Aparecida,Nossa Senhora Aparecida,,2025-10-12,Campina do Monte Alegre - SP,-23.5935653,-48.4801876
SP,07/09/2025 - Independência do Brasil,Independência do Brasil,,2025-09-07,Campina do Monte Alegre - SP,-23.5935653,-48.4801876
SP,09/07/2025 - Revolução Constitucionalista,Revolução Constitucionalista,,2025-07-09,Campina do Monte Alegre - SP,-23.5935653,-48.4801876
SP,01/05/2025 - Dia do Trabalho,Dia do Trabalho,,2025-05-01,Campina do Monte Alegre - SP,-23.5935653,-48.4801876
SP,21/04/2025 - Dia de Tiradentes,Dia de Tiradentes,,2025-04-21,Campina do Monte Alegre - SP,-23.5935653,-48.4801876
SP,18/04/2025 - Sexta-Feira Santa,Sexta-Feira Santa,,2025-04-18,Campina do Monte Alegre - SP,-23.5935653,-48.4801876
SP,01/01/2025 - Ano Novo,Ano Novo,,2025-01-01,Campina do Monte Alegre - SP,-23.5935653,-48.4801876
SP,25/12/2025 - Natal,Natal,,2025-12-25,Cajuru - SP,-23.4053003,-47.3828563
SP,15/11/2025 - Proclamação da República,Proclamação da República,,2025-11-15,Cajuru - SP,-23.4053003,-47.3828563
SP,02/11/2025 - Dia de Finados,Dia de Finados,,2025-11-02,Cajuru - SP,-23.4053003,-47.3828563
SP,12/10/2025 - Nossa Senhora Aparecida,Nossa Senhora Aparecida,,2025-10-12,Cajuru - SP,-23.4053003,-47.3828563
SP,07/09/2025 - Independência do Brasil,Independência do Brasil,,2025-09-07,Cajuru - SP,-23.4053003,-47.3828563
SP,18/08/2025 - Aniversário,Aniversário,,2025-08-18,Cajuru - SP,-23.4053003,-47.3828563
SP,11/07/2025 - Padroeiro,Padroeiro,,2025-07-11,Cajuru - SP,-23.4053003,-47.3828563
SP,09/07/2025 - Revolução Constitucionalista,Revolução Constitucionalista,,2025-07-09,Cajuru - SP,-23.4053003,-47.3828563
SP,13/05/2025 - N. Sra. Fátima,N. Sra. Fátima,,2025-05-13,Cajuru - SP,-23.4053003,-47.3828563
SP,01/05/2025 - Dia do Trabalho,Dia do Trabalho,,2025-05-01,Cajuru - SP,-23.4053003,-47.3828563
SP,21/04/2025 - Dia de Tiradentes,Dia de Tiradentes,,2025-04-21,Cajuru - SP,-23.4053003,-47.3828563
SP,18/04/2025 - Sexta-Feira Santa,Sexta-Feira Santa,,2025-04-18,Cajuru - SP,-23.4053003,-47.3828563
SP,20/01/2025 - São Sebastião,São Sebastião,,2025-01-20,Cajuru - SP,-23.4053003,-47.3828563
SP,01/01/2025 - Ano Novo,Ano Novo,,2025-01-01,Cajuru - SP,-23.4053003,-47.3828563
SP,25/12/2025 - Natal,Natal,,2025-12-25,Cajobi - SP,-20.8800101,-48.810427
SP,20/11/2025 - Dia da Consciência Negra,Dia da Consciência Negra,,2025-11-20,Cajobi - SP,-20.8800101,-48.810427
SP,15/11/2025 - Proclamação da República,Proclamação da República,,2025-11-15,Cajobi - SP,-20.8800101,-48.810427
SP,02/11/2025 - Dia de Finados,Dia de Finados,,2025-11-02,Cajobi - SP,-20.8800101,-48.810427
SP,12/10/2025 - Nossa Senhora Aparecida,Nossa Senhora Aparecida,,2025-10-12,Cajobi - SP,-20.8800101,-48.810427
SP,07/09/2025 - Independência do Brasil,Independência do Brasil,,2025-09-07,Cajobi - SP,-20.8800101,-48.810427
SP,15/08/2025 - Feriado Municipal,Feriado Municipal,,2025-08-15,Cajobi - SP,-20.8800101,-48.810427
SP,09/07/2025 - Revolução Constitucionalista,Revolução Constitucionalista,,2025-07-09,Cajobi - SP,-20.8800101,-48.810427
SP,13/05/2025 - Feriado Municipal,Feriado Municipal,,2025-05-13,Cajobi - SP,-20.8800101,-48.810427
SP,01/05/2025 - Dia do Trabalho,Dia do Trabalho,,2025-05-01,Cajobi - SP,-20.8800101,-48.810427
SP,21/04/2025 - Dia de Tiradentes,Dia de Tiradentes,,2025-04-21,Cajobi - SP,-20.8800101,-48.810427
SP,18/04/2025 - Sexta-Feira Santa,Sexta-Feira Santa,,2025-04-18,Cajobi - SP,-20.8800101,-48.810427
SP,01/01/2025 - Ano Novo,Ano Novo,,2025-01-01,Cajobi - SP,-20.8800101,-48.810427
SP,25/12/2025 - Natal,Natal,,2025-12-25,Cajati - SP,-24.7860284,-48.1748457
SP,15/11/2025 - Proclamação da República,Proclamação da República,,2025-11-15,Cajati - SP,-24.7860284,-48.1748457
SP,02/11/2025 - Dia de Finados,Dia de Finados,,2025-11-02,Cajati - SP,-24.7860284,-48.1748457
SP,12/10/2025 - Nossa Senhora Aparecida,Nossa Senhora Aparecida,,2025-10-12,Cajati - SP,-24.7860284,-48.1748457
SP,07/09/2025 - Independência do Brasil,Independência do Brasil,,2025-09-07,Cajati - SP,-24.7860284,-48.1748457
SP,09/07/2025 - Revolução Constitucionalista,Revolução Constitucionalista,,2025-07-09,Cajati - SP,-24.7860284,-48.1748457
SP,13/06/2025 - Dia de Santo Antônio,Dia de Santo Antônio,,2025-06-13,Cajati - SP,-24.7860284,-48.1748457
SP,19/05/2025 - Feriado Municipal,Feriado Municipal,,2025-05-19,Cajati - SP,-24.7860284,-48.1748457
SP,01/05/2025 - Dia do Trabalho,Dia do Trabalho,,2025-05-01,Cajati - SP,-24.7860284,-48.1748457
SP,21/04/2025 - Dia de Tiradentes,Dia de Tiradentes,,2025-04-21,Cajati - SP,-24.7860284,-48.1748457
SP,18/04/2025 - Sexta-Feira Santa,Sexta-Feira Santa,,2025-04-18,Cajati - SP,-24.7860284,-48.1748457
SP,01/01/2025 - Ano Novo,Ano Novo,,2025-01-01,Cajati - SP,-24.7860284,-48.1748457
SP,25/12/2025 - Natal,Natal,,2025-12-25,Cajamar - SP,-23.3108546,-46.9124378
SP,15/11/2025 - Proclamação da República,Proclamação da República,,2025-11-15,Cajamar - SP,-23.3108546,-46.9124378
SP,02/11/2025 - Dia de Finados,Dia de Finados,,2025-11-02,Cajamar - SP,-23.3108546,-46.9124378
SP,12/10/2025 - Nossa Senhora Aparecida,Nossa Senhora Aparecida,,2025-10-12,Cajamar - SP,-23.3108546,-46.9124378
SP,07/09/2025 - Independência do Brasil,Independência do Brasil,,2025-09-07,Cajamar - SP,-23.3108546,-46.9124378
SP,09/07/2025 - Revolução Constitucionalista,Revolução Constitucionalista,,2025-07-09,Cajamar - SP,-23.3108546,-46.9124378
SP,01/05/2025 - Dia do Trabalho,Dia do Trabalho,,2025-05-01,Cajamar - SP,-23.3108546,-46.9124378
SP,21/04/2025 - Dia de Tiradentes,Dia de Tiradentes,,2025-04-21,Cajamar - SP,-23.3108546,-46.9124378
SP,18/04/2025 - Sexta-Feira Santa,Sexta-Feira Santa,,2025-04-18,Cajamar - SP,-23.3108546,-46.9124378
SP,18/02/2025 - Feriado Municipal,Feriado Municipal,,2025-02-18,Cajamar - SP,-23.3108546,-46.9124378
SP,20/01/2025 - Feriado Municipal,Feriado Municipal,,2025-01-20,Cajamar - SP,-23.3108546,-46.9124378
SP,01/01/2025 - Ano Novo,Ano Novo,,2025-01-01,Cajamar - SP,-23.3108546,-46.9124378
SP,25/12/2025 - Natal,Natal,,2025-12-25,Caieiras - SP,-23.3661206,-46.7441311
SP,14/12/2025 - Feriado Municipal,Feriado Municipal,,2025-12-14,Caieiras - SP,-23.3661206,-46.7441311
SP,15/11/2025 - Proclamação da República,Proclamação da República,,2025-11-15,Caieiras - SP,-23.3661206,-46.7441311
SP,02/11/2025 - Dia de Finados,Dia de Finados,,2025-11-02,Caieiras - SP,-23.3661206,-46.7441311
SP,12/10/2025 - Nossa Senhora Aparecida,Nossa Senhora Aparecida,,2025-10-12,Caieiras - SP,-23.3661206,-46.7441311
SP,07/09/2025 - Independência do Brasil,Independência do Brasil,,2025-09-07,Caieiras - SP,-23.3661206,-46.7441311
SP,09/07/2025 - Revolução Constitucionalista,Revolução Constitucionalista,,2025-07-09,Caieiras - SP,-23.3661206,-46.7441311
SP,13/06/2025 - Dia de Santo Antônio,Dia de Santo Antônio,,2025-06-13,Caieiras - SP,-23.3661206,-46.7441311
SP,01/05/2025 - Dia do Trabalho,Dia do Trabalho,,2025-05-01,Caieiras - SP,-23.3661206,-46.7441311
SP,21/04/2025 - Dia de Tiradentes,Dia de Tiradentes,,2025-04-21,Caieiras - SP,-23.3661206,-46.7441311
SP,18/04/2025 - Sexta-Feira Santa,Sexta-Feira Santa,,2025-04-18,Caieiras - SP,-23.3661206,-46.7441311
SP,01/01/2025 - Ano Novo,Ano Novo,,2025-01-01,Caieiras - SP,-23.3661206,-46.7441311
SP,30/12/2025 - Feriado Municipal,Feriado Municipal,,2025-12-30,Caiabu - SP,-22.0147253,-51.2362283
SP,25/12/2025 - Natal,Natal,,2025-12-25,Caiabu - SP,-22.0147253,-51.2362283
SP,08/12/2025 - Feriado Municipal,Feriado Municipal,,2025-12-08,Caiabu - SP,-22.0147253,-51.2362283
SP,15/11/2025 - Proclamação da República,Proclamação da República,,2025-11-15,Caiabu - SP,-22.0147253,-51.2362283
SP,02/11/2025 - Dia de Finados,Dia de Finados,,2025-11-02,Caiabu - SP,-22.0147253,-51.2362283
SP,12/10/2025 - Nossa Senhora Aparecida,Nossa Senhora Aparecida,,2025-10-12,Caiabu - SP,-22.0147253,-51.2362283
SP,07/09/2025 - Independência do Brasil,Independência do Brasil,,2025-09-07,Caiabu - SP,-22.0147253,-51.2362283
SP,09/07/2025 - Revolução Constitucionalista,Revolução Constitucionalista,,2025-07-09,Caiabu - SP,-22.0147253,-51.2362283
SP,13/06/2025 - Dia de Santo Antônio,Dia de Santo Antônio,,2025-06-13,Caiabu - SP,-22.0147253,-51.2362283
SP,01/05/2025 - Dia do Trabalho,Dia do Trabalho,,2025-05-01,Caiabu - SP,-22.0147253,-51.2362283
SP,21/04/2025 - Dia de Tiradentes,Dia de Tiradentes,,2025-04-21,Caiabu - SP,-22.0147253,-51.2362283
SP,18/04/2025 - Sexta-Feira Santa,Sexta-Feira Santa,,2025-04-18,Caiabu - SP,-22.0147253,-51.2362283
SP,01/01/2025 - Ano Novo,Ano Novo,,2025-01-01,Caiabu - SP,-22.0147253,-51.2362283
SP,25/12/2025 - Natal,Natal,,2025-12-25,Caconde - SP,-21.538427,-46.6409078
SP,08/12/2025 - Aniversário da Cidade,Aniversário da Cidade,,2025-12-08,Caconde - SP,-21.538427,-46.6409078
SP,15/11/2025 - Proclamação da República,Proclamação da República,,2025-11-15,Caconde - SP,-21.538427,-46.6409078
SP,02/11/2025 - Dia de Finados,Dia de Finados,,2025-11-02,Caconde - SP,-21.538427,-46.6409078
SP,12/10/2025 - Nossa Senhora Aparecida,Nossa Senhora Aparecida,,2025-10-12,Caconde - SP,-21.538427,-46.6409078
SP,07/09/2025 - Independência do Brasil,Independência do Brasil,,2025-09-07,Caconde - SP,-21.538427,-46.6409078
SP,09/07/2025 - Revolução Constitucionalista,Revolução Constitucionalista,,2025-07-09,Caconde - SP,-21.538427,-46.6409078
SP,19/06/2025 - Corpus Christi,Corpus Christi,,2025-06-19,Caconde - SP,-21.538427,-46.6409078
SP,01/05/2025 - Dia do Trabalho,Dia do Trabalho,,2025-05-01,Caconde - SP,-21.538427,-46.6409078
SP,27/04/2025 - Aniversário Ranieri Mazzilli,Aniversário Ranieri Mazzilli,,2025-04-27,Caconde - SP,-21.538427,-46.6409078
SP,21/04/2025 - Dia de Tiradentes,Dia de Tiradentes,,2025-04-21,Caconde - SP,-21.538427,-46.6409078
SP,18/04/2025 - Sexta-Feira Santa,Sexta-Feira Santa,,2025-04-18,Caconde - SP,-21.538427,-46.6409078
SP,18/04/2025 - Sexta-Feira Santa,Sexta-Feira Santa,,2025-04-18,Caconde - SP,-21.538427,-46.6409078
SP,01/01/2025 - Ano Novo,Ano Novo,,2025-01-01,Caconde - SP,-21.538427,-46.6409078
SP,25/12/2025 - Natal,Natal,,2025-12-25,Cachoeira Paulista - SP,-22.6526264,-45.009685
SP,20/11/2025 - Dia da Consciência Negra,Dia da Consciência Negra,,2025-11-20,Cachoeira Paulista - SP,-22.6526264,-45.009685
SP,15/11/2025 - Proclamação da República,Proclamação da República,,2025-11-15,Cachoeira Paulista - SP,-22.6526264,-45.009685
SP,02/11/2025 - Dia de Finados,Dia de Finados,,2025-11-02,Cachoeira Paulista - SP,-22.6526264,-45.009685
SP,12/10/2025 - Nossa Senhora Aparecida,Nossa Senhora Aparecida,,2025-10-12,Cachoeira Paulista - SP,-22.6526264,-45.009685
SP,07/09/2025 - Independência do Brasil,Independência do Brasil,,2025-09-07,Cachoeira Paulista - SP,-22.6526264,-45.009685
SP,09/07/2025 - Revolução Constitucionalista,Revolução Constitucionalista,,2025-07-09,Cachoeira Paulista - SP,-22.6526264,-45.009685
SP,13/06/2025 - Dia de Santo Antônio,Dia de Santo Antônio,,2025-06-13,Cachoeira Paulista - SP,-22.6526264,-45.009685
SP,01/05/2025 - Dia do Trabalho,Dia do Trabalho,,2025-05-01,Cachoeira Paulista - SP,-22.6526264,-45.009685
SP,21/04/2025 - Dia de Tiradentes,Dia de Tiradentes,,2025-04-21,Cachoeira Paulista - SP,-22.6526264,-45.009685
SP,18/04/2025 - Sexta-Feira Santa,Sexta-Feira Santa,,2025-04-18,Cachoeira Paulista - SP,-22.6526264,-45.009685
SP,09/03/2025 - Feriado Municipal,Feriado Municipal,,2025-03-09,Cachoeira Paulista - SP,-22.6526264,-45.009685
SP,01/01/2025 - Ano Novo,Ano Novo,,2025-01-01,Cachoeira Paulista - SP,-22.6526264,-45.009685
SP,25/12/2025 - Natal,Natal,,2025-12-25,Buritizal - SP,-20.1878541,-47.7075361
SP,15/11/2025 - Proclamação da República,Proclamação da República,,2025-11-15,Buritizal - SP,-20.1878541,-47.7075361
SP,02/11/2025 - Dia de Finados,Dia de Finados,,2025-11-02,Buritizal - SP,-20.1878541,-47.7075361
SP,12/10/2025 - Nossa Senhora Aparecida,Nossa Senhora Aparecida,,2025-10-12,Buritizal - SP,-20.1878541,-47.7075361
SP,08/09/2025 - Feriado Municipal,Feriado Municipal,,2025-09-08,Buritizal - SP,-20.1878541,-47.7075361
SP,07/09/2025 - Independência do Brasil,Independência do Brasil,,2025-09-07,Buritizal - SP,-20.1878541,-47.7075361
SP,28/07/2025 - Feriado Municipal,Feriado Municipal,,2025-07-28,Buritizal - SP,-20.1878541,-47.7075361
SP,09/07/2025 - Revolução Constitucionalista,Revolução Constitucionalista,,2025-07-09,Buritizal - SP,-20.1878541,-47.7075361
SP,01/05/2025 - Dia do Trabalho,Dia do Trabalho,,2025-05-01,Buritizal - SP,-20.1878541,-47.7075361
SP,21/04/2025 - Dia de Tiradentes,Dia de Tiradentes,,2025-04-21,Buritizal - SP,-20.1878541,-47.7075361
SP,18/04/2025 - Sexta-Feira Santa,Sexta-Feira Santa,,2025-04-18,Buritizal - SP,-20.1878541,-47.7075361
SP,01/01/2025 - Ano Novo,Ano Novo,,2025-01-01,Buritizal - SP,-20.1878541,-47.7075361
SP,25/12/2025 - Natal,Natal,,2025-12-25,Buritama - SP,-21.0664017,-50.1448077
SP,08/12/2025 - Feriado Municipal,Feriado Municipal,,2025-12-08,Buritama - SP,-21.0664017,-50.1448077
SP,"20/11/2025 - Dia da Consciência Negra - Lei No. 3.249, de 18 de novembro de 2008",Dia da Consciência Negra,"Lei No. 3.249, de 18 de novembro de 2008",2025-11-20,Buritama - SP,-21.0664017,-50.1448077
SP,15/11/2025 - Proclamação da República,Proclamação da República,,2025-11-15,Buritama - SP,-21.0664017,-50.1448077
SP,02/11/2025 - Dia de Finados,Dia de Finados,,2025-11-02,Buritama - SP,-21.0664017,-50.1448077
SP,12/10/2025 - Nossa Senhora Aparecida,Nossa Senhora Aparecida,,2025-10-12,Buritama - SP,-21.0664017,-50.1448077
SP,07/09/2025 - Independência do Brasil,Independência do Brasil,,2025-09-07,Buritama - SP,-21.0664017,-50.1448077
SP,24/08/2025 - Feriado Municipal,Feriado Municipal,,2025-08-24,Buritama - SP,-21.0664017,-50.1448077
SP,09/07/2025 - Revolução Constitucionalista,Revolução Constitucionalista,,2025-07-09,Buritama - SP,-21.0664017,-50.1448077
SP,01/05/2025 - Dia do Trabalho,Dia do Trabalho,,2025-05-01,Buritama - SP,-21.0664017,-50.1448077
SP,21/04/2025 - Dia de Tiradentes,Dia de Tiradentes,,2025-04-21,Buritama - SP,-21.0664017,-50.1448077
SP,18/04/2025 - Sexta-Feira Santa,Sexta-Feira Santa,,2025-04-18,Buritama - SP,-21.0664017,-50.1448077
SP,01/01/2025 - Ano Novo,Ano Novo,,2025-01-01,Buritama - SP,-21.0664017,-50.1448077
SP,25/12/2025 - Natal,Natal,,2025-12-25,Buri - SP,-23.79849,-48.598924
SP,20/11/2025 - Dia da Consciência Negra,Dia da Consciência Negra,,2025-11-20,Buri - SP,-23.79849,-48.598924
SP,15/11/2025 - Proclamação da República,Proclamação da República,,2025-11-15,Buri - SP,-23.79849,-48.598924
SP,02/11/2025 - Dia de Finados,Dia de Finados,,2025-11-02,Buri - SP,-23.79849,-48.598924
SP,12/10/2025 - Nossa Senhora Aparecida,Nossa Senhora Aparecida,,2025-10-12,Buri - SP,-23.79849,-48.598924
SP,07/09/2025 - Independência do Brasil,Independência do Brasil,,2025-09-07,Buri - SP,-23.79849,-48.598924
SP,16/08/2025 - Feriado Municipal,Feriado Municipal,,2025-08-16,Buri - SP,-23.79849,-48.598924
SP,09/07/2025 - Revolução Constitucionalista,Revolução Constitucionalista,,2025-07-09,Buri - SP,-23.79849,-48.598924
SP,13/06/2025 - Dia de Santo Antônio,Dia de Santo Antônio,,2025-06-13,Buri - SP,-23.79849,-48.598924
SP,01/05/2025 - Dia do Trabalho,Dia do Trabalho,,2025-05-01,Buri - SP,-23.79849,-48.598924
SP,21/04/2025 - Dia de Tiradentes,Dia de Tiradentes,,2025-04-21,Buri - SP,-23.79849,-48.598924
SP,18/04/2025 - Sexta-Feira Santa,Sexta-Feira Santa,,2025-04-18,Buri - SP,-23.79849,-48.598924
SP,25/01/2025 - Feriado Municipal,Feriado Municipal,,2025-01-25,Buri - SP,-23.79849,-48.598924
SP,01/01/2025 - Ano Novo,Ano Novo,,2025-01-01,Buri - SP,-23.79849,-48.598924
SP,25/12/2025 - Natal,Natal,,2025-12-25,Brotas - SP,-22.2840884,-48.1267265
SP,15/11/2025 - Proclamação da República,Proclamação da República,,2025-11-15,Brotas - SP,-22.2840884,-48.1267265
SP,02/11/2025 - Dia de Finados,Dia de Finados,,2025-11-02,Brotas - SP,-22.2840884,-48.1267265
SP,12/10/2025 - Nossa Senhora Aparecida,Nossa Senhora Aparecida,,2025-10-12,Brotas - SP,-22.2840884,-48.1267265
SP,15/09/2025 - Feriado Municipal,Feriado Municipal,,2025-09-15,Brotas - SP,-22.2840884,-48.1267265
SP,07/09/2025 - Independência do Brasil,Independência do Brasil,,2025-09-07,Brotas - SP,-22.2840884,-48.1267265
SP,09/07/2025 - Revolução Constitucionalista,Revolução Constitucionalista,,2025-07-09,Brotas - SP,-22.2840884,-48.1267265
SP,03/05/2025 - Feriado Municipal,Feriado Municipal,,2025-05-03,Brotas - SP,-22.2840884,-48.1267265
SP,01/05/2025 - Dia do Trabalho,Dia do Trabalho,,2025-05-01,Brotas - SP,-22.2840884,-48.1267265
SP,21/04/2025 - Dia de Tiradentes,Dia de Tiradentes,,2025-04-21,Brotas - SP,-22.2840884,-48.1267265
SP,18/04/2025 - Sexta-Feira Santa,Sexta-Feira Santa,,2025-04-18,Brotas - SP,-22.2840884,-48.1267265
SP,01/01/2025 - Ano Novo,Ano Novo,,2025-01-01,Brotas - SP,-22.2840884,-48.1267265
SP,25/12/2025 - Natal,Natal,,2025-12-25,Brodowski - SP,-20.9862299,-47.6578768
SP,08/12/2025 - Feriado Municipal,Feriado Municipal,,2025-12-08,Brodowski - SP,-20.9862299,-47.6578768
SP,15/11/2025 - Proclamação da República,Proclamação da República,,2025-11-15,Brodowski - SP,-20.9862299,-47.6578768
SP,02/11/2025 - Dia de Finados,Dia de Finados,,2025-11-02,Brodowski - SP,-20.9862299,-47.6578768
SP,12/10/2025 - Nossa Senhora Aparecida,Nossa Senhora Aparecida,,2025-10-12,Brodowski - SP,-20.9862299,-47.6578768
SP,07/09/2025 - Independência do Brasil,Independência do Brasil,,2025-09-07,Brodowski - SP,-20.9862299,-47.6578768
SP,22/08/2025 - Feriado Municipal,Feriado Municipal,,2025-08-22,Brodowski - SP,-20.9862299,-47.6578768
SP,09/07/2025 - Revolução Constitucionalista,Revolução Constitucionalista,,2025-07-09,Brodowski - SP,-20.9862299,-47.6578768
SP,01/05/2025 - Dia do Trabalho,Dia do Trabalho,,2025-05-01,Brodowski - SP,-20.9862299,-47.6578768
SP,21/04/2025 - Dia de Tiradentes,Dia de Tiradentes,,2025-04-21,Brodowski - SP,-20.9862299,-47.6578768
SP,18/04/2025 - Sexta-Feira Santa,Sexta-Feira Santa,,2025-04-18,Brodowski - SP,-20.9862299,-47.6578768
SP,01/01/2025 - Ano Novo,Ano Novo,,2025-01-01,Brodowski - SP,-20.9862299,-47.6578768
SP,25/12/2025 - Natal,Natal,,2025-12-25,Brejo Alegre - SP,-21.1671191,-50.1850393
SP,15/11/2025 - Proclamação da República,Proclamação da República,,2025-11-15,Brejo Alegre - SP,-21.1671191,-50.1850393
SP,02/11/2025 - Dia de Finados,Dia de Finados,,2025-11-02,Brejo Alegre - SP,-21.1671191,-50.1850393
SP,12/10/2025 - Nossa Senhora Aparecida,Nossa Senhora Aparecida,,2025-10-12,Brejo Alegre - SP,-21.1671191,-50.1850393
SP,07/09/2025 - Independência do Brasil,Independência do Brasil,,2025-09-07,Brejo Alegre - SP,-21.1671191,-50.1850393
SP,09/07/2025 - Revolução Constitucionalista,Revolução Constitucionalista,,2025-07-09,Brejo Alegre - SP,-21.1671191,-50.1850393
SP,01/05/2025 - Dia do Trabalho,Dia do Trabalho,,2025-05-01,Brejo Alegre - SP,-21.1671191,-50.1850393
SP,21/04/2025 - Dia de Tiradentes,Dia de Tiradentes,,2025-04-21,Brejo Alegre - SP,-21.1671191,-50.1850393
SP,18/04/2025 - Sexta-Feira Santa,Sexta-Feira Santa,,2025-04-18,Brejo Alegre - SP,-21.1671191,-50.1850393
SP,01/01/2025 - Ano Novo,Ano Novo,,2025-01-01,Brejo Alegre - SP,-21.1671191,-50.1850393
SP,25/12/2025 - Natal,Natal,,2025-12-25,Anhembi - SP,-22.7884456,-48.1283641
SP,20/11/2025 - Dia da Consciência Negra,Dia da Consciência Negra,,2025-11-20,Anhembi - SP,-22.7884456,-48.1283641
SP,15/11/2025 - Proclamação da República,Proclamação da República,,2025-11-15,Anhembi - SP,-22.7884456,-48.1283641
SP,02/11/2025 - Dia de Finados,Dia de Finados,,2025-11-02,Anhembi - SP,-22.7884456,-48.1283641
SP,12/10/2025 - Nossa Senhora Aparecida,Nossa Senhora Aparecida,,2025-10-12,Anhembi - SP,-22.7884456,-48.1283641
SP,08/09/2025 - Feriado Municipal,Feriado Municipal,,2025-09-08,Anhembi - SP,-22.7884456,-48.1283641
SP,07/09/2025 - Independência do Brasil,Independência do Brasil,,2025-09-07,Anhembi - SP,-22.7884456,-48.1283641
SP,09/07/2025 - Revolução Constitucionalista,Revolução Constitucionalista,,2025-07-09,Anhembi - SP,-22.7884456,-48.1283641
SP,01/05/2025 - Dia do Trabalho,Dia do Trabalho,,2025-05-01,Anhembi - SP,-22.7884456,-48.1283641
SP,21/04/2025 - Dia de Tiradentes,Dia de Tiradentes,,2025-04-21,Anhembi - SP,-22.7884456,-48.1283641
SP,18/04/2025 - Sexta-Feira Santa,Sexta-Feira Santa,,2025-04-18,Anhembi - SP,-22.7884456,-48.1283641
SP,15/04/2025 - Feriado Municipal,Feriado Municipal,,2025-04-15,Anhembi - SP,-22.7884456,-48.1283641
SP,01/01/2025 - Ano Novo,Ano Novo,,2025-01-01,Anhembi - SP,-22.7884456,-48.1283641
SP,25/12/2025 - Natal,Natal,,2025-12-25,Andradina - SP,-20.8807478,-51.3792328
SP,15/11/2025 - Proclamação da República,Proclamação da República,,2025-11-15,Andradina - SP,-20.8807478,-51.3792328
SP,02/11/2025 - Dia de Finados,Dia de Finados,,2025-11-02,Andradina - SP,-20.8807478,-51.3792328
SP,12/10/2025 - Nossa Senhora Aparecida,Nossa Senhora Aparecida,,2025-10-12,Andradina - SP,-20.8807478,-51.3792328
SP,07/09/2025 - Independência do Brasil,Independência do Brasil,,2025-09-07,Andradina - SP,-20.8807478,-51.3792328
SP,11/07/2025 - Feriado Municipal,Feriado Municipal,,2025-07-11,Andradina - SP,-20.8807478,-51.3792328
SP,09/07/2025 - Revolução Constitucionalista,Revolução Constitucionalista,,2025-07-09,Andradina - SP,-20.8807478,-51.3792328
SP,01/05/2025 - Dia do Trabalho,Dia do Trabalho,,2025-05-01,Andradina - SP,-20.8807478,-51.3792328
SP,21/04/2025 - Dia de Tiradentes,Dia de Tiradentes,,2025-04-21,Andradina - SP,-20.8807478,-51.3792328
SP,18/04/2025 - Sexta-Feira Santa,Sexta-Feira Santa,,2025-04-18,Andradina - SP,-20.8807478,-51.3792328
SP,20/01/2025 - Feriado Municipal,Feriado Municipal,,2025-01-20,Andradina - SP,-20.8807478,-51.3792328
SP,01/01/2025 - Ano Novo,Ano Novo,,2025-01-01,Andradina - SP,-20.8807478,-51.3792328
SP,25/12/2025 - Natal,Natal,,2025-12-25,Amparo - SP,-22.7056672,-46.7528077
SP,20/11/2025 - Dia da Consciência Negra,Dia da Consciência Negra,,2025-11-20,Amparo - SP,-22.7056672,-46.7528077
SP,15/11/2025 - Proclamação da República,Proclamação da República,,2025-11-15,Amparo - SP,-22.7056672,-46.7528077
SP,02/11/2025 - Dia de Finados,Dia de Finados,,2025-11-02,Amparo - SP,-22.7056672,-46.7528077
SP,12/10/2025 - Nossa Senhora Aparecida,Nossa Senhora Aparecida,,2025-10-12,Amparo - SP,-22.7056672,-46.7528077
SP,08/09/2025 - Feriado Municipal,Feriado Municipal,,2025-09-08,Amparo - SP,-22.7056672,-46.7528077
SP,07/09/2025 - Independência do Brasil,Independência do Brasil,,2025-09-07,Amparo - SP,-22.7056672,-46.7528077
SP,09/07/2025 - Revolução Constitucionalista,Revolução Constitucionalista,,2025-07-09,Amparo - SP,-22.7056672,-46.7528077
SP,01/05/2025 - Dia do Trabalho,Dia do Trabalho,,2025-05-01,Amparo - SP,-22.7056672,-46.7528077
SP,21/04/2025 - Dia de Tiradentes,Dia de Tiradentes,,2025-04-21,Amparo - SP,-22.7056672,-46.7528077
SP,18/04/2025 - Sexta-Feira Santa,Sexta-Feira Santa,,2025-04-18,Amparo - SP,-22.7056672,-46.7528077
SP,08/04/2025 - Feriado Municipal,Feriado Municipal,,2025-04-08,Amparo - SP,-22.7056672,-46.7528077
SP,01/01/2025 - Ano Novo,Ano Novo,,2025-01-01,Amparo - SP,-22.7056672,-46.7528077
SP,25/12/2025 - Natal,Natal,,2025-12-25,Americana - SP,-22.7167917,-47.2941442
SP,16/11/2025 - Dia da Consciência Negra,Dia da Consciência Negra,,2025-11-16,Americana - SP,-22.7167917,-47.2941442
SP,15/11/2025 - Proclamação da República,Proclamação da República,,2025-11-15,Americana - SP,-22.7167917,-47.2941442
SP,02/11/2025 - Dia de Finados,Dia de Finados,,2025-11-02,Americana - SP,-22.7167917,-47.2941442
SP,12/10/2025 - Nossa Senhora Aparecida,Nossa Senhora Aparecida,,2025-10-12,Americana - SP,-22.7167917,-47.2941442
SP,07/09/2025 - Independência do Brasil,Independência do Brasil,,2025-09-07,Americana - SP,-22.7167917,-47.2941442
SP,09/07/2025 - Revolução Constitucionalista,Revolução Constitucionalista,,2025-07-09,Americana - SP,-22.7167917,-47.2941442
SP,19/06/2025 - Corpus Christi,Corpus Christi,,2025-06-19,Americana - SP,-22.7167917,-47.2941442
SP,13/06/2025 - Dia de Santo Antônio,Dia de Santo Antônio,,2025-06-13,Americana - SP,-22.7167917,-47.2941442
SP,01/05/2025 - Dia do Trabalho,Dia do Trabalho,,2025-05-01,Americana - SP,-22.7167917,-47.2941442
SP,21/04/2025 - Dia de Tiradentes,Dia de Tiradentes,,2025-04-21,Americana - SP,-22.7167917,-47.2941442
SP,18/04/2025 - Sexta-Feira Santa,Sexta-Feira Santa,,2025-04-18,Americana - SP,-22.7167917,-47.2941442
SP,18/04/2025 - Sexta-Feira Santa,Sexta-Feira Santa,,2025-04-18,Americana - SP,-22.7167917,-47.2941442
SP,01/01/2025 - Ano Novo,Ano Novo,,2025-01-01,Americana - SP,-22.7167917,-47.2941442
SP,25/12/2025 - Natal,Natal,,2025-12-25,Alto Alegre - SP,-21.5820592,-50.1661976
SP,15/11/2025 - Proclamação da República,Proclamação da República,,2025-11-15,Alto Alegre - SP,-21.5820592,-50.1661976
SP,02/11/2025 - Dia de Finados,Dia de Finados,,2025-11-02,Alto Alegre - SP,-21.5820592,-50.1661976
SP,12/10/2025 - Nossa Senhora Aparecida,Nossa Senhora Aparecida,,2025-10-12,Alto Alegre - SP,-21.5820592,-50.1661976
SP,07/09/2025 - Independência do Brasil,Independência do Brasil,,2025-09-07,Alto Alegre - SP,-21.5820592,-50.1661976
SP,15/08/2025 - Feriado Municipal,Feriado Municipal,,2025-08-15,Alto Alegre - SP,-21.5820592,-50.1661976
SP,09/07/2025 - Revolução Constitucionalista,Revolução Constitucionalista,,2025-07-09,Alto Alegre - SP,-21.5820592,-50.1661976
SP,24/06/2025 - Feriado Municipal,Feriado Municipal,,2025-06-24,Alto Alegre - SP,-21.5820592,-50.1661976
SP,01/05/2025 - Dia do Trabalho,Dia do Trabalho,,2025-05-01,Alto Alegre - SP,-21.5820592,-50.1661976
SP,21/04/2025 - Dia de Tiradentes,Dia de Tiradentes,,2025-04-21,Alto Alegre - SP,-21.5820592,-50.1661976
SP,18/04/2025 - Sexta-Feira Santa,Sexta-Feira Santa,,2025-04-18,Alto Alegre - SP,-21.5820592,-50.1661976
SP,01/01/2025 - Ano Novo,Ano Novo,,2025-01-01,Alto Alegre - SP,-21.5820592,-50.1661976
SP,31/12/2025 - Feriado Municipal,Feriado Municipal,,2025-12-31,Altair - SP,-20.5238955,-49.0606135
SP,25/12/2025 - Natal,Natal,,2025-12-25,Altair - SP,-20.5238955,-49.0606135
SP,08/12/2025 - Feriado Municipal,Feriado Municipal,,2025-12-08,Altair - SP,-20.5238955,-49.0606135
SP,20/11/2025 - Dia da Consciência Negra,Dia da Consciência Negra,,2025-11-20,Altair - SP,-20.5238955,-49.0606135
SP,15/11/2025 - Proclamação da República,Proclamação da República,,2025-11-15,Altair - SP,-20.5238955,-49.0606135
SP,02/11/2025 - Dia de Finados,Dia de Finados,,2025-11-02,Altair - SP,-20.5238955,-49.0606135
SP,12/10/2025 - Nossa Senhora Aparecida,Nossa Senhora Aparecida,,2025-10-12,Altair - SP,-20.5238955,-49.0606135
SP,07/09/2025 - Independência do Brasil,Independência do Brasil,,2025-09-07,Altair - SP,-20.5238955,-49.0606135
SP,09/07/2025 - Revolução Constitucionalista,Revolução Constitucionalista,,2025-07-09,Altair - SP,-20.5238955,-49.0606135
SP,01/05/2025 - Dia do Trabalho,Dia do Trabalho,,2025-05-01,Altair - SP,-20.5238955,-49.0606135
SP,21/04/2025 - Dia de Tiradentes,Dia de Tiradentes,,2025-04-21,Altair - SP,-20.5238955,-49.0606135
SP,18/04/2025 - Sexta-Feira Santa,Sexta-Feira Santa,,2025-04-18,Altair - SP,-20.5238955,-49.0606135
SP,20/01/2025 - Feriado Municipal,Feriado Municipal,,2025-01-20,Altair - SP,-20.5238955,-49.0606135
SP,01/01/2025 - Ano Novo,Ano Novo,,2025-01-01,Altair - SP,-20.5238955,-49.0606135
SP,25/12/2025 - Natal,Natal,,2025-12-25,Alfredo Marcondes - SP,-21.9527,-51.413956
SP,24/12/2025 - Feriado Municipal,Feriado Municipal,,2025-12-24,Alfredo Marcondes - SP,-21.9527,-51.413956
SP,20/11/2025 - Dia da Consciência Negra,Dia da Consciência Negra,,2025-11-20,Alfredo Marcondes - SP,-21.9527,-51.413956
SP,15/11/2025 - Proclamação da República,Proclamação da República,,2025-11-15,Alfredo Marcondes - SP,-21.9527,-51.413956
SP,02/11/2025 - Dia de Finados,Dia de Finados,,2025-11-02,Alfredo Marcondes - SP,-21.9527,-51.413956
SP,12/10/2025 - Nossa Senhora Aparecida,Nossa Senhora Aparecida,,2025-10-12,Alfredo Marcondes - SP,-21.9527,-51.413956
SP,07/09/2025 - Independência do Brasil,Independência do Brasil,,2025-09-07,Alfredo Marcondes - SP,-21.9527,-51.413956
SP,09/07/2025 - Revolução Constitucionalista,Revolução Constitucionalista,,2025-07-09,Alfredo Marcondes - SP,-21.9527,-51.413956
SP,01/05/2025 - Dia do Trabalho,Dia do Trabalho,,2025-05-01,Alfredo Marcondes - SP,-21.9527,-51.413956
SP,21/04/2025 - Dia de Tiradentes,Dia de Tiradentes,,2025-04-21,Alfredo Marcondes - SP,-21.9527,-51.413956
SP,18/04/2025 - Sexta-Feira Santa,Sexta-Feira Santa,,2025-04-18,Alfredo Marcondes - SP,-21.9527,-51.413956
SP,04/04/2025 - Feriado Municipal,Feriado Municipal,,2025-04-04,Alfredo Marcondes - SP,-21.9527,-51.413956
SP,01/01/2025 - Ano Novo,Ano Novo,,2025-01-01,Alfredo Marcondes - SP,-21.9527,-51.413956
SP,25/12/2025 - Natal,Natal,,2025-12-25,Alambari - SP,-23.5652776,-47.8877966
SP,15/11/2025 - Proclamação da República,Proclamação da República,,2025-11-15,Alambari - SP,-23.5652776,-47.8877966
SP,02/11/2025 - Dia de Finados,Dia de Finados,,2025-11-02,Alambari - SP,-23.5652776,-47.8877966
SP,12/10/2025 - Nossa Senhora Aparecida,Nossa Senhora Aparecida,,2025-10-12,Alambari - SP,-23.5652776,-47.8877966
SP,07/09/2025 - Independência do Brasil,Independência do Brasil,,2025-09-07,Alambari - SP,-23.5652776,-47.8877966
SP,09/07/2025 - Revolução Constitucionalista,Revolução Constitucionalista,,2025-07-09,Alambari - SP,-23.5652776,-47.8877966
SP,01/05/2025 - Dia do Trabalho,Dia do Trabalho,,2025-05-01,Alambari - SP,-23.5652776,-47.8877966
SP,21/04/2025 - Dia de Tiradentes,Dia de Tiradentes,,2025-04-21,Alambari - SP,-23.5652776,-47.8877966
SP,18/04/2025 - Sexta-Feira Santa,Sexta-Feira Santa,,2025-04-18,Alambari - SP,-23.5652776,-47.8877966
SP,01/01/2025 - Ano Novo,Ano Novo,,2025-01-01,Alambari - SP,-23.5652776,-47.8877966
SP,25/12/2025 - Natal,Natal,,2025-12-25,Agudos - SP,-22.4719836,-48.9884476
SP,15/11/2025 - Proclamação da República,Proclamação da República,,2025-11-15,Agudos - SP,-22.4719836,-48.9884476
SP,02/11/2025 - Dia de Finados,Dia de Finados,,2025-11-02,Agudos - SP,-22.4719836,-48.9884476
SP,12/10/2025 - Nossa Senhora Aparecida,Nossa Senhora Aparecida,,2025-10-12,Agudos - SP,-22.4719836,-48.9884476
SP,07/09/2025 - Independência do Brasil,Independência do Brasil,,2025-09-07,Agudos - SP,-22.4719836,-48.9884476
SP,27/07/2025 - Feriado Municipal,Feriado Municipal,,2025-07-27,Agudos - SP,-22.4719836,-48.9884476
SP,09/07/2025 - Revolução Constitucionalista,Revolução Constitucionalista,,2025-07-09,Agudos - SP,-22.4719836,-48.9884476
SP,01/05/2025 - Dia do Trabalho,Dia do Trabalho,,2025-05-01,Agudos - SP,-22.4719836,-48.9884476
SP,21/04/2025 - Dia de Tiradentes,Dia de Tiradentes,,2025-04-21,Agudos - SP,-22.4719836,-48.9884476
SP,18/04/2025 - Sexta-Feira Santa,Sexta-Feira Santa,,2025-04-18,Agudos - SP,-22.4719836,-48.9884476
SP,01/01/2025 - Ano Novo,Ano Novo,,2025-01-01,Agudos - SP,-22.4719836,-48.9884476
SP,25/12/2025 - Natal,Natal,,2025-12-25,Adolfo - SP,-21.2356597,-49.6441918
SP,30/11/2025 - Feriado Municipal,Feriado Municipal,,2025-11-30,Adolfo - SP,-21.2356597,-49.6441918
SP,15/11/2025 - Proclamação da República,Proclamação da República,,2025-11-15,Adolfo - SP,-21.2356597,-49.6441918
SP,02/11/2025 - Dia de Finados,Dia de Finados,,2025-11-02,Adolfo - SP,-21.2356597,-49.6441918
SP,12/10/2025 - Nossa Senhora Aparecida,Nossa Senhora Aparecida,,2025-10-12,Adolfo - SP,-21.2356597,-49.6441918
SP,07/09/2025 - Independência do Brasil,Independência do Brasil,,2025-09-07,Adolfo - SP,-21.2356597,-49.6441918
SP,09/07/2025 - Revolução Constitucionalista,Revolução Constitucionalista,,2025-07-09,Adolfo - SP,-21.2356597,-49.6441918
SP,01/05/2025 - Dia do Trabalho,Dia do Trabalho,,2025-05-01,Adolfo - SP,-21.2356597,-49.6441918
SP,21/04/2025 - Dia de Tiradentes,Dia de Tiradentes,,2025-04-21,Adolfo - SP,-21.2356597,-49.6441918
SP,18/04/2025 - Sexta-Feira Santa,Sexta-Feira Santa,,2025-04-18,Adolfo - SP,-21.2356597,-49.6441918
SP,19/03/2025 - São José,São José,,2025-03-19,Adolfo - SP,-21.2356597,-49.6441918
SP,01/01/2025 - Ano Novo,Ano Novo,,2025-01-01,Adolfo - SP,-21.2356597,-49.6441918
SP,25/12/2025 - Natal,Natal,,2025-12-25,Adamantina - SP,-21.7703112,-50.9614994
SP,08/12/2025 - Feriado Municipal,Feriado Municipal,,2025-12-08,Adamantina - SP,-21.7703112,-50.9614994
SP,15/11/2025 - Proclamação da República,Proclamação da República,,2025-11-15,Adamantina - SP,-21.7703112,-50.9614994
SP,02/11/2025 - Dia de Finados,Dia de Finados,,2025-11-02,Adamantina - SP,-21.7703112,-50.9614994
SP,12/10/2025 - Nossa Senhora Aparecida,Nossa Senhora Aparecida,,2025-10-12,Adamantina - SP,-21.7703112,-50.9614994
SP,07/09/2025 - Independência do Brasil,Independência do Brasil,,2025-09-07,Adamantina - SP,-21.7703112,-50.9614994
SP,09/07/2025 - Revolução Constitucionalista,Revolução Constitucionalista,,2025-07-09,Adamantina - SP,-21.7703112,-50.9614994
SP,13/06/2025 - Dia de Santo Antônio,Dia de Santo Antônio,,2025-06-13,Adamantina - SP,-21.7703112,-50.9614994
SP,01/05/2025 - Dia do Trabalho,Dia do Trabalho,,2025-05-01,Adamantina - SP,-21.7703112,-50.9614994
SP,21/04/2025 - Dia de Tiradentes,Dia de Tiradentes,,2025-04-21,Adamantina - SP,-21.7703112,-50.9614994
SP,18/04/2025 - Sexta-Feira Santa,Sexta-Feira Santa,,2025-04-18,Adamantina - SP,-21.7703112,-50.9614994
SP,01/01/2025 - Ano Novo,Ano Novo,,2025-01-01,Adamantina - SP,-21.7703112,-50.9614994
SP,25/12/2025 - Natal,Natal,,2025-12-25,Angatuba - SP,-23.5018499,-48.4089141
SP,15/11/2025 - Proclamação da República,Proclamação da República,,2025-11-15,Angatuba - SP,-23.5018499,-48.4089141
SP,02/11/2025 - Dia de Finados,Dia de Finados,,2025-11-02,Angatuba - SP,-23.5018499,-48.4089141
SP,12/10/2025 - Nossa Senhora Aparecida,Nossa Senhora Aparecida,,2025-10-12,Angatuba - SP,-23.5018499,-48.4089141
SP,07/09/2025 - Independência do Brasil,Independência do Brasil,,2025-09-07,Angatuba - SP,-23.5018499,-48.4089141
SP,09/07/2025 - Revolução Constitucionalista,Revolução Constitucionalista,,2025-07-09,Angatuba - SP,-23.5018499,-48.4089141
SP,01/05/2025 - Dia do Trabalho,Dia do Trabalho,,2025-05-01,Angatuba - SP,-23.5018499,-48.4089141
SP,21/04/2025 - Dia de Tiradentes,Dia de Tiradentes,,2025-04-21,Angatuba - SP,-23.5018499,-48.4089141
SP,18/04/2025 - Sexta-Feira Santa,Sexta-Feira Santa,,2025-04-18,Angatuba - SP,-23.5018499,-48.4089141
SP,11/03/2025 - Feriado Municipal,Feriado Municipal,,2025-03-11,Angatuba - SP,-23.5018499,-48.4089141
SP,01/01/2025 - Ano Novo,Ano Novo,,2025-01-01,Angatuba - SP,-23.5018499,-48.4089141
SP,25/12/2025 - Natal,Natal,,2025-12-25,Anhumas - SP,-22.2960422,-51.3836845
SP,13/12/2025 - Feriado Municipal,Feriado Municipal,,2025-12-13,Anhumas - SP,-22.2960422,-51.3836845
SP,15/11/2025 - Proclamação da República,Proclamação da República,,2025-11-15,Anhumas - SP,-22.2960422,-51.3836845
SP,02/11/2025 - Dia de Finados,Dia de Finados,,2025-11-02,Anhumas - SP,-22.2960422,-51.3836845
SP,12/10/2025 - Nossa Senhora Aparecida,Nossa Senhora Aparecida,,2025-10-12,Anhumas - SP,-22.2960422,-51.3836845
SP,07/09/2025 - Independência do Brasil,Independência do Brasil,,2025-09-07,Anhumas - SP,-22.2960422,-51.3836845
SP,06/08/2025 - Feriado Municipal,Feriado Municipal,,2025-08-06,Anhumas - SP,-22.2960422,-51.3836845
SP,09/07/2025 - Revolução Constitucionalista,Revolução Constitucionalista,,2025-07-09,Anhumas - SP,-22.2960422,-51.3836845
SP,01/05/2025 - Dia do Trabalho,Dia do Trabalho,,2025-05-01,Anhumas - SP,-22.2960422,-51.3836845
SP,21/04/2025 - Dia de Tiradentes,Dia de Tiradentes,,2025-04-21,Anhumas - SP,-22.2960422,-51.3836845
SP,18/04/2025 - Sexta-Feira Santa,Sexta-Feira Santa,,2025-04-18,Anhumas - SP,-22.2960422,-51.3836845
SP,01/01/2025 - Ano Novo,Ano Novo,,2025-01-01,Anhumas - SP,-22.2960422,-51.3836845
SP,25/12/2025 - Natal,Natal,,2025-12-25,Balbinos - SP,-21.9006253,-49.3583966
SP,08/12/2025 - Feriado Municipal,Feriado Municipal,,2025-12-08,Balbinos - SP,-21.9006253,-49.3583966
SP,15/11/2025 - Proclamação da República,Proclamação da República,,2025-11-15,Balbinos - SP,-21.9006253,-49.3583966
SP,02/11/2025 - Dia de Finados,Dia de Finados,,2025-11-02,Balbinos - SP,-21.9006253,-49.3583966
SP,12/10/2025 - Nossa Senhora Aparecida,Nossa Senhora Aparecida,,2025-10-12,Balbinos - SP,-21.9006253,-49.3583966
SP,07/09/2025 - Independência do Brasil,Independência do Brasil,,2025-09-07,Balbinos - SP,-21.9006253,-49.3583966
SP,09/07/2025 - Revolução Constitucionalista,Revolução Constitucionalista,,2025-07-09,Balbinos - SP,-21.9006253,-49.3583966
SP,24/06/2025 - Feriado Municipal,Feriado Municipal,,2025-06-24,Balbinos - SP,-21.9006253,-49.3583966
SP,01/05/2025 - Dia do Trabalho,Dia do Trabalho,,2025-05-01,Balbinos - SP,-21.9006253,-49.3583966
SP,21/04/2025 - Dia de Tiradentes,Dia de Tiradentes,,2025-04-21,Balbinos - SP,-21.9006253,-49.3583966
SP,18/04/2025 - Sexta-Feira Santa,Sexta-Feira Santa,,2025-04-18,Balbinos - SP,-21.9006253,-49.3583966
SP,01/01/2025 - Ano Novo,Ano Novo,,2025-01-01,Balbinos - SP,-21.9006253,-49.3583966
SP,25/12/2025 - Natal,Natal,,2025-12-25,Aparecida - SP,-23.0320991,-47.1218206
SP,17/12/2025 - Feriado Municipal,Feriado Municipal,,2025-12-17,Aparecida - SP,-23.0320991,-47.1218206
SP,20/11/2025 - Dia da Consciência Negra,Dia da Consciência Negra,,2025-11-20,Aparecida - SP,-23.0320991,-47.1218206
SP,15/11/2025 - Proclamação da República,Proclamação da República,,2025-11-15,Aparecida - SP,-23.0320991,-47.1218206
SP,02/11/2025 - Dia de Finados,Dia de Finados,,2025-11-02,Aparecida - SP,-23.0320991,-47.1218206
SP,12/10/2025 - Nossa Senhora Aparecida,Nossa Senhora Aparecida,,2025-10-12,Aparecida - SP,-23.0320991,-47.1218206
SP,07/09/2025 - Independência do Brasil,Independência do Brasil,,2025-09-07,Aparecida - SP,-23.0320991,-47.1218206
SP,09/07/2025 - Revolução Constitucionalista,Revolução Constitucionalista,,2025-07-09,Aparecida - SP,-23.0320991,-47.1218206
SP,01/05/2025 - Dia do Trabalho,Dia do Trabalho,,2025-05-01,Aparecida - SP,-23.0320991,-47.1218206
SP,21/04/2025 - Dia de Tiradentes,Dia de Tiradentes,,2025-04-21,Aparecida - SP,-23.0320991,-47.1218206
SP,18/04/2025 - Sexta-Feira Santa,Sexta-Feira Santa,,2025-04-18,Aparecida - SP,-23.0320991,-47.1218206
SP,01/01/2025 - Ano Novo,Ano Novo,,2025-01-01,Aparecida - SP,-23.0320991,-47.1218206
SP,25/12/2025 - Natal,Natal,,2025-12-25,Bady Bassitt - SP,-20.8872413,-49.4368354
SP,08/12/2025 - Feriado Municipal,Feriado Municipal,,2025-12-08,Bady Bassitt - SP,-20.8872413,-49.4368354
SP,15/11/2025 - Proclamação da República,Proclamação da República,,2025-11-15,Bady Bassitt - SP,-20.8872413,-49.4368354
SP,02/11/2025 - Dia de Finados,Dia de Finados,,2025-11-02,Bady Bassitt - SP,-20.8872413,-49.4368354
SP,12/10/2025 - Nossa Senhora Aparecida,Nossa Senhora Aparecida,,2025-10-12,Bady Bassitt - SP,-20.8872413,-49.4368354
SP,07/09/2025 - Independência do Brasil,Independência do Brasil,,2025-09-07,Bady Bassitt - SP,-20.8872413,-49.4368354
SP,09/07/2025 - Revolução Constitucionalista,Revolução Constitucionalista,,2025-07-09,Bady Bassitt - SP,-20.8872413,-49.4368354
SP,01/05/2025 - Dia do Trabalho,Dia do Trabalho,,2025-05-01,Bady Bassitt - SP,-20.8872413,-49.4368354
SP,21/04/2025 - Dia de Tiradentes,Dia de Tiradentes,,2025-04-21,Bady Bassitt - SP,-20.8872413,-49.4368354
SP,18/04/2025 - Sexta-Feira Santa,Sexta-Feira Santa,,2025-04-18,Bady Bassitt - SP,-20.8872413,-49.4368354
SP,18/02/2025 - Feriado Municipal,Feriado Municipal,,2025-02-18,Bady Bassitt - SP,-20.8872413,-49.4368354
SP,20/01/2025 - Feriado Municipal,Feriado Municipal,,2025-01-20,Bady Bassitt - SP,-20.8872413,-49.4368354
SP,01/01/2025 - Ano Novo,Ano Novo,,2025-01-01,Bady Bassitt - SP,-20.8872413,-49.4368354
SP,29/12/2025 - Feriado Municipal,Feriado Municipal,,2025-12-29,Avanhandava - SP,-23.5500638,-46.6449722
SP,25/12/2025 - Natal,Natal,,2025-12-25,Avanhandava - SP,-23.5500638,-46.6449722
SP,13/12/2025 - Feriado Municipal,Feriado Municipal,,2025-12-13,Avanhandava - SP,-23.5500638,-46.6449722
SP,15/11/2025 - Proclamação da República,Proclamação da República,,2025-11-15,Avanhandava - SP,-23.5500638,-46.6449722
SP,02/11/2025 - Dia de Finados,Dia de Finados,,2025-11-02,Avanhandava - SP,-23.5500638,-46.6449722
SP,12/10/2025 - Nossa Senhora Aparecida,Nossa Senhora Aparecida,,2025-10-12,Avanhandava - SP,-23.5500638,-46.6449722
SP,07/09/2025 - Independência do Brasil,Independência do Brasil,,2025-09-07,Avanhandava - SP,-23.5500638,-46.6449722
SP,09/07/2025 - Revolução Constitucionalista,Revolução Constitucionalista,,2025-07-09,Avanhandava - SP,-23.5500638,-46.6449722
SP,01/05/2025 - Dia do Trabalho,Dia do Trabalho,,2025-05-01,Avanhandava - SP,-23.5500638,-46.6449722
SP,21/04/2025 - Dia de Tiradentes,Dia de Tiradentes,,2025-04-21,Avanhandava - SP,-23.5500638,-46.6449722
SP,18/04/2025 - Sexta-Feira Santa,Sexta-Feira Santa,,2025-04-18,Avanhandava - SP,-23.5500638,-46.6449722
SP,01/01/2025 - Ano Novo,Ano Novo,,2025-01-01,Avanhandava - SP,-23.5500638,-46.6449722
SP,25/12/2025 - Natal,Natal,,2025-12-25,Auriflama - SP,-20.6877142,-50.5523887
SP,20/11/2025 - Dia da Consciência Negra,Dia da Consciência Negra,,2025-11-20,Auriflama - SP,-20.6877142,-50.5523887
SP,15/11/2025 - Proclamação da República,Proclamação da República,,2025-11-15,Auriflama - SP,-20.6877142,-50.5523887
SP,02/11/2025 - Dia de Finados,Dia de Finados,,2025-11-02,Auriflama - SP,-20.6877142,-50.5523887
SP,12/10/2025 - Nossa Senhora Aparecida,Nossa Senhora Aparecida,,2025-10-12,Auriflama - SP,-20.6877142,-50.5523887
SP,07/09/2025 - Independência do Brasil,Independência do Brasil,,2025-09-07,Auriflama - SP,-20.6877142,-50.5523887
SP,09/07/2025 - Revolução Constitucionalista,Revolução Constitucionalista,,2025-07-09,Auriflama - SP,-20.6877142,-50.5523887
SP,01/05/2025 - Dia do Trabalho,Dia do Trabalho,,2025-05-01,Auriflama - SP,-20.6877142,-50.5523887
SP,21/04/2025 - Dia de Tiradentes,Dia de Tiradentes,,2025-04-21,Auriflama - SP,-20.6877142,-50.5523887
SP,18/04/2025 - Sexta-Feira Santa,Sexta-Feira Santa,,2025-04-18,Auriflama - SP,-20.6877142,-50.5523887
SP,01/01/2025 - Ano Novo,Ano Novo,,2025-01-01,Auriflama - SP,-20.6877142,-50.5523887
SP,25/12/2025 - Natal,Natal,,2025-12-25,Atibaia - SP,-23.1604764,-46.584771
SP,15/11/2025 - Proclamação da República,Proclamação da República,,2025-11-15,Atibaia - SP,-23.1604764,-46.584771
SP,02/11/2025 - Finados,Finados,,2025-11-02,Atibaia - SP,-23.1604764,-46.584771
SP,02/11/2025 - Dia de Finados,Dia de Finados,,2025-11-02,Atibaia - SP,-23.1604764,-46.584771
SP,12/10/2025 - Nossa Senhora Aparecida,Nossa Senhora Aparecida,,2025-10-12,Atibaia - SP,-23.1604764,-46.584771
SP,07/09/2025 - Independência do Brasil,Independência do Brasil,,2025-09-07,Atibaia - SP,-23.1604764,-46.584771
SP,09/07/2025 - Revolução Constitucionalista,Revolução Constitucionalista,,2025-07-09,Atibaia - SP,-23.1604764,-46.584771
SP,24/06/2025 - Aniversário da Cidade,Aniversário da Cidade,,2025-06-24,Atibaia - SP,-23.1604764,-46.584771
SP,19/06/2025 - Corpus Christi,Corpus Christi,,2025-06-19,Atibaia - SP,-23.1604764,-46.584771
SP,01/05/2025 - Dia do Trabalho,Dia do Trabalho,,2025-05-01,Atibaia - SP,-23.1604764,-46.584771
SP,21/04/2025 - Dia de Tiradentes,Dia de Tiradentes,,2025-04-21,Atibaia - SP,-23.1604764,-46.584771
SP,18/04/2025 - Sexta-Feira Santa,Sexta-Feira Santa,,2025-04-18,Atibaia - SP,-23.1604764,-46.584771
SP,18/04/2025 - Sexta-Feira Santa,Sexta-Feira Santa,,2025-04-18,Atibaia - SP,-23.1604764,-46.584771
SP,01/01/2025 - Ano Novo,Ano Novo,,2025-01-01,Atibaia - SP,-23.1604764,-46.584771
SP,25/12/2025 - Natal,Natal,,2025-12-25,Assis - SP,-22.6366928,-50.4030114
SP,15/11/2025 - Proclamação da República,Proclamação da República,,2025-11-15,Assis - SP,-22.6366928,-50.4030114
SP,02/11/2025 - Dia de Finados,Dia de Finados,,2025-11-02,Assis - SP,-22.6366928,-50.4030114
SP,12/10/2025 - Nossa Senhora Aparecida,Nossa Senhora Aparecida,,2025-10-12,Assis - SP,-22.6366928,-50.4030114
SP,07/09/2025 - Independência do Brasil,Independência do Brasil,,2025-09-07,Assis - SP,-22.6366928,-50.4030114
SP,09/07/2025 - Revolução Constitucionalista,Revolução Constitucionalista,,2025-07-09,Assis - SP,-22.6366928,-50.4030114
SP,01/07/2025 - Feriado Municipal,Feriado Municipal,,2025-07-01,Assis - SP,-22.6366928,-50.4030114
SP,01/05/2025 - Dia do Trabalho,Dia do Trabalho,,2025-05-01,Assis - SP,-22.6366928,-50.4030114
SP,21/04/2025 - Dia de Tiradentes,Dia de Tiradentes,,2025-04-21,Assis - SP,-22.6366928,-50.4030114
SP,18/04/2025 - Sexta-Feira Santa,Sexta-Feira Santa,,2025-04-18,Assis - SP,-22.6366928,-50.4030114
SP,01/01/2025 - Ano Novo,Ano Novo,,2025-01-01,Assis - SP,-22.6366928,-50.4030114
SP,25/12/2025 - Natal,Natal,,2025-12-25,Artur Nogueira - SP,-22.5737108,-47.1729018
SP,15/11/2025 - Proclamação da República,Proclamação da República,,2025-11-15,Artur Nogueira - SP,-22.5737108,-47.1729018
SP,02/11/2025 - Dia de Finados,Dia de Finados,,2025-11-02,Artur Nogueira - SP,-22.5737108,-47.1729018
SP,12/10/2025 - Nossa Senhora Aparecida,Nossa Senhora Aparecida,,2025-10-12,Artur Nogueira - SP,-22.5737108,-47.1729018
SP,15/09/2025 - Feriado Municipal,Feriado Municipal,,2025-09-15,Artur Nogueira - SP,-22.5737108,-47.1729018
SP,07/09/2025 - Independência do Brasil,Independência do Brasil,,2025-09-07,Artur Nogueira - SP,-22.5737108,-47.1729018
SP,09/07/2025 - Revolução Constitucionalista,Revolução Constitucionalista,,2025-07-09,Artur Nogueira - SP,-22.5737108,-47.1729018
SP,01/05/2025 - Dia do Trabalho,Dia do Trabalho,,2025-05-01,Artur Nogueira - SP,-22.5737108,-47.1729018
SP,21/04/2025 - Dia de Tiradentes,Dia de Tiradentes,,2025-04-21,Artur Nogueira - SP,-22.5737108,-47.1729018
SP,18/04/2025 - Sexta-Feira Santa,Sexta-Feira Santa,,2025-04-18,Artur Nogueira - SP,-22.5737108,-47.1729018
SP,10/04/2025 - Feriado Municipal,Feriado Municipal,,2025-04-10,Artur Nogueira - SP,-22.5737108,-47.1729018
SP,01/01/2025 - Ano Novo,Ano Novo,,2025-01-01,Artur Nogueira - SP,-22.5737108,-47.1729018
SP,25/12/2025 - Natal,Natal,,2025-12-25,Ariranha - SP,-21.18716,-48.790418
SP,15/11/2025 - Proclamação da República,Proclamação da República,,2025-11-15,Ariranha - SP,-21.18716,-48.790418
SP,02/11/2025 - Dia de Finados,Dia de Finados,,2025-11-02,Ariranha - SP,-21.18716,-48.790418
SP,12/10/2025 - Nossa Senhora Aparecida,Nossa Senhora Aparecida,,2025-10-12,Ariranha - SP,-21.18716,-48.790418
SP,07/09/2025 - Independência do Brasil,Independência do Brasil,,2025-09-07,Ariranha - SP,-21.18716,-48.790418
SP,09/07/2025 - Revolução Constitucionalista,Revolução Constitucionalista,,2025-07-09,Ariranha - SP,-21.18716,-48.790418
SP,24/06/2025 - Feriado Municipal,Feriado Municipal,,2025-06-24,Ariranha - SP,-21.18716,-48.790418
SP,01/05/2025 - Dia do Trabalho,Dia do Trabalho,,2025-05-01,Ariranha - SP,-21.18716,-48.790418
SP,21/04/2025 - Dia de Tiradentes,Dia de Tiradentes,,2025-04-21,Ariranha - SP,-21.18716,-48.790418
SP,18/04/2025 - Sexta-Feira Santa,Sexta-Feira Santa,,2025-04-18,Ariranha - SP,-21.18716,-48.790418
SP,10/04/2025 - Feriado Municipal,Feriado Municipal,,2025-04-10,Ariranha - SP,-21.18716,-48.790418
SP,01/01/2025 - Ano Novo,Ano Novo,,2025-01-01,Ariranha - SP,-21.18716,-48.790418
SP,25/12/2025 - Natal,Natal,,2025-12-25,Areias - SP,-22.5800929,-44.6975127
SP,15/11/2025 - Proclamação da República,Proclamação da República,,2025-11-15,Areias - SP,-22.5800929,-44.6975127
SP,02/11/2025 - Dia de Finados,Dia de Finados,,2025-11-02,Areias - SP,-22.5800929,-44.6975127
SP,12/10/2025 - Nossa Senhora Aparecida,Nossa Senhora Aparecida,,2025-10-12,Areias - SP,-22.5800929,-44.6975127
SP,07/09/2025 - Independência do Brasil,Independência do Brasil,,2025-09-07,Areias - SP,-22.5800929,-44.6975127
SP,09/07/2025 - Revolução Constitucionalista,Revolução Constitucionalista,,2025-07-09,Areias - SP,-22.5800929,-44.6975127
SP,01/05/2025 - Dia do Trabalho,Dia do Trabalho,,2025-05-01,Areias - SP,-22.5800929,-44.6975127
SP,21/04/2025 - Dia de Tiradentes,Dia de Tiradentes,,2025-04-21,Areias - SP,-22.5800929,-44.6975127
SP,18/04/2025 - Sexta-Feira Santa,Sexta-Feira Santa,,2025-04-18,Areias - SP,-22.5800929,-44.6975127
SP,01/01/2025 - Ano Novo,Ano Novo,,2025-01-01,Areias - SP,-22.5800929,-44.6975127
SP,25/12/2025 - Natal,Natal,,2025-12-25,Arealva - SP,-22.1694726,-49.0271228
SP,25/11/2025 - Feriado Municipal,Feriado Municipal,,2025-11-25,Arealva - SP,-22.1694726,-49.0271228
SP,15/11/2025 - Proclamação da República,Proclamação da República,,2025-11-15,Arealva - SP,-22.1694726,-49.0271228
SP,02/11/2025 - Dia de Finados,Dia de Finados,,2025-11-02,Arealva - SP,-22.1694726,-49.0271228
SP,12/10/2025 - Nossa Senhora Aparecida,Nossa Senhora Aparecida,,2025-10-12,Arealva - SP,-22.1694726,-49.0271228
SP,07/09/2025 - Independência do Brasil,Independência do Brasil,,2025-09-07,Arealva - SP,-22.1694726,-49.0271228
SP,09/07/2025 - Revolução Constitucionalista,Revolução Constitucionalista,,2025-07-09,Arealva - SP,-22.1694726,-49.0271228
SP,01/05/2025 - Dia do Trabalho,Dia do Trabalho,,2025-05-01,Arealva - SP,-22.1694726,-49.0271228
SP,21/04/2025 - Dia de Tiradentes,Dia de Tiradentes,,2025-04-21,Arealva - SP,-22.1694726,-49.0271228
SP,18/04/2025 - Sexta-Feira Santa,Sexta-Feira Santa,,2025-04-18,Arealva - SP,-22.1694726,-49.0271228
SP,01/04/2025 - Feriado Municipal,Feriado Municipal,,2025-04-01,Arealva - SP,-22.1694726,-49.0271228
SP,01/01/2025 - Ano Novo,Ano Novo,,2025-01-01,Arealva - SP,-22.1694726,-49.0271228
SP,25/12/2025 - Natal,Natal,,2025-12-25,Araras - SP,-22.4134148,-47.3957784
SP,20/11/2025 - Dia da Consciência Negra,Dia da Consciência Negra,,2025-11-20,Araras - SP,-22.4134148,-47.3957784
SP,15/11/2025 - Proclamação da República,Proclamação da República,,2025-11-15,Araras - SP,-22.4134148,-47.3957784
SP,02/11/2025 - Dia de Finados,Dia de Finados,,2025-11-02,Araras - SP,-22.4134148,-47.3957784
SP,12/10/2025 - Nossa Senhora Aparecida,Nossa Senhora Aparecida,,2025-10-12,Araras - SP,-22.4134148,-47.3957784
SP,07/09/2025 - Independência do Brasil,Independência do Brasil,,2025-09-07,Araras - SP,-22.4134148,-47.3957784
SP,15/08/2025 - Feriado Municipal,Feriado Municipal,,2025-08-15,Araras - SP,-22.4134148,-47.3957784
SP,09/07/2025 - Revolução Constitucionalista,Revolução Constitucionalista,,2025-07-09,Araras - SP,-22.4134148,-47.3957784
SP,01/05/2025 - Dia do Trabalho,Dia do Trabalho,,2025-05-01,Araras - SP,-22.4134148,-47.3957784
SP,21/04/2025 - Dia de Tiradentes,Dia de Tiradentes,,2025-04-21,Araras - SP,-22.4134148,-47.3957784
SP,18/04/2025 - Sexta-Feira Santa,Sexta-Feira Santa,,2025-04-18,Araras - SP,-22.4134148,-47.3957784
SP,01/01/2025 - Ano Novo,Ano Novo,,2025-01-01,Araras - SP,-22.4134148,-47.3957784
SP,25/12/2025 - Natal,Natal,,2025-12-25,Araraquara - SP,-21.993173,-47.3333435
SP,20/11/2025 - Dia da Consciência Negra,Dia da Consciência Negra,,2025-11-20,Araraquara - SP,-21.993173,-47.3333435
SP,15/11/2025 - Proclamação da República,Proclamação da República,,2025-11-15,Araraquara - SP,-21.993173,-47.3333435
SP,02/11/2025 - Dia de Finados,Dia de Finados,,2025-11-02,Araraquara - SP,-21.993173,-47.3333435
SP,12/10/2025 - Nossa Senhora Aparecida,Nossa Senhora Aparecida,,2025-10-12,Araraquara - SP,-21.993173,-47.3333435
SP,07/09/2025 - Independência do Brasil,Independência do Brasil,,2025-09-07,Araraquara - SP,-21.993173,-47.3333435
SP,22/08/2025 - Feriado Municipal,Feriado Municipal,,2025-08-22,Araraquara - SP,-21.993173,-47.3333435
SP,09/07/2025 - Revolução Constitucionalista,Revolução Constitucionalista,,2025-07-09,Araraquara - SP,-21.993173,-47.3333435
SP,01/05/2025 - Dia do Trabalho,Dia do Trabalho,,2025-05-01,Araraquara - SP,-21.993173,-47.3333435
SP,21/04/2025 - Dia de Tiradentes,Dia de Tiradentes,,2025-04-21,Araraquara - SP,-21.993173,-47.3333435
SP,18/04/2025 - Sexta-Feira Santa,Sexta-Feira Santa,,2025-04-18,Araraquara - SP,-21.993173,-47.3333435
SP,01/01/2025 - Ano Novo,Ano Novo,,2025-01-01,Araraquara - SP,-21.993173,-47.3333435
SP,25/12/2025 - Natal,Natal,,2025-12-25,Arandu - SP,-23.2119457,-48.9964906
SP,30/11/2025 - Feriado Municipal,Feriado Municipal,,2025-11-30,Arandu - SP,-23.2119457,-48.9964906
SP,15/11/2025 - Proclamação da República,Proclamação da República,,2025-11-15,Arandu - SP,-23.2119457,-48.9964906
SP,02/11/2025 - Dia de Finados,Dia de Finados,,2025-11-02,Arandu - SP,-23.2119457,-48.9964906
SP,12/10/2025 - Nossa Senhora Aparecida,Nossa Senhora Aparecida,,2025-10-12,Arandu - SP,-23.2119457,-48.9964906
SP,07/09/2025 - Independência do Brasil,Independência do Brasil,,2025-09-07,Arandu - SP,-23.2119457,-48.9964906
SP,15/08/2025 - Feriado Municipal,Feriado Municipal,,2025-08-15,Arandu - SP,-23.2119457,-48.9964906
SP,09/07/2025 - Revolução Constitucionalista,Revolução Constitucionalista,,2025-07-09,Arandu - SP,-23.2119457,-48.9964906
SP,01/05/2025 - Dia do Trabalho,Dia do Trabalho,,2025-05-01,Arandu - SP,-23.2119457,-48.9964906
SP,21/04/2025 - Dia de Tiradentes,Dia de Tiradentes,,2025-04-21,Arandu - SP,-23.2119457,-48.9964906
SP,18/04/2025 - Sexta-Feira Santa,Sexta-Feira Santa,,2025-04-18,Arandu - SP,-23.2119457,-48.9964906
SP,19/03/2025 - São José,São José,,2025-03-19,Arandu - SP,-23.2119457,-48.9964906
SP,01/01/2025 - Ano Novo,Ano Novo,,2025-01-01,Arandu - SP,-23.2119457,-48.9964906
SP,25/12/2025 - Natal,Natal,,2025-12-25,Aramina - SP,-20.0876144,-47.789201
SP,20/11/2025 - Dia da Consciência Negra,Dia da Consciência Negra,,2025-11-20,Aramina - SP,-20.0876144,-47.789201
SP,15/11/2025 - Proclamação da República,Proclamação da República,,2025-11-15,Aramina - SP,-20.0876144,-47.789201
SP,02/11/2025 - Dia de Finados,Dia de Finados,,2025-11-02,Aramina - SP,-20.0876144,-47.789201
SP,12/10/2025 - Nossa Senhora Aparecida,Nossa Senhora Aparecida,,2025-10-12,Aramina - SP,-20.0876144,-47.789201
SP,07/09/2025 - Independência do Brasil,Independência do Brasil,,2025-09-07,Aramina - SP,-20.0876144,-47.789201
SP,09/07/2025 - Revolução Constitucionalista,Revolução Constitucionalista,,2025-07-09,Aramina - SP,-20.0876144,-47.789201
SP,13/06/2025 - Dia de Santo Antônio,Dia de Santo Antônio,,2025-06-13,Aramina - SP,-20.0876144,-47.789201
SP,01/05/2025 - Dia do Trabalho,Dia do Trabalho,,2025-05-01,Aramina - SP,-20.0876144,-47.789201
SP,21/04/2025 - Dia de Tiradentes,Dia de Tiradentes,,2025-04-21,Aramina - SP,-20.0876144,-47.789201
SP,18/04/2025 - Sexta-Feira Santa,Sexta-Feira Santa,,2025-04-18,Aramina - SP,-20.0876144,-47.789201
SP,04/04/2025 - Feriado Municipal,Feriado Municipal,,2025-04-04,Aramina - SP,-20.0876144,-47.789201
SP,01/01/2025 - Ano Novo,Ano Novo,,2025-01-01,Aramina - SP,-20.0876144,-47.789201
SP,25/12/2025 - Natal,Natal,,2025-12-25,Canas - SP,-22.7029347,-45.0526508
SP,20/11/2025 - Dia da Consciência Negra,Dia da Consciência Negra,,2025-11-20,Canas - SP,-22.7029347,-45.0526508
SP,15/11/2025 - Proclamação da República,Proclamação da República,,2025-11-15,Canas - SP,-22.7029347,-45.0526508
SP,02/11/2025 - Dia de Finados,Dia de Finados,,2025-11-02,Canas - SP,-22.7029347,-45.0526508
SP,12/10/2025 - Nossa Senhora Aparecida,Nossa Senhora Aparecida,,2025-10-12,Canas - SP,-22.7029347,-45.0526508
SP,07/09/2025 - Independência do Brasil,Independência do Brasil,,2025-09-07,Canas - SP,-22.7029347,-45.0526508
SP,09/07/2025 - Revolução Constitucionalista,Revolução Constitucionalista,,2025-07-09,Canas - SP,-22.7029347,-45.0526508
SP,24/05/2025 - Feriado Municipal,Feriado Municipal,,2025-05-24,Canas - SP,-22.7029347,-45.0526508
SP,01/05/2025 - Dia do Trabalho,Dia do Trabalho,,2025-05-01,Canas - SP,-22.7029347,-45.0526508
SP,21/04/2025 - Dia de Tiradentes,Dia de Tiradentes,,2025-04-21,Canas - SP,-22.7029347,-45.0526508
SP,18/04/2025 - Sexta-Feira Santa,Sexta-Feira Santa,,2025-04-18,Canas - SP,-22.7029347,-45.0526508
SP,22/03/2025 - Feriado Municipal,Feriado Municipal,,2025-03-22,Canas - SP,-22.7029347,-45.0526508
SP,01/01/2025 - Ano Novo,Ano Novo,,2025-01-01,Canas - SP,-22.7029347,-45.0526508
SP,25/12/2025 - Natal,Natal,,2025-12-25,Getulina - SP,-21.7976044,-49.9267812
SP,20/11/2025 - Dia da Consciência Negra,Dia da Consciência Negra,,2025-11-20,Getulina - SP,-21.7976044,-49.9267812
SP,15/11/2025 - Proclamação da República,Proclamação da República,,2025-11-15,Getulina - SP,-21.7976044,-49.9267812
SP,02/11/2025 - Dia de Finados,Dia de Finados,,2025-11-02,Getulina - SP,-21.7976044,-49.9267812
SP,12/10/2025 - Nossa Senhora Aparecida,Nossa Senhora Aparecida,,2025-10-12,Getulina - SP,-21.7976044,-49.9267812
SP,07/09/2025 - Independência do Brasil,Independência do Brasil,,2025-09-07,Getulina - SP,-21.7976044,-49.9267812
SP,15/08/2025 - Feriado Municipal,Feriado Municipal,,2025-08-15,Getulina - SP,-21.7976044,-49.9267812
SP,09/07/2025 - Revolução Constitucionalista,Revolução Constitucionalista,,2025-07-09,Getulina - SP,-21.7976044,-49.9267812
SP,01/05/2025 - Dia do Trabalho,Dia do Trabalho,,2025-05-01,Getulina - SP,-21.7976044,-49.9267812
SP,21/04/2025 - Dia de Tiradentes,Dia de Tiradentes,,2025-04-21,Getulina - SP,-21.7976044,-49.9267812
SP,18/04/2025 - Sexta-Feira Santa,Sexta-Feira Santa,,2025-04-18,Getulina - SP,-21.7976044,-49.9267812
SP,25/03/2025 - Feriado Municipal,Feriado Municipal,,2025-03-25,Getulina - SP,-21.7976044,-49.9267812
SP,01/01/2025 - Ano Novo,Ano Novo,,2025-01-01,Getulina - SP,-21.7976044,-49.9267812
SP,25/12/2025 - Natal,Natal,,2025-12-25,General Salgado - SP,-20.5333429,-50.494775
SP,08/12/2025 - Feriado Municipal,Feriado Municipal,,2025-12-08,General Salgado - SP,-20.5333429,-50.494775
SP,15/11/2025 - Proclamação da República,Proclamação da República,,2025-11-15,General Salgado - SP,-20.5333429,-50.494775
SP,02/11/2025 - Dia de Finados,Dia de Finados,,2025-11-02,General Salgado - SP,-20.5333429,-50.494775
SP,12/10/2025 - Nossa Senhora Aparecida,Nossa Senhora Aparecida,,2025-10-12,General Salgado - SP,-20.5333429,-50.494775
SP,15/09/2025 - Feriado Municipal,Feriado Municipal,,2025-09-15,General Salgado - SP,-20.5333429,-50.494775
SP,07/09/2025 - Independência do Brasil,Independência do Brasil,,2025-09-07,General Salgado - SP,-20.5333429,-50.494775
SP,09/07/2025 - Revolução Constitucionalista,Revolução Constitucionalista,,2025-07-09,General Salgado - SP,-20.5333429,-50.494775
SP,01/05/2025 - Dia do Trabalho,Dia do Trabalho,,2025-05-01,General Salgado - SP,-20.5333429,-50.494775
SP,21/04/2025 - Dia de Tiradentes,Dia de Tiradentes,,2025-04-21,General Salgado - SP,-20.5333429,-50.494775
SP,18/04/2025 - Sexta-Feira Santa,Sexta-Feira Santa,,2025-04-18,General Salgado - SP,-20.5333429,-50.494775
SP,01/01/2025 - Ano Novo,Ano Novo,,2025-01-01,General Salgado - SP,-20.5333429,-50.494775
SP,25/12/2025 - Natal,Natal,,2025-12-25,Gabriel Monteiro - SP,-23.5740905,-46.6864882
SP,15/11/2025 - Proclamação da República,Proclamação da República,,2025-11-15,Gabriel Monteiro - SP,-23.5740905,-46.6864882
SP,03/11/2025 - Feriado Municipal,Feriado Municipal,,2025-11-03,Gabriel Monteiro - SP,-23.5740905,-46.6864882
SP,02/11/2025 - Dia de Finados,Dia de Finados,,2025-11-02,Gabriel Monteiro - SP,-23.5740905,-46.6864882
SP,12/10/2025 - Nossa Senhora Aparecida,Nossa Senhora Aparecida,,2025-10-12,Gabriel Monteiro - SP,-23.5740905,-46.6864882
SP,07/09/2025 - Independência do Brasil,Independência do Brasil,,2025-09-07,Gabriel Monteiro - SP,-23.5740905,-46.6864882
SP,09/07/2025 - Revolução Constitucionalista,Revolução Constitucionalista,,2025-07-09,Gabriel Monteiro - SP,-23.5740905,-46.6864882
SP,29/06/2025 - Feriado Municipal,Feriado Municipal,,2025-06-29,Gabriel Monteiro - SP,-23.5740905,-46.6864882
SP,01/05/2025 - Dia do Trabalho,Dia do Trabalho,,2025-05-01,Gabriel Monteiro - SP,-23.5740905,-46.6864882
SP,21/04/2025 - Dia de Tiradentes,Dia de Tiradentes,,2025-04-21,Gabriel Monteiro - SP,-23.5740905,-46.6864882
SP,18/04/2025 - Sexta-Feira Santa,Sexta-Feira Santa,,2025-04-18,Gabriel Monteiro - SP,-23.5740905,-46.6864882
SP,01/01/2025 - Ano Novo,Ano Novo,,2025-01-01,Gabriel Monteiro - SP,-23.5740905,-46.6864882
SP,25/12/2025 - Natal,Natal,,2025-12-25,Franco da Rocha - SP,-23.3268216,-46.7239722
SP,08/12/2025 - Feriado Municipal,Feriado Municipal,,2025-12-08,Franco da Rocha - SP,-23.3268216,-46.7239722
SP,30/11/2025 - Feriado Municipal,Feriado Municipal,,2025-11-30,Franco da Rocha - SP,-23.3268216,-46.7239722
SP,20/11/2025 - Dia da Consciência Negra,Dia da Consciência Negra,,2025-11-20,Franco da Rocha - SP,-23.3268216,-46.7239722
SP,15/11/2025 - Proclamação da República,Proclamação da República,,2025-11-15,Franco da Rocha - SP,-23.3268216,-46.7239722
SP,02/11/2025 - Dia de Finados,Dia de Finados,,2025-11-02,Franco da Rocha - SP,-23.3268216,-46.7239722
SP,12/10/2025 - Nossa Senhora Aparecida,Nossa Senhora Aparecida,,2025-10-12,Franco da Rocha - SP,-23.3268216,-46.7239722
SP,07/09/2025 - Independência do Brasil,Independência do Brasil,,2025-09-07,Franco da Rocha - SP,-23.3268216,-46.7239722
SP,09/07/2025 - Revolução Constitucionalista,Revolução Constitucionalista,,2025-07-09,Franco da Rocha - SP,-23.3268216,-46.7239722
SP,01/05/2025 - Dia do Trabalho,Dia do Trabalho,,2025-05-01,Franco da Rocha - SP,-23.3268216,-46.7239722
SP,21/04/2025 - Dia de Tiradentes,Dia de Tiradentes,,2025-04-21,Franco da Rocha - SP,-23.3268216,-46.7239722
SP,18/04/2025 - Sexta-Feira Santa,Sexta-Feira Santa,,2025-04-18,Franco da Rocha - SP,-23.3268216,-46.7239722
SP,01/01/2025 - Ano Novo,Ano Novo,,2025-01-01,Franco da Rocha - SP,-23.3268216,-46.7239722
SP,25/12/2025 - Natal,Natal,,2025-12-25,Francisco Morato - SP,-23.2746177,-46.7165843
SP,20/11/2025 - Dia da Consciência Negra,Dia da Consciência Negra,,2025-11-20,Francisco Morato - SP,-23.2746177,-46.7165843
SP,15/11/2025 - Proclamação da República,Proclamação da República,,2025-11-15,Francisco Morato - SP,-23.2746177,-46.7165843
SP,02/11/2025 - Dia de Finados,Dia de Finados,,2025-11-02,Francisco Morato - SP,-23.2746177,-46.7165843
SP,12/10/2025 - Nossa Senhora Aparecida,Nossa Senhora Aparecida,,2025-10-12,Francisco Morato - SP,-23.2746177,-46.7165843
SP,07/09/2025 - Independência do Brasil,Independência do Brasil,,2025-09-07,Francisco Morato - SP,-23.2746177,-46.7165843
SP,09/07/2025 - Revolução Constitucionalista,Revolução Constitucionalista,,2025-07-09,Francisco Morato - SP,-23.2746177,-46.7165843
SP,01/05/2025 - Dia do Trabalho,Dia do Trabalho,,2025-05-01,Francisco Morato - SP,-23.2746177,-46.7165843
SP,21/04/2025 - Dia de Tiradentes,Dia de Tiradentes,,2025-04-21,Francisco Morato - SP,-23.2746177,-46.7165843
SP,18/04/2025 - Sexta-Feira Santa,Sexta-Feira Santa,,2025-04-18,Francisco Morato - SP,-23.2746177,-46.7165843
SP,21/03/2025 - Feriado Municipal,Feriado Municipal,,2025-03-21,Francisco Morato - SP,-23.2746177,-46.7165843
SP,01/01/2025 - Ano Novo,Ano Novo,,2025-01-01,Francisco Morato - SP,-23.2746177,-46.7165843
SP,25/12/2025 - Natal,Natal,,2025-12-25,Franca - SP,-23.4802355,-47.4217179
SP,08/12/2025 - Dia da Padroeira,Dia da Padroeira,,2025-12-08,Franca - SP,-23.4802355,-47.4217179
SP,28/11/2025 - Aniversário da Cidade,Aniversário da Cidade,,2025-11-28,Franca - SP,-23.4802355,-47.4217179
SP,20/11/2025 - Dia da Consciência Negra,Dia da Consciência Negra,,2025-11-20,Franca - SP,-23.4802355,-47.4217179
SP,15/11/2025 - Proclamação da República,Proclamação da República,,2025-11-15,Franca - SP,-23.4802355,-47.4217179
SP,02/11/2025 - Dia de Finados,Dia de Finados,,2025-11-02,Franca - SP,-23.4802355,-47.4217179
SP,12/10/2025 - Nossa Senhora Aparecida,Nossa Senhora Aparecida,,2025-10-12,Franca - SP,-23.4802355,-47.4217179
SP,07/09/2025 - Independência do Brasil,Independência do Brasil,,2025-09-07,Franca - SP,-23.4802355,-47.4217179
SP,09/07/2025 - Revolução Constitucionalista,Revolução Constitucionalista,,2025-07-09,Franca - SP,-23.4802355,-47.4217179
SP,01/05/2025 - Dia do Trabalho,Dia do Trabalho,,2025-05-01,Franca - SP,-23.4802355,-47.4217179
SP,21/04/2025 - Dia de Tiradentes,Dia de Tiradentes,,2025-04-21,Franca - SP,-23.4802355,-47.4217179
SP,18/04/2025 - Sexta-Feira Santa,Sexta-Feira Santa,,2025-04-18,Franca - SP,-23.4802355,-47.4217179
SP,01/01/2025 - Ano Novo,Ano Novo,,2025-01-01,Franca - SP,-23.4802355,-47.4217179
SP,25/12/2025 - Natal,Natal,,2025-12-25,Floreal - SP,-20.6782547,-50.1469908
SP,08/12/2025 - Feriado Municipal,Feriado Municipal,,2025-12-08,Floreal - SP,-20.6782547,-50.1469908
SP,15/11/2025 - Proclamação da República,Proclamação da República,,2025-11-15,Floreal - SP,-20.6782547,-50.1469908
SP,02/11/2025 - Dia de Finados,Dia de Finados,,2025-11-02,Floreal - SP,-20.6782547,-50.1469908
SP,12/10/2025 - Nossa Senhora Aparecida,Nossa Senhora Aparecida,,2025-10-12,Floreal - SP,-20.6782547,-50.1469908
SP,07/09/2025 - Independência do Brasil,Independência do Brasil,,2025-09-07,Floreal - SP,-20.6782547,-50.1469908
SP,06/08/2025 - Feriado Municipal,Feriado Municipal,,2025-08-06,Floreal - SP,-20.6782547,-50.1469908
SP,09/07/2025 - Revolução Constitucionalista,Revolução Constitucionalista,,2025-07-09,Floreal - SP,-20.6782547,-50.1469908
SP,01/05/2025 - Dia do Trabalho,Dia do Trabalho,,2025-05-01,Floreal - SP,-20.6782547,-50.1469908
SP,21/04/2025 - Dia de Tiradentes,Dia de Tiradentes,,2025-04-21,Floreal - SP,-20.6782547,-50.1469908
SP,18/04/2025 - Sexta-Feira Santa,Sexta-Feira Santa,,2025-04-18,Floreal - SP,-20.6782547,-50.1469908
SP,20/01/2025 - Feriado Municipal,Feriado Municipal,,2025-01-20,Floreal - SP,-20.6782547,-50.1469908
SP,01/01/2025 - Ano Novo,Ano Novo,,2025-01-01,Floreal - SP,-20.6782547,-50.1469908
SP,25/12/2025 - Natal,Natal,,2025-12-25,Flora Rica - SP,-23.7207242,-46.565492
SP,15/11/2025 - Proclamação da República,Proclamação da República,,2025-11-15,Flora Rica - SP,-23.7207242,-46.565492
SP,02/11/2025 - Dia de Finados,Dia de Finados,,2025-11-02,Flora Rica - SP,-23.7207242,-46.565492
SP,12/10/2025 - Nossa Senhora Aparecida,Nossa Senhora Aparecida,,2025-10-12,Flora Rica - SP,-23.7207242,-46.565492
SP,07/09/2025 - Independência do Brasil,Independência do Brasil,,2025-09-07,Flora Rica - SP,-23.7207242,-46.565492
SP,09/07/2025 - Revolução Constitucionalista,Revolução Constitucionalista,,2025-07-09,Flora Rica - SP,-23.7207242,-46.565492
SP,01/05/2025 - Dia do Trabalho,Dia do Trabalho,,2025-05-01,Flora Rica - SP,-23.7207242,-46.565492
SP,21/04/2025 - Dia de Tiradentes,Dia de Tiradentes,,2025-04-21,Flora Rica - SP,-23.7207242,-46.565492
SP,18/04/2025 - Sexta-Feira Santa,Sexta-Feira Santa,,2025-04-18,Flora Rica - SP,-23.7207242,-46.565492
SP,19/03/2025 - São José,São José,,2025-03-19,Flora Rica - SP,-23.7207242,-46.565492
SP,01/01/2025 - Ano Novo,Ano Novo,,2025-01-01,Flora Rica - SP,-23.7207242,-46.565492
SP,25/12/2025 - Natal,Natal,,2025-12-25,Ferraz de Vasconcelos - SP,-23.5363345,-46.3590017
SP,20/11/2025 - Dia da Consciência Negra,Dia da Consciência Negra,,2025-11-20,Ferraz de Vasconcelos - SP,-23.5363345,-46.3590017
SP,15/11/2025 - Proclamação da República,Proclamação da República,,2025-11-15,Ferraz de Vasconcelos - SP,-23.5363345,-46.3590017
SP,02/11/2025 - Dia de Finados,Dia de Finados,,2025-11-02,Ferraz de Vasconcelos - SP,-23.5363345,-46.3590017
SP,14/10/2025 - Aniversário da cidade,Aniversário da cidade,,2025-10-14,Ferraz de Vasconcelos - SP,-23.5363345,-46.3590017
SP,12/10/2025 - Nossa Senhora Aparecida,Nossa Senhora Aparecida,,2025-10-12,Ferraz de Vasconcelos - SP,-23.5363345,-46.3590017
SP,07/09/2025 - Independência do Brasil,Independência do Brasil,,2025-09-07,Ferraz de Vasconcelos - SP,-23.5363345,-46.3590017
SP,09/07/2025 - Revolução Constitucionalista,Revolução Constitucionalista,,2025-07-09,Ferraz de Vasconcelos - SP,-23.5363345,-46.3590017
SP,01/05/2025 - Dia do Trabalho,Dia do Trabalho,,2025-05-01,Ferraz de Vasconcelos - SP,-23.5363345,-46.3590017
SP,21/04/2025 - Dia de Tiradentes,Dia de Tiradentes,,2025-04-21,Ferraz de Vasconcelos - SP,-23.5363345,-46.3590017
SP,18/04/2025 - Sexta-Feira Santa,Sexta-Feira Santa,,2025-04-18,Ferraz de Vasconcelos - SP,-23.5363345,-46.3590017
SP,01/01/2025 - Ano Novo,Ano Novo,,2025-01-01,Ferraz de Vasconcelos - SP,-23.5363345,-46.3590017
SP,25/12/2025 - Natal,Natal,,2025-12-25,Fernando Prestes - SP,-21.2638382,-48.6870287
SP,13/12/2025 - Feriado Municipal,Feriado Municipal,,2025-12-13,Fernando Prestes - SP,-21.2638382,-48.6870287
SP,15/11/2025 - Proclamação da República,Proclamação da República,,2025-11-15,Fernando Prestes - SP,-21.2638382,-48.6870287
SP,02/11/2025 - Dia de Finados,Dia de Finados,,2025-11-02,Fernando Prestes - SP,-21.2638382,-48.6870287
SP,12/10/2025 - Nossa Senhora Aparecida,Nossa Senhora Aparecida,,2025-10-12,Fernando Prestes - SP,-21.2638382,-48.6870287
SP,07/09/2025 - Independência do Brasil,Independência do Brasil,,2025-09-07,Fernando Prestes - SP,-21.2638382,-48.6870287
SP,09/07/2025 - Revolução Constitucionalista,Revolução Constitucionalista,,2025-07-09,Fernando Prestes - SP,-21.2638382,-48.6870287
SP,05/07/2025 - Feriado Municipal,Feriado Municipal,,2025-07-05,Fernando Prestes - SP,-21.2638382,-48.6870287
SP,01/05/2025 - Dia do Trabalho,Dia do Trabalho,,2025-05-01,Fernando Prestes - SP,-21.2638382,-48.6870287
SP,21/04/2025 - Dia de Tiradentes,Dia de Tiradentes,,2025-04-21,Fernando Prestes - SP,-21.2638382,-48.6870287
SP,18/04/2025 - Sexta-Feira Santa,Sexta-Feira Santa,,2025-04-18,Fernando Prestes - SP,-21.2638382,-48.6870287
SP,20/01/2025 - Feriado Municipal,Feriado Municipal,,2025-01-20,Fernando Prestes - SP,-21.2638382,-48.6870287
SP,01/01/2025 - Ano Novo,Ano Novo,,2025-01-01,Fernando Prestes - SP,-21.2638382,-48.6870287
SP,25/12/2025 - Natal,Natal,,2025-12-25,Fartura - SP,-23.3876531,-49.5094297
SP,15/11/2025 - Proclamação da República,Proclamação da República,,2025-11-15,Fartura - SP,-23.3876531,-49.5094297
SP,02/11/2025 - Dia de Finados,Dia de Finados,,2025-11-02,Fartura - SP,-23.3876531,-49.5094297
SP,12/10/2025 - Nossa Senhora Aparecida,Nossa Senhora Aparecida,,2025-10-12,Fartura - SP,-23.3876531,-49.5094297
SP,15/09/2025 - Feriado Municipal,Feriado Municipal,,2025-09-15,Fartura - SP,-23.3876531,-49.5094297
SP,07/09/2025 - Independência do Brasil,Independência do Brasil,,2025-09-07,Fartura - SP,-23.3876531,-49.5094297
SP,09/07/2025 - Revolução Constitucionalista,Revolução Constitucionalista,,2025-07-09,Fartura - SP,-23.3876531,-49.5094297
SP,01/05/2025 - Dia do Trabalho,Dia do Trabalho,,2025-05-01,Fartura - SP,-23.3876531,-49.5094297
SP,21/04/2025 - Dia de Tiradentes,Dia de Tiradentes,,2025-04-21,Fartura - SP,-23.3876531,-49.5094297
SP,18/04/2025 - Sexta-Feira Santa,Sexta-Feira Santa,,2025-04-18,Fartura - SP,-23.3876531,-49.5094297
SP,31/03/2025 - Feriado Municipal,Feriado Municipal,,2025-03-31,Fartura - SP,-23.3876531,-49.5094297
SP,01/01/2025 - Ano Novo,Ano Novo,,2025-01-01,Fartura - SP,-23.3876531,-49.5094297
SP,25/12/2025 - Natal,Natal,,2025-12-25,Euclides da Cunha Paulista - SP,-22.55452,-52.592779
SP,08/12/2025 - Feriado Municipal,Feriado Municipal,,2025-12-08,Euclides da Cunha Paulista - SP,-22.55452,-52.592779
SP,15/11/2025 - Proclamação da República,Proclamação da República,,2025-11-15,Euclides da Cunha Paulista - SP,-22.55452,-52.592779
SP,02/11/2025 - Dia de Finados,Dia de Finados,,2025-11-02,Euclides da Cunha Paulista - SP,-22.55452,-52.592779
SP,12/10/2025 - Nossa Senhora Aparecida,Nossa Senhora Aparecida,,2025-10-12,Euclides da Cunha Paulista - SP,-22.55452,-52.592779
SP,15/09/2025 - Feriado Municipal,Feriado Municipal,,2025-09-15,Euclides da Cunha Paulista - SP,-22.55452,-52.592779
SP,07/09/2025 - Independência do Brasil,Independência do Brasil,,2025-09-07,Euclides da Cunha Paulista - SP,-22.55452,-52.592779
SP,09/07/2025 - Revolução Constitucionalista,Revolução Constitucionalista,,2025-07-09,Euclides da Cunha Paulista - SP,-22.55452,-52.592779
SP,01/05/2025 - Dia do Trabalho,Dia do Trabalho,,2025-05-01,Euclides da Cunha Paulista - SP,-22.55452,-52.592779
SP,21/04/2025 - Dia de Tiradentes,Dia de Tiradentes,,2025-04-21,Euclides da Cunha Paulista - SP,-22.55452,-52.592779
SP,18/04/2025 - Sexta-Feira Santa,Sexta-Feira Santa,,2025-04-18,Euclides da Cunha Paulista - SP,-22.55452,-52.592779
SP,19/03/2025 - São José,São José,,2025-03-19,Euclides da Cunha Paulista - SP,-22.55452,-52.592779
SP,09/01/2025 - Feriado Municipal,Feriado Municipal,,2025-01-09,Euclides da Cunha Paulista - SP,-22.55452,-52.592779
SP,01/01/2025 - Ano Novo,Ano Novo,,2025-01-01,Euclides da Cunha Paulista - SP,-22.55452,-52.592779
SP,25/12/2025 - Natal,Natal,,2025-12-25,Estrela do Norte - SP,-22.4886301,-51.6606857
SP,13/12/2025 - Feriado Municipal,Feriado Municipal,,2025-12-13,Estrela do Norte - SP,-22.4886301,-51.6606857
SP,15/11/2025 - Proclamação da República,Proclamação da República,,2025-11-15,Estrela do Norte - SP,-22.4886301,-51.6606857
SP,02/11/2025 - Dia de Finados,Dia de Finados,,2025-11-02,Estrela do Norte - SP,-22.4886301,-51.6606857
SP,12/10/2025 - Nossa Senhora Aparecida,Nossa Senhora Aparecida,,2025-10-12,Estrela do Norte - SP,-22.4886301,-51.6606857
SP,07/09/2025 - Independência do Brasil,Independência do Brasil,,2025-09-07,Estrela do Norte - SP,-22.4886301,-51.6606857
SP,09/07/2025 - Revolução Constitucionalista,Revolução Constitucionalista,,2025-07-09,Estrela do Norte - SP,-22.4886301,-51.6606857
SP,29/06/2025 - Feriado Municipal,Feriado Municipal,,2025-06-29,Estrela do Norte - SP,-22.4886301,-51.6606857
SP,01/05/2025 - Dia do Trabalho,Dia do Trabalho,,2025-05-01,Estrela do Norte - SP,-22.4886301,-51.6606857
SP,21/04/2025 - Dia de Tiradentes,Dia de Tiradentes,,2025-04-21,Estrela do Norte - SP,-22.4886301,-51.6606857
SP,18/04/2025 - Sexta-Feira Santa,Sexta-Feira Santa,,2025-04-18,Estrela do Norte - SP,-22.4886301,-51.6606857
SP,21/03/2025 - Feriado Municipal,Feriado Municipal,,2025-03-21,Estrela do Norte - SP,-22.4886301,-51.6606857
SP,20/01/2025 - Feriado Municipal,Feriado Municipal,,2025-01-20,Estrela do Norte - SP,-22.4886301,-51.6606857
SP,01/01/2025 - Ano Novo,Ano Novo,,2025-01-01,Estrela do Norte - SP,-22.4886301,-51.6606857
SP,25/12/2025 - Natal,Natal,,2025-12-25,Estiva Gerbi - SP,-22.2680134,-46.9540153
SP,15/11/2025 - Proclamação da República,Proclamação da República,,2025-11-15,Estiva Gerbi - SP,-22.2680134,-46.9540153
SP,02/11/2025 - Dia de Finados,Dia de Finados,,2025-11-02,Estiva Gerbi - SP,-22.2680134,-46.9540153
SP,12/10/2025 - Nossa Senhora Aparecida,Nossa Senhora Aparecida,,2025-10-12,Estiva Gerbi - SP,-22.2680134,-46.9540153
SP,07/09/2025 - Independência do Brasil,Independência do Brasil,,2025-09-07,Estiva Gerbi - SP,-22.2680134,-46.9540153
SP,09/07/2025 - Revolução Constitucionalista,Revolução Constitucionalista,,2025-07-09,Estiva Gerbi - SP,-22.2680134,-46.9540153
SP,19/05/2025 - Feriado Municipal,Feriado Municipal,,2025-05-19,Estiva Gerbi - SP,-22.2680134,-46.9540153
SP,01/05/2025 - Dia do Trabalho,Dia do Trabalho,,2025-05-01,Estiva Gerbi - SP,-22.2680134,-46.9540153
SP,21/04/2025 - Dia de Tiradentes,Dia de Tiradentes,,2025-04-21,Estiva Gerbi - SP,-22.2680134,-46.9540153
SP,18/04/2025 - Sexta-Feira Santa,Sexta-Feira Santa,,2025-04-18,Estiva Gerbi - SP,-22.2680134,-46.9540153
SP,19/03/2025 - São José,São José,,2025-03-19,Estiva Gerbi - SP,-22.2680134,-46.9540153
SP,01/01/2025 - Ano Novo,Ano Novo,,2025-01-01,Estiva Gerbi - SP,-22.2680134,-46.9540153
SP,25/12/2025 - Natal,Natal,,2025-12-25,Ibitinga - SP,-21.7434473,-48.8556038
SP,15/11/2025 - Proclamação da República,Proclamação da República,,2025-11-15,Ibitinga - SP,-21.7434473,-48.8556038
SP,02/11/2025 - Dia de Finados,Dia de Finados,,2025-11-02,Ibitinga - SP,-21.7434473,-48.8556038
SP,12/10/2025 - Nossa Senhora Aparecida,Nossa Senhora Aparecida,,2025-10-12,Ibitinga - SP,-21.7434473,-48.8556038
SP,07/09/2025 - Independência do Brasil,Independência do Brasil,,2025-09-07,Ibitinga - SP,-21.7434473,-48.8556038
SP,06/08/2025 - Feriado Municipal,Feriado Municipal,,2025-08-06,Ibitinga - SP,-21.7434473,-48.8556038
SP,09/07/2025 - Revolução Constitucionalista,Revolução Constitucionalista,,2025-07-09,Ibitinga - SP,-21.7434473,-48.8556038
SP,04/07/2025 - Feriado Municipal,Feriado Municipal,,2025-07-04,Ibitinga - SP,-21.7434473,-48.8556038
SP,01/05/2025 - Dia do Trabalho,Dia do Trabalho,,2025-05-01,Ibitinga - SP,-21.7434473,-48.8556038
SP,21/04/2025 - Dia de Tiradentes,Dia de Tiradentes,,2025-04-21,Ibitinga - SP,-21.7434473,-48.8556038
SP,18/04/2025 - Sexta-Feira Santa,Sexta-Feira Santa,,2025-04-18,Ibitinga - SP,-21.7434473,-48.8556038
SP,01/01/2025 - Ano Novo,Ano Novo,,2025-01-01,Ibitinga - SP,-21.7434473,-48.8556038
SP,25/12/2025 - Natal,Natal,,2025-12-25,Ibirarema - SP,-22.8131812,-50.0720477
SP,30/11/2025 - Feriado Municipal,Feriado Municipal,,2025-11-30,Ibirarema - SP,-22.8131812,-50.0720477
SP,20/11/2025 - Dia da Consciência Negra,Dia da Consciência Negra,,2025-11-20,Ibirarema - SP,-22.8131812,-50.0720477
SP,15/11/2025 - Proclamação da República,Proclamação da República,,2025-11-15,Ibirarema - SP,-22.8131812,-50.0720477
SP,02/11/2025 - Dia de Finados,Dia de Finados,,2025-11-02,Ibirarema - SP,-22.8131812,-50.0720477
SP,12/10/2025 - Nossa Senhora Aparecida,Nossa Senhora Aparecida,,2025-10-12,Ibirarema - SP,-22.8131812,-50.0720477
SP,07/09/2025 - Independência do Brasil,Independência do Brasil,,2025-09-07,Ibirarema - SP,-22.8131812,-50.0720477
SP,09/07/2025 - Revolução Constitucionalista,Revolução Constitucionalista,,2025-07-09,Ibirarema - SP,-22.8131812,-50.0720477
SP,01/05/2025 - Dia do Trabalho,Dia do Trabalho,,2025-05-01,Ibirarema - SP,-22.8131812,-50.0720477
SP,21/04/2025 - Dia de Tiradentes,Dia de Tiradentes,,2025-04-21,Ibirarema - SP,-22.8131812,-50.0720477
SP,18/04/2025 - Sexta-Feira Santa,Sexta-Feira Santa,,2025-04-18,Ibirarema - SP,-22.8131812,-50.0720477
SP,11/02/2025 - Feriado Municipal,Feriado Municipal,,2025-02-11,Ibirarema - SP,-22.8131812,-50.0720477
SP,01/01/2025 - Ano Novo,Ano Novo,,2025-01-01,Ibirarema - SP,-22.8131812,-50.0720477
SP,25/12/2025 - Natal,Natal,,2025-12-25,Iaras - SP,-22.8742567,-49.1593923
SP,13/12/2025 - Feriado Municipal,Feriado Municipal,,2025-12-13,Iaras - SP,-22.8742567,-49.1593923
SP,20/11/2025 - Dia da Consciência Negra,Dia da Consciência Negra,,2025-11-20,Iaras - SP,-22.8742567,-49.1593923
SP,15/11/2025 - Proclamação da República,Proclamação da República,,2025-11-15,Iaras - SP,-22.8742567,-49.1593923
SP,02/11/2025 - Dia de Finados,Dia de Finados,,2025-11-02,Iaras - SP,-22.8742567,-49.1593923
SP,12/10/2025 - Nossa Senhora Aparecida,Nossa Senhora Aparecida,,2025-10-12,Iaras - SP,-22.8742567,-49.1593923
SP,07/09/2025 - Independência do Brasil,Independência do Brasil,,2025-09-07,Iaras - SP,-22.8742567,-49.1593923
SP,09/07/2025 - Revolução Constitucionalista,Revolução Constitucionalista,,2025-07-09,Iaras - SP,-22.8742567,-49.1593923
SP,01/05/2025 - Dia do Trabalho,Dia do Trabalho,,2025-05-01,Iaras - SP,-22.8742567,-49.1593923
SP,21/04/2025 - Dia de Tiradentes,Dia de Tiradentes,,2025-04-21,Iaras - SP,-22.8742567,-49.1593923
SP,18/04/2025 - Sexta-Feira Santa,Sexta-Feira Santa,,2025-04-18,Iaras - SP,-22.8742567,-49.1593923
SP,09/01/2025 - Feriado Municipal,Feriado Municipal,,2025-01-09,Iaras - SP,-22.8742567,-49.1593923
SP,01/01/2025 - Ano Novo,Ano Novo,,2025-01-01,Iaras - SP,-22.8742567,-49.1593923
SP,25/12/2025 - Natal,Natal,,2025-12-25,Iacri - SP,-21.8605725,-50.6875817
SP,15/11/2025 - Proclamação da República,Proclamação da República,,2025-11-15,Iacri - SP,-21.8605725,-50.6875817
SP,02/11/2025 - Dia de Finados,Dia de Finados,,2025-11-02,Iacri - SP,-21.8605725,-50.6875817
SP,12/10/2025 - Nossa Senhora Aparecida,Nossa Senhora Aparecida,,2025-10-12,Iacri - SP,-21.8605725,-50.6875817
SP,07/09/2025 - Independência do Brasil,Independência do Brasil,,2025-09-07,Iacri - SP,-21.8605725,-50.6875817
SP,09/07/2025 - Revolução Constitucionalista,Revolução Constitucionalista,,2025-07-09,Iacri - SP,-21.8605725,-50.6875817
SP,29/06/2025 - Feriado Municipal,Feriado Municipal,,2025-06-29,Iacri - SP,-21.8605725,-50.6875817
SP,21/06/2025 - Feriado Municipal,Feriado Municipal,,2025-06-21,Iacri - SP,-21.8605725,-50.6875817
SP,01/05/2025 - Dia do Trabalho,Dia do Trabalho,,2025-05-01,Iacri - SP,-21.8605725,-50.6875817
SP,21/04/2025 - Dia de Tiradentes,Dia de Tiradentes,,2025-04-21,Iacri - SP,-21.8605725,-50.6875817
SP,18/04/2025 - Sexta-Feira Santa,Sexta-Feira Santa,,2025-04-18,Iacri - SP,-21.8605725,-50.6875817
SP,01/01/2025 - Ano Novo,Ano Novo,,2025-01-01,Iacri - SP,-21.8605725,-50.6875817
SP,25/12/2025 - Natal,Natal,,2025-12-25,Iacanga - SP,-21.8928341,-49.0226082
SP,15/11/2025 - Proclamação da República,Proclamação da República,,2025-11-15,Iacanga - SP,-21.8928341,-49.0226082
SP,02/11/2025 - Dia de Finados,Dia de Finados,,2025-11-02,Iacanga - SP,-21.8928341,-49.0226082
SP,12/10/2025 - Nossa Senhora Aparecida,Nossa Senhora Aparecida,,2025-10-12,Iacanga - SP,-21.8928341,-49.0226082
SP,07/09/2025 - Independência do Brasil,Independência do Brasil,,2025-09-07,Iacanga - SP,-21.8928341,-49.0226082
SP,09/07/2025 - Revolução Constitucionalista,Revolução Constitucionalista,,2025-07-09,Iacanga - SP,-21.8928341,-49.0226082
SP,24/06/2025 - Feriado Municipal,Feriado Municipal,,2025-06-24,Iacanga - SP,-21.8928341,-49.0226082
SP,01/05/2025 - Dia do Trabalho,Dia do Trabalho,,2025-05-01,Iacanga - SP,-21.8928341,-49.0226082
SP,21/04/2025 - Dia de Tiradentes,Dia de Tiradentes,,2025-04-21,Iacanga - SP,-21.8928341,-49.0226082
SP,18/04/2025 - Sexta-Feira Santa,Sexta-Feira Santa,,2025-04-18,Iacanga - SP,-21.8928341,-49.0226082
SP,15/04/2025 - Feriado Municipal,Feriado Municipal,,2025-04-15,Iacanga - SP,-21.8928341,-49.0226082
SP,01/01/2025 - Ano Novo,Ano Novo,,2025-01-01,Iacanga - SP,-21.8928341,-49.0226082
SP,25/12/2025 - Natal,Natal,,2025-12-25,Holambra - SP,-22.6303544,-47.0441224
SP,15/11/2025 - Proclamação da República,Proclamação da República,,2025-11-15,Holambra - SP,-22.6303544,-47.0441224
SP,02/11/2025 - Dia de Finados,Dia de Finados,,2025-11-02,Holambra - SP,-22.6303544,-47.0441224
SP,27/10/2025 - Aniversário de Holambra,Aniversário de Holambra,,2025-10-27,Holambra - SP,-22.6303544,-47.0441224
SP,12/10/2025 - Nossa Senhora Aparecida,Nossa Senhora Aparecida,,2025-10-12,Holambra - SP,-22.6303544,-47.0441224
SP,07/09/2025 - Independência do Brasil,Independência do Brasil,,2025-09-07,Holambra - SP,-22.6303544,-47.0441224
SP,09/07/2025 - Revolução Constitucionalista,Revolução Constitucionalista,,2025-07-09,Holambra - SP,-22.6303544,-47.0441224
SP,19/06/2025 - Corpus Christi,Corpus Christi,,2025-06-19,Holambra - SP,-22.6303544,-47.0441224
SP,25/05/2025 - Divino Esp. Santo,Divino Esp. Santo,,2025-05-25,Holambra - SP,-22.6303544,-47.0441224
SP,01/05/2025 - Dia do Trabalho,Dia do Trabalho,,2025-05-01,Holambra - SP,-22.6303544,-47.0441224
SP,21/04/2025 - Dia de Tiradentes,Dia de Tiradentes,,2025-04-21,Holambra - SP,-22.6303544,-47.0441224
SP,18/04/2025 - Sexta-Feira Santa,Sexta-Feira Santa,,2025-04-18,Holambra - SP,-22.6303544,-47.0441224
SP,18/04/2025 - Sexta-Feira Santa,Sexta-Feira Santa,,2025-04-18,Holambra - SP,-22.6303544,-47.0441224
SP,01/01/2025 - Ano Novo,Ano Novo,,2025-01-01,Holambra - SP,-22.6303544,-47.0441224
SP,25/12/2025 - Natal,Natal,,2025-12-25,Guarulhos - SP,-23.4588843,-46.5090214
SP,08/12/2025 - Aniversário de Guarulhos,Aniversário de Guarulhos,,2025-12-08,Guarulhos - SP,-23.4588843,-46.5090214
SP,20/11/2025 - Consciência Negra,Consciência Negra,,2025-11-20,Guarulhos - SP,-23.4588843,-46.5090214
SP,15/11/2025 - Proclamação da República,Proclamação da República,,2025-11-15,Guarulhos - SP,-23.4588843,-46.5090214
SP,02/11/2025 - Dia de Finados,Dia de Finados,,2025-11-02,Guarulhos - SP,-23.4588843,-46.5090214
SP,12/10/2025 - Nossa Senhora Aparecida,Nossa Senhora Aparecida,,2025-10-12,Guarulhos - SP,-23.4588843,-46.5090214
SP,07/09/2025 - Independência do Brasil,Independência do Brasil,,2025-09-07,Guarulhos - SP,-23.4588843,-46.5090214
SP,09/07/2025 - Revolução Constitucionalista,Revolução Constitucionalista,,2025-07-09,Guarulhos - SP,-23.4588843,-46.5090214
SP,01/05/2025 - Dia do Trabalho,Dia do Trabalho,,2025-05-01,Guarulhos - SP,-23.4588843,-46.5090214
SP,21/04/2025 - Dia de Tiradentes,Dia de Tiradentes,,2025-04-21,Guarulhos - SP,-23.4588843,-46.5090214
SP,18/04/2025 - Sexta-Feira Santa,Sexta-Feira Santa,,2025-04-18,Guarulhos - SP,-23.4588843,-46.5090214
SP,01/01/2025 - Ano Novo,Ano Novo,,2025-01-01,Guarulhos - SP,-23.4588843,-46.5090214
SP,25/12/2025 - Natal,Natal,,2025-12-25,Guariba - SP,-21.35938,-48.23158
SP,20/11/2025 - Dia da Consciência Negra,Dia da Consciência Negra,,2025-11-20,Guariba - SP,-21.35938,-48.23158
SP,15/11/2025 - Proclamação da República,Proclamação da República,,2025-11-15,Guariba - SP,-21.35938,-48.23158
SP,02/11/2025 - Dia de Finados,Dia de Finados,,2025-11-02,Guariba - SP,-21.35938,-48.23158
SP,12/10/2025 - Nossa Senhora Aparecida,Nossa Senhora Aparecida,,2025-10-12,Guariba - SP,-21.35938,-48.23158
SP,21/09/2025 - Feriado Municipal,Feriado Municipal,,2025-09-21,Guariba - SP,-21.35938,-48.23158
SP,07/09/2025 - Independência do Brasil,Independência do Brasil,,2025-09-07,Guariba - SP,-21.35938,-48.23158
SP,09/07/2025 - Revolução Constitucionalista,Revolução Constitucionalista,,2025-07-09,Guariba - SP,-21.35938,-48.23158
SP,01/05/2025 - Dia do Trabalho,Dia do Trabalho,,2025-05-01,Guariba - SP,-21.35938,-48.23158
SP,21/04/2025 - Dia de Tiradentes,Dia de Tiradentes,,2025-04-21,Guariba - SP,-21.35938,-48.23158
SP,18/04/2025 - Sexta-Feira Santa,Sexta-Feira Santa,,2025-04-18,Guariba - SP,-21.35938,-48.23158
SP,01/01/2025 - Ano Novo,Ano Novo,,2025-01-01,Guariba - SP,-21.35938,-48.23158
SP,25/12/2025 - Natal,Natal,,2025-12-25,Guararema - SP,-23.4120731,-46.0398158
SP,15/11/2025 - Proclamação da República,Proclamação da República,,2025-11-15,Guararema - SP,-23.4120731,-46.0398158
SP,02/11/2025 - Dia de Finados,Dia de Finados,,2025-11-02,Guararema - SP,-23.4120731,-46.0398158
SP,12/10/2025 - Nossa Senhora Aparecida,Nossa Senhora Aparecida,,2025-10-12,Guararema - SP,-23.4120731,-46.0398158
SP,19/09/2025 - Feriado Municipal,Feriado Municipal,,2025-09-19,Guararema - SP,-23.4120731,-46.0398158
SP,07/09/2025 - Independência do Brasil,Independência do Brasil,,2025-09-07,Guararema - SP,-23.4120731,-46.0398158
SP,09/07/2025 - Revolução Constitucionalista,Revolução Constitucionalista,,2025-07-09,Guararema - SP,-23.4120731,-46.0398158
SP,01/05/2025 - Dia do Trabalho,Dia do Trabalho,,2025-05-01,Guararema - SP,-23.4120731,-46.0398158
SP,21/04/2025 - Dia de Tiradentes,Dia de Tiradentes,,2025-04-21,Guararema - SP,-23.4120731,-46.0398158
SP,18/04/2025 - Sexta-Feira Santa,Sexta-Feira Santa,,2025-04-18,Guararema - SP,-23.4120731,-46.0398158
SP,01/01/2025 - Ano Novo,Ano Novo,,2025-01-01,Guararema - SP,-23.4120731,-46.0398158
SP,25/12/2025 - Natal,Natal,,2025-12-25,Guararapes - SP,-21.2604949,-50.6353758
SP,08/12/2025 - Feriado Municipal,Feriado Municipal,,2025-12-08,Guararapes - SP,-21.2604949,-50.6353758
SP,20/11/2025 - Dia da Consciência Negra,Dia da Consciência Negra,,2025-11-20,Guararapes - SP,-21.2604949,-50.6353758
SP,15/11/2025 - Proclamação da República,Proclamação da República,,2025-11-15,Guararapes - SP,-21.2604949,-50.6353758
SP,02/11/2025 - Dia de Finados,Dia de Finados,,2025-11-02,Guararapes - SP,-21.2604949,-50.6353758
SP,12/10/2025 - Nossa Senhora Aparecida,Nossa Senhora Aparecida,,2025-10-12,Guararapes - SP,-21.2604949,-50.6353758
SP,07/09/2025 - Independência do Brasil,Independência do Brasil,,2025-09-07,Guararapes - SP,-21.2604949,-50.6353758
SP,09/07/2025 - Revolução Constitucionalista,Revolução Constitucionalista,,2025-07-09,Guararapes - SP,-21.2604949,-50.6353758
SP,29/06/2025 - Feriado Municipal,Feriado Municipal,,2025-06-29,Guararapes - SP,-21.2604949,-50.6353758
SP,01/05/2025 - Dia do Trabalho,Dia do Trabalho,,2025-05-01,Guararapes - SP,-21.2604949,-50.6353758
SP,21/04/2025 - Dia de Tiradentes,Dia de Tiradentes,,2025-04-21,Guararapes - SP,-21.2604949,-50.6353758
SP,18/04/2025 - Sexta-Feira Santa,Sexta-Feira Santa,,2025-04-18,Guararapes - SP,-21.2604949,-50.6353758
SP,01/01/2025 - Ano Novo,Ano Novo,,2025-01-01,Guararapes - SP,-21.2604949,-50.6353758
SP,25/12/2025 - Natal,Natal,,2025-12-25,Guaraci - SP,-20.4976771,-48.9452074
SP,30/11/2025 - Feriado Municipal,Feriado Municipal,,2025-11-30,Guaraci - SP,-20.4976771,-48.9452074
SP,20/11/2025 - Dia da Consciência Negra,Dia da Consciência Negra,,2025-11-20,Guaraci - SP,-20.4976771,-48.9452074
SP,15/11/2025 - Proclamação da República,Proclamação da República,,2025-11-15,Guaraci - SP,-20.4976771,-48.9452074
SP,02/11/2025 - Dia de Finados,Dia de Finados,,2025-11-02,Guaraci - SP,-20.4976771,-48.9452074
SP,12/10/2025 - Nossa Senhora Aparecida,Nossa Senhora Aparecida,,2025-10-12,Guaraci - SP,-20.4976771,-48.9452074
SP,07/09/2025 - Independência do Brasil,Independência do Brasil,,2025-09-07,Guaraci - SP,-20.4976771,-48.9452074
SP,06/08/2025 - Feriado Municipal,Feriado Municipal,,2025-08-06,Guaraci - SP,-20.4976771,-48.9452074
SP,09/07/2025 - Revolução Constitucionalista,Revolução Constitucionalista,,2025-07-09,Guaraci - SP,-20.4976771,-48.9452074
SP,01/05/2025 - Dia do Trabalho,Dia do Trabalho,,2025-05-01,Guaraci - SP,-20.4976771,-48.9452074
SP,21/04/2025 - Dia de Tiradentes,Dia de Tiradentes,,2025-04-21,Guaraci - SP,-20.4976771,-48.9452074
SP,18/04/2025 - Sexta-Feira Santa,Sexta-Feira Santa,,2025-04-18,Guaraci - SP,-20.4976771,-48.9452074
SP,20/01/2025 - Feriado Municipal,Feriado Municipal,,2025-01-20,Guaraci - SP,-20.4976771,-48.9452074
SP,01/01/2025 - Ano Novo,Ano Novo,,2025-01-01,Guaraci - SP,-20.4976771,-48.9452074
SP,25/12/2025 - Natal,Natal,,2025-12-25,Guapiara - SP,-24.1922548,-48.5297628
SP,24/12/2025 - Elevação a Município,Elevação a Município,,2025-12-24,Guapiara - SP,-24.1922548,-48.5297628
SP,20/11/2025 - Dia da Consciência Negra,Dia da Consciência Negra,,2025-11-20,Guapiara - SP,-24.1922548,-48.5297628
SP,15/11/2025 - Proclamação da República,Proclamação da República,,2025-11-15,Guapiara - SP,-24.1922548,-48.5297628
SP,02/11/2025 - Dia de Finados,Dia de Finados,,2025-11-02,Guapiara - SP,-24.1922548,-48.5297628
SP,12/10/2025 - Nossa Senhora Aparecida,Nossa Senhora Aparecida,,2025-10-12,Guapiara - SP,-24.1922548,-48.5297628
SP,07/09/2025 - Independência do Brasil,Independência do Brasil,,2025-09-07,Guapiara - SP,-24.1922548,-48.5297628
SP,09/07/2025 - Revolução Constitucionalista,Revolução Constitucionalista,,2025-07-09,Guapiara - SP,-24.1922548,-48.5297628
SP,02/05/2025 - Aniversário da Cidade,Aniversário da Cidade,,2025-05-02,Guapiara - SP,-24.1922548,-48.5297628
SP,01/05/2025 - Dia do Trabalho,Dia do Trabalho,,2025-05-01,Guapiara - SP,-24.1922548,-48.5297628
SP,21/04/2025 - Dia de Tiradentes,Dia de Tiradentes,,2025-04-21,Guapiara - SP,-24.1922548,-48.5297628
SP,18/04/2025 - Sexta-Feira Santa,Sexta-Feira Santa,,2025-04-18,Guapiara - SP,-24.1922548,-48.5297628
SP,19/03/2025 - Dia de São José,Dia de São José,,2025-03-19,Guapiara - SP,-24.1922548,-48.5297628
SP,01/01/2025 - Ano Novo,Ano Novo,,2025-01-01,Guapiara - SP,-24.1922548,-48.5297628
SP,25/12/2025 - Natal,Natal,,2025-12-25,Engenheiro Coelho - SP,-22.4900563,-47.1673316
SP,20/11/2025 - Dia da Consciência Negra,Dia da Consciência Negra,,2025-11-20,Engenheiro Coelho - SP,-22.4900563,-47.1673316
SP,15/11/2025 - Proclamação da República,Proclamação da República,,2025-11-15,Engenheiro Coelho - SP,-22.4900563,-47.1673316
SP,02/11/2025 - Dia de Finados,Dia de Finados,,2025-11-02,Engenheiro Coelho - SP,-22.4900563,-47.1673316
SP,12/10/2025 - Nossa Senhora Aparecida,Nossa Senhora Aparecida,,2025-10-12,Engenheiro Coelho - SP,-22.4900563,-47.1673316
SP,07/09/2025 - Independência do Brasil,Independência do Brasil,,2025-09-07,Engenheiro Coelho - SP,-22.4900563,-47.1673316
SP,09/07/2025 - Revolução Constitucionalista,Revolução Constitucionalista,,2025-07-09,Engenheiro Coelho - SP,-22.4900563,-47.1673316
SP,29/06/2025 - Dia de São Pedro,Dia de São Pedro,,2025-06-29,Engenheiro Coelho - SP,-22.4900563,-47.1673316
SP,19/05/2025 - Aniversário da Cidade,Aniversário da Cidade,,2025-05-19,Engenheiro Coelho - SP,-22.4900563,-47.1673316
SP,01/05/2025 - Dia do Trabalho,Dia do Trabalho,,2025-05-01,Engenheiro Coelho - SP,-22.4900563,-47.1673316
SP,21/04/2025 - Dia de Tiradentes,Dia de Tiradentes,,2025-04-21,Engenheiro Coelho - SP,-22.4900563,-47.1673316
SP,18/04/2025 - Sexta-Feira Santa,Sexta-Feira Santa,,2025-04-18,Engenheiro Coelho - SP,-22.4900563,-47.1673316
SP,01/01/2025 - Ano Novo,Ano Novo,,2025-01-01,Engenheiro Coelho - SP,-22.4900563,-47.1673316
SP,25/12/2025 - Natal,Natal,,2025-12-25,Coroados - SP,-21.3334506,-50.2991716
SP,15/11/2025 - Proclamação da República,Proclamação da República,,2025-11-15,Coroados - SP,-21.3334506,-50.2991716
SP,02/11/2025 - Dia de Finados,Dia de Finados,,2025-11-02,Coroados - SP,-21.3334506,-50.2991716
SP,12/10/2025 - Nossa Senhora Aparecida,Nossa Senhora Aparecida,,2025-10-12,Coroados - SP,-21.3334506,-50.2991716
SP,07/09/2025 - Independência do Brasil,Independência do Brasil,,2025-09-07,Coroados - SP,-21.3334506,-50.2991716
SP,09/07/2025 - Revolução Constitucionalista,Revolução Constitucionalista,,2025-07-09,Coroados - SP,-21.3334506,-50.2991716
SP,13/06/2025 - Dia de Santo Antônio,Dia de Santo Antônio,,2025-06-13,Coroados - SP,-21.3334506,-50.2991716
SP,01/05/2025 - Dia do Trabalho,Dia do Trabalho,,2025-05-01,Coroados - SP,-21.3334506,-50.2991716
SP,21/04/2025 - Dia de Tiradentes,Dia de Tiradentes,,2025-04-21,Coroados - SP,-21.3334506,-50.2991716
SP,18/04/2025 - Sexta-Feira Santa,Sexta-Feira Santa,,2025-04-18,Coroados - SP,-21.3334506,-50.2991716
SP,20/01/2025 - Feriado Municipal,Feriado Municipal,,2025-01-20,Coroados - SP,-21.3334506,-50.2991716
SP,01/01/2025 - Ano Novo,Ano Novo,,2025-01-01,Coroados - SP,-21.3334506,-50.2991716
SP,25/12/2025 - Natal,Natal,,2025-12-25,Conchas - SP,-23.0246775,-48.0062166
SP,04/12/2025 - Feriado Municipal,Feriado Municipal,,2025-12-04,Conchas - SP,-23.0246775,-48.0062166
SP,15/11/2025 - Proclamação da República,Proclamação da República,,2025-11-15,Conchas - SP,-23.0246775,-48.0062166
SP,02/11/2025 - Dia de Finados,Dia de Finados,,2025-11-02,Conchas - SP,-23.0246775,-48.0062166
SP,12/10/2025 - Nossa Senhora Aparecida,Nossa Senhora Aparecida,,2025-10-12,Conchas - SP,-23.0246775,-48.0062166
SP,07/09/2025 - Independência do Brasil,Independência do Brasil,,2025-09-07,Conchas - SP,-23.0246775,-48.0062166
SP,06/08/2025 - Feriado Municipal,Feriado Municipal,,2025-08-06,Conchas - SP,-23.0246775,-48.0062166
SP,09/07/2025 - Revolução Constitucionalista,Revolução Constitucionalista,,2025-07-09,Conchas - SP,-23.0246775,-48.0062166
SP,13/06/2025 - Dia de Santo Antônio,Dia de Santo Antônio,,2025-06-13,Conchas - SP,-23.0246775,-48.0062166
SP,01/05/2025 - Dia do Trabalho,Dia do Trabalho,,2025-05-01,Conchas - SP,-23.0246775,-48.0062166
SP,21/04/2025 - Dia de Tiradentes,Dia de Tiradentes,,2025-04-21,Conchas - SP,-23.0246775,-48.0062166
SP,18/04/2025 - Sexta-Feira Santa,Sexta-Feira Santa,,2025-04-18,Conchas - SP,-23.0246775,-48.0062166
SP,01/01/2025 - Ano Novo,Ano Novo,,2025-01-01,Conchas - SP,-23.0246775,-48.0062166
SP,25/12/2025 - Natal,Natal,,2025-12-25,Conchal - SP,-22.337512,-47.172927
SP,15/11/2025 - Proclamação da República,Proclamação da República,,2025-11-15,Conchal - SP,-22.337512,-47.172927
SP,02/11/2025 - Dia de Finados,Dia de Finados,,2025-11-02,Conchal - SP,-22.337512,-47.172927
SP,12/10/2025 - Nossa Senhora Aparecida,Nossa Senhora Aparecida,,2025-10-12,Conchal - SP,-22.337512,-47.172927
SP,07/09/2025 - Independência do Brasil,Independência do Brasil,,2025-09-07,Conchal - SP,-22.337512,-47.172927
SP,09/07/2025 - Revolução Constitucionalista,Revolução Constitucionalista,,2025-07-09,Conchal - SP,-22.337512,-47.172927
SP,01/05/2025 - Dia do Trabalho,Dia do Trabalho,,2025-05-01,Conchal - SP,-22.337512,-47.172927
SP,21/04/2025 - Dia de Tiradentes,Dia de Tiradentes,,2025-04-21,Conchal - SP,-22.337512,-47.172927
SP,18/04/2025 - Sexta-Feira Santa,Sexta-Feira Santa,,2025-04-18,Conchal - SP,-22.337512,-47.172927
SP,09/04/2025 - Feriado Municipal,Feriado Municipal,,2025-04-09,Conchal - SP,-22.337512,-47.172927
SP,01/01/2025 - Ano Novo,Ano Novo,,2025-01-01,Conchal - SP,-22.337512,-47.172927
SP,25/12/2025 - Natal,Natal,,2025-12-25,Colina - SP,-20.711443,-48.53867
SP,08/12/2025 - Feriado Municipal,Feriado Municipal,,2025-12-08,Colina - SP,-20.711443,-48.53867
SP,20/11/2025 - Consciência Negra,Consciência Negra,,2025-11-20,Colina - SP,-20.711443,-48.53867
SP,15/11/2025 - Proclamação da República,Proclamação da República,,2025-11-15,Colina - SP,-20.711443,-48.53867
SP,02/11/2025 - Dia de Finados,Dia de Finados,,2025-11-02,Colina - SP,-20.711443,-48.53867
SP,12/10/2025 - Nossa Senhora Aparecida,Nossa Senhora Aparecida,,2025-10-12,Colina - SP,-20.711443,-48.53867
SP,07/09/2025 - Independência do Brasil,Independência do Brasil,,2025-09-07,Colina - SP,-20.711443,-48.53867
SP,09/07/2025 - Revolução Constitucionalista,Revolução Constitucionalista,,2025-07-09,Colina - SP,-20.711443,-48.53867
SP,19/06/2025 - Corpus Christi,Corpus Christi,,2025-06-19,Colina - SP,-20.711443,-48.53867
SP,01/05/2025 - Dia do Trabalho,Dia do Trabalho,,2025-05-01,Colina - SP,-20.711443,-48.53867
SP,21/04/2025 - Dia de Tiradentes,Dia de Tiradentes,,2025-04-21,Colina - SP,-20.711443,-48.53867
SP,18/04/2025 - Sexta-Feira Santa,Sexta-Feira Santa,,2025-04-18,Colina - SP,-20.711443,-48.53867
SP,18/04/2025 - Sexta-Feira Santa,Sexta-Feira Santa,,2025-04-18,Colina - SP,-20.711443,-48.53867
SP,19/03/2025 - São José,São José,,2025-03-19,Colina - SP,-20.711443,-48.53867
SP,01/01/2025 - Ano Novo,Ano Novo,,2025-01-01,Colina - SP,-20.711443,-48.53867
SP,25/12/2025 - Natal,Natal,,2025-12-25,Clementina - SP,-21.5136294,-50.4554105
SP,20/11/2025 - Dia da Consciência Negra,Dia da Consciência Negra,,2025-11-20,Clementina - SP,-21.5136294,-50.4554105
SP,15/11/2025 - Proclamação da República,Proclamação da República,,2025-11-15,Clementina - SP,-21.5136294,-50.4554105
SP,02/11/2025 - Dia de Finados,Dia de Finados,,2025-11-02,Clementina - SP,-21.5136294,-50.4554105
SP,12/10/2025 - Nossa Senhora Aparecida,Nossa Senhora Aparecida,,2025-10-12,Clementina - SP,-21.5136294,-50.4554105
SP,07/09/2025 - Independência do Brasil,Independência do Brasil,,2025-09-07,Clementina - SP,-21.5136294,-50.4554105
SP,09/07/2025 - Revolução Constitucionalista,Revolução Constitucionalista,,2025-07-09,Clementina - SP,-21.5136294,-50.4554105
SP,24/06/2025 - Feriado Municipal,Feriado Municipal,,2025-06-24,Clementina - SP,-21.5136294,-50.4554105
SP,01/05/2025 - Dia do Trabalho,Dia do Trabalho,,2025-05-01,Clementina - SP,-21.5136294,-50.4554105
SP,21/04/2025 - Dia de Tiradentes,Dia de Tiradentes,,2025-04-21,Clementina - SP,-21.5136294,-50.4554105
SP,18/04/2025 - Sexta-Feira Santa,Sexta-Feira Santa,,2025-04-18,Clementina - SP,-21.5136294,-50.4554105
SP,01/01/2025 - Ano Novo,Ano Novo,,2025-01-01,Clementina - SP,-21.5136294,-50.4554105
SP,25/12/2025 - Natal,Natal,,2025-12-25,Chavantes - SP,-23.0406405,-49.7071698
SP,04/12/2025 - Feriado Municipal,Feriado Municipal,,2025-12-04,Chavantes - SP,-23.0406405,-49.7071698
SP,20/11/2025 - Dia da Consciência Negra,Dia da Consciência Negra,,2025-11-20,Chavantes - SP,-23.0406405,-49.7071698
SP,15/11/2025 - Proclamação da República,Proclamação da República,,2025-11-15,Chavantes - SP,-23.0406405,-49.7071698
SP,02/11/2025 - Dia de Finados,Dia de Finados,,2025-11-02,Chavantes - SP,-23.0406405,-49.7071698
SP,12/10/2025 - Nossa Senhora Aparecida,Nossa Senhora Aparecida,,2025-10-12,Chavantes - SP,-23.0406405,-49.7071698
SP,07/09/2025 - Independência do Brasil,Independência do Brasil,,2025-09-07,Chavantes - SP,-23.0406405,-49.7071698
SP,09/07/2025 - Revolução Constitucionalista,Revolução Constitucionalista,,2025-07-09,Chavantes - SP,-23.0406405,-49.7071698
SP,01/05/2025 - Dia do Trabalho,Dia do Trabalho,,2025-05-01,Chavantes - SP,-23.0406405,-49.7071698
SP,21/04/2025 - Dia de Tiradentes,Dia de Tiradentes,,2025-04-21,Chavantes - SP,-23.0406405,-49.7071698
SP,18/04/2025 - Sexta-Feira Santa,Sexta-Feira Santa,,2025-04-18,Chavantes - SP,-23.0406405,-49.7071698
SP,01/01/2025 - Ano Novo,Ano Novo,,2025-01-01,Chavantes - SP,-23.0406405,-49.7071698
SP,25/12/2025 - Natal,Natal,,2025-12-25,Charqueada - SP,-22.5111799,-47.7754423
SP,08/12/2025 - Feriado Municipal,Feriado Municipal,,2025-12-08,Charqueada - SP,-22.5111799,-47.7754423
SP,20/11/2025 - Dia da Consciência Negra,Dia da Consciência Negra,,2025-11-20,Charqueada - SP,-22.5111799,-47.7754423
SP,15/11/2025 - Proclamação da República,Proclamação da República,,2025-11-15,Charqueada - SP,-22.5111799,-47.7754423
SP,02/11/2025 - Dia de Finados,Dia de Finados,,2025-11-02,Charqueada - SP,-22.5111799,-47.7754423
SP,12/10/2025 - Nossa Senhora Aparecida,Nossa Senhora Aparecida,,2025-10-12,Charqueada - SP,-22.5111799,-47.7754423
SP,07/09/2025 - Independência do Brasil,Independência do Brasil,,2025-09-07,Charqueada - SP,-22.5111799,-47.7754423
SP,09/07/2025 - Revolução Constitucionalista,Revolução Constitucionalista,,2025-07-09,Charqueada - SP,-22.5111799,-47.7754423
SP,01/05/2025 - Dia do Trabalho,Dia do Trabalho,,2025-05-01,Charqueada - SP,-22.5111799,-47.7754423
SP,21/04/2025 - Dia de Tiradentes,Dia de Tiradentes,,2025-04-21,Charqueada - SP,-22.5111799,-47.7754423
SP,18/04/2025 - Sexta-Feira Santa,Sexta-Feira Santa,,2025-04-18,Charqueada - SP,-22.5111799,-47.7754423
SP,01/01/2025 - Ano Novo,Ano Novo,,2025-01-01,Charqueada - SP,-22.5111799,-47.7754423
SP,25/12/2025 - Natal,Natal,,2025-12-25,Cerquilho - SP,-23.1654097,-47.7350779
SP,15/11/2025 - Proclamação da República,Proclamação da República,,2025-11-15,Cerquilho - SP,-23.1654097,-47.7350779
SP,02/11/2025 - Dia de Finados,Dia de Finados,,2025-11-02,Cerquilho - SP,-23.1654097,-47.7350779
SP,12/10/2025 - Nossa Senhora Aparecida,Nossa Senhora Aparecida,,2025-10-12,Cerquilho - SP,-23.1654097,-47.7350779
SP,07/09/2025 - Independência do Brasil,Independência do Brasil,,2025-09-07,Cerquilho - SP,-23.1654097,-47.7350779
SP,09/07/2025 - Revolução Constitucionalista,Revolução Constitucionalista,,2025-07-09,Cerquilho - SP,-23.1654097,-47.7350779
SP,01/05/2025 - Dia do Trabalho,Dia do Trabalho,,2025-05-01,Cerquilho - SP,-23.1654097,-47.7350779
SP,21/04/2025 - Dia de Tiradentes,Dia de Tiradentes,,2025-04-21,Cerquilho - SP,-23.1654097,-47.7350779
SP,18/04/2025 - Sexta-Feira Santa,Sexta-Feira Santa,,2025-04-18,Cerquilho - SP,-23.1654097,-47.7350779
SP,03/04/2025 - Feriado Municipal,Feriado Municipal,,2025-04-03,Cerquilho - SP,-23.1654097,-47.7350779
SP,19/03/2025 - São José,São José,,2025-03-19,Cerquilho - SP,-23.1654097,-47.7350779
SP,01/01/2025 - Ano Novo,Ano Novo,,2025-01-01,Cerquilho - SP,-23.1654097,-47.7350779
SP,25/12/2025 - Natal,Natal,,2025-12-25,Cedral - SP,-20.906284,-49.2666994
SP,08/12/2025 - Feriado Municipal,Feriado Municipal,,2025-12-08,Cedral - SP,-20.906284,-49.2666994
SP,15/11/2025 - Proclamação da República,Proclamação da República,,2025-11-15,Cedral - SP,-20.906284,-49.2666994
SP,02/11/2025 - Dia de Finados,Dia de Finados,,2025-11-02,Cedral - SP,-20.906284,-49.2666994
SP,12/10/2025 - Nossa Senhora Aparecida,Nossa Senhora Aparecida,,2025-10-12,Cedral - SP,-20.906284,-49.2666994
SP,07/09/2025 - Independência do Brasil,Independência do Brasil,,2025-09-07,Cedral - SP,-20.906284,-49.2666994
SP,09/07/2025 - Revolução Constitucionalista,Revolução Constitucionalista,,2025-07-09,Cedral - SP,-20.906284,-49.2666994
SP,21/06/2025 - Feriado Municipal,Feriado Municipal,,2025-06-21,Cedral - SP,-20.906284,-49.2666994
SP,01/05/2025 - Dia do Trabalho,Dia do Trabalho,,2025-05-01,Cedral - SP,-20.906284,-49.2666994
SP,21/04/2025 - Dia de Tiradentes,Dia de Tiradentes,,2025-04-21,Cedral - SP,-20.906284,-49.2666994
SP,18/04/2025 - Sexta-Feira Santa,Sexta-Feira Santa,,2025-04-18,Cedral - SP,-20.906284,-49.2666994
SP,01/01/2025 - Ano Novo,Ano Novo,,2025-01-01,Cedral - SP,-20.906284,-49.2666994
SP,25/12/2025 - Natal,Natal,,2025-12-25,Catanduva - SP,-21.143887,-48.97519
SP,15/11/2025 - Proclamação da República,Proclamação da República,,2025-11-15,Catanduva - SP,-21.143887,-48.97519
SP,02/11/2025 - Dia de Finados,Dia de Finados,,2025-11-02,Catanduva - SP,-21.143887,-48.97519
SP,12/10/2025 - Nossa Senhora Aparecida,Nossa Senhora Aparecida,,2025-10-12,Catanduva - SP,-21.143887,-48.97519
SP,07/09/2025 - Independência do Brasil,Independência do Brasil,,2025-09-07,Catanduva - SP,-21.143887,-48.97519
SP,08/08/2025 - São Domingos,São Domingos,,2025-08-08,Catanduva - SP,-21.143887,-48.97519
SP,09/07/2025 - Revolução Constitucionalista,Revolução Constitucionalista,,2025-07-09,Catanduva - SP,-21.143887,-48.97519
SP,01/05/2025 - Dia do Trabalho,Dia do Trabalho,,2025-05-01,Catanduva - SP,-21.143887,-48.97519
SP,21/04/2025 - Dia de Tiradentes,Dia de Tiradentes,,2025-04-21,Catanduva - SP,-21.143887,-48.97519
SP,18/04/2025 - Sexta-Feira Santa,Sexta-Feira Santa,,2025-04-18,Catanduva - SP,-21.143887,-48.97519
SP,14/04/2025 - Aniversário do município,Aniversário do município,,2025-04-14,Catanduva - SP,-21.143887,-48.97519
SP,01/01/2025 - Ano Novo,Ano Novo,,2025-01-01,Catanduva - SP,-21.143887,-48.97519
SP,25/12/2025 - Natal,Natal,,2025-12-25,Castilho - SP,-23.5412077,-47.4267121
SP,15/11/2025 - Proclamação da República,Proclamação da República,,2025-11-15,Castilho - SP,-23.5412077,-47.4267121
SP,02/11/2025 - Dia de Finados,Dia de Finados,,2025-11-02,Castilho - SP,-23.5412077,-47.4267121
SP,12/10/2025 - Nossa Senhora Aparecida,Nossa Senhora Aparecida,,2025-10-12,Castilho - SP,-23.5412077,-47.4267121
SP,07/09/2025 - Independência do Brasil,Independência do Brasil,,2025-09-07,Castilho - SP,-23.5412077,-47.4267121
SP,10/08/2025 - Feriado Municipal,Feriado Municipal,,2025-08-10,Castilho - SP,-23.5412077,-47.4267121
SP,09/07/2025 - Revolução Constitucionalista,Revolução Constitucionalista,,2025-07-09,Castilho - SP,-23.5412077,-47.4267121
SP,01/05/2025 - Dia do Trabalho,Dia do Trabalho,,2025-05-01,Castilho - SP,-23.5412077,-47.4267121
SP,21/04/2025 - Dia de Tiradentes,Dia de Tiradentes,,2025-04-21,Castilho - SP,-23.5412077,-47.4267121
SP,18/04/2025 - Sexta-Feira Santa,Sexta-Feira Santa,,2025-04-18,Castilho - SP,-23.5412077,-47.4267121
SP,19/03/2025 - São José,São José,,2025-03-19,Castilho - SP,-23.5412077,-47.4267121
SP,01/01/2025 - Ano Novo,Ano Novo,,2025-01-01,Castilho - SP,-23.5412077,-47.4267121
SP,25/12/2025 - Natal,Natal,,2025-12-25,Casa Branca - SP,-21.7772861,-47.0710051
SP,15/11/2025 - Proclamação da República,Proclamação da República,,2025-11-15,Casa Branca - SP,-21.7772861,-47.0710051
SP,02/11/2025 - Dia de Finados,Dia de Finados,,2025-11-02,Casa Branca - SP,-21.7772861,-47.0710051
SP,12/10/2025 - Nossa Senhora Aparecida,Nossa Senhora Aparecida,,2025-10-12,Casa Branca - SP,-21.7772861,-47.0710051
SP,15/09/2025 - Feriado Municipal,Feriado Municipal,,2025-09-15,Casa Branca - SP,-21.7772861,-47.0710051
SP,07/09/2025 - Independência do Brasil,Independência do Brasil,,2025-09-07,Casa Branca - SP,-21.7772861,-47.0710051
SP,09/07/2025 - Revolução Constitucionalista,Revolução Constitucionalista,,2025-07-09,Casa Branca - SP,-21.7772861,-47.0710051
SP,01/05/2025 - Dia do Trabalho,Dia do Trabalho,,2025-05-01,Casa Branca - SP,-21.7772861,-47.0710051
SP,21/04/2025 - Dia de Tiradentes,Dia de Tiradentes,,2025-04-21,Casa Branca - SP,-21.7772861,-47.0710051
SP,18/04/2025 - Sexta-Feira Santa,Sexta-Feira Santa,,2025-04-18,Casa Branca - SP,-21.7772861,-47.0710051
SP,01/01/2025 - Ano Novo,Ano Novo,,2025-01-01,Casa Branca - SP,-21.7772861,-47.0710051
SP,25/12/2025 - Natal,Natal,,2025-12-25,Cardoso - SP,-22.9507332,-45.4641503
SP,20/11/2025 - Dia da Consciência Negra,Dia da Consciência Negra,,2025-11-20,Cardoso - SP,-22.9507332,-45.4641503
SP,15/11/2025 - Proclamação da República,Proclamação da República,,2025-11-15,Cardoso - SP,-22.9507332,-45.4641503
SP,02/11/2025 - Dia de Finados,Dia de Finados,,2025-11-02,Cardoso - SP,-22.9507332,-45.4641503
SP,12/10/2025 - Nossa Senhora Aparecida,Nossa Senhora Aparecida,,2025-10-12,Cardoso - SP,-22.9507332,-45.4641503
SP,07/09/2025 - Independência do Brasil,Independência do Brasil,,2025-09-07,Cardoso - SP,-22.9507332,-45.4641503
SP,09/07/2025 - Revolução Constitucionalista,Revolução Constitucionalista,,2025-07-09,Cardoso - SP,-22.9507332,-45.4641503
SP,01/05/2025 - Dia do Trabalho,Dia do Trabalho,,2025-05-01,Cardoso - SP,-22.9507332,-45.4641503
SP,21/04/2025 - Dia de Tiradentes,Dia de Tiradentes,,2025-04-21,Cardoso - SP,-22.9507332,-45.4641503
SP,18/04/2025 - Sexta-Feira Santa,Sexta-Feira Santa,,2025-04-18,Cardoso - SP,-22.9507332,-45.4641503
SP,20/01/2025 - Feriado Municipal,Feriado Municipal,,2025-01-20,Cardoso - SP,-22.9507332,-45.4641503
SP,01/01/2025 - Ano Novo,Ano Novo,,2025-01-01,Cardoso - SP,-22.9507332,-45.4641503
SP,25/12/2025 - Natal,Natal,,2025-12-25,Caraguatatuba - SP,-23.6814497,-45.4345116
SP,20/11/2025 - Consciência Negra,Consciência Negra,,2025-11-20,Caraguatatuba - SP,-23.6814497,-45.4345116
SP,15/11/2025 - Proclamação da República,Proclamação da República,,2025-11-15,Caraguatatuba - SP,-23.6814497,-45.4345116
SP,02/11/2025 - Dia de Finados,Dia de Finados,,2025-11-02,Caraguatatuba - SP,-23.6814497,-45.4345116
SP,12/10/2025 - Nossa Senhora Aparecida,Nossa Senhora Aparecida,,2025-10-12,Caraguatatuba - SP,-23.6814497,-45.4345116
SP,07/09/2025 - Independência do Brasil,Independência do Brasil,,2025-09-07,Caraguatatuba - SP,-23.6814497,-45.4345116
SP,09/07/2025 - Revolução Constitucionalista,Revolução Constitucionalista,,2025-07-09,Caraguatatuba - SP,-23.6814497,-45.4345116
SP,19/06/2025 - Corpus Christi,Corpus Christi,,2025-06-19,Caraguatatuba - SP,-23.6814497,-45.4345116
SP,13/06/2025 - Padroeiro,Padroeiro,,2025-06-13,Caraguatatuba - SP,-23.6814497,-45.4345116
SP,01/05/2025 - Dia do Trabalho,Dia do Trabalho,,2025-05-01,Caraguatatuba - SP,-23.6814497,-45.4345116
SP,21/04/2025 - Dia de Tiradentes,Dia de Tiradentes,,2025-04-21,Caraguatatuba - SP,-23.6814497,-45.4345116
SP,20/04/2025 - Aniversário,Aniversário,,2025-04-20,Caraguatatuba - SP,-23.6814497,-45.4345116
SP,18/04/2025 - Sexta-feira da Paixão,Sexta-feira da Paixão,,2025-04-18,Caraguatatuba - SP,-23.6814497,-45.4345116
SP,18/04/2025 - Sexta-Feira Santa,Sexta-Feira Santa,,2025-04-18,Caraguatatuba - SP,-23.6814497,-45.4345116
SP,01/01/2025 - Ano Novo,Ano Novo,,2025-01-01,Caraguatatuba - SP,-23.6814497,-45.4345116
SP,25/12/2025 - Natal,Natal,,2025-12-25,Capivari - SP,-23.0051771,-47.5191771
SP,20/11/2025 - Dia da Consciência Negra,Dia da Consciência Negra,,2025-11-20,Capivari - SP,-23.0051771,-47.5191771
SP,15/11/2025 - Proclamação da República,Proclamação da República,,2025-11-15,Capivari - SP,-23.0051771,-47.5191771
SP,02/11/2025 - Dia de Finados,Dia de Finados,,2025-11-02,Capivari - SP,-23.0051771,-47.5191771
SP,12/10/2025 - Nossa Senhora Aparecida,Nossa Senhora Aparecida,,2025-10-12,Capivari - SP,-23.0051771,-47.5191771
SP,07/09/2025 - Independência do Brasil,Independência do Brasil,,2025-09-07,Capivari - SP,-23.0051771,-47.5191771
SP,09/07/2025 - Revolução Constitucionalista,Revolução Constitucionalista,,2025-07-09,Capivari - SP,-23.0051771,-47.5191771
SP,24/06/2025 - Feriado Municipal,Feriado Municipal,,2025-06-24,Capivari - SP,-23.0051771,-47.5191771
SP,01/05/2025 - Dia do Trabalho,Dia do Trabalho,,2025-05-01,Capivari - SP,-23.0051771,-47.5191771
SP,21/04/2025 - Dia de Tiradentes,Dia de Tiradentes,,2025-04-21,Capivari - SP,-23.0051771,-47.5191771
SP,18/04/2025 - Sexta-Feira Santa,Sexta-Feira Santa,,2025-04-18,Capivari - SP,-23.0051771,-47.5191771
SP,01/01/2025 - Ano Novo,Ano Novo,,2025-01-01,Capivari - SP,-23.0051771,-47.5191771
SP,25/12/2025 - Natal,Natal,,2025-12-25,Capela do Alto - SP,-23.5365662,-47.7163964
SP,15/11/2025 - Proclamação da República,Proclamação da República,,2025-11-15,Capela do Alto - SP,-23.5365662,-47.7163964
SP,02/11/2025 - Dia de Finados,Dia de Finados,,2025-11-02,Capela do Alto - SP,-23.5365662,-47.7163964
SP,12/10/2025 - Nossa Senhora Aparecida,Nossa Senhora Aparecida,,2025-10-12,Capela do Alto - SP,-23.5365662,-47.7163964
SP,07/09/2025 - Independência do Brasil,Independência do Brasil,,2025-09-07,Capela do Alto - SP,-23.5365662,-47.7163964
SP,09/07/2025 - Revolução Constitucionalista,Revolução Constitucionalista,,2025-07-09,Capela do Alto - SP,-23.5365662,-47.7163964
SP,29/05/2025 - Feriado Municipal,Feriado Municipal,,2025-05-29,Capela do Alto - SP,-23.5365662,-47.7163964
SP,01/05/2025 - Dia do Trabalho,Dia do Trabalho,,2025-05-01,Capela do Alto - SP,-23.5365662,-47.7163964
SP,21/04/2025 - Dia de Tiradentes,Dia de Tiradentes,,2025-04-21,Capela do Alto - SP,-23.5365662,-47.7163964
SP,18/04/2025 - Sexta-Feira Santa,Sexta-Feira Santa,,2025-04-18,Capela do Alto - SP,-23.5365662,-47.7163964
SP,26/03/2025 - Feriado Municipal,Feriado Municipal,,2025-03-26,Capela do Alto - SP,-23.5365662,-47.7163964
SP,01/01/2025 - Ano Novo,Ano Novo,,2025-01-01,Capela do Alto - SP,-23.5365662,-47.7163964
SP,25/12/2025 - Natal,Natal,,2025-12-25,Canitar - SP,-23.0066616,-49.7840632
SP,15/11/2025 - Proclamação da República,Proclamação da República,,2025-11-15,Canitar - SP,-23.0066616,-49.7840632
SP,02/11/2025 - Dia de Finados,Dia de Finados,,2025-11-02,Canitar - SP,-23.0066616,-49.7840632
SP,12/10/2025 - Nossa Senhora Aparecida,Nossa Senhora Aparecida,,2025-10-12,Canitar - SP,-23.0066616,-49.7840632
SP,07/09/2025 - Independência do Brasil,Independência do Brasil,,2025-09-07,Canitar - SP,-23.0066616,-49.7840632
SP,09/07/2025 - Revolução Constitucionalista,Revolução Constitucionalista,,2025-07-09,Canitar - SP,-23.0066616,-49.7840632
SP,01/05/2025 - Dia do Trabalho,Dia do Trabalho,,2025-05-01,Canitar - SP,-23.0066616,-49.7840632
SP,21/04/2025 - Dia de Tiradentes,Dia de Tiradentes,,2025-04-21,Canitar - SP,-23.0066616,-49.7840632
SP,18/04/2025 - Sexta-Feira Santa,Sexta-Feira Santa,,2025-04-18,Canitar - SP,-23.0066616,-49.7840632
SP,01/01/2025 - Ano Novo,Ano Novo,,2025-01-01,Canitar - SP,-23.0066616,-49.7840632
SP,25/12/2025 - Natal,Natal,,2025-12-25,Coronel Macedo - SP,-23.6304001,-49.313234
SP,08/12/2025 - Feriado Municipal,Feriado Municipal,,2025-12-08,Coronel Macedo - SP,-23.6304001,-49.313234
SP,15/11/2025 - Proclamação da República,Proclamação da República,,2025-11-15,Coronel Macedo - SP,-23.6304001,-49.313234
SP,02/11/2025 - Dia de Finados,Dia de Finados,,2025-11-02,Coronel Macedo - SP,-23.6304001,-49.313234
SP,12/10/2025 - Nossa Senhora Aparecida,Nossa Senhora Aparecida,,2025-10-12,Coronel Macedo - SP,-23.6304001,-49.313234
SP,07/09/2025 - Independência do Brasil,Independência do Brasil,,2025-09-07,Coronel Macedo - SP,-23.6304001,-49.313234
SP,09/07/2025 - Revolução Constitucionalista,Revolução Constitucionalista,,2025-07-09,Coronel Macedo - SP,-23.6304001,-49.313234
SP,06/06/2025 - Feriado Municipal,Feriado Municipal,,2025-06-06,Coronel Macedo - SP,-23.6304001,-49.313234
SP,01/05/2025 - Dia do Trabalho,Dia do Trabalho,,2025-05-01,Coronel Macedo - SP,-23.6304001,-49.313234
SP,21/04/2025 - Dia de Tiradentes,Dia de Tiradentes,,2025-04-21,Coronel Macedo - SP,-23.6304001,-49.313234
SP,18/04/2025 - Sexta-Feira Santa,Sexta-Feira Santa,,2025-04-18,Coronel Macedo - SP,-23.6304001,-49.313234
SP,05/04/2025 - Feriado Municipal,Feriado Municipal,,2025-04-05,Coronel Macedo - SP,-23.6304001,-49.313234
SP,21/03/2025 - Feriado Municipal,Feriado Municipal,,2025-03-21,Coronel Macedo - SP,-23.6304001,-49.313234
SP,01/01/2025 - Ano Novo,Ano Novo,,2025-01-01,Coronel Macedo - SP,-23.6304001,-49.313234
SP,25/12/2025 - Natal,Natal,,2025-12-25,Embu das Artes - SP,-23.6788187,-46.8515666
SP,15/11/2025 - Proclamação da República,Proclamação da República,,2025-11-15,Embu das Artes - SP,-23.6788187,-46.8515666
SP,02/11/2025 - Dia de Finados,Dia de Finados,,2025-11-02,Embu das Artes - SP,-23.6788187,-46.8515666
SP,12/10/2025 - Nossa Senhora Aparecida,Nossa Senhora Aparecida,,2025-10-12,Embu das Artes - SP,-23.6788187,-46.8515666
SP,07/10/2025 - Padroeira,Padroeira,,2025-10-07,Embu das Artes - SP,-23.6788187,-46.8515666
SP,07/09/2025 - Independência do Brasil,Independência do Brasil,,2025-09-07,Embu das Artes - SP,-23.6788187,-46.8515666
SP,09/07/2025 - Revolução Constitucionalista,Revolução Constitucionalista,,2025-07-09,Embu das Artes - SP,-23.6788187,-46.8515666
SP,19/06/2025 - Corpus Christi,Corpus Christi,,2025-06-19,Embu das Artes - SP,-23.6788187,-46.8515666
SP,01/05/2025 - Dia do Trabalho,Dia do Trabalho,,2025-05-01,Embu das Artes - SP,-23.6788187,-46.8515666
SP,21/04/2025 - Dia de Tiradentes,Dia de Tiradentes,,2025-04-21,Embu das Artes - SP,-23.6788187,-46.8515666
SP,18/04/2025 - Paixão de Cristo,Paixão de Cristo,,2025-04-18,Embu das Artes - SP,-23.6788187,-46.8515666
SP,18/04/2025 - Sexta-Feira Santa,Sexta-Feira Santa,,2025-04-18,Embu das Artes - SP,-23.6788187,-46.8515666
SP,18/02/2025 - Aniversário da Cidade,Aniversário da Cidade,,2025-02-18,Embu das Artes - SP,-23.6788187,-46.8515666
SP,01/01/2025 - Ano Novo,Ano Novo,,2025-01-01,Embu das Artes - SP,-23.6788187,-46.8515666
SP,25/12/2025 - Natal,Natal,,2025-12-25,Elias Fausto - SP,-22.9869282,-47.3798534
SP,30/11/2025 - Feriado Municipal,Feriado Municipal,,2025-11-30,Elias Fausto - SP,-22.9869282,-47.3798534
SP,15/11/2025 - Proclamação da República,Proclamação da República,,2025-11-15,Elias Fausto - SP,-22.9869282,-47.3798534
SP,02/11/2025 - Dia de Finados,Dia de Finados,,2025-11-02,Elias Fausto - SP,-22.9869282,-47.3798534
SP,12/10/2025 - Nossa Senhora Aparecida,Nossa Senhora Aparecida,,2025-10-12,Elias Fausto - SP,-22.9869282,-47.3798534
SP,07/09/2025 - Independência do Brasil,Independência do Brasil,,2025-09-07,Elias Fausto - SP,-22.9869282,-47.3798534
SP,09/07/2025 - Revolução Constitucionalista,Revolução Constitucionalista,,2025-07-09,Elias Fausto - SP,-22.9869282,-47.3798534
SP,01/05/2025 - Dia do Trabalho,Dia do Trabalho,,2025-05-01,Elias Fausto - SP,-22.9869282,-47.3798534
SP,21/04/2025 - Dia de Tiradentes,Dia de Tiradentes,,2025-04-21,Elias Fausto - SP,-22.9869282,-47.3798534
SP,18/04/2025 - Sexta-Feira Santa,Sexta-Feira Santa,,2025-04-18,Elias Fausto - SP,-22.9869282,-47.3798534
SP,19/03/2025 - São José,São José,,2025-03-19,Elias Fausto - SP,-22.9869282,-47.3798534
SP,01/01/2025 - Ano Novo,Ano Novo,,2025-01-01,Elias Fausto - SP,-22.9869282,-47.3798534
SP,25/12/2025 - Natal,Natal,,2025-12-25,Eldorado - SP,-20.793325,-49.3818936
SP,20/11/2025 - Consciência Negra,Consciência Negra,,2025-11-20,Eldorado - SP,-20.793325,-49.3818936
SP,15/11/2025 - Proclamação da República,Proclamação da República,,2025-11-15,Eldorado - SP,-20.793325,-49.3818936
SP,02/11/2025 - Dia de Finados,Dia de Finados,,2025-11-02,Eldorado - SP,-20.793325,-49.3818936
SP,12/10/2025 - Nossa Senhora Aparecida,Nossa Senhora Aparecida,,2025-10-12,Eldorado - SP,-20.793325,-49.3818936
SP,08/09/2025 - Dia da Padroeira,Dia da Padroeira,,2025-09-08,Eldorado - SP,-20.793325,-49.3818936
SP,07/09/2025 - Independência do Brasil,Independência do Brasil,,2025-09-07,Eldorado - SP,-20.793325,-49.3818936
SP,09/07/2025 - Revolução Constitucionalista,Revolução Constitucionalista,,2025-07-09,Eldorado - SP,-20.793325,-49.3818936
SP,01/05/2025 - Dia do Trabalho,Dia do Trabalho,,2025-05-01,Eldorado - SP,-20.793325,-49.3818936
SP,21/04/2025 - Dia de Tiradentes,Dia de Tiradentes,,2025-04-21,Eldorado - SP,-20.793325,-49.3818936
SP,18/04/2025 - Sexta-Feira Santa,Sexta-Feira Santa,,2025-04-18,Eldorado - SP,-20.793325,-49.3818936
SP,18/04/2025 - Sexta-Feira Santa,Sexta-Feira Santa,,2025-04-18,Eldorado - SP,-20.793325,-49.3818936
SP,10/03/2025 - Aniversário da Cidade,Aniversário da Cidade,,2025-03-10,Eldorado - SP,-20.793325,-49.3818936
SP,01/01/2025 - Ano Novo,Ano Novo,,2025-01-01,Eldorado - SP,-20.793325,-49.3818936
SP,25/12/2025 - Natal,Natal,,2025-12-25,Dumont - SP,-22.8929529,-47.056135
SP,08/12/2025 - Feriado Municipal,Feriado Municipal,,2025-12-08,Dumont - SP,-22.8929529,-47.056135
SP,20/11/2025 - Dia da Consciência Negra,Dia da Consciência Negra,,2025-11-20,Dumont - SP,-22.8929529,-47.056135
SP,15/11/2025 - Proclamação da República,Proclamação da República,,2025-11-15,Dumont - SP,-22.8929529,-47.056135
SP,02/11/2025 - Dia de Finados,Dia de Finados,,2025-11-02,Dumont - SP,-22.8929529,-47.056135
SP,12/10/2025 - Nossa Senhora Aparecida,Nossa Senhora Aparecida,,2025-10-12,Dumont - SP,-22.8929529,-47.056135
SP,07/09/2025 - Independência do Brasil,Independência do Brasil,,2025-09-07,Dumont - SP,-22.8929529,-47.056135
SP,09/07/2025 - Revolução Constitucionalista,Revolução Constitucionalista,,2025-07-09,Dumont - SP,-22.8929529,-47.056135
SP,01/05/2025 - Dia do Trabalho,Dia do Trabalho,,2025-05-01,Dumont - SP,-22.8929529,-47.056135
SP,21/04/2025 - Dia de Tiradentes,Dia de Tiradentes,,2025-04-21,Dumont - SP,-22.8929529,-47.056135
SP,18/04/2025 - Sexta-Feira Santa,Sexta-Feira Santa,,2025-04-18,Dumont - SP,-22.8929529,-47.056135
SP,21/03/2025 - Feriado Municipal,Feriado Municipal,,2025-03-21,Dumont - SP,-22.8929529,-47.056135
SP,01/01/2025 - Ano Novo,Ano Novo,,2025-01-01,Dumont - SP,-22.8929529,-47.056135
SP,25/12/2025 - Natal,Natal,,2025-12-25,Duartina - SP,-22.414562,-49.408355
SP,13/12/2025 - Feriado Municipal,Feriado Municipal,,2025-12-13,Duartina - SP,-22.414562,-49.408355
SP,11/12/2025 - Feriado Municipal,Feriado Municipal,,2025-12-11,Duartina - SP,-22.414562,-49.408355
SP,15/11/2025 - Proclamação da República,Proclamação da República,,2025-11-15,Duartina - SP,-22.414562,-49.408355
SP,02/11/2025 - Dia de Finados,Dia de Finados,,2025-11-02,Duartina - SP,-22.414562,-49.408355
SP,12/10/2025 - Nossa Senhora Aparecida,Nossa Senhora Aparecida,,2025-10-12,Duartina - SP,-22.414562,-49.408355
SP,07/09/2025 - Independência do Brasil,Independência do Brasil,,2025-09-07,Duartina - SP,-22.414562,-49.408355
SP,09/07/2025 - Revolução Constitucionalista,Revolução Constitucionalista,,2025-07-09,Duartina - SP,-22.414562,-49.408355
SP,01/05/2025 - Dia do Trabalho,Dia do Trabalho,,2025-05-01,Duartina - SP,-22.414562,-49.408355
SP,21/04/2025 - Dia de Tiradentes,Dia de Tiradentes,,2025-04-21,Duartina - SP,-22.414562,-49.408355
SP,18/04/2025 - Sexta-Feira Santa,Sexta-Feira Santa,,2025-04-18,Duartina - SP,-22.414562,-49.408355
SP,01/01/2025 - Ano Novo,Ano Novo,,2025-01-01,Duartina - SP,-22.414562,-49.408355
SP,25/12/2025 - Natal,Natal,,2025-12-25,Dracena - SP,-21.4884653,-51.5325767
SP,08/12/2025 - Feriado Municipal,Feriado Municipal,,2025-12-08,Dracena - SP,-21.4884653,-51.5325767
SP,15/11/2025 - Proclamação da República,Proclamação da República,,2025-11-15,Dracena - SP,-21.4884653,-51.5325767
SP,02/11/2025 - Dia de Finados,Dia de Finados,,2025-11-02,Dracena - SP,-21.4884653,-51.5325767
SP,12/10/2025 - Nossa Senhora Aparecida,Nossa Senhora Aparecida,,2025-10-12,Dracena - SP,-21.4884653,-51.5325767
SP,07/09/2025 - Independência do Brasil,Independência do Brasil,,2025-09-07,Dracena - SP,-21.4884653,-51.5325767
SP,09/07/2025 - Revolução Constitucionalista,Revolução Constitucionalista,,2025-07-09,Dracena - SP,-21.4884653,-51.5325767
SP,01/05/2025 - Dia do Trabalho,Dia do Trabalho,,2025-05-01,Dracena - SP,-21.4884653,-51.5325767
SP,21/04/2025 - Dia de Tiradentes,Dia de Tiradentes,,2025-04-21,Dracena - SP,-21.4884653,-51.5325767
SP,18/04/2025 - Sexta-Feira Santa,Sexta-Feira Santa,,2025-04-18,Dracena - SP,-21.4884653,-51.5325767
SP,01/01/2025 - Ano Novo,Ano Novo,,2025-01-01,Dracena - SP,-21.4884653,-51.5325767
SP,25/12/2025 - Natal,Natal,,2025-12-25,Dourado - SP,-22.1211161,-48.3150275
SP,15/11/2025 - Proclamação da República,Proclamação da República,,2025-11-15,Dourado - SP,-22.1211161,-48.3150275
SP,02/11/2025 - Dia de Finados,Dia de Finados,,2025-11-02,Dourado - SP,-22.1211161,-48.3150275
SP,12/10/2025 - Nossa Senhora Aparecida,Nossa Senhora Aparecida,,2025-10-12,Dourado - SP,-22.1211161,-48.3150275
SP,07/09/2025 - Independência do Brasil,Independência do Brasil,,2025-09-07,Dourado - SP,-22.1211161,-48.3150275
SP,09/07/2025 - Revolução Constitucionalista,Revolução Constitucionalista,,2025-07-09,Dourado - SP,-22.1211161,-48.3150275
SP,24/06/2025 - Feriado Municipal,Feriado Municipal,,2025-06-24,Dourado - SP,-22.1211161,-48.3150275
SP,19/05/2025 - Feriado Municipal,Feriado Municipal,,2025-05-19,Dourado - SP,-22.1211161,-48.3150275
SP,01/05/2025 - Dia do Trabalho,Dia do Trabalho,,2025-05-01,Dourado - SP,-22.1211161,-48.3150275
SP,21/04/2025 - Dia de Tiradentes,Dia de Tiradentes,,2025-04-21,Dourado - SP,-22.1211161,-48.3150275
SP,18/04/2025 - Sexta-Feira Santa,Sexta-Feira Santa,,2025-04-18,Dourado - SP,-22.1211161,-48.3150275
SP,01/01/2025 - Ano Novo,Ano Novo,,2025-01-01,Dourado - SP,-22.1211161,-48.3150275
SP,25/12/2025 - Natal,Natal,,2025-12-25,Dobrada - SP,-21.5180904,-48.3938897
SP,15/11/2025 - Proclamação da República,Proclamação da República,,2025-11-15,Dobrada - SP,-21.5180904,-48.3938897
SP,02/11/2025 - Dia de Finados,Dia de Finados,,2025-11-02,Dobrada - SP,-21.5180904,-48.3938897
SP,12/10/2025 - Nossa Senhora Aparecida,Nossa Senhora Aparecida,,2025-10-12,Dobrada - SP,-21.5180904,-48.3938897
SP,07/09/2025 - Independência do Brasil,Independência do Brasil,,2025-09-07,Dobrada - SP,-21.5180904,-48.3938897
SP,09/07/2025 - Revolução Constitucionalista,Revolução Constitucionalista,,2025-07-09,Dobrada - SP,-21.5180904,-48.3938897
SP,01/05/2025 - Dia do Trabalho,Dia do Trabalho,,2025-05-01,Dobrada - SP,-21.5180904,-48.3938897
SP,21/04/2025 - Dia de Tiradentes,Dia de Tiradentes,,2025-04-21,Dobrada - SP,-21.5180904,-48.3938897
SP,18/04/2025 - Sexta-Feira Santa,Sexta-Feira Santa,,2025-04-18,Dobrada - SP,-21.5180904,-48.3938897
SP,02/04/2025 - Feriado Municipal,Feriado Municipal,,2025-04-02,Dobrada - SP,-21.5180904,-48.3938897
SP,01/01/2025 - Ano Novo,Ano Novo,,2025-01-01,Dobrada - SP,-21.5180904,-48.3938897
SP,25/12/2025 - Natal,Natal,,2025-12-25,Cosmorama - SP,-20.4796299,-49.7791204
SP,15/11/2025 - Proclamação da República,Proclamação da República,,2025-11-15,Cosmorama - SP,-20.4796299,-49.7791204
SP,02/11/2025 - Dia de Finados,Dia de Finados,,2025-11-02,Cosmorama - SP,-20.4796299,-49.7791204
SP,12/10/2025 - Nossa Senhora Aparecida,Nossa Senhora Aparecida,,2025-10-12,Cosmorama - SP,-20.4796299,-49.7791204
SP,07/09/2025 - Independência do Brasil,Independência do Brasil,,2025-09-07,Cosmorama - SP,-20.4796299,-49.7791204
SP,09/07/2025 - Revolução Constitucionalista,Revolução Constitucionalista,,2025-07-09,Cosmorama - SP,-20.4796299,-49.7791204
SP,13/06/2025 - Dia de Santo Antônio,Dia de Santo Antônio,,2025-06-13,Cosmorama - SP,-20.4796299,-49.7791204
SP,01/05/2025 - Dia do Trabalho,Dia do Trabalho,,2025-05-01,Cosmorama - SP,-20.4796299,-49.7791204
SP,21/04/2025 - Dia de Tiradentes,Dia de Tiradentes,,2025-04-21,Cosmorama - SP,-20.4796299,-49.7791204
SP,18/04/2025 - Sexta-Feira Santa,Sexta-Feira Santa,,2025-04-18,Cosmorama - SP,-20.4796299,-49.7791204
SP,01/01/2025 - Ano Novo,Ano Novo,,2025-01-01,Cosmorama - SP,-20.4796299,-49.7791204
SP,25/12/2025 - Natal,Natal,,2025-12-25,Dirce Reis - SP,-20.4664067,-50.606276
SP,15/11/2025 - Proclamação da República,Proclamação da República,,2025-11-15,Dirce Reis - SP,-20.4664067,-50.606276
SP,02/11/2025 - Dia de Finados,Dia de Finados,,2025-11-02,Dirce Reis - SP,-20.4664067,-50.606276
SP,12/10/2025 - Nossa Senhora Aparecida,Nossa Senhora Aparecida,,2025-10-12,Dirce Reis - SP,-20.4664067,-50.606276
SP,07/09/2025 - Independência do Brasil,Independência do Brasil,,2025-09-07,Dirce Reis - SP,-20.4664067,-50.606276
SP,09/07/2025 - Revolução Constitucionalista,Revolução Constitucionalista,,2025-07-09,Dirce Reis - SP,-20.4664067,-50.606276
SP,01/05/2025 - Dia do Trabalho,Dia do Trabalho,,2025-05-01,Dirce Reis - SP,-20.4664067,-50.606276
SP,21/04/2025 - Dia de Tiradentes,Dia de Tiradentes,,2025-04-21,Dirce Reis - SP,-20.4664067,-50.606276
SP,18/04/2025 - Sexta-Feira Santa,Sexta-Feira Santa,,2025-04-18,Dirce Reis - SP,-20.4664067,-50.606276
SP,01/01/2025 - Ano Novo,Ano Novo,,2025-01-01,Dirce Reis - SP,-20.4664067,-50.606276
SP,25/12/2025 - Natal,Natal,,2025-12-25,Diadema - SP,-23.6824729,-46.5997506
SP,"08/12/2025 - Aniversário da cidade e Dia da Imaculada Conceição, padroeira da cidade","Aniversário da cidade e Dia da Imaculada Conceição, padroeira da cidade",,2025-12-08,Diadema - SP,-23.6824729,-46.5997506
SP,20/11/2025 - Dia da Consciência Negra,Dia da Consciência Negra,,2025-11-20,Diadema - SP,-23.6824729,-46.5997506
SP,15/11/2025 - Proclamação da República,Proclamação da República,,2025-11-15,Diadema - SP,-23.6824729,-46.5997506
SP,02/11/2025 - Dia de Finados,Dia de Finados,,2025-11-02,Diadema - SP,-23.6824729,-46.5997506
SP,12/10/2025 - Nossa Senhora Aparecida,Nossa Senhora Aparecida,,2025-10-12,Diadema - SP,-23.6824729,-46.5997506
SP,07/09/2025 - Independência do Brasil,Independência do Brasil,,2025-09-07,Diadema - SP,-23.6824729,-46.5997506
SP,09/07/2025 - Revolução Constitucionalista,Revolução Constitucionalista,,2025-07-09,Diadema - SP,-23.6824729,-46.5997506
SP,19/06/2025 - Corpus Christi,Corpus Christi,,2025-06-19,Diadema - SP,-23.6824729,-46.5997506
SP,01/05/2025 - Dia do Trabalho,Dia do Trabalho,,2025-05-01,Diadema - SP,-23.6824729,-46.5997506
SP,21/04/2025 - Dia de Tiradentes,Dia de Tiradentes,,2025-04-21,Diadema - SP,-23.6824729,-46.5997506
SP,18/04/2025 - Sexta-feira Santa,Sexta-feira Santa,,2025-04-18,Diadema - SP,-23.6824729,-46.5997506
SP,18/04/2025 - Sexta-Feira Santa,Sexta-Feira Santa,,2025-04-18,Diadema - SP,-23.6824729,-46.5997506
SP,01/01/2025 - Ano Novo,Ano Novo,,2025-01-01,Diadema - SP,-23.6824729,-46.5997506
SP,25/12/2025 - Natal,Natal,,2025-12-25,Descalvado - SP,-21.9196637,-47.5850194
SP,15/11/2025 - Proclamação da República,Proclamação da República,,2025-11-15,Descalvado - SP,-21.9196637,-47.5850194
SP,02/11/2025 - Dia de Finados,Dia de Finados,,2025-11-02,Descalvado - SP,-21.9196637,-47.5850194
SP,12/10/2025 - Nossa Senhora Aparecida,Nossa Senhora Aparecida,,2025-10-12,Descalvado - SP,-21.9196637,-47.5850194
SP,08/09/2025 - Feriado Municipal,Feriado Municipal,,2025-09-08,Descalvado - SP,-21.9196637,-47.5850194
SP,07/09/2025 - Independência do Brasil,Independência do Brasil,,2025-09-07,Descalvado - SP,-21.9196637,-47.5850194
SP,09/07/2025 - Revolução Constitucionalista,Revolução Constitucionalista,,2025-07-09,Descalvado - SP,-21.9196637,-47.5850194
SP,01/05/2025 - Dia do Trabalho,Dia do Trabalho,,2025-05-01,Descalvado - SP,-21.9196637,-47.5850194
SP,21/04/2025 - Dia de Tiradentes,Dia de Tiradentes,,2025-04-21,Descalvado - SP,-21.9196637,-47.5850194
SP,18/04/2025 - Sexta-Feira Santa,Sexta-Feira Santa,,2025-04-18,Descalvado - SP,-21.9196637,-47.5850194
SP,01/01/2025 - Ano Novo,Ano Novo,,2025-01-01,Descalvado - SP,-21.9196637,-47.5850194
SP,25/12/2025 - Natal,Natal,,2025-12-25,Cunha - SP,-23.0762444,-44.9557122
SP,08/12/2025 - Feriado Municipal,Feriado Municipal,,2025-12-08,Cunha - SP,-23.0762444,-44.9557122
SP,15/11/2025 - Proclamação da República,Proclamação da República,,2025-11-15,Cunha - SP,-23.0762444,-44.9557122
SP,02/11/2025 - Dia de Finados,Dia de Finados,,2025-11-02,Cunha - SP,-23.0762444,-44.9557122
SP,12/10/2025 - Nossa Senhora Aparecida,Nossa Senhora Aparecida,,2025-10-12,Cunha - SP,-23.0762444,-44.9557122
SP,07/09/2025 - Independência do Brasil,Independência do Brasil,,2025-09-07,Cunha - SP,-23.0762444,-44.9557122
SP,09/07/2025 - Revolução Constitucionalista,Revolução Constitucionalista,,2025-07-09,Cunha - SP,-23.0762444,-44.9557122
SP,01/05/2025 - Dia do Trabalho,Dia do Trabalho,,2025-05-01,Cunha - SP,-23.0762444,-44.9557122
SP,21/04/2025 - Dia de Tiradentes,Dia de Tiradentes,,2025-04-21,Cunha - SP,-23.0762444,-44.9557122
SP,20/04/2025 - Feriado Municipal,Feriado Municipal,,2025-04-20,Cunha - SP,-23.0762444,-44.9557122
SP,18/04/2025 - Sexta-Feira Santa,Sexta-Feira Santa,,2025-04-18,Cunha - SP,-23.0762444,-44.9557122
SP,19/03/2025 - São José,São José,,2025-03-19,Cunha - SP,-23.0762444,-44.9557122
SP,01/01/2025 - Ano Novo,Ano Novo,,2025-01-01,Cunha - SP,-23.0762444,-44.9557122
SP,25/12/2025 - Natal,Natal,,2025-12-25,Cruzeiro - SP,-22.5783685,-44.9642044
SP,08/12/2025 - Padroeira,Padroeira,,2025-12-08,Cruzeiro - SP,-22.5783685,-44.9642044
SP,15/11/2025 - Proclamação da República,Proclamação da República,,2025-11-15,Cruzeiro - SP,-22.5783685,-44.9642044
SP,02/11/2025 - Dia de Finados,Dia de Finados,,2025-11-02,Cruzeiro - SP,-22.5783685,-44.9642044
SP,12/10/2025 - Nossa Senhora Aparecida,Nossa Senhora Aparecida,,2025-10-12,Cruzeiro - SP,-22.5783685,-44.9642044
SP,02/10/2025 - Dia do município,Dia do município,,2025-10-02,Cruzeiro - SP,-22.5783685,-44.9642044
SP,07/09/2025 - Independência do Brasil,Independência do Brasil,,2025-09-07,Cruzeiro - SP,-22.5783685,-44.9642044
SP,09/07/2025 - Revolução Constitucionalista,Revolução Constitucionalista,,2025-07-09,Cruzeiro - SP,-22.5783685,-44.9642044
SP,01/05/2025 - Dia do Trabalho,Dia do Trabalho,,2025-05-01,Cruzeiro - SP,-22.5783685,-44.9642044
SP,21/04/2025 - Dia de Tiradentes,Dia de Tiradentes,,2025-04-21,Cruzeiro - SP,-22.5783685,-44.9642044
SP,18/04/2025 - Sexta-Feira Santa,Sexta-Feira Santa,,2025-04-18,Cruzeiro - SP,-22.5783685,-44.9642044
SP,01/01/2025 - Ano Novo,Ano Novo,,2025-01-01,Cruzeiro - SP,-22.5783685,-44.9642044
SP,25/12/2025 - Natal,Natal,,2025-12-25,Cristais Paulista - SP,-20.4082169,-47.3041987
SP,20/11/2025 - Dia da ,Dia da ,,2025-11-20,Cristais Paulista - SP,-20.4082169,-47.3041987
SP,15/11/2025 - Proclamação da República,Proclamação da República,,2025-11-15,Cristais Paulista - SP,-20.4082169,-47.3041987
SP,02/11/2025 - Dia de Finados,Dia de Finados,,2025-11-02,Cristais Paulista - SP,-20.4082169,-47.3041987
SP,12/10/2025 - Nossa Senhora Aparecida,Nossa Senhora Aparecida,,2025-10-12,Cristais Paulista - SP,-20.4082169,-47.3041987
SP,07/09/2025 - Independência do Brasil,Independência do Brasil,,2025-09-07,Cristais Paulista - SP,-20.4082169,-47.3041987
SP,15/08/2025 - Feriado Municipal,Feriado Municipal,,2025-08-15,Cristais Paulista - SP,-20.4082169,-47.3041987
SP,28/07/2025 - Feriado Municipal,Feriado Municipal,,2025-07-28,Cristais Paulista - SP,-20.4082169,-47.3041987
SP,09/07/2025 - Revolução Constitucionalista,Revolução Constitucionalista,,2025-07-09,Cristais Paulista - SP,-20.4082169,-47.3041987
SP,01/05/2025 - Dia do Trabalho,Dia do Trabalho,,2025-05-01,Cristais Paulista - SP,-20.4082169,-47.3041987
SP,21/04/2025 - Dia de Tiradentes,Dia de Tiradentes,,2025-04-21,Cristais Paulista - SP,-20.4082169,-47.3041987
SP,18/04/2025 - Sexta-Feira Santa,Sexta-Feira Santa,,2025-04-18,Cristais Paulista - SP,-20.4082169,-47.3041987
SP,01/01/2025 - Ano Novo,Ano Novo,,2025-01-01,Cristais Paulista - SP,-20.4082169,-47.3041987
SP,25/12/2025 - Natal,Natal,,2025-12-25,Cravinhos - SP,-21.3212871,-47.7340803
SP,20/11/2025 - Consciência Negra,Consciência Negra,,2025-11-20,Cravinhos - SP,-21.3212871,-47.7340803
SP,15/11/2025 - Proclamação da República,Proclamação da República,,2025-11-15,Cravinhos - SP,-21.3212871,-47.7340803
SP,02/11/2025 - Dia de Finados,Dia de Finados,,2025-11-02,Cravinhos - SP,-21.3212871,-47.7340803
SP,12/10/2025 - Nossa Senhora Aparecida,Nossa Senhora Aparecida,,2025-10-12,Cravinhos - SP,-21.3212871,-47.7340803
SP,07/09/2025 - Independência do Brasil,Independência do Brasil,,2025-09-07,Cravinhos - SP,-21.3212871,-47.7340803
SP,09/07/2025 - Revolução Constitucionalista,Revolução Constitucionalista,,2025-07-09,Cravinhos - SP,-21.3212871,-47.7340803
SP,01/05/2025 - Dia do Trabalho,Dia do Trabalho,,2025-05-01,Cravinhos - SP,-21.3212871,-47.7340803
SP,21/04/2025 - Dia de Tiradentes,Dia de Tiradentes,,2025-04-21,Cravinhos - SP,-21.3212871,-47.7340803
SP,18/04/2025 - Sexta-Feira Santa,Sexta-Feira Santa,,2025-04-18,Cravinhos - SP,-21.3212871,-47.7340803
SP,19/03/2025 - São José,São José,,2025-03-19,Cravinhos - SP,-21.3212871,-47.7340803
SP,01/01/2025 - Ano Novo,Ano Novo,,2025-01-01,Cravinhos - SP,-21.3212871,-47.7340803
SP,25/12/2025 - Natal,Natal,,2025-12-25,Cotia - SP,-23.6124139,-46.9248924
SP,15/11/2025 - Proclamação da República,Proclamação da República,,2025-11-15,Cotia - SP,-23.6124139,-46.9248924
SP,02/11/2025 - Dia de Finados,Dia de Finados,,2025-11-02,Cotia - SP,-23.6124139,-46.9248924
SP,12/10/2025 - Nossa Senhora Aparecida,Nossa Senhora Aparecida,,2025-10-12,Cotia - SP,-23.6124139,-46.9248924
SP,08/09/2025 - Feriado Municipal,Feriado Municipal,,2025-09-08,Cotia - SP,-23.6124139,-46.9248924
SP,07/09/2025 - Independência do Brasil,Independência do Brasil,,2025-09-07,Cotia - SP,-23.6124139,-46.9248924
SP,09/07/2025 - Revolução Constitucionalista,Revolução Constitucionalista,,2025-07-09,Cotia - SP,-23.6124139,-46.9248924
SP,01/05/2025 - Dia do Trabalho,Dia do Trabalho,,2025-05-01,Cotia - SP,-23.6124139,-46.9248924
SP,21/04/2025 - Dia de Tiradentes,Dia de Tiradentes,,2025-04-21,Cotia - SP,-23.6124139,-46.9248924
SP,18/04/2025 - Sexta-Feira Santa,Sexta-Feira Santa,,2025-04-18,Cotia - SP,-23.6124139,-46.9248924
SP,02/04/2025 - Feriado Municipal,Feriado Municipal,,2025-04-02,Cotia - SP,-23.6124139,-46.9248924
SP,01/01/2025 - Ano Novo,Ano Novo,,2025-01-01,Cotia - SP,-23.6124139,-46.9248924
SP,25/12/2025 - Natal,Natal,,2025-12-25,Magda - SP,-20.6472307,-50.2216958
SP,08/12/2025 - Feriado Municipal,Feriado Municipal,,2025-12-08,Magda - SP,-20.6472307,-50.2216958
SP,15/11/2025 - Proclamação da República,Proclamação da República,,2025-11-15,Magda - SP,-20.6472307,-50.2216958
SP,02/11/2025 - Dia de Finados,Dia de Finados,,2025-11-02,Magda - SP,-20.6472307,-50.2216958
SP,12/10/2025 - Nossa Senhora Aparecida,Nossa Senhora Aparecida,,2025-10-12,Magda - SP,-20.6472307,-50.2216958
SP,07/09/2025 - Independência do Brasil,Independência do Brasil,,2025-09-07,Magda - SP,-20.6472307,-50.2216958
SP,09/07/2025 - Revolução Constitucionalista,Revolução Constitucionalista,,2025-07-09,Magda - SP,-20.6472307,-50.2216958
SP,01/05/2025 - Dia do Trabalho,Dia do Trabalho,,2025-05-01,Magda - SP,-20.6472307,-50.2216958
SP,21/04/2025 - Dia de Tiradentes,Dia de Tiradentes,,2025-04-21,Magda - SP,-20.6472307,-50.2216958
SP,18/04/2025 - Sexta-Feira Santa,Sexta-Feira Santa,,2025-04-18,Magda - SP,-20.6472307,-50.2216958
SP,25/03/2025 - Feriado Municipal,Feriado Municipal,,2025-03-25,Magda - SP,-20.6472307,-50.2216958
SP,01/01/2025 - Ano Novo,Ano Novo,,2025-01-01,Magda - SP,-20.6472307,-50.2216958
SP,25/12/2025 - Natal,Natal,,2025-12-25,Turmalina - SP,-20.1039849,-50.4602226
SP,15/11/2025 - Proclamação da República,Proclamação da República,,2025-11-15,Turmalina - SP,-20.1039849,-50.4602226
SP,02/11/2025 - Dia de Finados,Dia de Finados,,2025-11-02,Turmalina - SP,-20.1039849,-50.4602226
SP,12/10/2025 - Nossa Senhora Aparecida,Nossa Senhora Aparecida,,2025-10-12,Turmalina - SP,-20.1039849,-50.4602226
SP,07/09/2025 - Independência do Brasil,Independência do Brasil,,2025-09-07,Turmalina - SP,-20.1039849,-50.4602226
SP,15/08/2025 - Feriado Municipal,Feriado Municipal,,2025-08-15,Turmalina - SP,-20.1039849,-50.4602226
SP,06/08/2025 - Feriado Municipal,Feriado Municipal,,2025-08-06,Turmalina - SP,-20.1039849,-50.4602226
SP,09/07/2025 - Revolução Constitucionalista,Revolução Constitucionalista,,2025-07-09,Turmalina - SP,-20.1039849,-50.4602226
SP,01/05/2025 - Dia do Trabalho,Dia do Trabalho,,2025-05-01,Turmalina - SP,-20.1039849,-50.4602226
SP,21/04/2025 - Dia de Tiradentes,Dia de Tiradentes,,2025-04-21,Turmalina - SP,-20.1039849,-50.4602226
SP,18/04/2025 - Sexta-Feira Santa,Sexta-Feira Santa,,2025-04-18,Turmalina - SP,-20.1039849,-50.4602226
SP,01/01/2025 - Ano Novo,Ano Novo,,2025-01-01,Turmalina - SP,-20.1039849,-50.4602226
SP,25/12/2025 - Natal,Natal,,2025-12-25,Votorantim - SP,-23.5412077,-47.4267121
SP,08/12/2025 - Feriado Municipal,Feriado Municipal,,2025-12-08,Votorantim - SP,-23.5412077,-47.4267121
SP,20/11/2025 - Dia da Consciência Negra,Dia da Consciência Negra,,2025-11-20,Votorantim - SP,-23.5412077,-47.4267121
SP,15/11/2025 - Proclamação da República,Proclamação da República,,2025-11-15,Votorantim - SP,-23.5412077,-47.4267121
SP,02/11/2025 - Dia de Finados,Dia de Finados,,2025-11-02,Votorantim - SP,-23.5412077,-47.4267121
SP,12/10/2025 - Nossa Senhora Aparecida,Nossa Senhora Aparecida,,2025-10-12,Votorantim - SP,-23.5412077,-47.4267121
SP,07/09/2025 - Independência do Brasil,Independência do Brasil,,2025-09-07,Votorantim - SP,-23.5412077,-47.4267121
SP,09/07/2025 - Revolução Constitucionalista,Revolução Constitucionalista,,2025-07-09,Votorantim - SP,-23.5412077,-47.4267121
SP,01/05/2025 - Dia do Trabalho,Dia do Trabalho,,2025-05-01,Votorantim - SP,-23.5412077,-47.4267121
SP,21/04/2025 - Dia de Tiradentes,Dia de Tiradentes,,2025-04-21,Votorantim - SP,-23.5412077,-47.4267121
SP,18/04/2025 - Sexta-Feira Santa,Sexta-Feira Santa,,2025-04-18,Votorantim - SP,-23.5412077,-47.4267121
SP,01/01/2025 - Ano Novo,Ano Novo,,2025-01-01,Votorantim - SP,-23.5412077,-47.4267121
SP,25/12/2025 - Natal,Natal,,2025-12-25,Votuporanga - SP,-20.4083838,-49.9769098
SP,15/11/2025 - Proclamação da República,Proclamação da República,,2025-11-15,Votuporanga - SP,-20.4083838,-49.9769098
SP,02/11/2025 - Dia de Finados,Dia de Finados,,2025-11-02,Votuporanga - SP,-20.4083838,-49.9769098
SP,12/10/2025 - Nossa Senhora Aparecida,Nossa Senhora Aparecida,,2025-10-12,Votuporanga - SP,-20.4083838,-49.9769098
SP,07/09/2025 - Independência do Brasil,Independência do Brasil,,2025-09-07,Votuporanga - SP,-20.4083838,-49.9769098
SP,08/08/2025 - Feriado Municipal,Feriado Municipal,,2025-08-08,Votuporanga - SP,-20.4083838,-49.9769098
SP,09/07/2025 - Revolução Constitucionalista,Revolução Constitucionalista,,2025-07-09,Votuporanga - SP,-20.4083838,-49.9769098
SP,01/05/2025 - Dia do Trabalho,Dia do Trabalho,,2025-05-01,Votuporanga - SP,-20.4083838,-49.9769098
SP,21/04/2025 - Dia de Tiradentes,Dia de Tiradentes,,2025-04-21,Votuporanga - SP,-20.4083838,-49.9769098
SP,18/04/2025 - Sexta-Feira Santa,Sexta-Feira Santa,,2025-04-18,Votuporanga - SP,-20.4083838,-49.9769098
SP,01/01/2025 - Ano Novo,Ano Novo,,2025-01-01,Votuporanga - SP,-20.4083838,-49.9769098
SP,25/12/2025 - Natal,Natal,,2025-12-25,Zacarias - SP,-23.4945733,-48.4077811
SP,15/11/2025 - Proclamação da República,Proclamação da República,,2025-11-15,Zacarias - SP,-23.4945733,-48.4077811
SP,02/11/2025 - Dia de Finados,Dia de Finados,,2025-11-02,Zacarias - SP,-23.4945733,-48.4077811
SP,12/10/2025 - Nossa Senhora Aparecida,Nossa Senhora Aparecida,,2025-10-12,Zacarias - SP,-23.4945733,-48.4077811
SP,07/09/2025 - Independência do Brasil,Independência do Brasil,,2025-09-07,Zacarias - SP,-23.4945733,-48.4077811
SP,09/07/2025 - Revolução Constitucionalista,Revolução Constitucionalista,,2025-07-09,Zacarias - SP,-23.4945733,-48.4077811
SP,01/05/2025 - Dia do Trabalho,Dia do Trabalho,,2025-05-01,Zacarias - SP,-23.4945733,-48.4077811
SP,21/04/2025 - Dia de Tiradentes,Dia de Tiradentes,,2025-04-21,Zacarias - SP,-23.4945733,-48.4077811
SP,18/04/2025 - Sexta-Feira Santa,Sexta-Feira Santa,,2025-04-18,Zacarias - SP,-23.4945733,-48.4077811
SP,01/01/2025 - Ano Novo,Ano Novo,,2025-01-01,Zacarias - SP,-23.4945733,-48.4077811
SP,25/12/2025 - Natal,Natal,,2025-12-25,Santana da Ponte Pensa - SP,-20.2543758,-50.7975649
SP,15/11/2025 - Proclamação da República,Proclamação da República,,2025-11-15,Santana da Ponte Pensa - SP,-20.2543758,-50.7975649
SP,02/11/2025 - Dia de Finados,Dia de Finados,,2025-11-02,Santana da Ponte Pensa - SP,-20.2543758,-50.7975649
SP,12/10/2025 - Nossa Senhora Aparecida,Nossa Senhora Aparecida,,2025-10-12,Santana da Ponte Pensa - SP,-20.2543758,-50.7975649
SP,07/09/2025 - Independência do Brasil,Independência do Brasil,,2025-09-07,Santana da Ponte Pensa - SP,-20.2543758,-50.7975649
SP,26/07/2025 - Feriado Municipal,Feriado Municipal,,2025-07-26,Santana da Ponte Pensa - SP,-20.2543758,-50.7975649
SP,09/07/2025 - Revolução Constitucionalista,Revolução Constitucionalista,,2025-07-09,Santana da Ponte Pensa - SP,-20.2543758,-50.7975649
SP,01/05/2025 - Dia do Trabalho,Dia do Trabalho,,2025-05-01,Santana da Ponte Pensa - SP,-20.2543758,-50.7975649
SP,21/04/2025 - Dia de Tiradentes,Dia de Tiradentes,,2025-04-21,Santana da Ponte Pensa - SP,-20.2543758,-50.7975649
SP,18/04/2025 - Sexta-Feira Santa,Sexta-Feira Santa,,2025-04-18,Santana da Ponte Pensa - SP,-20.2543758,-50.7975649
SP,21/03/2025 - Feriado Municipal,Feriado Municipal,,2025-03-21,Santana da Ponte Pensa - SP,-20.2543758,-50.7975649
SP,01/01/2025 - Ano Novo,Ano Novo,,2025-01-01,Santana da Ponte Pensa - SP,-20.2543758,-50.7975649
SP,25/12/2025 - Natal,Natal,,2025-12-25,Santa Salete - SP,-20.2451795,-50.6889625
SP,15/11/2025 - Proclamação da República,Proclamação da República,,2025-11-15,Santa Salete - SP,-20.2451795,-50.6889625
SP,02/11/2025 - Dia de Finados,Dia de Finados,,2025-11-02,Santa Salete - SP,-20.2451795,-50.6889625
SP,12/10/2025 - Nossa Senhora Aparecida,Nossa Senhora Aparecida,,2025-10-12,Santa Salete - SP,-20.2451795,-50.6889625
SP,07/09/2025 - Independência do Brasil,Independência do Brasil,,2025-09-07,Santa Salete - SP,-20.2451795,-50.6889625
SP,09/07/2025 - Revolução Constitucionalista,Revolução Constitucionalista,,2025-07-09,Santa Salete - SP,-20.2451795,-50.6889625
SP,01/05/2025 - Dia do Trabalho,Dia do Trabalho,,2025-05-01,Santa Salete - SP,-20.2451795,-50.6889625
SP,21/04/2025 - Dia de Tiradentes,Dia de Tiradentes,,2025-04-21,Santa Salete - SP,-20.2451795,-50.6889625
SP,18/04/2025 - Sexta-Feira Santa,Sexta-Feira Santa,,2025-04-18,Santa Salete - SP,-20.2451795,-50.6889625
SP,01/01/2025 - Ano Novo,Ano Novo,,2025-01-01,Santa Salete - SP,-20.2451795,-50.6889625
SP,25/12/2025 - Natal,Natal,,2025-12-25,Santa Rosa de Viterbo - SP,-21.4387117,-47.3481672
SP,20/11/2025 - Dia da Consciência Negra,Dia da Consciência Negra,,2025-11-20,Santa Rosa de Viterbo - SP,-21.4387117,-47.3481672
SP,15/11/2025 - Proclamação da República,Proclamação da República,,2025-11-15,Santa Rosa de Viterbo - SP,-21.4387117,-47.3481672
SP,02/11/2025 - Dia de Finados,Dia de Finados,,2025-11-02,Santa Rosa de Viterbo - SP,-21.4387117,-47.3481672
SP,12/10/2025 - Nossa Senhora Aparecida,Nossa Senhora Aparecida,,2025-10-12,Santa Rosa de Viterbo - SP,-21.4387117,-47.3481672
SP,07/09/2025 - Independência do Brasil,Independência do Brasil,,2025-09-07,Santa Rosa de Viterbo - SP,-21.4387117,-47.3481672
SP,04/09/2025 - Aniversário da Cidade,Aniversário da Cidade,,2025-09-04,Santa Rosa de Viterbo - SP,-21.4387117,-47.3481672
SP,09/07/2025 - Revolução Constitucionalista,Revolução Constitucionalista,,2025-07-09,Santa Rosa de Viterbo - SP,-21.4387117,-47.3481672
SP,19/06/2025 - Corpus Christi,Corpus Christi,,2025-06-19,Santa Rosa de Viterbo - SP,-21.4387117,-47.3481672
SP,01/05/2025 - Dia do Trabalho,Dia do Trabalho,,2025-05-01,Santa Rosa de Viterbo - SP,-21.4387117,-47.3481672
SP,21/04/2025 - Dia de Tiradentes,Dia de Tiradentes,,2025-04-21,Santa Rosa de Viterbo - SP,-21.4387117,-47.3481672
SP,18/04/2025 - Sexta-Feira Santa,Sexta-Feira Santa,,2025-04-18,Santa Rosa de Viterbo - SP,-21.4387117,-47.3481672
SP,18/04/2025 - Sexta-Feira Santa,Sexta-Feira Santa,,2025-04-18,Santa Rosa de Viterbo - SP,-21.4387117,-47.3481672
SP,01/01/2025 - Ano Novo,Ano Novo,,2025-01-01,Santa Rosa de Viterbo - SP,-21.4387117,-47.3481672
SP,25/12/2025 - Natal,Natal,,2025-12-25,Santa Rita do Passa Quatro - SP,-21.7106131,-47.4720566
SP,15/11/2025 - Proclamação da República,Proclamação da República,,2025-11-15,Santa Rita do Passa Quatro - SP,-21.7106131,-47.4720566
SP,02/11/2025 - Dia de Finados,Dia de Finados,,2025-11-02,Santa Rita do Passa Quatro - SP,-21.7106131,-47.4720566
SP,12/10/2025 - Nossa Senhora Aparecida,Nossa Senhora Aparecida,,2025-10-12,Santa Rita do Passa Quatro - SP,-21.7106131,-47.4720566
SP,07/09/2025 - Independência do Brasil,Independência do Brasil,,2025-09-07,Santa Rita do Passa Quatro - SP,-21.7106131,-47.4720566
SP,09/07/2025 - Revolução Constitucionalista,Revolução Constitucionalista,,2025-07-09,Santa Rita do Passa Quatro - SP,-21.7106131,-47.4720566
SP,22/05/2025 - Feriado Municipal,Feriado Municipal,,2025-05-22,Santa Rita do Passa Quatro - SP,-21.7106131,-47.4720566
SP,01/05/2025 - Dia do Trabalho,Dia do Trabalho,,2025-05-01,Santa Rita do Passa Quatro - SP,-21.7106131,-47.4720566
SP,21/04/2025 - Dia de Tiradentes,Dia de Tiradentes,,2025-04-21,Santa Rita do Passa Quatro - SP,-21.7106131,-47.4720566
SP,18/04/2025 - Sexta-Feira Santa,Sexta-Feira Santa,,2025-04-18,Santa Rita do Passa Quatro - SP,-21.7106131,-47.4720566
SP,01/01/2025 - Ano Novo,Ano Novo,,2025-01-01,Santa Rita do Passa Quatro - SP,-21.7106131,-47.4720566
SP,25/12/2025 - Natal,Natal,,2025-12-25,Santa Mercedes - SP,-21.3526333,-51.7522587
SP,20/11/2025 - Dia da Consciência Negra,Dia da Consciência Negra,,2025-11-20,Santa Mercedes - SP,-21.3526333,-51.7522587
SP,15/11/2025 - Proclamação da República,Proclamação da República,,2025-11-15,Santa Mercedes - SP,-21.3526333,-51.7522587
SP,02/11/2025 - Dia de Finados,Dia de Finados,,2025-11-02,Santa Mercedes - SP,-21.3526333,-51.7522587
SP,12/10/2025 - Nossa Senhora Aparecida,Nossa Senhora Aparecida,,2025-10-12,Santa Mercedes - SP,-21.3526333,-51.7522587
SP,24/09/2025 - Feriado Municipal,Feriado Municipal,,2025-09-24,Santa Mercedes - SP,-21.3526333,-51.7522587
SP,07/09/2025 - Independência do Brasil,Independência do Brasil,,2025-09-07,Santa Mercedes - SP,-21.3526333,-51.7522587
SP,09/07/2025 - Revolução Constitucionalista,Revolução Constitucionalista,,2025-07-09,Santa Mercedes - SP,-21.3526333,-51.7522587
SP,01/05/2025 - Dia do Trabalho,Dia do Trabalho,,2025-05-01,Santa Mercedes - SP,-21.3526333,-51.7522587
SP,21/04/2025 - Dia de Tiradentes,Dia de Tiradentes,,2025-04-21,Santa Mercedes - SP,-21.3526333,-51.7522587
SP,18/04/2025 - Sexta-Feira Santa,Sexta-Feira Santa,,2025-04-18,Santa Mercedes - SP,-21.3526333,-51.7522587
SP,01/01/2025 - Ano Novo,Ano Novo,,2025-01-01,Santa Mercedes - SP,-21.3526333,-51.7522587
SP,25/12/2025 - Natal,Natal,,2025-12-25,Santa Maria da Serra - SP,-22.5691072,-48.157095
SP,15/11/2025 - Proclamação da República,Proclamação da República,,2025-11-15,Santa Maria da Serra - SP,-22.5691072,-48.157095
SP,02/11/2025 - Dia de Finados,Dia de Finados,,2025-11-02,Santa Maria da Serra - SP,-22.5691072,-48.157095
SP,12/10/2025 - Nossa Senhora Aparecida,Nossa Senhora Aparecida,,2025-10-12,Santa Maria da Serra - SP,-22.5691072,-48.157095
SP,07/09/2025 - Independência do Brasil,Independência do Brasil,,2025-09-07,Santa Maria da Serra - SP,-22.5691072,-48.157095
SP,15/08/2025 - Feriado Municipal,Feriado Municipal,,2025-08-15,Santa Maria da Serra - SP,-22.5691072,-48.157095
SP,09/07/2025 - Revolução Constitucionalista,Revolução Constitucionalista,,2025-07-09,Santa Maria da Serra - SP,-22.5691072,-48.157095
SP,01/05/2025 - Dia do Trabalho,Dia do Trabalho,,2025-05-01,Santa Maria da Serra - SP,-22.5691072,-48.157095
SP,21/04/2025 - Dia de Tiradentes,Dia de Tiradentes,,2025-04-21,Santa Maria da Serra - SP,-22.5691072,-48.157095
SP,18/04/2025 - Sexta-Feira Santa,Sexta-Feira Santa,,2025-04-18,Santa Maria da Serra - SP,-22.5691072,-48.157095
SP,01/01/2025 - Ano Novo,Ano Novo,,2025-01-01,Santa Maria da Serra - SP,-22.5691072,-48.157095
SP,25/12/2025 - Natal,Natal,,2025-12-25,Santa Isabel - SP,-23.3173874,-46.2218338
SP,20/11/2025 - Dia da Consciência Negra,Dia da Consciência Negra,,2025-11-20,Santa Isabel - SP,-23.3173874,-46.2218338
SP,15/11/2025 - Proclamação da República,Proclamação da República,,2025-11-15,Santa Isabel - SP,-23.3173874,-46.2218338
SP,02/11/2025 - Dia de Finados,Dia de Finados,,2025-11-02,Santa Isabel - SP,-23.3173874,-46.2218338
SP,12/10/2025 - Nossa Senhora Aparecida,Nossa Senhora Aparecida,,2025-10-12,Santa Isabel - SP,-23.3173874,-46.2218338
SP,07/09/2025 - Independência do Brasil,Independência do Brasil,,2025-09-07,Santa Isabel - SP,-23.3173874,-46.2218338
SP,09/07/2025 - Revolução Constitucionalista,Revolução Constitucionalista,,2025-07-09,Santa Isabel - SP,-23.3173874,-46.2218338
SP,04/07/2025 - Feriado Municipal,Feriado Municipal,,2025-07-04,Santa Isabel - SP,-23.3173874,-46.2218338
SP,01/05/2025 - Dia do Trabalho,Dia do Trabalho,,2025-05-01,Santa Isabel - SP,-23.3173874,-46.2218338
SP,21/04/2025 - Dia de Tiradentes,Dia de Tiradentes,,2025-04-21,Santa Isabel - SP,-23.3173874,-46.2218338
SP,18/04/2025 - Sexta-Feira Santa,Sexta-Feira Santa,,2025-04-18,Santa Isabel - SP,-23.3173874,-46.2218338
SP,01/01/2025 - Ano Novo,Ano Novo,,2025-01-01,Santa Isabel - SP,-23.3173874,-46.2218338
SP,25/12/2025 - Natal,Natal,,2025-12-25,Vista Alegre do Alto - SP,-21.171293,-48.6299172
SP,15/11/2025 - Proclamação da República,Proclamação da República,,2025-11-15,Vista Alegre do Alto - SP,-21.171293,-48.6299172
SP,02/11/2025 - Dia de Finados,Dia de Finados,,2025-11-02,Vista Alegre do Alto - SP,-21.171293,-48.6299172
SP,12/10/2025 - Nossa Senhora Aparecida,Nossa Senhora Aparecida,,2025-10-12,Vista Alegre do Alto - SP,-21.171293,-48.6299172
SP,07/09/2025 - Independência do Brasil,Independência do Brasil,,2025-09-07,Vista Alegre do Alto - SP,-21.171293,-48.6299172
SP,09/07/2025 - Revolução Constitucionalista,Revolução Constitucionalista,,2025-07-09,Vista Alegre do Alto - SP,-21.171293,-48.6299172
SP,22/05/2025 - Feriado Municipal,Feriado Municipal,,2025-05-22,Vista Alegre do Alto - SP,-21.171293,-48.6299172
SP,01/05/2025 - Dia do Trabalho,Dia do Trabalho,,2025-05-01,Vista Alegre do Alto - SP,-21.171293,-48.6299172
SP,21/04/2025 - Dia de Tiradentes,Dia de Tiradentes,,2025-04-21,Vista Alegre do Alto - SP,-21.171293,-48.6299172
SP,18/04/2025 - Sexta-Feira Santa,Sexta-Feira Santa,,2025-04-18,Vista Alegre do Alto - SP,-21.171293,-48.6299172
SP,25/03/2025 - Feriado Municipal,Feriado Municipal,,2025-03-25,Vista Alegre do Alto - SP,-21.171293,-48.6299172
SP,18/02/2025 - Feriado Municipal,Feriado Municipal,,2025-02-18,Vista Alegre do Alto - SP,-21.171293,-48.6299172
SP,01/01/2025 - Ano Novo,Ano Novo,,2025-01-01,Vista Alegre do Alto - SP,-21.171293,-48.6299172
SP,25/12/2025 - Natal,Natal,,2025-12-25,Valentim Gentil - SP,-20.4221315,-50.0809572
SP,15/11/2025 - Proclamação da República,Proclamação da República,,2025-11-15,Valentim Gentil - SP,-20.4221315,-50.0809572
SP,02/11/2025 - Dia de Finados,Dia de Finados,,2025-11-02,Valentim Gentil - SP,-20.4221315,-50.0809572
SP,12/10/2025 - Nossa Senhora Aparecida,Nossa Senhora Aparecida,,2025-10-12,Valentim Gentil - SP,-20.4221315,-50.0809572
SP,07/09/2025 - Independência do Brasil,Independência do Brasil,,2025-09-07,Valentim Gentil - SP,-20.4221315,-50.0809572
SP,09/07/2025 - Revolução Constitucionalista,Revolução Constitucionalista,,2025-07-09,Valentim Gentil - SP,-20.4221315,-50.0809572
SP,03/05/2025 - Feriado Municipal,Feriado Municipal,,2025-05-03,Valentim Gentil - SP,-20.4221315,-50.0809572
SP,01/05/2025 - Dia do Trabalho,Dia do Trabalho,,2025-05-01,Valentim Gentil - SP,-20.4221315,-50.0809572
SP,21/04/2025 - Dia de Tiradentes,Dia de Tiradentes,,2025-04-21,Valentim Gentil - SP,-20.4221315,-50.0809572
SP,18/04/2025 - Sexta-Feira Santa,Sexta-Feira Santa,,2025-04-18,Valentim Gentil - SP,-20.4221315,-50.0809572
SP,20/01/2025 - Feriado Municipal,Feriado Municipal,,2025-01-20,Valentim Gentil - SP,-20.4221315,-50.0809572
SP,01/01/2025 - Ano Novo,Ano Novo,,2025-01-01,Valentim Gentil - SP,-20.4221315,-50.0809572
SP,25/12/2025 - Natal,Natal,,2025-12-25,Ubatuba - SP,-23.4413574,-45.0795051
SP,15/11/2025 - Proclamação da República,Proclamação da República,,2025-11-15,Ubatuba - SP,-23.4413574,-45.0795051
SP,02/11/2025 - Dia de Finados,Dia de Finados,,2025-11-02,Ubatuba - SP,-23.4413574,-45.0795051
SP,28/10/2025 - Aniversário da Cidade,Aniversário da Cidade,,2025-10-28,Ubatuba - SP,-23.4413574,-45.0795051
SP,12/10/2025 - Nossa Senhora Aparecida,Nossa Senhora Aparecida,,2025-10-12,Ubatuba - SP,-23.4413574,-45.0795051
SP,14/09/2025 - Feriado Municipal,Feriado Municipal,,2025-09-14,Ubatuba - SP,-23.4413574,-45.0795051
SP,07/09/2025 - Independência do Brasil,Independência do Brasil,,2025-09-07,Ubatuba - SP,-23.4413574,-45.0795051
SP,09/07/2025 - Revolução Constitucionalista,Revolução Constitucionalista,,2025-07-09,Ubatuba - SP,-23.4413574,-45.0795051
SP,29/06/2025 - Feriado Municipal,Feriado Municipal,,2025-06-29,Ubatuba - SP,-23.4413574,-45.0795051
SP,01/05/2025 - Dia do Trabalho,Dia do Trabalho,,2025-05-01,Ubatuba - SP,-23.4413574,-45.0795051
SP,21/04/2025 - Dia de Tiradentes,Dia de Tiradentes,,2025-04-21,Ubatuba - SP,-23.4413574,-45.0795051
SP,18/04/2025 - Sexta-Feira Santa,Sexta-Feira Santa,,2025-04-18,Ubatuba - SP,-23.4413574,-45.0795051
SP,01/01/2025 - Ano Novo,Ano Novo,,2025-01-01,Ubatuba - SP,-23.4413574,-45.0795051
SP,25/12/2025 - Natal,Natal,,2025-12-25,Ubirajara - SP,-20.6527752,-47.2833665
SP,15/11/2025 - Proclamação da República,Proclamação da República,,2025-11-15,Ubirajara - SP,-20.6527752,-47.2833665
SP,02/11/2025 - Dia de Finados,Dia de Finados,,2025-11-02,Ubirajara - SP,-20.6527752,-47.2833665
SP,12/10/2025 - Nossa Senhora Aparecida,Nossa Senhora Aparecida,,2025-10-12,Ubirajara - SP,-20.6527752,-47.2833665
SP,07/09/2025 - Independência do Brasil,Independência do Brasil,,2025-09-07,Ubirajara - SP,-20.6527752,-47.2833665
SP,09/07/2025 - Revolução Constitucionalista,Revolução Constitucionalista,,2025-07-09,Ubirajara - SP,-20.6527752,-47.2833665
SP,01/05/2025 - Dia do Trabalho,Dia do Trabalho,,2025-05-01,Ubirajara - SP,-20.6527752,-47.2833665
SP,21/04/2025 - Dia de Tiradentes,Dia de Tiradentes,,2025-04-21,Ubirajara - SP,-20.6527752,-47.2833665
SP,18/04/2025 - Sexta-Feira Santa,Sexta-Feira Santa,,2025-04-18,Ubirajara - SP,-20.6527752,-47.2833665
SP,01/01/2025 - Ano Novo,Ano Novo,,2025-01-01,Ubirajara - SP,-20.6527752,-47.2833665
SP,25/12/2025 - Natal,Natal,,2025-12-25,Uchoa - SP,-20.9600734,-49.174976
SP,15/11/2025 - Proclamação da República,Proclamação da República,,2025-11-15,Uchoa - SP,-20.9600734,-49.174976
SP,02/11/2025 - Dia de Finados,Dia de Finados,,2025-11-02,Uchoa - SP,-20.9600734,-49.174976
SP,12/10/2025 - Nossa Senhora Aparecida,Nossa Senhora Aparecida,,2025-10-12,Uchoa - SP,-20.9600734,-49.174976
SP,07/09/2025 - Independência do Brasil,Independência do Brasil,,2025-09-07,Uchoa - SP,-20.9600734,-49.174976
SP,09/07/2025 - Revolução Constitucionalista,Revolução Constitucionalista,,2025-07-09,Uchoa - SP,-20.9600734,-49.174976
SP,08/07/2025 - Feriado Municipal,Feriado Municipal,,2025-07-08,Uchoa - SP,-20.9600734,-49.174976
SP,01/05/2025 - Dia do Trabalho,Dia do Trabalho,,2025-05-01,Uchoa - SP,-20.9600734,-49.174976
SP,21/04/2025 - Dia de Tiradentes,Dia de Tiradentes,,2025-04-21,Uchoa - SP,-20.9600734,-49.174976
SP,18/04/2025 - Sexta-Feira Santa,Sexta-Feira Santa,,2025-04-18,Uchoa - SP,-20.9600734,-49.174976
SP,28/03/2025 - Feriado Municipal,Feriado Municipal,,2025-03-28,Uchoa - SP,-20.9600734,-49.174976
SP,01/01/2025 - Ano Novo,Ano Novo,,2025-01-01,Uchoa - SP,-20.9600734,-49.174976
SP,25/12/2025 - Natal,Natal,,2025-12-25,Uru - SP,-21.7846064,-49.2819702
SP,15/11/2025 - Proclamação da República,Proclamação da República,,2025-11-15,Uru - SP,-21.7846064,-49.2819702
SP,02/11/2025 - Dia de Finados,Dia de Finados,,2025-11-02,Uru - SP,-21.7846064,-49.2819702
SP,12/10/2025 - Nossa Senhora Aparecida,Nossa Senhora Aparecida,,2025-10-12,Uru - SP,-21.7846064,-49.2819702
SP,07/09/2025 - Independência do Brasil,Independência do Brasil,,2025-09-07,Uru - SP,-21.7846064,-49.2819702
SP,09/07/2025 - Revolução Constitucionalista,Revolução Constitucionalista,,2025-07-09,Uru - SP,-21.7846064,-49.2819702
SP,13/06/2025 - Dia de Santo Antônio,Dia de Santo Antônio,,2025-06-13,Uru - SP,-21.7846064,-49.2819702
SP,01/05/2025 - Dia do Trabalho,Dia do Trabalho,,2025-05-01,Uru - SP,-21.7846064,-49.2819702
SP,21/04/2025 - Dia de Tiradentes,Dia de Tiradentes,,2025-04-21,Uru - SP,-21.7846064,-49.2819702
SP,18/04/2025 - Sexta-Feira Santa,Sexta-Feira Santa,,2025-04-18,Uru - SP,-21.7846064,-49.2819702
SP,20/01/2025 - Feriado Municipal,Feriado Municipal,,2025-01-20,Uru - SP,-21.7846064,-49.2819702
SP,01/01/2025 - Ano Novo,Ano Novo,,2025-01-01,Uru - SP,-21.7846064,-49.2819702
SP,25/12/2025 - Natal,Natal,,2025-12-25,Valinhos - SP,-23.0143366,-47.0211215
SP,20/11/2025 - Dia da Consciência Negra,Dia da Consciência Negra,,2025-11-20,Valinhos - SP,-23.0143366,-47.0211215
SP,15/11/2025 - Proclamação da República,Proclamação da República,,2025-11-15,Valinhos - SP,-23.0143366,-47.0211215
SP,02/11/2025 - Dia de Finados,Dia de Finados,,2025-11-02,Valinhos - SP,-23.0143366,-47.0211215
SP,12/10/2025 - Nossa Senhora Aparecida,Nossa Senhora Aparecida,,2025-10-12,Valinhos - SP,-23.0143366,-47.0211215
SP,07/09/2025 - Independência do Brasil,Independência do Brasil,,2025-09-07,Valinhos - SP,-23.0143366,-47.0211215
SP,09/07/2025 - Revolução Constitucionalista,Revolução Constitucionalista,,2025-07-09,Valinhos - SP,-23.0143366,-47.0211215
SP,01/05/2025 - Dia do Trabalho,Dia do Trabalho,,2025-05-01,Valinhos - SP,-23.0143366,-47.0211215
SP,21/04/2025 - Dia de Tiradentes,Dia de Tiradentes,,2025-04-21,Valinhos - SP,-23.0143366,-47.0211215
SP,18/04/2025 - Sexta-Feira Santa,Sexta-Feira Santa,,2025-04-18,Valinhos - SP,-23.0143366,-47.0211215
SP,20/01/2025 - Feriado Municipal,Feriado Municipal,,2025-01-20,Valinhos - SP,-23.0143366,-47.0211215
SP,01/01/2025 - Ano Novo,Ano Novo,,2025-01-01,Valinhos - SP,-23.0143366,-47.0211215
SP,25/12/2025 - Natal,Natal,,2025-12-25,Viradouro - SP,-20.8724046,-48.2979261
SP,15/11/2025 - Proclamação da República,Proclamação da República,,2025-11-15,Viradouro - SP,-20.8724046,-48.2979261
SP,02/11/2025 - Dia de Finados,Dia de Finados,,2025-11-02,Viradouro - SP,-20.8724046,-48.2979261
SP,12/10/2025 - Nossa Senhora Aparecida,Nossa Senhora Aparecida,,2025-10-12,Viradouro - SP,-20.8724046,-48.2979261
SP,07/09/2025 - Independência do Brasil,Independência do Brasil,,2025-09-07,Viradouro - SP,-20.8724046,-48.2979261
SP,09/07/2025 - Revolução Constitucionalista,Revolução Constitucionalista,,2025-07-09,Viradouro - SP,-20.8724046,-48.2979261
SP,29/06/2025 - Feriado Municipal,Feriado Municipal,,2025-06-29,Viradouro - SP,-20.8724046,-48.2979261
SP,01/05/2025 - Dia do Trabalho,Dia do Trabalho,,2025-05-01,Viradouro - SP,-20.8724046,-48.2979261
SP,21/04/2025 - Dia de Tiradentes,Dia de Tiradentes,,2025-04-21,Viradouro - SP,-20.8724046,-48.2979261
SP,18/04/2025 - Sexta-Feira Santa,Sexta-Feira Santa,,2025-04-18,Viradouro - SP,-20.8724046,-48.2979261
SP,04/04/2025 - Feriado Municipal,Feriado Municipal,,2025-04-04,Viradouro - SP,-20.8724046,-48.2979261
SP,23/03/2025 - Feriado Municipal,Feriado Municipal,,2025-03-23,Viradouro - SP,-20.8724046,-48.2979261
SP,01/01/2025 - Ano Novo,Ano Novo,,2025-01-01,Viradouro - SP,-20.8724046,-48.2979261
SP,30/12/2025 - Feriado Municipal,Feriado Municipal,,2025-12-30,Vargem - SP,-22.891496,-46.4155615
SP,25/12/2025 - Natal,Natal,,2025-12-25,Vargem - SP,-22.891496,-46.4155615
SP,15/11/2025 - Proclamação da República,Proclamação da República,,2025-11-15,Vargem - SP,-22.891496,-46.4155615
SP,02/11/2025 - Dia de Finados,Dia de Finados,,2025-11-02,Vargem - SP,-22.891496,-46.4155615
SP,12/10/2025 - Nossa Senhora Aparecida,Nossa Senhora Aparecida,,2025-10-12,Vargem - SP,-22.891496,-46.4155615
SP,07/09/2025 - Independência do Brasil,Independência do Brasil,,2025-09-07,Vargem - SP,-22.891496,-46.4155615
SP,09/07/2025 - Revolução Constitucionalista,Revolução Constitucionalista,,2025-07-09,Vargem - SP,-22.891496,-46.4155615
SP,13/06/2025 - Dia de Santo Antônio,Dia de Santo Antônio,,2025-06-13,Vargem - SP,-22.891496,-46.4155615
SP,01/05/2025 - Dia do Trabalho,Dia do Trabalho,,2025-05-01,Vargem - SP,-22.891496,-46.4155615
SP,21/04/2025 - Dia de Tiradentes,Dia de Tiradentes,,2025-04-21,Vargem - SP,-22.891496,-46.4155615
SP,18/04/2025 - Sexta-Feira Santa,Sexta-Feira Santa,,2025-04-18,Vargem - SP,-22.891496,-46.4155615
SP,01/01/2025 - Ano Novo,Ano Novo,,2025-01-01,Vargem - SP,-22.891496,-46.4155615
SP,25/12/2025 - Natal,Natal,,2025-12-25,Vargem Grande do Sul - SP,-21.8244938,-46.8997133
SP,15/11/2025 - Proclamação da República,Proclamação da República,,2025-11-15,Vargem Grande do Sul - SP,-21.8244938,-46.8997133
SP,02/11/2025 - Dia de Finados,Dia de Finados,,2025-11-02,Vargem Grande do Sul - SP,-21.8244938,-46.8997133
SP,12/10/2025 - Nossa Senhora Aparecida,Nossa Senhora Aparecida,,2025-10-12,Vargem Grande do Sul - SP,-21.8244938,-46.8997133
SP,26/09/2025 - Feriado Municipal,Feriado Municipal,,2025-09-26,Vargem Grande do Sul - SP,-21.8244938,-46.8997133
SP,07/09/2025 - Independência do Brasil,Independência do Brasil,,2025-09-07,Vargem Grande do Sul - SP,-21.8244938,-46.8997133
SP,26/07/2025 - Feriado Municipal,Feriado Municipal,,2025-07-26,Vargem Grande do Sul - SP,-21.8244938,-46.8997133
SP,09/07/2025 - Revolução Constitucionalista,Revolução Constitucionalista,,2025-07-09,Vargem Grande do Sul - SP,-21.8244938,-46.8997133
SP,01/05/2025 - Dia do Trabalho,Dia do Trabalho,,2025-05-01,Vargem Grande do Sul - SP,-21.8244938,-46.8997133
SP,21/04/2025 - Dia de Tiradentes,Dia de Tiradentes,,2025-04-21,Vargem Grande do Sul - SP,-21.8244938,-46.8997133
SP,18/04/2025 - Sexta-Feira Santa,Sexta-Feira Santa,,2025-04-18,Vargem Grande do Sul - SP,-21.8244938,-46.8997133
SP,01/01/2025 - Ano Novo,Ano Novo,,2025-01-01,Vargem Grande do Sul - SP,-21.8244938,-46.8997133
SP,25/12/2025 - Natal,Natal,,2025-12-25,Vargem Grande Paulista - SP,-23.6317516,-47.0344285
SP,27/11/2025 - Feriado Municipal,Feriado Municipal,,2025-11-27,Vargem Grande Paulista - SP,-23.6317516,-47.0344285
SP,15/11/2025 - Proclamação da República,Proclamação da República,,2025-11-15,Vargem Grande Paulista - SP,-23.6317516,-47.0344285
SP,02/11/2025 - Dia de Finados,Dia de Finados,,2025-11-02,Vargem Grande Paulista - SP,-23.6317516,-47.0344285
SP,12/10/2025 - Nossa Senhora Aparecida,Nossa Senhora Aparecida,,2025-10-12,Vargem Grande Paulista - SP,-23.6317516,-47.0344285
SP,07/09/2025 - Independência do Brasil,Independência do Brasil,,2025-09-07,Vargem Grande Paulista - SP,-23.6317516,-47.0344285
SP,09/07/2025 - Revolução Constitucionalista,Revolução Constitucionalista,,2025-07-09,Vargem Grande Paulista - SP,-23.6317516,-47.0344285
SP,01/05/2025 - Dia do Trabalho,Dia do Trabalho,,2025-05-01,Vargem Grande Paulista - SP,-23.6317516,-47.0344285
SP,21/04/2025 - Dia de Tiradentes,Dia de Tiradentes,,2025-04-21,Vargem Grande Paulista - SP,-23.6317516,-47.0344285
SP,18/04/2025 - Sexta-Feira Santa,Sexta-Feira Santa,,2025-04-18,Vargem Grande Paulista - SP,-23.6317516,-47.0344285
SP,01/01/2025 - Ano Novo,Ano Novo,,2025-01-01,Vargem Grande Paulista - SP,-23.6317516,-47.0344285
SP,25/12/2025 - Natal,Natal,,2025-12-25,Vera Cruz - SP,-24.1001781,-46.640872
SP,15/11/2025 - Proclamação da República,Proclamação da República,,2025-11-15,Vera Cruz - SP,-24.1001781,-46.640872
SP,02/11/2025 - Dia de Finados,Dia de Finados,,2025-11-02,Vera Cruz - SP,-24.1001781,-46.640872
SP,12/10/2025 - Nossa Senhora Aparecida,Nossa Senhora Aparecida,,2025-10-12,Vera Cruz - SP,-24.1001781,-46.640872
SP,07/09/2025 - Independência do Brasil,Independência do Brasil,,2025-09-07,Vera Cruz - SP,-24.1001781,-46.640872
SP,09/07/2025 - Revolução Constitucionalista,Revolução Constitucionalista,,2025-07-09,Vera Cruz - SP,-24.1001781,-46.640872
SP,15/06/2025 - Feriado Municipal,Feriado Municipal,,2025-06-15,Vera Cruz - SP,-24.1001781,-46.640872
SP,01/05/2025 - Dia do Trabalho,Dia do Trabalho,,2025-05-01,Vera Cruz - SP,-24.1001781,-46.640872
SP,21/04/2025 - Dia de Tiradentes,Dia de Tiradentes,,2025-04-21,Vera Cruz - SP,-24.1001781,-46.640872
SP,18/04/2025 - Sexta-Feira Santa,Sexta-Feira Santa,,2025-04-18,Vera Cruz - SP,-24.1001781,-46.640872
SP,25/01/2025 - Feriado Municipal,Feriado Municipal,,2025-01-25,Vera Cruz - SP,-24.1001781,-46.640872
SP,01/01/2025 - Ano Novo,Ano Novo,,2025-01-01,Vera Cruz - SP,-24.1001781,-46.640872
SP,25/12/2025 - Natal,Natal,,2025-12-25,Vinhedo - SP,-23.0584756,-47.0282716
SP,15/11/2025 - Proclamação da República,Proclamação da República,,2025-11-15,Vinhedo - SP,-23.0584756,-47.0282716
SP,02/11/2025 - Dia de Finados,Dia de Finados,,2025-11-02,Vinhedo - SP,-23.0584756,-47.0282716
SP,12/10/2025 - Nossa Senhora Aparecida,Nossa Senhora Aparecida,,2025-10-12,Vinhedo - SP,-23.0584756,-47.0282716
SP,07/09/2025 - Independência do Brasil,Independência do Brasil,,2025-09-07,Vinhedo - SP,-23.0584756,-47.0282716
SP,26/07/2025 - Feriado Municipal,Feriado Municipal,,2025-07-26,Vinhedo - SP,-23.0584756,-47.0282716
SP,09/07/2025 - Revolução Constitucionalista,Revolução Constitucionalista,,2025-07-09,Vinhedo - SP,-23.0584756,-47.0282716
SP,01/05/2025 - Dia do Trabalho,Dia do Trabalho,,2025-05-01,Vinhedo - SP,-23.0584756,-47.0282716
SP,21/04/2025 - Dia de Tiradentes,Dia de Tiradentes,,2025-04-21,Vinhedo - SP,-23.0584756,-47.0282716
SP,18/04/2025 - Sexta-Feira Santa,Sexta-Feira Santa,,2025-04-18,Vinhedo - SP,-23.0584756,-47.0282716
SP,02/04/2025 - Feriado Municipal,Feriado Municipal,,2025-04-02,Vinhedo - SP,-23.0584756,-47.0282716
SP,01/01/2025 - Ano Novo,Ano Novo,,2025-01-01,Vinhedo - SP,-23.0584756,-47.0282716
SP,25/12/2025 - Natal,Natal,,2025-12-25,Santa Gertrudes - SP,-23.2472544,-46.8533286
SP,15/11/2025 - Proclamação da República,Proclamação da República,,2025-11-15,Santa Gertrudes - SP,-23.2472544,-46.8533286
SP,02/11/2025 - Dia de Finados,Dia de Finados,,2025-11-02,Santa Gertrudes - SP,-23.2472544,-46.8533286
SP,12/10/2025 - Nossa Senhora Aparecida,Nossa Senhora Aparecida,,2025-10-12,Santa Gertrudes - SP,-23.2472544,-46.8533286
SP,07/09/2025 - Independência do Brasil,Independência do Brasil,,2025-09-07,Santa Gertrudes - SP,-23.2472544,-46.8533286
SP,16/08/2025 - Feriado Municipal,Feriado Municipal,,2025-08-16,Santa Gertrudes - SP,-23.2472544,-46.8533286
SP,26/07/2025 - Feriado Municipal,Feriado Municipal,,2025-07-26,Santa Gertrudes - SP,-23.2472544,-46.8533286
SP,09/07/2025 - Revolução Constitucionalista,Revolução Constitucionalista,,2025-07-09,Santa Gertrudes - SP,-23.2472544,-46.8533286
SP,01/05/2025 - Dia do Trabalho,Dia do Trabalho,,2025-05-01,Santa Gertrudes - SP,-23.2472544,-46.8533286
SP,21/04/2025 - Dia de Tiradentes,Dia de Tiradentes,,2025-04-21,Santa Gertrudes - SP,-23.2472544,-46.8533286
SP,18/04/2025 - Sexta-Feira Santa,Sexta-Feira Santa,,2025-04-18,Santa Gertrudes - SP,-23.2472544,-46.8533286
SP,01/01/2025 - Ano Novo,Ano Novo,,2025-01-01,Santa Gertrudes - SP,-23.2472544,-46.8533286
SP,25/12/2025 - Natal,Natal,,2025-12-25,Santa Ernestina - SP,-21.4634463,-48.3912139
SP,15/11/2025 - Proclamação da República,Proclamação da República,,2025-11-15,Santa Ernestina - SP,-21.4634463,-48.3912139
SP,02/11/2025 - Dia de Finados,Dia de Finados,,2025-11-02,Santa Ernestina - SP,-21.4634463,-48.3912139
SP,12/10/2025 - Nossa Senhora Aparecida,Nossa Senhora Aparecida,,2025-10-12,Santa Ernestina - SP,-21.4634463,-48.3912139
SP,07/09/2025 - Independência do Brasil,Independência do Brasil,,2025-09-07,Santa Ernestina - SP,-21.4634463,-48.3912139
SP,26/07/2025 - Feriado Municipal,Feriado Municipal,,2025-07-26,Santa Ernestina - SP,-21.4634463,-48.3912139
SP,09/07/2025 - Revolução Constitucionalista,Revolução Constitucionalista,,2025-07-09,Santa Ernestina - SP,-21.4634463,-48.3912139
SP,01/05/2025 - Dia do Trabalho,Dia do Trabalho,,2025-05-01,Santa Ernestina - SP,-21.4634463,-48.3912139
SP,21/04/2025 - Dia de Tiradentes,Dia de Tiradentes,,2025-04-21,Santa Ernestina - SP,-21.4634463,-48.3912139
SP,18/04/2025 - Sexta-Feira Santa,Sexta-Feira Santa,,2025-04-18,Santa Ernestina - SP,-21.4634463,-48.3912139
SP,01/01/2025 - Ano Novo,Ano Novo,,2025-01-01,Santa Ernestina - SP,-21.4634463,-48.3912139
SP,25/12/2025 - Natal,Natal,,2025-12-25,Rio Claro - SP,-22.3588911,-47.5531482
SP,20/11/2025 - Dia da Consciência Negra,Dia da Consciência Negra,,2025-11-20,Rio Claro - SP,-22.3588911,-47.5531482
SP,15/11/2025 - Proclamação da República,Proclamação da República,,2025-11-15,Rio Claro - SP,-22.3588911,-47.5531482
SP,02/11/2025 - Dia de Finados,Dia de Finados,,2025-11-02,Rio Claro - SP,-22.3588911,-47.5531482
SP,12/10/2025 - Nossa Senhora Aparecida,Nossa Senhora Aparecida,,2025-10-12,Rio Claro - SP,-22.3588911,-47.5531482
SP,07/09/2025 - Independência do Brasil,Independência do Brasil,,2025-09-07,Rio Claro - SP,-22.3588911,-47.5531482
SP,09/07/2025 - Revolução Constitucionalista,Revolução Constitucionalista,,2025-07-09,Rio Claro - SP,-22.3588911,-47.5531482
SP,24/06/2025 - São João,São João,,2025-06-24,Rio Claro - SP,-22.3588911,-47.5531482
SP,19/06/2025 - Corpus Christi,Corpus Christi,,2025-06-19,Rio Claro - SP,-22.3588911,-47.5531482
SP,01/05/2025 - Dia do Trabalho,Dia do Trabalho,,2025-05-01,Rio Claro - SP,-22.3588911,-47.5531482
SP,21/04/2025 - Dia de Tiradentes,Dia de Tiradentes,,2025-04-21,Rio Claro - SP,-22.3588911,-47.5531482
SP,18/04/2025 - Sexta-feira Santa,Sexta-feira Santa,,2025-04-18,Rio Claro - SP,-22.3588911,-47.5531482
SP,18/04/2025 - Sexta-Feira Santa,Sexta-Feira Santa,,2025-04-18,Rio Claro - SP,-22.3588911,-47.5531482
SP,01/01/2025 - Ano Novo,Ano Novo,,2025-01-01,Rio Claro - SP,-22.3588911,-47.5531482
SP,25/12/2025 - Natal,Natal,,2025-12-25,Roseira - SP,-22.8941493,-45.3142577
SP,20/11/2025 - Dia da Consciência Negra,Dia da Consciência Negra,,2025-11-20,Roseira - SP,-22.8941493,-45.3142577
SP,15/11/2025 - Proclamação da República,Proclamação da República,,2025-11-15,Roseira - SP,-22.8941493,-45.3142577
SP,02/11/2025 - Dia de Finados,Dia de Finados,,2025-11-02,Roseira - SP,-22.8941493,-45.3142577
SP,12/10/2025 - Nossa Senhora Aparecida,Nossa Senhora Aparecida,,2025-10-12,Roseira - SP,-22.8941493,-45.3142577
SP,07/09/2025 - Independência do Brasil,Independência do Brasil,,2025-09-07,Roseira - SP,-22.8941493,-45.3142577
SP,26/07/2025 - Feriado Municipal,Feriado Municipal,,2025-07-26,Roseira - SP,-22.8941493,-45.3142577
SP,09/07/2025 - Revolução Constitucionalista,Revolução Constitucionalista,,2025-07-09,Roseira - SP,-22.8941493,-45.3142577
SP,01/05/2025 - Dia do Trabalho,Dia do Trabalho,,2025-05-01,Roseira - SP,-22.8941493,-45.3142577
SP,21/04/2025 - Dia de Tiradentes,Dia de Tiradentes,,2025-04-21,Roseira - SP,-22.8941493,-45.3142577
SP,18/04/2025 - Sexta-Feira Santa,Sexta-Feira Santa,,2025-04-18,Roseira - SP,-22.8941493,-45.3142577
SP,21/03/2025 - Feriado Municipal,Feriado Municipal,,2025-03-21,Roseira - SP,-22.8941493,-45.3142577
SP,01/01/2025 - Ano Novo,Ano Novo,,2025-01-01,Roseira - SP,-22.8941493,-45.3142577
SP,25/12/2025 - Natal,Natal,,2025-12-25,Rosana - SP,-22.5788641,-53.0552246
SP,15/11/2025 - Proclamação da República,Proclamação da República,,2025-11-15,Rosana - SP,-22.5788641,-53.0552246
SP,05/11/2025 - Feriado Municipal,Feriado Municipal,,2025-11-05,Rosana - SP,-22.5788641,-53.0552246
SP,02/11/2025 - Dia de Finados,Dia de Finados,,2025-11-02,Rosana - SP,-22.5788641,-53.0552246
SP,12/10/2025 - Nossa Senhora Aparecida,Nossa Senhora Aparecida,,2025-10-12,Rosana - SP,-22.5788641,-53.0552246
SP,07/09/2025 - Independência do Brasil,Independência do Brasil,,2025-09-07,Rosana - SP,-22.5788641,-53.0552246
SP,09/07/2025 - Revolução Constitucionalista,Revolução Constitucionalista,,2025-07-09,Rosana - SP,-22.5788641,-53.0552246
SP,01/05/2025 - Dia do Trabalho,Dia do Trabalho,,2025-05-01,Rosana - SP,-22.5788641,-53.0552246
SP,21/04/2025 - Dia de Tiradentes,Dia de Tiradentes,,2025-04-21,Rosana - SP,-22.5788641,-53.0552246
SP,18/04/2025 - Sexta-Feira Santa,Sexta-Feira Santa,,2025-04-18,Rosana - SP,-22.5788641,-53.0552246
SP,02/02/2025 - Feriado Municipal,Feriado Municipal,,2025-02-02,Rosana - SP,-22.5788641,-53.0552246
SP,01/01/2025 - Ano Novo,Ano Novo,,2025-01-01,Rosana - SP,-22.5788641,-53.0552246
SP,30/12/2025 - Feriado Municipal,Feriado Municipal,,2025-12-30,Riversul - SP,-23.8303603,-49.4340558
SP,25/12/2025 - Natal,Natal,,2025-12-25,Riversul - SP,-23.8303603,-49.4340558
SP,20/11/2025 - Dia da Consciência Negra,Dia da Consciência Negra,,2025-11-20,Riversul - SP,-23.8303603,-49.4340558
SP,15/11/2025 - Proclamação da República,Proclamação da República,,2025-11-15,Riversul - SP,-23.8303603,-49.4340558
SP,02/11/2025 - Dia de Finados,Dia de Finados,,2025-11-02,Riversul - SP,-23.8303603,-49.4340558
SP,12/10/2025 - Nossa Senhora Aparecida,Nossa Senhora Aparecida,,2025-10-12,Riversul - SP,-23.8303603,-49.4340558
SP,07/09/2025 - Independência do Brasil,Independência do Brasil,,2025-09-07,Riversul - SP,-23.8303603,-49.4340558
SP,06/08/2025 - Feriado Municipal,Feriado Municipal,,2025-08-06,Riversul - SP,-23.8303603,-49.4340558
SP,09/07/2025 - Revolução Constitucionalista,Revolução Constitucionalista,,2025-07-09,Riversul - SP,-23.8303603,-49.4340558
SP,01/05/2025 - Dia do Trabalho,Dia do Trabalho,,2025-05-01,Riversul - SP,-23.8303603,-49.4340558
SP,21/04/2025 - Dia de Tiradentes,Dia de Tiradentes,,2025-04-21,Riversul - SP,-23.8303603,-49.4340558
SP,18/04/2025 - Sexta-Feira Santa,Sexta-Feira Santa,,2025-04-18,Riversul - SP,-23.8303603,-49.4340558
SP,01/01/2025 - Ano Novo,Ano Novo,,2025-01-01,Riversul - SP,-23.8303603,-49.4340558
SP,25/12/2025 - Natal,Natal,,2025-12-25,Rio Grande da Serra - SP,-23.7441905,-46.3924746
SP,15/11/2025 - Proclamação da República,Proclamação da República,,2025-11-15,Rio Grande da Serra - SP,-23.7441905,-46.3924746
SP,02/11/2025 - Dia de Finados,Dia de Finados,,2025-11-02,Rio Grande da Serra - SP,-23.7441905,-46.3924746
SP,12/10/2025 - Nossa Senhora Aparecida,Nossa Senhora Aparecida,,2025-10-12,Rio Grande da Serra - SP,-23.7441905,-46.3924746
SP,07/09/2025 - Independência do Brasil,Independência do Brasil,,2025-09-07,Rio Grande da Serra - SP,-23.7441905,-46.3924746
SP,09/07/2025 - Revolução Constitucionalista,Revolução Constitucionalista,,2025-07-09,Rio Grande da Serra - SP,-23.7441905,-46.3924746
SP,03/05/2025 - Feriado Municipal,Feriado Municipal,,2025-05-03,Rio Grande da Serra - SP,-23.7441905,-46.3924746
SP,01/05/2025 - Dia do Trabalho,Dia do Trabalho,,2025-05-01,Rio Grande da Serra - SP,-23.7441905,-46.3924746
SP,21/04/2025 - Dia de Tiradentes,Dia de Tiradentes,,2025-04-21,Rio Grande da Serra - SP,-23.7441905,-46.3924746
SP,18/04/2025 - Sexta-Feira Santa,Sexta-Feira Santa,,2025-04-18,Rio Grande da Serra - SP,-23.7441905,-46.3924746
SP,20/01/2025 - Feriado Municipal,Feriado Municipal,,2025-01-20,Rio Grande da Serra - SP,-23.7441905,-46.3924746
SP,01/01/2025 - Ano Novo,Ano Novo,,2025-01-01,Rio Grande da Serra - SP,-23.7441905,-46.3924746
SP,25/12/2025 - Natal,Natal,,2025-12-25,Rio das Pedras - SP,-22.8365387,-47.606651
SP,20/11/2025 - Dia da Consciência Negra,Dia da Consciência Negra,,2025-11-20,Rio das Pedras - SP,-22.8365387,-47.606651
SP,15/11/2025 - Proclamação da República,Proclamação da República,,2025-11-15,Rio das Pedras - SP,-22.8365387,-47.606651
SP,02/11/2025 - Dia de Finados,Dia de Finados,,2025-11-02,Rio das Pedras - SP,-22.8365387,-47.606651
SP,12/10/2025 - Nossa Senhora Aparecida,Nossa Senhora Aparecida,,2025-10-12,Rio das Pedras - SP,-22.8365387,-47.606651
SP,07/09/2025 - Independência do Brasil,Independência do Brasil,,2025-09-07,Rio das Pedras - SP,-22.8365387,-47.606651
SP,06/08/2025 - Feriado Municipal,Feriado Municipal,,2025-08-06,Rio das Pedras - SP,-22.8365387,-47.606651
SP,10/07/2025 - Feriado Municipal,Feriado Municipal,,2025-07-10,Rio das Pedras - SP,-22.8365387,-47.606651
SP,09/07/2025 - Revolução Constitucionalista,Revolução Constitucionalista,,2025-07-09,Rio das Pedras - SP,-22.8365387,-47.606651
SP,01/05/2025 - Dia do Trabalho,Dia do Trabalho,,2025-05-01,Rio das Pedras - SP,-22.8365387,-47.606651
SP,21/04/2025 - Dia de Tiradentes,Dia de Tiradentes,,2025-04-21,Rio das Pedras - SP,-22.8365387,-47.606651
SP,18/04/2025 - Sexta-Feira Santa,Sexta-Feira Santa,,2025-04-18,Rio das Pedras - SP,-22.8365387,-47.606651
SP,01/01/2025 - Ano Novo,Ano Novo,,2025-01-01,Rio das Pedras - SP,-22.8365387,-47.606651
SP,25/12/2025 - Natal,Natal,,2025-12-25,Sabino - SP,-21.4179844,-49.5808235
SP,08/12/2025 - Feriado Municipal,Feriado Municipal,,2025-12-08,Sabino - SP,-21.4179844,-49.5808235
SP,15/11/2025 - Proclamação da República,Proclamação da República,,2025-11-15,Sabino - SP,-21.4179844,-49.5808235
SP,02/11/2025 - Dia de Finados,Dia de Finados,,2025-11-02,Sabino - SP,-21.4179844,-49.5808235
SP,12/10/2025 - Nossa Senhora Aparecida,Nossa Senhora Aparecida,,2025-10-12,Sabino - SP,-21.4179844,-49.5808235
SP,07/09/2025 - Independência do Brasil,Independência do Brasil,,2025-09-07,Sabino - SP,-21.4179844,-49.5808235
SP,09/07/2025 - Revolução Constitucionalista,Revolução Constitucionalista,,2025-07-09,Sabino - SP,-21.4179844,-49.5808235
SP,01/05/2025 - Dia do Trabalho,Dia do Trabalho,,2025-05-01,Sabino - SP,-21.4179844,-49.5808235
SP,21/04/2025 - Dia de Tiradentes,Dia de Tiradentes,,2025-04-21,Sabino - SP,-21.4179844,-49.5808235
SP,18/04/2025 - Sexta-Feira Santa,Sexta-Feira Santa,,2025-04-18,Sabino - SP,-21.4179844,-49.5808235
SP,20/01/2025 - Feriado Municipal,Feriado Municipal,,2025-01-20,Sabino - SP,-21.4179844,-49.5808235
SP,01/01/2025 - Ano Novo,Ano Novo,,2025-01-01,Sabino - SP,-21.4179844,-49.5808235
SP,25/12/2025 - Natal,Natal,,2025-12-25,Rifaina - SP,-20.0811589,-47.4210736
SP,24/12/2025 - Feriado Municipal,Feriado Municipal,,2025-12-24,Rifaina - SP,-20.0811589,-47.4210736
SP,20/11/2025 - Dia da Consciência Negra,Dia da Consciência Negra,,2025-11-20,Rifaina - SP,-20.0811589,-47.4210736
SP,15/11/2025 - Proclamação da República,Proclamação da República,,2025-11-15,Rifaina - SP,-20.0811589,-47.4210736
SP,02/11/2025 - Dia de Finados,Dia de Finados,,2025-11-02,Rifaina - SP,-20.0811589,-47.4210736
SP,12/10/2025 - Nossa Senhora Aparecida,Nossa Senhora Aparecida,,2025-10-12,Rifaina - SP,-20.0811589,-47.4210736
SP,07/09/2025 - Independência do Brasil,Independência do Brasil,,2025-09-07,Rifaina - SP,-20.0811589,-47.4210736
SP,09/07/2025 - Revolução Constitucionalista,Revolução Constitucionalista,,2025-07-09,Rifaina - SP,-20.0811589,-47.4210736
SP,13/06/2025 - Dia de Santo Antônio,Dia de Santo Antônio,,2025-06-13,Rifaina - SP,-20.0811589,-47.4210736
SP,01/05/2025 - Dia do Trabalho,Dia do Trabalho,,2025-05-01,Rifaina - SP,-20.0811589,-47.4210736
SP,21/04/2025 - Dia de Tiradentes,Dia de Tiradentes,,2025-04-21,Rifaina - SP,-20.0811589,-47.4210736
SP,18/04/2025 - Sexta-Feira Santa,Sexta-Feira Santa,,2025-04-18,Rifaina - SP,-20.0811589,-47.4210736
SP,01/01/2025 - Ano Novo,Ano Novo,,2025-01-01,Rifaina - SP,-20.0811589,-47.4210736
SP,25/12/2025 - Natal,Natal,,2025-12-25,Sagres - SP,-21.8840628,-50.9574608
SP,15/11/2025 - Proclamação da República,Proclamação da República,,2025-11-15,Sagres - SP,-21.8840628,-50.9574608
SP,02/11/2025 - Dia de Finados,Dia de Finados,,2025-11-02,Sagres - SP,-21.8840628,-50.9574608
SP,12/10/2025 - Nossa Senhora Aparecida,Nossa Senhora Aparecida,,2025-10-12,Sagres - SP,-21.8840628,-50.9574608
SP,07/09/2025 - Independência do Brasil,Independência do Brasil,,2025-09-07,Sagres - SP,-21.8840628,-50.9574608
SP,09/07/2025 - Revolução Constitucionalista,Revolução Constitucionalista,,2025-07-09,Sagres - SP,-21.8840628,-50.9574608
SP,01/05/2025 - Dia do Trabalho,Dia do Trabalho,,2025-05-01,Sagres - SP,-21.8840628,-50.9574608
SP,21/04/2025 - Dia de Tiradentes,Dia de Tiradentes,,2025-04-21,Sagres - SP,-21.8840628,-50.9574608
SP,18/04/2025 - Sexta-Feira Santa,Sexta-Feira Santa,,2025-04-18,Sagres - SP,-21.8840628,-50.9574608
SP,18/02/2025 - Feriado Municipal,Feriado Municipal,,2025-02-18,Sagres - SP,-21.8840628,-50.9574608
SP,01/01/2025 - Ano Novo,Ano Novo,,2025-01-01,Sagres - SP,-21.8840628,-50.9574608
SP,25/12/2025 - Natal,Natal,,2025-12-25,Santa Cruz do Rio Pardo - SP,-22.9253446,-49.6221952
SP,15/11/2025 - Proclamação da República,Proclamação da República,,2025-11-15,Santa Cruz do Rio Pardo - SP,-22.9253446,-49.6221952
SP,02/11/2025 - Dia de Finados,Dia de Finados,,2025-11-02,Santa Cruz do Rio Pardo - SP,-22.9253446,-49.6221952
SP,12/10/2025 - Nossa Senhora Aparecida,Nossa Senhora Aparecida,,2025-10-12,Santa Cruz do Rio Pardo - SP,-22.9253446,-49.6221952
SP,07/09/2025 - Independência do Brasil,Independência do Brasil,,2025-09-07,Santa Cruz do Rio Pardo - SP,-22.9253446,-49.6221952
SP,09/07/2025 - Revolução Constitucionalista,Revolução Constitucionalista,,2025-07-09,Santa Cruz do Rio Pardo - SP,-22.9253446,-49.6221952
SP,13/05/2025 - Feriado Municipal,Feriado Municipal,,2025-05-13,Santa Cruz do Rio Pardo - SP,-22.9253446,-49.6221952
SP,01/05/2025 - Dia do Trabalho,Dia do Trabalho,,2025-05-01,Santa Cruz do Rio Pardo - SP,-22.9253446,-49.6221952
SP,21/04/2025 - Dia de Tiradentes,Dia de Tiradentes,,2025-04-21,Santa Cruz do Rio Pardo - SP,-22.9253446,-49.6221952
SP,18/04/2025 - Sexta-Feira Santa,Sexta-Feira Santa,,2025-04-18,Santa Cruz do Rio Pardo - SP,-22.9253446,-49.6221952
SP,20/01/2025 - Feriado Municipal,Feriado Municipal,,2025-01-20,Santa Cruz do Rio Pardo - SP,-22.9253446,-49.6221952
SP,01/01/2025 - Ano Novo,Ano Novo,,2025-01-01,Santa Cruz do Rio Pardo - SP,-22.9253446,-49.6221952
SP,25/12/2025 - Natal,Natal,,2025-12-25,Santa Cruz das Palmeiras - SP,-21.822171,-47.2346139
SP,15/11/2025 - Proclamação da República,Proclamação da República,,2025-11-15,Santa Cruz das Palmeiras - SP,-21.822171,-47.2346139
SP,02/11/2025 - Dia de Finados,Dia de Finados,,2025-11-02,Santa Cruz das Palmeiras - SP,-21.822171,-47.2346139
SP,12/10/2025 - Nossa Senhora Aparecida,Nossa Senhora Aparecida,,2025-10-12,Santa Cruz das Palmeiras - SP,-21.822171,-47.2346139
SP,14/09/2025 - Feriado Municipal,Feriado Municipal,,2025-09-14,Santa Cruz das Palmeiras - SP,-21.822171,-47.2346139
SP,07/09/2025 - Independência do Brasil,Independência do Brasil,,2025-09-07,Santa Cruz das Palmeiras - SP,-21.822171,-47.2346139
SP,09/07/2025 - Revolução Constitucionalista,Revolução Constitucionalista,,2025-07-09,Santa Cruz das Palmeiras - SP,-21.822171,-47.2346139
SP,03/05/2025 - Feriado Municipal,Feriado Municipal,,2025-05-03,Santa Cruz das Palmeiras - SP,-21.822171,-47.2346139
SP,01/05/2025 - Dia do Trabalho,Dia do Trabalho,,2025-05-01,Santa Cruz das Palmeiras - SP,-21.822171,-47.2346139
SP,21/04/2025 - Dia de Tiradentes,Dia de Tiradentes,,2025-04-21,Santa Cruz das Palmeiras - SP,-21.822171,-47.2346139
SP,18/04/2025 - Sexta-Feira Santa,Sexta-Feira Santa,,2025-04-18,Santa Cruz das Palmeiras - SP,-21.822171,-47.2346139
SP,01/01/2025 - Ano Novo,Ano Novo,,2025-01-01,Santa Cruz das Palmeiras - SP,-21.822171,-47.2346139
SP,25/12/2025 - Natal,Natal,,2025-12-25,Santa Branca - SP,-22.3368107,-49.0874675
SP,15/11/2025 - Proclamação da República,Proclamação da República,,2025-11-15,Santa Branca - SP,-22.3368107,-49.0874675
SP,02/11/2025 - Dia de Finados,Dia de Finados,,2025-11-02,Santa Branca - SP,-22.3368107,-49.0874675
SP,12/10/2025 - Nossa Senhora Aparecida,Nossa Senhora Aparecida,,2025-10-12,Santa Branca - SP,-22.3368107,-49.0874675
SP,07/09/2025 - Independência do Brasil,Independência do Brasil,,2025-09-07,Santa Branca - SP,-22.3368107,-49.0874675
SP,09/07/2025 - Revolução Constitucionalista,Revolução Constitucionalista,,2025-07-09,Santa Branca - SP,-22.3368107,-49.0874675
SP,22/05/2025 - Feriado Municipal,Feriado Municipal,,2025-05-22,Santa Branca - SP,-22.3368107,-49.0874675
SP,01/05/2025 - Dia do Trabalho,Dia do Trabalho,,2025-05-01,Santa Branca - SP,-22.3368107,-49.0874675
SP,21/04/2025 - Dia de Tiradentes,Dia de Tiradentes,,2025-04-21,Santa Branca - SP,-22.3368107,-49.0874675
SP,18/04/2025 - Sexta-Feira Santa,Sexta-Feira Santa,,2025-04-18,Santa Branca - SP,-22.3368107,-49.0874675
SP,01/01/2025 - Ano Novo,Ano Novo,,2025-01-01,Santa Branca - SP,-22.3368107,-49.0874675
SP,25/12/2025 - Natal,Natal,,2025-12-25,Santa Albertina - SP,-22.7396272,-45.5929645
SP,20/11/2025 - Dia da Consciência Negra,Dia da Consciência Negra,,2025-11-20,Santa Albertina - SP,-22.7396272,-45.5929645
SP,15/11/2025 - Proclamação da República,Proclamação da República,,2025-11-15,Santa Albertina - SP,-22.7396272,-45.5929645
SP,02/11/2025 - Dia de Finados,Dia de Finados,,2025-11-02,Santa Albertina - SP,-22.7396272,-45.5929645
SP,12/10/2025 - Nossa Senhora Aparecida,Nossa Senhora Aparecida,,2025-10-12,Santa Albertina - SP,-22.7396272,-45.5929645
SP,07/09/2025 - Independência do Brasil,Independência do Brasil,,2025-09-07,Santa Albertina - SP,-22.7396272,-45.5929645
SP,09/07/2025 - Revolução Constitucionalista,Revolução Constitucionalista,,2025-07-09,Santa Albertina - SP,-22.7396272,-45.5929645
SP,24/06/2025 - Feriado Municipal,Feriado Municipal,,2025-06-24,Santa Albertina - SP,-22.7396272,-45.5929645
SP,01/05/2025 - Dia do Trabalho,Dia do Trabalho,,2025-05-01,Santa Albertina - SP,-22.7396272,-45.5929645
SP,21/04/2025 - Dia de Tiradentes,Dia de Tiradentes,,2025-04-21,Santa Albertina - SP,-22.7396272,-45.5929645
SP,18/04/2025 - Sexta-Feira Santa,Sexta-Feira Santa,,2025-04-18,Santa Albertina - SP,-22.7396272,-45.5929645
SP,01/01/2025 - Ano Novo,Ano Novo,,2025-01-01,Santa Albertina - SP,-22.7396272,-45.5929645
SP,25/12/2025 - Natal,Natal,,2025-12-25,Sandovalina - SP,-22.4560782,-51.7634004
SP,15/11/2025 - Proclamação da República,Proclamação da República,,2025-11-15,Sandovalina - SP,-22.4560782,-51.7634004
SP,02/11/2025 - Dia de Finados,Dia de Finados,,2025-11-02,Sandovalina - SP,-22.4560782,-51.7634004
SP,12/10/2025 - Nossa Senhora Aparecida,Nossa Senhora Aparecida,,2025-10-12,Sandovalina - SP,-22.4560782,-51.7634004
SP,07/09/2025 - Independência do Brasil,Independência do Brasil,,2025-09-07,Sandovalina - SP,-22.4560782,-51.7634004
SP,15/08/2025 - Feriado Municipal,Feriado Municipal,,2025-08-15,Sandovalina - SP,-22.4560782,-51.7634004
SP,09/07/2025 - Revolução Constitucionalista,Revolução Constitucionalista,,2025-07-09,Sandovalina - SP,-22.4560782,-51.7634004
SP,13/06/2025 - Dia de Santo Antônio,Dia de Santo Antônio,,2025-06-13,Sandovalina - SP,-22.4560782,-51.7634004
SP,01/05/2025 - Dia do Trabalho,Dia do Trabalho,,2025-05-01,Sandovalina - SP,-22.4560782,-51.7634004
SP,21/04/2025 - Dia de Tiradentes,Dia de Tiradentes,,2025-04-21,Sandovalina - SP,-22.4560782,-51.7634004
SP,18/04/2025 - Sexta-Feira Santa,Sexta-Feira Santa,,2025-04-18,Sandovalina - SP,-22.4560782,-51.7634004
SP,01/01/2025 - Ano Novo,Ano Novo,,2025-01-01,Sandovalina - SP,-22.4560782,-51.7634004
SP,25/12/2025 - Natal,Natal,,2025-12-25,Sales - SP,-23.2063939,-46.8771188
SP,30/11/2025 - Feriado Municipal,Feriado Municipal,,2025-11-30,Sales - SP,-23.2063939,-46.8771188
SP,15/11/2025 - Proclamação da República,Proclamação da República,,2025-11-15,Sales - SP,-23.2063939,-46.8771188
SP,02/11/2025 - Dia de Finados,Dia de Finados,,2025-11-02,Sales - SP,-23.2063939,-46.8771188
SP,12/10/2025 - Nossa Senhora Aparecida,Nossa Senhora Aparecida,,2025-10-12,Sales - SP,-23.2063939,-46.8771188
SP,07/09/2025 - Independência do Brasil,Independência do Brasil,,2025-09-07,Sales - SP,-23.2063939,-46.8771188
SP,09/07/2025 - Revolução Constitucionalista,Revolução Constitucionalista,,2025-07-09,Sales - SP,-23.2063939,-46.8771188
SP,01/05/2025 - Dia do Trabalho,Dia do Trabalho,,2025-05-01,Sales - SP,-23.2063939,-46.8771188
SP,21/04/2025 - Dia de Tiradentes,Dia de Tiradentes,,2025-04-21,Sales - SP,-23.2063939,-46.8771188
SP,18/04/2025 - Sexta-Feira Santa,Sexta-Feira Santa,,2025-04-18,Sales - SP,-23.2063939,-46.8771188
SP,01/01/2025 - Ano Novo,Ano Novo,,2025-01-01,Sales - SP,-23.2063939,-46.8771188
SP,27/12/2025 - Feriado Municipal,Feriado Municipal,,2025-12-27,Salto Grande - SP,-22.7071928,-47.3083536
SP,25/12/2025 - Natal,Natal,,2025-12-25,Salto Grande - SP,-22.7071928,-47.3083536
SP,15/11/2025 - Proclamação da República,Proclamação da República,,2025-11-15,Salto Grande - SP,-22.7071928,-47.3083536
SP,02/11/2025 - Dia de Finados,Dia de Finados,,2025-11-02,Salto Grande - SP,-22.7071928,-47.3083536
SP,12/10/2025 - Nossa Senhora Aparecida,Nossa Senhora Aparecida,,2025-10-12,Salto Grande - SP,-22.7071928,-47.3083536
SP,15/09/2025 - Feriado Municipal,Feriado Municipal,,2025-09-15,Salto Grande - SP,-22.7071928,-47.3083536
SP,07/09/2025 - Independência do Brasil,Independência do Brasil,,2025-09-07,Salto Grande - SP,-22.7071928,-47.3083536
SP,09/07/2025 - Revolução Constitucionalista,Revolução Constitucionalista,,2025-07-09,Salto Grande - SP,-22.7071928,-47.3083536
SP,01/05/2025 - Dia do Trabalho,Dia do Trabalho,,2025-05-01,Salto Grande - SP,-22.7071928,-47.3083536
SP,21/04/2025 - Dia de Tiradentes,Dia de Tiradentes,,2025-04-21,Salto Grande - SP,-22.7071928,-47.3083536
SP,18/04/2025 - Sexta-Feira Santa,Sexta-Feira Santa,,2025-04-18,Salto Grande - SP,-22.7071928,-47.3083536
SP,01/01/2025 - Ano Novo,Ano Novo,,2025-01-01,Salto Grande - SP,-22.7071928,-47.3083536
SP,30/12/2025 - Feriado Municipal,Feriado Municipal,,2025-12-30,Salto de Pirapora - SP,-23.6646409,-47.5818636
SP,25/12/2025 - Natal,Natal,,2025-12-25,Salto de Pirapora - SP,-23.6646409,-47.5818636
SP,15/11/2025 - Proclamação da República,Proclamação da República,,2025-11-15,Salto de Pirapora - SP,-23.6646409,-47.5818636
SP,02/11/2025 - Dia de Finados,Dia de Finados,,2025-11-02,Salto de Pirapora - SP,-23.6646409,-47.5818636
SP,12/10/2025 - Nossa Senhora Aparecida,Nossa Senhora Aparecida,,2025-10-12,Salto de Pirapora - SP,-23.6646409,-47.5818636
SP,07/09/2025 - Independência do Brasil,Independência do Brasil,,2025-09-07,Salto de Pirapora - SP,-23.6646409,-47.5818636
SP,09/07/2025 - Revolução Constitucionalista,Revolução Constitucionalista,,2025-07-09,Salto de Pirapora - SP,-23.6646409,-47.5818636
SP,24/06/2025 - Feriado Municipal,Feriado Municipal,,2025-06-24,Salto de Pirapora - SP,-23.6646409,-47.5818636
SP,01/05/2025 - Dia do Trabalho,Dia do Trabalho,,2025-05-01,Salto de Pirapora - SP,-23.6646409,-47.5818636
SP,21/04/2025 - Dia de Tiradentes,Dia de Tiradentes,,2025-04-21,Salto de Pirapora - SP,-23.6646409,-47.5818636
SP,18/04/2025 - Sexta-Feira Santa,Sexta-Feira Santa,,2025-04-18,Salto de Pirapora - SP,-23.6646409,-47.5818636
SP,01/01/2025 - Ano Novo,Ano Novo,,2025-01-01,Salto de Pirapora - SP,-23.6646409,-47.5818636
SP,25/12/2025 - Natal,Natal,,2025-12-25,Salto - SP,-23.2493592,-47.3026816
SP,20/11/2025 - Dia da Consciência Negra,Dia da Consciência Negra,,2025-11-20,Salto - SP,-23.2493592,-47.3026816
SP,15/11/2025 - Proclamação da República,Proclamação da República,,2025-11-15,Salto - SP,-23.2493592,-47.3026816
SP,02/11/2025 - Dia de Finados,Dia de Finados,,2025-11-02,Salto - SP,-23.2493592,-47.3026816
SP,12/10/2025 - Nossa Senhora Aparecida,Nossa Senhora Aparecida,,2025-10-12,Salto - SP,-23.2493592,-47.3026816
SP,08/09/2025 - Nossa Sra Mont Serrat,Nossa Sra Mont Serrat,,2025-09-08,Salto - SP,-23.2493592,-47.3026816
SP,07/09/2025 - Independência do Brasil,Independência do Brasil,,2025-09-07,Salto - SP,-23.2493592,-47.3026816
SP,09/07/2025 - Revolução Constitucionalista,Revolução Constitucionalista,,2025-07-09,Salto - SP,-23.2493592,-47.3026816
SP,01/05/2025 - Dia do Trabalho,Dia do Trabalho,,2025-05-01,Salto - SP,-23.2493592,-47.3026816
SP,21/04/2025 - Dia de Tiradentes,Dia de Tiradentes,,2025-04-21,Salto - SP,-23.2493592,-47.3026816
SP,18/04/2025 - Sexta-Feira Santa,Sexta-Feira Santa,,2025-04-18,Salto - SP,-23.2493592,-47.3026816
SP,01/01/2025 - Ano Novo,Ano Novo,,2025-01-01,Salto - SP,-23.2493592,-47.3026816
SP,25/12/2025 - Natal,Natal,,2025-12-25,Saltinho - SP,-23.7742398,-47.2903543
SP,15/11/2025 - Proclamação da República,Proclamação da República,,2025-11-15,Saltinho - SP,-23.7742398,-47.2903543
SP,02/11/2025 - Dia de Finados,Dia de Finados,,2025-11-02,Saltinho - SP,-23.7742398,-47.2903543
SP,12/10/2025 - Nossa Senhora Aparecida,Nossa Senhora Aparecida,,2025-10-12,Saltinho - SP,-23.7742398,-47.2903543
SP,07/09/2025 - Independência do Brasil,Independência do Brasil,,2025-09-07,Saltinho - SP,-23.7742398,-47.2903543
SP,09/07/2025 - Revolução Constitucionalista,Revolução Constitucionalista,,2025-07-09,Saltinho - SP,-23.7742398,-47.2903543
SP,30/06/2025 - Feriado Municipal,Feriado Municipal,,2025-06-30,Saltinho - SP,-23.7742398,-47.2903543
SP,19/05/2025 - Feriado Municipal,Feriado Municipal,,2025-05-19,Saltinho - SP,-23.7742398,-47.2903543
SP,01/05/2025 - Dia do Trabalho,Dia do Trabalho,,2025-05-01,Saltinho - SP,-23.7742398,-47.2903543
SP,21/04/2025 - Dia de Tiradentes,Dia de Tiradentes,,2025-04-21,Saltinho - SP,-23.7742398,-47.2903543
SP,18/04/2025 - Sexta-Feira Santa,Sexta-Feira Santa,,2025-04-18,Saltinho - SP,-23.7742398,-47.2903543
SP,01/01/2025 - Ano Novo,Ano Novo,,2025-01-01,Saltinho - SP,-23.7742398,-47.2903543
SP,25/12/2025 - Natal,Natal,,2025-12-25,Sales Oliveira - SP,-21.8778779,-51.8355817
SP,15/11/2025 - Proclamação da República,Proclamação da República,,2025-11-15,Sales Oliveira - SP,-21.8778779,-51.8355817
SP,02/11/2025 - Dia de Finados,Dia de Finados,,2025-11-02,Sales Oliveira - SP,-21.8778779,-51.8355817
SP,12/10/2025 - Nossa Senhora Aparecida,Nossa Senhora Aparecida,,2025-10-12,Sales Oliveira - SP,-21.8778779,-51.8355817
SP,07/09/2025 - Independência do Brasil,Independência do Brasil,,2025-09-07,Sales Oliveira - SP,-21.8778779,-51.8355817
SP,09/07/2025 - Revolução Constitucionalista,Revolução Constitucionalista,,2025-07-09,Sales Oliveira - SP,-21.8778779,-51.8355817
SP,22/05/2025 - Feriado Municipal,Feriado Municipal,,2025-05-22,Sales Oliveira - SP,-21.8778779,-51.8355817
SP,01/05/2025 - Dia do Trabalho,Dia do Trabalho,,2025-05-01,Sales Oliveira - SP,-21.8778779,-51.8355817
SP,21/04/2025 - Dia de Tiradentes,Dia de Tiradentes,,2025-04-21,Sales Oliveira - SP,-21.8778779,-51.8355817
SP,18/04/2025 - Sexta-Feira Santa,Sexta-Feira Santa,,2025-04-18,Sales Oliveira - SP,-21.8778779,-51.8355817
SP,01/01/2025 - Ano Novo,Ano Novo,,2025-01-01,Sales Oliveira - SP,-21.8778779,-51.8355817
SP,25/12/2025 - Natal,Natal,,2025-12-25,Ubarana - SP,-21.1637674,-49.7167796
SP,15/11/2025 - Proclamação da República,Proclamação da República,,2025-11-15,Ubarana - SP,-21.1637674,-49.7167796
SP,02/11/2025 - Dia de Finados,Dia de Finados,,2025-11-02,Ubarana - SP,-21.1637674,-49.7167796
SP,12/10/2025 - Nossa Senhora Aparecida,Nossa Senhora Aparecida,,2025-10-12,Ubarana - SP,-21.1637674,-49.7167796
SP,07/09/2025 - Independência do Brasil,Independência do Brasil,,2025-09-07,Ubarana - SP,-21.1637674,-49.7167796
SP,09/07/2025 - Revolução Constitucionalista,Revolução Constitucionalista,,2025-07-09,Ubarana - SP,-21.1637674,-49.7167796
SP,01/05/2025 - Dia do Trabalho,Dia do Trabalho,,2025-05-01,Ubarana - SP,-21.1637674,-49.7167796
SP,21/04/2025 - Dia de Tiradentes,Dia de Tiradentes,,2025-04-21,Ubarana - SP,-21.1637674,-49.7167796
SP,18/04/2025 - Sexta-Feira Santa,Sexta-Feira Santa,,2025-04-18,Ubarana - SP,-21.1637674,-49.7167796
SP,01/01/2025 - Ano Novo,Ano Novo,,2025-01-01,Ubarana - SP,-21.1637674,-49.7167796
SP,25/12/2025 - Natal,Natal,,2025-12-25,Tupi Paulista - SP,-21.3872382,-51.5799675
SP,15/11/2025 - Proclamação da República,Proclamação da República,,2025-11-15,Tupi Paulista - SP,-21.3872382,-51.5799675
SP,02/11/2025 - Dia de Finados,Dia de Finados,,2025-11-02,Tupi Paulista - SP,-21.3872382,-51.5799675
SP,12/10/2025 - Nossa Senhora Aparecida,Nossa Senhora Aparecida,,2025-10-12,Tupi Paulista - SP,-21.3872382,-51.5799675
SP,07/09/2025 - Independência do Brasil,Independência do Brasil,,2025-09-07,Tupi Paulista - SP,-21.3872382,-51.5799675
SP,28/08/2025 - Feriado Municipal,Feriado Municipal,,2025-08-28,Tupi Paulista - SP,-21.3872382,-51.5799675
SP,15/08/2025 - Feriado Municipal,Feriado Municipal,,2025-08-15,Tupi Paulista - SP,-21.3872382,-51.5799675
SP,09/07/2025 - Revolução Constitucionalista,Revolução Constitucionalista,,2025-07-09,Tupi Paulista - SP,-21.3872382,-51.5799675
SP,01/05/2025 - Dia do Trabalho,Dia do Trabalho,,2025-05-01,Tupi Paulista - SP,-21.3872382,-51.5799675
SP,21/04/2025 - Dia de Tiradentes,Dia de Tiradentes,,2025-04-21,Tupi Paulista - SP,-21.3872382,-51.5799675
SP,18/04/2025 - Sexta-Feira Santa,Sexta-Feira Santa,,2025-04-18,Tupi Paulista - SP,-21.3872382,-51.5799675
SP,01/01/2025 - Ano Novo,Ano Novo,,2025-01-01,Tupi Paulista - SP,-21.3872382,-51.5799675
SP,25/12/2025 - Natal,Natal,,2025-12-25,Serra Azul - SP,-21.3132591,-47.5635821
SP,08/12/2025 - Feriado Municipal,Feriado Municipal,,2025-12-08,Serra Azul - SP,-21.3132591,-47.5635821
SP,20/11/2025 - Dia da Consciência Negra,Dia da Consciência Negra,,2025-11-20,Serra Azul - SP,-21.3132591,-47.5635821
SP,15/11/2025 - Proclamação da República,Proclamação da República,,2025-11-15,Serra Azul - SP,-21.3132591,-47.5635821
SP,14/11/2025 - Feriado Municipal,Feriado Municipal,,2025-11-14,Serra Azul - SP,-21.3132591,-47.5635821
SP,02/11/2025 - Dia de Finados,Dia de Finados,,2025-11-02,Serra Azul - SP,-21.3132591,-47.5635821
SP,12/10/2025 - Nossa Senhora Aparecida,Nossa Senhora Aparecida,,2025-10-12,Serra Azul - SP,-21.3132591,-47.5635821
SP,07/09/2025 - Independência do Brasil,Independência do Brasil,,2025-09-07,Serra Azul - SP,-21.3132591,-47.5635821
SP,09/07/2025 - Revolução Constitucionalista,Revolução Constitucionalista,,2025-07-09,Serra Azul - SP,-21.3132591,-47.5635821
SP,01/05/2025 - Dia do Trabalho,Dia do Trabalho,,2025-05-01,Serra Azul - SP,-21.3132591,-47.5635821
SP,21/04/2025 - Dia de Tiradentes,Dia de Tiradentes,,2025-04-21,Serra Azul - SP,-21.3132591,-47.5635821
SP,18/04/2025 - Sexta-Feira Santa,Sexta-Feira Santa,,2025-04-18,Serra Azul - SP,-21.3132591,-47.5635821
SP,01/01/2025 - Ano Novo,Ano Novo,,2025-01-01,Serra Azul - SP,-21.3132591,-47.5635821
SP,25/12/2025 - Natal,Natal,,2025-12-25,Serra Negra - SP,-22.6126459,-46.699986
SP,20/11/2025 - Dia da Consciência Negra,Dia da Consciência Negra,,2025-11-20,Serra Negra - SP,-22.6126459,-46.699986
SP,15/11/2025 - Proclamação da República,Proclamação da República,,2025-11-15,Serra Negra - SP,-22.6126459,-46.699986
SP,02/11/2025 - Dia de Finados,Dia de Finados,,2025-11-02,Serra Negra - SP,-22.6126459,-46.699986
SP,01/11/2025 - Feriado Municipal,Feriado Municipal,,2025-11-01,Serra Negra - SP,-22.6126459,-46.699986
SP,12/10/2025 - Nossa Senhora Aparecida,Nossa Senhora Aparecida,,2025-10-12,Serra Negra - SP,-22.6126459,-46.699986
SP,23/09/2025 - Feriado Municipal,Feriado Municipal,,2025-09-23,Serra Negra - SP,-22.6126459,-46.699986
SP,07/09/2025 - Independência do Brasil,Independência do Brasil,,2025-09-07,Serra Negra - SP,-22.6126459,-46.699986
SP,09/07/2025 - Revolução Constitucionalista,Revolução Constitucionalista,,2025-07-09,Serra Negra - SP,-22.6126459,-46.699986
SP,01/05/2025 - Dia do Trabalho,Dia do Trabalho,,2025-05-01,Serra Negra - SP,-22.6126459,-46.699986
SP,21/04/2025 - Dia de Tiradentes,Dia de Tiradentes,,2025-04-21,Serra Negra - SP,-22.6126459,-46.699986
SP,18/04/2025 - Sexta-Feira Santa,Sexta-Feira Santa,,2025-04-18,Serra Negra - SP,-22.6126459,-46.699986
SP,01/01/2025 - Ano Novo,Ano Novo,,2025-01-01,Serra Negra - SP,-22.6126459,-46.699986
SP,25/12/2025 - Natal,Natal,,2025-12-25,Serrana - SP,-21.2066883,-47.6053774
SP,15/11/2025 - Proclamação da República,Proclamação da República,,2025-11-15,Serrana - SP,-21.2066883,-47.6053774
SP,02/11/2025 - Dia de Finados,Dia de Finados,,2025-11-02,Serrana - SP,-21.2066883,-47.6053774
SP,12/10/2025 - Nossa Senhora Aparecida,Nossa Senhora Aparecida,,2025-10-12,Serrana - SP,-21.2066883,-47.6053774
SP,15/09/2025 - Feriado Municipal,Feriado Municipal,,2025-09-15,Serrana - SP,-21.2066883,-47.6053774
SP,07/09/2025 - Independência do Brasil,Independência do Brasil,,2025-09-07,Serrana - SP,-21.2066883,-47.6053774
SP,09/07/2025 - Revolução Constitucionalista,Revolução Constitucionalista,,2025-07-09,Serrana - SP,-21.2066883,-47.6053774
SP,01/05/2025 - Dia do Trabalho,Dia do Trabalho,,2025-05-01,Serrana - SP,-21.2066883,-47.6053774
SP,21/04/2025 - Dia de Tiradentes,Dia de Tiradentes,,2025-04-21,Serrana - SP,-21.2066883,-47.6053774
SP,18/04/2025 - Sexta-Feira Santa,Sexta-Feira Santa,,2025-04-18,Serrana - SP,-21.2066883,-47.6053774
SP,10/04/2025 - Feriado Municipal,Feriado Municipal,,2025-04-10,Serrana - SP,-21.2066883,-47.6053774
SP,01/01/2025 - Ano Novo,Ano Novo,,2025-01-01,Serrana - SP,-21.2066883,-47.6053774
SP,25/12/2025 - Natal,Natal,,2025-12-25,Manduri - SP,-23.0009977,-49.3203673
SP,30/11/2025 - Feriado Municipal,Feriado Municipal,,2025-11-30,Manduri - SP,-23.0009977,-49.3203673
SP,15/11/2025 - Proclamação da República,Proclamação da República,,2025-11-15,Manduri - SP,-23.0009977,-49.3203673
SP,02/11/2025 - Dia de Finados,Dia de Finados,,2025-11-02,Manduri - SP,-23.0009977,-49.3203673
SP,12/10/2025 - Nossa Senhora Aparecida,Nossa Senhora Aparecida,,2025-10-12,Manduri - SP,-23.0009977,-49.3203673
SP,07/09/2025 - Independência do Brasil,Independência do Brasil,,2025-09-07,Manduri - SP,-23.0009977,-49.3203673
SP,09/07/2025 - Revolução Constitucionalista,Revolução Constitucionalista,,2025-07-09,Manduri - SP,-23.0009977,-49.3203673
SP,13/06/2025 - Dia de Santo Antônio,Dia de Santo Antônio,,2025-06-13,Manduri - SP,-23.0009977,-49.3203673
SP,01/05/2025 - Dia do Trabalho,Dia do Trabalho,,2025-05-01,Manduri - SP,-23.0009977,-49.3203673
SP,21/04/2025 - Dia de Tiradentes,Dia de Tiradentes,,2025-04-21,Manduri - SP,-23.0009977,-49.3203673
SP,18/04/2025 - Sexta-Feira Santa,Sexta-Feira Santa,,2025-04-18,Manduri - SP,-23.0009977,-49.3203673
SP,01/01/2025 - Ano Novo,Ano Novo,,2025-01-01,Manduri - SP,-23.0009977,-49.3203673
SP,25/12/2025 - Natal,Natal,,2025-12-25,Santo Expedito - SP,-21.8411378,-46.9012322
SP,10/12/2025 - Feriado Municipal,Feriado Municipal,,2025-12-10,Santo Expedito - SP,-21.8411378,-46.9012322
SP,15/11/2025 - Proclamação da República,Proclamação da República,,2025-11-15,Santo Expedito - SP,-21.8411378,-46.9012322
SP,02/11/2025 - Dia de Finados,Dia de Finados,,2025-11-02,Santo Expedito - SP,-21.8411378,-46.9012322
SP,12/10/2025 - Nossa Senhora Aparecida,Nossa Senhora Aparecida,,2025-10-12,Santo Expedito - SP,-21.8411378,-46.9012322
SP,07/09/2025 - Independência do Brasil,Independência do Brasil,,2025-09-07,Santo Expedito - SP,-21.8411378,-46.9012322
SP,09/07/2025 - Revolução Constitucionalista,Revolução Constitucionalista,,2025-07-09,Santo Expedito - SP,-21.8411378,-46.9012322
SP,01/05/2025 - Dia do Trabalho,Dia do Trabalho,,2025-05-01,Santo Expedito - SP,-21.8411378,-46.9012322
SP,21/04/2025 - Dia de Tiradentes,Dia de Tiradentes,,2025-04-21,Santo Expedito - SP,-21.8411378,-46.9012322
SP,19/04/2025 - Feriado Municipal,Feriado Municipal,,2025-04-19,Santo Expedito - SP,-21.8411378,-46.9012322
SP,18/04/2025 - Sexta-Feira Santa,Sexta-Feira Santa,,2025-04-18,Santo Expedito - SP,-21.8411378,-46.9012322
SP,01/01/2025 - Ano Novo,Ano Novo,,2025-01-01,Santo Expedito - SP,-21.8411378,-46.9012322
SP,25/12/2025 - Natal,Natal,,2025-12-25,Santos - SP,-23.9335988,-46.3286399
SP,20/11/2025 - Dia da Consciência Negra,Dia da Consciência Negra,,2025-11-20,Santos - SP,-23.9335988,-46.3286399
SP,15/11/2025 - Proclamação da República,Proclamação da República,,2025-11-15,Santos - SP,-23.9335988,-46.3286399
SP,02/11/2025 - Dia de Finados,Dia de Finados,,2025-11-02,Santos - SP,-23.9335988,-46.3286399
SP,12/10/2025 - Nossa Senhora Aparecida,Nossa Senhora Aparecida,,2025-10-12,Santos - SP,-23.9335988,-46.3286399
SP,08/09/2025 - N. Sra do Monte Serrat,N. Sra do Monte Serrat,,2025-09-08,Santos - SP,-23.9335988,-46.3286399
SP,07/09/2025 - Independência do Brasil,Independência do Brasil,,2025-09-07,Santos - SP,-23.9335988,-46.3286399
SP,09/07/2025 - Revolução Constitucionalista,Revolução Constitucionalista,,2025-07-09,Santos - SP,-23.9335988,-46.3286399
SP,01/05/2025 - Dia do Trabalho,Dia do Trabalho,,2025-05-01,Santos - SP,-23.9335988,-46.3286399
SP,21/04/2025 - Dia de Tiradentes,Dia de Tiradentes,,2025-04-21,Santos - SP,-23.9335988,-46.3286399
SP,18/04/2025 - Sexta-Feira Santa,Sexta-Feira Santa,,2025-04-18,Santos - SP,-23.9335988,-46.3286399
SP,26/01/2025 - Aniversário da Cidade,Aniversário da Cidade,,2025-01-26,Santos - SP,-23.9335988,-46.3286399
SP,01/01/2025 - Ano Novo,Ano Novo,,2025-01-01,Santos - SP,-23.9335988,-46.3286399
SP,25/12/2025 - Natal,Natal,,2025-12-25,Sete Barras - SP,-24.385606,-47.9276347
SP,18/12/2025 - Feriado Municipal,Feriado Municipal,,2025-12-18,Sete Barras - SP,-24.385606,-47.9276347
SP,20/11/2025 - Dia da Consciência Negra,Dia da Consciência Negra,,2025-11-20,Sete Barras - SP,-24.385606,-47.9276347
SP,15/11/2025 - Proclamação da República,Proclamação da República,,2025-11-15,Sete Barras - SP,-24.385606,-47.9276347
SP,02/11/2025 - Dia de Finados,Dia de Finados,,2025-11-02,Sete Barras - SP,-24.385606,-47.9276347
SP,12/10/2025 - Nossa Senhora Aparecida,Nossa Senhora Aparecida,,2025-10-12,Sete Barras - SP,-24.385606,-47.9276347
SP,07/09/2025 - Independência do Brasil,Independência do Brasil,,2025-09-07,Sete Barras - SP,-24.385606,-47.9276347
SP,09/07/2025 - Revolução Constitucionalista,Revolução Constitucionalista,,2025-07-09,Sete Barras - SP,-24.385606,-47.9276347
SP,24/06/2025 - Feriado Municipal,Feriado Municipal,,2025-06-24,Sete Barras - SP,-24.385606,-47.9276347
SP,01/05/2025 - Dia do Trabalho,Dia do Trabalho,,2025-05-01,Sete Barras - SP,-24.385606,-47.9276347
SP,21/04/2025 - Dia de Tiradentes,Dia de Tiradentes,,2025-04-21,Sete Barras - SP,-24.385606,-47.9276347
SP,18/04/2025 - Sexta-Feira Santa,Sexta-Feira Santa,,2025-04-18,Sete Barras - SP,-24.385606,-47.9276347
SP,01/01/2025 - Ano Novo,Ano Novo,,2025-01-01,Sete Barras - SP,-24.385606,-47.9276347
SP,25/12/2025 - Natal,Natal,,2025-12-25,Tarabai - SP,-22.3038726,-51.5628675
SP,08/12/2025 - Feriado Municipal,Feriado Municipal,,2025-12-08,Tarabai - SP,-22.3038726,-51.5628675
SP,20/11/2025 - Dia da Consciência Negra,Dia da Consciência Negra,,2025-11-20,Tarabai - SP,-22.3038726,-51.5628675
SP,15/11/2025 - Proclamação da República,Proclamação da República,,2025-11-15,Tarabai - SP,-22.3038726,-51.5628675
SP,02/11/2025 - Dia de Finados,Dia de Finados,,2025-11-02,Tarabai - SP,-22.3038726,-51.5628675
SP,12/10/2025 - Nossa Senhora Aparecida,Nossa Senhora Aparecida,,2025-10-12,Tarabai - SP,-22.3038726,-51.5628675
SP,07/09/2025 - Independência do Brasil,Independência do Brasil,,2025-09-07,Tarabai - SP,-22.3038726,-51.5628675
SP,09/07/2025 - Revolução Constitucionalista,Revolução Constitucionalista,,2025-07-09,Tarabai - SP,-22.3038726,-51.5628675
SP,01/05/2025 - Dia do Trabalho,Dia do Trabalho,,2025-05-01,Tarabai - SP,-22.3038726,-51.5628675
SP,21/04/2025 - Dia de Tiradentes,Dia de Tiradentes,,2025-04-21,Tarabai - SP,-22.3038726,-51.5628675
SP,18/04/2025 - Sexta-Feira Santa,Sexta-Feira Santa,,2025-04-18,Tarabai - SP,-22.3038726,-51.5628675
SP,21/03/2025 - Feriado Municipal,Feriado Municipal,,2025-03-21,Tarabai - SP,-22.3038726,-51.5628675
SP,01/01/2025 - Ano Novo,Ano Novo,,2025-01-01,Tarabai - SP,-22.3038726,-51.5628675
SP,25/12/2025 - Natal,Natal,,2025-12-25,Teodoro Sampaio - SP,-22.5298153,-52.1622555
SP,15/11/2025 - Proclamação da República,Proclamação da República,,2025-11-15,Teodoro Sampaio - SP,-22.5298153,-52.1622555
SP,02/11/2025 - Dia de Finados,Dia de Finados,,2025-11-02,Teodoro Sampaio - SP,-22.5298153,-52.1622555
SP,12/10/2025 - Nossa Senhora Aparecida,Nossa Senhora Aparecida,,2025-10-12,Teodoro Sampaio - SP,-22.5298153,-52.1622555
SP,07/09/2025 - Independência do Brasil,Independência do Brasil,,2025-09-07,Teodoro Sampaio - SP,-22.5298153,-52.1622555
SP,09/07/2025 - Revolução Constitucionalista,Revolução Constitucionalista,,2025-07-09,Teodoro Sampaio - SP,-22.5298153,-52.1622555
SP,27/06/2025 - Feriado Municipal,Feriado Municipal,,2025-06-27,Teodoro Sampaio - SP,-22.5298153,-52.1622555
SP,01/05/2025 - Dia do Trabalho,Dia do Trabalho,,2025-05-01,Teodoro Sampaio - SP,-22.5298153,-52.1622555
SP,21/04/2025 - Dia de Tiradentes,Dia de Tiradentes,,2025-04-21,Teodoro Sampaio - SP,-22.5298153,-52.1622555
SP,18/04/2025 - Sexta-Feira Santa,Sexta-Feira Santa,,2025-04-18,Teodoro Sampaio - SP,-22.5298153,-52.1622555
SP,21/03/2025 - Feriado Municipal,Feriado Municipal,,2025-03-21,Teodoro Sampaio - SP,-22.5298153,-52.1622555
SP,01/01/2025 - Ano Novo,Ano Novo,,2025-01-01,Teodoro Sampaio - SP,-22.5298153,-52.1622555
SP,25/12/2025 - Natal,Natal,,2025-12-25,Timburi - SP,-23.2064076,-49.6045576
SP,20/11/2025 - Dia da Consciência Negra,Dia da Consciência Negra,,2025-11-20,Timburi - SP,-23.2064076,-49.6045576
SP,15/11/2025 - Proclamação da República,Proclamação da República,,2025-11-15,Timburi - SP,-23.2064076,-49.6045576
SP,02/11/2025 - Dia de Finados,Dia de Finados,,2025-11-02,Timburi - SP,-23.2064076,-49.6045576
SP,12/10/2025 - Nossa Senhora Aparecida,Nossa Senhora Aparecida,,2025-10-12,Timburi - SP,-23.2064076,-49.6045576
SP,07/09/2025 - Independência do Brasil,Independência do Brasil,,2025-09-07,Timburi - SP,-23.2064076,-49.6045576
SP,09/07/2025 - Revolução Constitucionalista,Revolução Constitucionalista,,2025-07-09,Timburi - SP,-23.2064076,-49.6045576
SP,01/05/2025 - Dia do Trabalho,Dia do Trabalho,,2025-05-01,Timburi - SP,-23.2064076,-49.6045576
SP,21/04/2025 - Dia de Tiradentes,Dia de Tiradentes,,2025-04-21,Timburi - SP,-23.2064076,-49.6045576
SP,18/04/2025 - Sexta-Feira Santa,Sexta-Feira Santa,,2025-04-18,Timburi - SP,-23.2064076,-49.6045576
SP,01/01/2025 - Ano Novo,Ano Novo,,2025-01-01,Timburi - SP,-23.2064076,-49.6045576
SP,25/12/2025 - Natal,Natal,,2025-12-25,Taquaritinga - SP,-21.4051876,-48.4944498
SP,15/11/2025 - Proclamação da República,Proclamação da República,,2025-11-15,Taquaritinga - SP,-21.4051876,-48.4944498
SP,02/11/2025 - Dia de Finados,Dia de Finados,,2025-11-02,Taquaritinga - SP,-21.4051876,-48.4944498
SP,12/10/2025 - Nossa Senhora Aparecida,Nossa Senhora Aparecida,,2025-10-12,Taquaritinga - SP,-21.4051876,-48.4944498
SP,07/09/2025 - Independência do Brasil,Independência do Brasil,,2025-09-07,Taquaritinga - SP,-21.4051876,-48.4944498
SP,16/08/2025 - Feriado Municipal,Feriado Municipal,,2025-08-16,Taquaritinga - SP,-21.4051876,-48.4944498
SP,09/07/2025 - Revolução Constitucionalista,Revolução Constitucionalista,,2025-07-09,Taquaritinga - SP,-21.4051876,-48.4944498
SP,01/05/2025 - Dia do Trabalho,Dia do Trabalho,,2025-05-01,Taquaritinga - SP,-21.4051876,-48.4944498
SP,21/04/2025 - Dia de Tiradentes,Dia de Tiradentes,,2025-04-21,Taquaritinga - SP,-21.4051876,-48.4944498
SP,18/04/2025 - Sexta-Feira Santa,Sexta-Feira Santa,,2025-04-18,Taquaritinga - SP,-21.4051876,-48.4944498
SP,20/01/2025 - Feriado Municipal,Feriado Municipal,,2025-01-20,Taquaritinga - SP,-21.4051876,-48.4944498
SP,01/01/2025 - Ano Novo,Ano Novo,,2025-01-01,Taquaritinga - SP,-21.4051876,-48.4944498
SP,25/12/2025 - Natal,Natal,,2025-12-25,Torre de Pedra - SP,-23.2478026,-48.1941034
SP,15/11/2025 - Proclamação da República,Proclamação da República,,2025-11-15,Torre de Pedra - SP,-23.2478026,-48.1941034
SP,02/11/2025 - Dia de Finados,Dia de Finados,,2025-11-02,Torre de Pedra - SP,-23.2478026,-48.1941034
SP,12/10/2025 - Nossa Senhora Aparecida,Nossa Senhora Aparecida,,2025-10-12,Torre de Pedra - SP,-23.2478026,-48.1941034
SP,07/09/2025 - Independência do Brasil,Independência do Brasil,,2025-09-07,Torre de Pedra - SP,-23.2478026,-48.1941034
SP,09/07/2025 - Revolução Constitucionalista,Revolução Constitucionalista,,2025-07-09,Torre de Pedra - SP,-23.2478026,-48.1941034
SP,01/05/2025 - Dia do Trabalho,Dia do Trabalho,,2025-05-01,Torre de Pedra - SP,-23.2478026,-48.1941034
SP,21/04/2025 - Dia de Tiradentes,Dia de Tiradentes,,2025-04-21,Torre de Pedra - SP,-23.2478026,-48.1941034
SP,18/04/2025 - Sexta-Feira Santa,Sexta-Feira Santa,,2025-04-18,Torre de Pedra - SP,-23.2478026,-48.1941034
SP,01/01/2025 - Ano Novo,Ano Novo,,2025-01-01,Torre de Pedra - SP,-23.2478026,-48.1941034
SP,25/12/2025 - Natal,Natal,,2025-12-25,Torrinha - SP,-23.6324799,-46.5312596
SP,08/12/2025 - Feriado Municipal,Feriado Municipal,,2025-12-08,Torrinha - SP,-23.6324799,-46.5312596
SP,15/11/2025 - Proclamação da República,Proclamação da República,,2025-11-15,Torrinha - SP,-23.6324799,-46.5312596
SP,02/11/2025 - Dia de Finados,Dia de Finados,,2025-11-02,Torrinha - SP,-23.6324799,-46.5312596
SP,12/10/2025 - Nossa Senhora Aparecida,Nossa Senhora Aparecida,,2025-10-12,Torrinha - SP,-23.6324799,-46.5312596
SP,07/09/2025 - Independência do Brasil,Independência do Brasil,,2025-09-07,Torrinha - SP,-23.6324799,-46.5312596
SP,09/07/2025 - Revolução Constitucionalista,Revolução Constitucionalista,,2025-07-09,Torrinha - SP,-23.6324799,-46.5312596
SP,01/05/2025 - Dia do Trabalho,Dia do Trabalho,,2025-05-01,Torrinha - SP,-23.6324799,-46.5312596
SP,21/04/2025 - Dia de Tiradentes,Dia de Tiradentes,,2025-04-21,Torrinha - SP,-23.6324799,-46.5312596
SP,18/04/2025 - Sexta-Feira Santa,Sexta-Feira Santa,,2025-04-18,Torrinha - SP,-23.6324799,-46.5312596
SP,07/04/2025 - Feriado Municipal,Feriado Municipal,,2025-04-07,Torrinha - SP,-23.6324799,-46.5312596
SP,19/03/2025 - São José,São José,,2025-03-19,Torrinha - SP,-23.6324799,-46.5312596
SP,01/01/2025 - Ano Novo,Ano Novo,,2025-01-01,Torrinha - SP,-23.6324799,-46.5312596
SP,25/12/2025 - Natal,Natal,,2025-12-25,Trabiju - SP,-22.0410733,-48.3350302
SP,15/11/2025 - Proclamação da República,Proclamação da República,,2025-11-15,Trabiju - SP,-22.0410733,-48.3350302
SP,02/11/2025 - Dia de Finados,Dia de Finados,,2025-11-02,Trabiju - SP,-22.0410733,-48.3350302
SP,12/10/2025 - Nossa Senhora Aparecida,Nossa Senhora Aparecida,,2025-10-12,Trabiju - SP,-22.0410733,-48.3350302
SP,07/09/2025 - Independência do Brasil,Independência do Brasil,,2025-09-07,Trabiju - SP,-22.0410733,-48.3350302
SP,09/07/2025 - Revolução Constitucionalista,Revolução Constitucionalista,,2025-07-09,Trabiju - SP,-22.0410733,-48.3350302
SP,01/05/2025 - Dia do Trabalho,Dia do Trabalho,,2025-05-01,Trabiju - SP,-22.0410733,-48.3350302
SP,21/04/2025 - Dia de Tiradentes,Dia de Tiradentes,,2025-04-21,Trabiju - SP,-22.0410733,-48.3350302
SP,18/04/2025 - Sexta-Feira Santa,Sexta-Feira Santa,,2025-04-18,Trabiju - SP,-22.0410733,-48.3350302
SP,01/01/2025 - Ano Novo,Ano Novo,,2025-01-01,Trabiju - SP,-22.0410733,-48.3350302
SP,25/12/2025 - Natal,Natal,,2025-12-25,Tuiuti - SP,-22.8343978,-46.6466524
SP,15/11/2025 - Proclamação da República,Proclamação da República,,2025-11-15,Tuiuti - SP,-22.8343978,-46.6466524
SP,02/11/2025 - Dia de Finados,Dia de Finados,,2025-11-02,Tuiuti - SP,-22.8343978,-46.6466524
SP,12/10/2025 - Nossa Senhora Aparecida,Nossa Senhora Aparecida,,2025-10-12,Tuiuti - SP,-22.8343978,-46.6466524
SP,07/09/2025 - Independência do Brasil,Independência do Brasil,,2025-09-07,Tuiuti - SP,-22.8343978,-46.6466524
SP,09/07/2025 - Revolução Constitucionalista,Revolução Constitucionalista,,2025-07-09,Tuiuti - SP,-22.8343978,-46.6466524
SP,01/05/2025 - Dia do Trabalho,Dia do Trabalho,,2025-05-01,Tuiuti - SP,-22.8343978,-46.6466524
SP,21/04/2025 - Dia de Tiradentes,Dia de Tiradentes,,2025-04-21,Tuiuti - SP,-22.8343978,-46.6466524
SP,18/04/2025 - Sexta-Feira Santa,Sexta-Feira Santa,,2025-04-18,Tuiuti - SP,-22.8343978,-46.6466524
SP,01/01/2025 - Ano Novo,Ano Novo,,2025-01-01,Tuiuti - SP,-22.8343978,-46.6466524
SP,25/12/2025 - Natal,Natal,,2025-12-25,Taquarituba - SP,-23.5446179,-49.2440546
SP,15/11/2025 - Proclamação da República,Proclamação da República,,2025-11-15,Taquarituba - SP,-23.5446179,-49.2440546
SP,02/11/2025 - Dia de Finados,Dia de Finados,,2025-11-02,Taquarituba - SP,-23.5446179,-49.2440546
SP,12/10/2025 - Nossa Senhora Aparecida,Nossa Senhora Aparecida,,2025-10-12,Taquarituba - SP,-23.5446179,-49.2440546
SP,07/09/2025 - Independência do Brasil,Independência do Brasil,,2025-09-07,Taquarituba - SP,-23.5446179,-49.2440546
SP,16/08/2025 - Feriado Municipal,Feriado Municipal,,2025-08-16,Taquarituba - SP,-23.5446179,-49.2440546
SP,09/07/2025 - Revolução Constitucionalista,Revolução Constitucionalista,,2025-07-09,Taquarituba - SP,-23.5446179,-49.2440546
SP,01/05/2025 - Dia do Trabalho,Dia do Trabalho,,2025-05-01,Taquarituba - SP,-23.5446179,-49.2440546
SP,21/04/2025 - Dia de Tiradentes,Dia de Tiradentes,,2025-04-21,Taquarituba - SP,-23.5446179,-49.2440546
SP,18/04/2025 - Sexta-Feira Santa,Sexta-Feira Santa,,2025-04-18,Taquarituba - SP,-23.5446179,-49.2440546
SP,01/01/2025 - Ano Novo,Ano Novo,,2025-01-01,Taquarituba - SP,-23.5446179,-49.2440546
SP,25/12/2025 - Natal,Natal,,2025-12-25,Taquaral - SP,-22.87444,-47.0427005
SP,15/11/2025 - Proclamação da República,Proclamação da República,,2025-11-15,Taquaral - SP,-22.87444,-47.0427005
SP,02/11/2025 - Dia de Finados,Dia de Finados,,2025-11-02,Taquaral - SP,-22.87444,-47.0427005
SP,12/10/2025 - Nossa Senhora Aparecida,Nossa Senhora Aparecida,,2025-10-12,Taquaral - SP,-22.87444,-47.0427005
SP,07/09/2025 - Independência do Brasil,Independência do Brasil,,2025-09-07,Taquaral - SP,-22.87444,-47.0427005
SP,09/07/2025 - Revolução Constitucionalista,Revolução Constitucionalista,,2025-07-09,Taquaral - SP,-22.87444,-47.0427005
SP,01/05/2025 - Dia do Trabalho,Dia do Trabalho,,2025-05-01,Taquaral - SP,-22.87444,-47.0427005
SP,21/04/2025 - Dia de Tiradentes,Dia de Tiradentes,,2025-04-21,Taquaral - SP,-22.87444,-47.0427005
SP,18/04/2025 - Sexta-Feira Santa,Sexta-Feira Santa,,2025-04-18,Taquaral - SP,-22.87444,-47.0427005
SP,01/01/2025 - Ano Novo,Ano Novo,,2025-01-01,Taquaral - SP,-22.87444,-47.0427005
SP,25/12/2025 - Natal,Natal,,2025-12-25,Silveiras - SP,-22.8162972,-44.8411993
SP,08/12/2025 - Feriado Municipal,Feriado Municipal,,2025-12-08,Silveiras - SP,-22.8162972,-44.8411993
SP,15/11/2025 - Proclamação da República,Proclamação da República,,2025-11-15,Silveiras - SP,-22.8162972,-44.8411993
SP,02/11/2025 - Dia de Finados,Dia de Finados,,2025-11-02,Silveiras - SP,-22.8162972,-44.8411993
SP,12/10/2025 - Nossa Senhora Aparecida,Nossa Senhora Aparecida,,2025-10-12,Silveiras - SP,-22.8162972,-44.8411993
SP,07/09/2025 - Independência do Brasil,Independência do Brasil,,2025-09-07,Silveiras - SP,-22.8162972,-44.8411993
SP,09/07/2025 - Revolução Constitucionalista,Revolução Constitucionalista,,2025-07-09,Silveiras - SP,-22.8162972,-44.8411993
SP,01/05/2025 - Dia do Trabalho,Dia do Trabalho,,2025-05-01,Silveiras - SP,-22.8162972,-44.8411993
SP,21/04/2025 - Dia de Tiradentes,Dia de Tiradentes,,2025-04-21,Silveiras - SP,-22.8162972,-44.8411993
SP,18/04/2025 - Sexta-Feira Santa,Sexta-Feira Santa,,2025-04-18,Silveiras - SP,-22.8162972,-44.8411993
SP,28/02/2025 - Feriado Municipal,Feriado Municipal,,2025-02-28,Silveiras - SP,-22.8162972,-44.8411993
SP,01/01/2025 - Ano Novo,Ano Novo,,2025-01-01,Silveiras - SP,-22.8162972,-44.8411993
SP,25/12/2025 - Natal,Natal,,2025-12-25,Tabatinga - SP,-23.5663816,-45.2649835
SP,15/11/2025 - Proclamação da República,Proclamação da República,,2025-11-15,Tabatinga - SP,-23.5663816,-45.2649835
SP,02/11/2025 - Dia de Finados,Dia de Finados,,2025-11-02,Tabatinga - SP,-23.5663816,-45.2649835
SP,12/10/2025 - Nossa Senhora Aparecida,Nossa Senhora Aparecida,,2025-10-12,Tabatinga - SP,-23.5663816,-45.2649835
SP,07/09/2025 - Independência do Brasil,Independência do Brasil,,2025-09-07,Tabatinga - SP,-23.5663816,-45.2649835
SP,09/07/2025 - Revolução Constitucionalista,Revolução Constitucionalista,,2025-07-09,Tabatinga - SP,-23.5663816,-45.2649835
SP,01/05/2025 - Dia do Trabalho,Dia do Trabalho,,2025-05-01,Tabatinga - SP,-23.5663816,-45.2649835
SP,21/04/2025 - Dia de Tiradentes,Dia de Tiradentes,,2025-04-21,Tabatinga - SP,-23.5663816,-45.2649835
SP,18/04/2025 - Sexta-Feira Santa,Sexta-Feira Santa,,2025-04-18,Tabatinga - SP,-23.5663816,-45.2649835
SP,01/01/2025 - Ano Novo,Ano Novo,,2025-01-01,Tabatinga - SP,-23.5663816,-45.2649835
SP,25/12/2025 - Natal,Natal,,2025-12-25,Socorro - SP,-22.5902619,-46.5249112
SP,15/11/2025 - Proclamação da República,Proclamação da República,,2025-11-15,Socorro - SP,-22.5902619,-46.5249112
SP,02/11/2025 - Dia de Finados,Dia de Finados,,2025-11-02,Socorro - SP,-22.5902619,-46.5249112
SP,12/10/2025 - Nossa Senhora Aparecida,Nossa Senhora Aparecida,,2025-10-12,Socorro - SP,-22.5902619,-46.5249112
SP,07/09/2025 - Independência do Brasil,Independência do Brasil,,2025-09-07,Socorro - SP,-22.5902619,-46.5249112
SP,15/08/2025 - Feriado Municipal,Feriado Municipal,,2025-08-15,Socorro - SP,-22.5902619,-46.5249112
SP,09/07/2025 - Revolução Constitucionalista,Revolução Constitucionalista,,2025-07-09,Socorro - SP,-22.5902619,-46.5249112
SP,01/05/2025 - Dia do Trabalho,Dia do Trabalho,,2025-05-01,Socorro - SP,-22.5902619,-46.5249112
SP,21/04/2025 - Dia de Tiradentes,Dia de Tiradentes,,2025-04-21,Socorro - SP,-22.5902619,-46.5249112
SP,18/04/2025 - Sexta-Feira Santa,Sexta-Feira Santa,,2025-04-18,Socorro - SP,-22.5902619,-46.5249112
SP,01/01/2025 - Ano Novo,Ano Novo,,2025-01-01,Socorro - SP,-22.5902619,-46.5249112
SP,25/12/2025 - Natal,Natal,,2025-12-25,Sorocaba - SP,-23.4684836,-47.4424129
SP,20/11/2025 - Consciência Negra,Consciência Negra,,2025-11-20,Sorocaba - SP,-23.4684836,-47.4424129
SP,15/11/2025 - Proclamação da República,Proclamação da República,,2025-11-15,Sorocaba - SP,-23.4684836,-47.4424129
SP,02/11/2025 - Dia de Finados,Dia de Finados,,2025-11-02,Sorocaba - SP,-23.4684836,-47.4424129
SP,12/10/2025 - Nossa Senhora Aparecida,Nossa Senhora Aparecida,,2025-10-12,Sorocaba - SP,-23.4684836,-47.4424129
SP,07/09/2025 - Independência do Brasil,Independência do Brasil,,2025-09-07,Sorocaba - SP,-23.4684836,-47.4424129
SP,15/08/2025 - Aniversário,Aniversário,,2025-08-15,Sorocaba - SP,-23.4684836,-47.4424129
SP,09/07/2025 - Revolução Constitucionalista,Revolução Constitucionalista,,2025-07-09,Sorocaba - SP,-23.4684836,-47.4424129
SP,19/06/2025 - Corpus Christi,Corpus Christi,,2025-06-19,Sorocaba - SP,-23.4684836,-47.4424129
SP,01/05/2025 - Dia do Trabalho,Dia do Trabalho,,2025-05-01,Sorocaba - SP,-23.4684836,-47.4424129
SP,21/04/2025 - Dia de Tiradentes,Dia de Tiradentes,,2025-04-21,Sorocaba - SP,-23.4684836,-47.4424129
SP,18/04/2025 - Sexta-Feira Santa,Sexta-Feira Santa,,2025-04-18,Sorocaba - SP,-23.4684836,-47.4424129
SP,01/01/2025 - Ano Novo,Ano Novo,,2025-01-01,Sorocaba - SP,-23.4684836,-47.4424129
SP,25/12/2025 - Natal,Natal,,2025-12-25,Sud Mennucci - SP,-20.6906175,-50.9240834
SP,20/11/2025 - Dia da Consciência Negra,Dia da Consciência Negra,,2025-11-20,Sud Mennucci - SP,-20.6906175,-50.9240834
SP,15/11/2025 - Proclamação da República,Proclamação da República,,2025-11-15,Sud Mennucci - SP,-20.6906175,-50.9240834
SP,02/11/2025 - Dia de Finados,Dia de Finados,,2025-11-02,Sud Mennucci - SP,-20.6906175,-50.9240834
SP,12/10/2025 - Nossa Senhora Aparecida,Nossa Senhora Aparecida,,2025-10-12,Sud Mennucci - SP,-20.6906175,-50.9240834
SP,10/09/2025 - Feriado Municipal,Feriado Municipal,,2025-09-10,Sud Mennucci - SP,-20.6906175,-50.9240834
SP,07/09/2025 - Independência do Brasil,Independência do Brasil,,2025-09-07,Sud Mennucci - SP,-20.6906175,-50.9240834
SP,09/07/2025 - Revolução Constitucionalista,Revolução Constitucionalista,,2025-07-09,Sud Mennucci - SP,-20.6906175,-50.9240834
SP,01/05/2025 - Dia do Trabalho,Dia do Trabalho,,2025-05-01,Sud Mennucci - SP,-20.6906175,-50.9240834
SP,21/04/2025 - Dia de Tiradentes,Dia de Tiradentes,,2025-04-21,Sud Mennucci - SP,-20.6906175,-50.9240834
SP,18/04/2025 - Sexta-Feira Santa,Sexta-Feira Santa,,2025-04-18,Sud Mennucci - SP,-20.6906175,-50.9240834
SP,01/01/2025 - Ano Novo,Ano Novo,,2025-01-01,Sud Mennucci - SP,-20.6906175,-50.9240834
SP,25/12/2025 - Natal,Natal,,2025-12-25,Suzano - SP,-23.6630981,-46.307061
SP,20/11/2025 - Dia da Consciência Negra,Dia da Consciência Negra,,2025-11-20,Suzano - SP,-23.6630981,-46.307061
SP,15/11/2025 - Proclamação da República,Proclamação da República,,2025-11-15,Suzano - SP,-23.6630981,-46.307061
SP,02/11/2025 - Dia de Finados,Dia de Finados,,2025-11-02,Suzano - SP,-23.6630981,-46.307061
SP,12/10/2025 - Nossa Senhora Aparecida,Nossa Senhora Aparecida,,2025-10-12,Suzano - SP,-23.6630981,-46.307061
SP,07/09/2025 - Independência do Brasil,Independência do Brasil,,2025-09-07,Suzano - SP,-23.6630981,-46.307061
SP,09/07/2025 - Revolução Constitucionalista,Revolução Constitucionalista,,2025-07-09,Suzano - SP,-23.6630981,-46.307061
SP,19/06/2025 - Corpus Christi,Corpus Christi,,2025-06-19,Suzano - SP,-23.6630981,-46.307061
SP,01/05/2025 - Dia do Trabalho,Dia do Trabalho,,2025-05-01,Suzano - SP,-23.6630981,-46.307061
SP,21/04/2025 - Dia de Tiradentes,Dia de Tiradentes,,2025-04-21,Suzano - SP,-23.6630981,-46.307061
SP,18/04/2025 - Sexta-feira Santa,Sexta-feira Santa,,2025-04-18,Suzano - SP,-23.6630981,-46.307061
SP,18/04/2025 - Sexta-Feira Santa,Sexta-Feira Santa,,2025-04-18,Suzano - SP,-23.6630981,-46.307061
SP,02/04/2025 - Feriado Municipal,Feriado Municipal,,2025-04-02,Suzano - SP,-23.6630981,-46.307061
SP,"20/01/2025 - Dia de São Sebastião, padroeiro da Cidade","Dia de São Sebastião, padroeiro da Cidade",,2025-01-20,Suzano - SP,-23.6630981,-46.307061
SP,01/01/2025 - Ano Novo,Ano Novo,,2025-01-01,Suzano - SP,-23.6630981,-46.307061
SP,27/12/2025 - Feriado Municipal,Feriado Municipal,,2025-12-27,Tapiratiba - SP,-21.4739642,-46.7449194
SP,25/12/2025 - Natal,Natal,,2025-12-25,Tapiratiba - SP,-21.4739642,-46.7449194
SP,15/11/2025 - Proclamação da República,Proclamação da República,,2025-11-15,Tapiratiba - SP,-21.4739642,-46.7449194
SP,02/11/2025 - Dia de Finados,Dia de Finados,,2025-11-02,Tapiratiba - SP,-21.4739642,-46.7449194
SP,12/10/2025 - Nossa Senhora Aparecida,Nossa Senhora Aparecida,,2025-10-12,Tapiratiba - SP,-21.4739642,-46.7449194
SP,07/09/2025 - Independência do Brasil,Independência do Brasil,,2025-09-07,Tapiratiba - SP,-21.4739642,-46.7449194
SP,09/07/2025 - Revolução Constitucionalista,Revolução Constitucionalista,,2025-07-09,Tapiratiba - SP,-21.4739642,-46.7449194
SP,01/05/2025 - Dia do Trabalho,Dia do Trabalho,,2025-05-01,Tapiratiba - SP,-21.4739642,-46.7449194
SP,21/04/2025 - Dia de Tiradentes,Dia de Tiradentes,,2025-04-21,Tapiratiba - SP,-21.4739642,-46.7449194
SP,18/04/2025 - Sexta-Feira Santa,Sexta-Feira Santa,,2025-04-18,Tapiratiba - SP,-21.4739642,-46.7449194
SP,01/01/2025 - Ano Novo,Ano Novo,,2025-01-01,Tapiratiba - SP,-21.4739642,-46.7449194
SP,25/12/2025 - Natal,Natal,,2025-12-25,Taciba - SP,-22.3893943,-51.2888486
SP,08/12/2025 - Feriado Municipal,Feriado Municipal,,2025-12-08,Taciba - SP,-22.3893943,-51.2888486
SP,15/11/2025 - Proclamação da República,Proclamação da República,,2025-11-15,Taciba - SP,-22.3893943,-51.2888486
SP,02/11/2025 - Dia de Finados,Dia de Finados,,2025-11-02,Taciba - SP,-22.3893943,-51.2888486
SP,01/11/2025 - Feriado Municipal,Feriado Municipal,,2025-11-01,Taciba - SP,-22.3893943,-51.2888486
SP,12/10/2025 - Nossa Senhora Aparecida,Nossa Senhora Aparecida,,2025-10-12,Taciba - SP,-22.3893943,-51.2888486
SP,07/09/2025 - Independência do Brasil,Independência do Brasil,,2025-09-07,Taciba - SP,-22.3893943,-51.2888486
SP,09/07/2025 - Revolução Constitucionalista,Revolução Constitucionalista,,2025-07-09,Taciba - SP,-22.3893943,-51.2888486
SP,01/05/2025 - Dia do Trabalho,Dia do Trabalho,,2025-05-01,Taciba - SP,-22.3893943,-51.2888486
SP,21/04/2025 - Dia de Tiradentes,Dia de Tiradentes,,2025-04-21,Taciba - SP,-22.3893943,-51.2888486
SP,18/04/2025 - Sexta-Feira Santa,Sexta-Feira Santa,,2025-04-18,Taciba - SP,-22.3893943,-51.2888486
SP,01/01/2025 - Ano Novo,Ano Novo,,2025-01-01,Taciba - SP,-22.3893943,-51.2888486
SP,25/12/2025 - Natal,Natal,,2025-12-25,Tanabi - SP,-20.5254205,-49.6571611
SP,08/12/2025 - Feriado Municipal,Feriado Municipal,,2025-12-08,Tanabi - SP,-20.5254205,-49.6571611
SP,15/11/2025 - Proclamação da República,Proclamação da República,,2025-11-15,Tanabi - SP,-20.5254205,-49.6571611
SP,02/11/2025 - Dia de Finados,Dia de Finados,,2025-11-02,Tanabi - SP,-20.5254205,-49.6571611
SP,12/10/2025 - Nossa Senhora Aparecida,Nossa Senhora Aparecida,,2025-10-12,Tanabi - SP,-20.5254205,-49.6571611
SP,07/09/2025 - Independência do Brasil,Independência do Brasil,,2025-09-07,Tanabi - SP,-20.5254205,-49.6571611
SP,09/07/2025 - Revolução Constitucionalista,Revolução Constitucionalista,,2025-07-09,Tanabi - SP,-20.5254205,-49.6571611
SP,01/05/2025 - Dia do Trabalho,Dia do Trabalho,,2025-05-01,Tanabi - SP,-20.5254205,-49.6571611
SP,21/04/2025 - Dia de Tiradentes,Dia de Tiradentes,,2025-04-21,Tanabi - SP,-20.5254205,-49.6571611
SP,18/04/2025 - Sexta-Feira Santa,Sexta-Feira Santa,,2025-04-18,Tanabi - SP,-20.5254205,-49.6571611
SP,01/01/2025 - Ano Novo,Ano Novo,,2025-01-01,Tanabi - SP,-20.5254205,-49.6571611
SP,25/12/2025 - Natal,Natal,,2025-12-25,Terra Roxa - SP,-20.7886471,-48.3345039
SP,20/11/2025 - Dia da Consciência Negra,Dia da Consciência Negra,,2025-11-20,Terra Roxa - SP,-20.7886471,-48.3345039
SP,15/11/2025 - Proclamação da República,Proclamação da República,,2025-11-15,Terra Roxa - SP,-20.7886471,-48.3345039
SP,02/11/2025 - Dia de Finados,Dia de Finados,,2025-11-02,Terra Roxa - SP,-20.7886471,-48.3345039
SP,12/10/2025 - Nossa Senhora Aparecida,Nossa Senhora Aparecida,,2025-10-12,Terra Roxa - SP,-20.7886471,-48.3345039
SP,07/09/2025 - Independência do Brasil,Independência do Brasil,,2025-09-07,Terra Roxa - SP,-20.7886471,-48.3345039
SP,09/07/2025 - Revolução Constitucionalista,Revolução Constitucionalista,,2025-07-09,Terra Roxa - SP,-20.7886471,-48.3345039
SP,19/06/2025 - Corpus Christi,Corpus Christi,,2025-06-19,Terra Roxa - SP,-20.7886471,-48.3345039
SP,01/05/2025 - Dia do Trabalho,Dia do Trabalho,,2025-05-01,Terra Roxa - SP,-20.7886471,-48.3345039
SP,21/04/2025 - Dia de Tiradentes,Dia de Tiradentes,,2025-04-21,Terra Roxa - SP,-20.7886471,-48.3345039
SP,18/04/2025 - Sexta-Feira Santa,Sexta-Feira Santa,,2025-04-18,Terra Roxa - SP,-20.7886471,-48.3345039
SP,18/04/2025 - Sexta-Feira Santa,Sexta-Feira Santa,,2025-04-18,Terra Roxa - SP,-20.7886471,-48.3345039
SP,26/03/2025 - Feriado Municipal,Feriado Municipal,,2025-03-26,Terra Roxa - SP,-20.7886471,-48.3345039
SP,04/03/2025 - Carnaval,Carnaval,,2025-03-04,Terra Roxa - SP,-20.7886471,-48.3345039
SP,01/01/2025 - Ano Novo,Ano Novo,,2025-01-01,Terra Roxa - SP,-20.7886471,-48.3345039
SP,25/12/2025 - Natal,Natal,,2025-12-25,Paraibuna - SP,-23.3693021,-45.6795666
SP,15/11/2025 - Proclamação da República,Proclamação da República,,2025-11-15,Paraibuna - SP,-23.3693021,-45.6795666
SP,02/11/2025 - Dia de Finados,Dia de Finados,,2025-11-02,Paraibuna - SP,-23.3693021,-45.6795666
SP,12/10/2025 - Nossa Senhora Aparecida,Nossa Senhora Aparecida,,2025-10-12,Paraibuna - SP,-23.3693021,-45.6795666
SP,07/09/2025 - Independência do Brasil,Independência do Brasil,,2025-09-07,Paraibuna - SP,-23.3693021,-45.6795666
SP,10/07/2025 - Feriado Municipal,Feriado Municipal,,2025-07-10,Paraibuna - SP,-23.3693021,-45.6795666
SP,09/07/2025 - Revolução Constitucionalista,Revolução Constitucionalista,,2025-07-09,Paraibuna - SP,-23.3693021,-45.6795666
SP,13/06/2025 - Dia de Santo Antônio,Dia de Santo Antônio,,2025-06-13,Paraibuna - SP,-23.3693021,-45.6795666
SP,01/05/2025 - Dia do Trabalho,Dia do Trabalho,,2025-05-01,Paraibuna - SP,-23.3693021,-45.6795666
SP,21/04/2025 - Dia de Tiradentes,Dia de Tiradentes,,2025-04-21,Paraibuna - SP,-23.3693021,-45.6795666
SP,18/04/2025 - Sexta-Feira Santa,Sexta-Feira Santa,,2025-04-18,Paraibuna - SP,-23.3693021,-45.6795666
SP,01/01/2025 - Ano Novo,Ano Novo,,2025-01-01,Paraibuna - SP,-23.3693021,-45.6795666
SP,25/12/2025 - Natal,Natal,,2025-12-25,Novo Horizonte - SP,-21.4674564,-49.2235377
SP,08/12/2025 - Imaculada Conceição,Imaculada Conceição,,2025-12-08,Novo Horizonte - SP,-21.4674564,-49.2235377
SP,15/11/2025 - Proclamação da República,Proclamação da República,,2025-11-15,Novo Horizonte - SP,-21.4674564,-49.2235377
SP,02/11/2025 - Dia de Finados,Dia de Finados,,2025-11-02,Novo Horizonte - SP,-21.4674564,-49.2235377
SP,28/10/2025 - Dia do município,Dia do município,,2025-10-28,Novo Horizonte - SP,-21.4674564,-49.2235377
SP,12/10/2025 - Nossa Senhora Aparecida,Nossa Senhora Aparecida,,2025-10-12,Novo Horizonte - SP,-21.4674564,-49.2235377
SP,07/09/2025 - Independência do Brasil,Independência do Brasil,,2025-09-07,Novo Horizonte - SP,-21.4674564,-49.2235377
SP,09/07/2025 - Revolução Constitucionalista,Revolução Constitucionalista,,2025-07-09,Novo Horizonte - SP,-21.4674564,-49.2235377
SP,19/06/2025 - Corpus Christi,Corpus Christi,,2025-06-19,Novo Horizonte - SP,-21.4674564,-49.2235377
SP,01/05/2025 - Dia do Trabalho,Dia do Trabalho,,2025-05-01,Novo Horizonte - SP,-21.4674564,-49.2235377
SP,21/04/2025 - Dia de Tiradentes,Dia de Tiradentes,,2025-04-21,Novo Horizonte - SP,-21.4674564,-49.2235377
SP,18/04/2025 - Sexta-feira Santa,Sexta-feira Santa,,2025-04-18,Novo Horizonte - SP,-21.4674564,-49.2235377
SP,18/04/2025 - Sexta-Feira Santa,Sexta-Feira Santa,,2025-04-18,Novo Horizonte - SP,-21.4674564,-49.2235377
SP,19/03/2025 - São José,São José,,2025-03-19,Novo Horizonte - SP,-21.4674564,-49.2235377
SP,01/01/2025 - Ano Novo,Ano Novo,,2025-01-01,Novo Horizonte - SP,-21.4674564,-49.2235377
SP,25/12/2025 - Natal,Natal,,2025-12-25,Novais - SP,-20.9941576,-48.9188283
SP,15/11/2025 - Proclamação da República,Proclamação da República,,2025-11-15,Novais - SP,-20.9941576,-48.9188283
SP,02/11/2025 - Dia de Finados,Dia de Finados,,2025-11-02,Novais - SP,-20.9941576,-48.9188283
SP,12/10/2025 - Nossa Senhora Aparecida,Nossa Senhora Aparecida,,2025-10-12,Novais - SP,-20.9941576,-48.9188283
SP,07/09/2025 - Independência do Brasil,Independência do Brasil,,2025-09-07,Novais - SP,-20.9941576,-48.9188283
SP,09/07/2025 - Revolução Constitucionalista,Revolução Constitucionalista,,2025-07-09,Novais - SP,-20.9941576,-48.9188283
SP,01/05/2025 - Dia do Trabalho,Dia do Trabalho,,2025-05-01,Novais - SP,-20.9941576,-48.9188283
SP,21/04/2025 - Dia de Tiradentes,Dia de Tiradentes,,2025-04-21,Novais - SP,-20.9941576,-48.9188283
SP,18/04/2025 - Sexta-Feira Santa,Sexta-Feira Santa,,2025-04-18,Novais - SP,-20.9941576,-48.9188283
SP,01/01/2025 - Ano Novo,Ano Novo,,2025-01-01,Novais - SP,-20.9941576,-48.9188283
SP,25/12/2025 - Natal,Natal,,2025-12-25,Nova Odessa - SP,-22.7735736,-47.3042812
SP,20/11/2025 - Consciência Negra,Consciência Negra,,2025-11-20,Nova Odessa - SP,-22.7735736,-47.3042812
SP,15/11/2025 - Proclamação da República,Proclamação da República,,2025-11-15,Nova Odessa - SP,-22.7735736,-47.3042812
SP,02/11/2025 - Dia de Finados,Dia de Finados,,2025-11-02,Nova Odessa - SP,-22.7735736,-47.3042812
SP,12/10/2025 - Nossa Senhora Aparecida,Nossa Senhora Aparecida,,2025-10-12,Nova Odessa - SP,-22.7735736,-47.3042812
SP,15/09/2025 - Padroeira,Padroeira,,2025-09-15,Nova Odessa - SP,-22.7735736,-47.3042812
SP,07/09/2025 - Independência do Brasil,Independência do Brasil,,2025-09-07,Nova Odessa - SP,-22.7735736,-47.3042812
SP,09/07/2025 - Revolução Constitucionalista,Revolução Constitucionalista,,2025-07-09,Nova Odessa - SP,-22.7735736,-47.3042812
SP,19/06/2025 - Corpus Christi,Corpus Christi,,2025-06-19,Nova Odessa - SP,-22.7735736,-47.3042812
SP,01/05/2025 - Dia do Trabalho,Dia do Trabalho,,2025-05-01,Nova Odessa - SP,-22.7735736,-47.3042812
SP,21/04/2025 - Dia de Tiradentes,Dia de Tiradentes,,2025-04-21,Nova Odessa - SP,-22.7735736,-47.3042812
SP,18/04/2025 - Sexta-Feira Santa,Sexta-Feira Santa,,2025-04-18,Nova Odessa - SP,-22.7735736,-47.3042812
SP,01/01/2025 - Ano Novo,Ano Novo,,2025-01-01,Nova Odessa - SP,-22.7735736,-47.3042812
SP,25/12/2025 - Natal,Natal,,2025-12-25,Nova Guataporanga - SP,-21.3384789,-51.6431409
SP,20/11/2025 - Dia da Consciência Negra,Dia da Consciência Negra,,2025-11-20,Nova Guataporanga - SP,-21.3384789,-51.6431409
SP,15/11/2025 - Proclamação da República,Proclamação da República,,2025-11-15,Nova Guataporanga - SP,-21.3384789,-51.6431409
SP,02/11/2025 - Dia de Finados,Dia de Finados,,2025-11-02,Nova Guataporanga - SP,-21.3384789,-51.6431409
SP,20/10/2025 - Aniversário da cidade,Aniversário da cidade,,2025-10-20,Nova Guataporanga - SP,-21.3384789,-51.6431409
SP,12/10/2025 - Nossa Senhora Aparecida,Nossa Senhora Aparecida,,2025-10-12,Nova Guataporanga - SP,-21.3384789,-51.6431409
SP,07/09/2025 - Independência do Brasil,Independência do Brasil,,2025-09-07,Nova Guataporanga - SP,-21.3384789,-51.6431409
SP,09/07/2025 - Revolução Constitucionalista,Revolução Constitucionalista,,2025-07-09,Nova Guataporanga - SP,-21.3384789,-51.6431409
SP,29/06/2025 - Feriado Municipal,Feriado Municipal,,2025-06-29,Nova Guataporanga - SP,-21.3384789,-51.6431409
SP,01/05/2025 - Dia do Trabalho,Dia do Trabalho,,2025-05-01,Nova Guataporanga - SP,-21.3384789,-51.6431409
SP,21/04/2025 - Dia de Tiradentes,Dia de Tiradentes,,2025-04-21,Nova Guataporanga - SP,-21.3384789,-51.6431409
SP,18/04/2025 - Sexta-Feira Santa,Sexta-Feira Santa,,2025-04-18,Nova Guataporanga - SP,-21.3384789,-51.6431409
SP,01/01/2025 - Ano Novo,Ano Novo,,2025-01-01,Nova Guataporanga - SP,-21.3384789,-51.6431409
SP,25/12/2025 - Natal,Natal,,2025-12-25,Nova Granada - SP,-20.5345426,-49.3186951
SP,20/11/2025 - Dia da Consciência Negra,Dia da Consciência Negra,,2025-11-20,Nova Granada - SP,-20.5345426,-49.3186951
SP,15/11/2025 - Proclamação da República,Proclamação da República,,2025-11-15,Nova Granada - SP,-20.5345426,-49.3186951
SP,02/11/2025 - Dia de Finados,Dia de Finados,,2025-11-02,Nova Granada - SP,-20.5345426,-49.3186951
SP,12/10/2025 - Nossa Senhora Aparecida,Nossa Senhora Aparecida,,2025-10-12,Nova Granada - SP,-20.5345426,-49.3186951
SP,07/09/2025 - Independência do Brasil,Independência do Brasil,,2025-09-07,Nova Granada - SP,-20.5345426,-49.3186951
SP,09/07/2025 - Revolução Constitucionalista,Revolução Constitucionalista,,2025-07-09,Nova Granada - SP,-20.5345426,-49.3186951
SP,01/05/2025 - Dia do Trabalho,Dia do Trabalho,,2025-05-01,Nova Granada - SP,-20.5345426,-49.3186951
SP,21/04/2025 - Dia de Tiradentes,Dia de Tiradentes,,2025-04-21,Nova Granada - SP,-20.5345426,-49.3186951
SP,18/04/2025 - Sexta-Feira Santa,Sexta-Feira Santa,,2025-04-18,Nova Granada - SP,-20.5345426,-49.3186951
SP,22/03/2025 - Feriado Municipal,Feriado Municipal,,2025-03-22,Nova Granada - SP,-20.5345426,-49.3186951
SP,01/01/2025 - Ano Novo,Ano Novo,,2025-01-01,Nova Granada - SP,-20.5345426,-49.3186951
SP,30/12/2025 - Feriado Municipal,Feriado Municipal,,2025-12-30,Nova Europa - SP,-23.1674473,-47.0516588
SP,25/12/2025 - Natal,Natal,,2025-12-25,Nova Europa - SP,-23.1674473,-47.0516588
SP,15/11/2025 - Proclamação da República,Proclamação da República,,2025-11-15,Nova Europa - SP,-23.1674473,-47.0516588
SP,02/11/2025 - Dia de Finados,Dia de Finados,,2025-11-02,Nova Europa - SP,-23.1674473,-47.0516588
SP,12/10/2025 - Nossa Senhora Aparecida,Nossa Senhora Aparecida,,2025-10-12,Nova Europa - SP,-23.1674473,-47.0516588
SP,07/09/2025 - Independência do Brasil,Independência do Brasil,,2025-09-07,Nova Europa - SP,-23.1674473,-47.0516588
SP,09/07/2025 - Revolução Constitucionalista,Revolução Constitucionalista,,2025-07-09,Nova Europa - SP,-23.1674473,-47.0516588
SP,01/05/2025 - Dia do Trabalho,Dia do Trabalho,,2025-05-01,Nova Europa - SP,-23.1674473,-47.0516588
SP,21/04/2025 - Dia de Tiradentes,Dia de Tiradentes,,2025-04-21,Nova Europa - SP,-23.1674473,-47.0516588
SP,18/04/2025 - Sexta-Feira Santa,Sexta-Feira Santa,,2025-04-18,Nova Europa - SP,-23.1674473,-47.0516588
SP,01/01/2025 - Ano Novo,Ano Novo,,2025-01-01,Nova Europa - SP,-23.1674473,-47.0516588
SP,25/12/2025 - Natal,Natal,,2025-12-25,Nova Castilho - SP,-20.7615415,-50.3407195
SP,15/11/2025 - Proclamação da República,Proclamação da República,,2025-11-15,Nova Castilho - SP,-20.7615415,-50.3407195
SP,02/11/2025 - Dia de Finados,Dia de Finados,,2025-11-02,Nova Castilho - SP,-20.7615415,-50.3407195
SP,12/10/2025 - Nossa Senhora Aparecida,Nossa Senhora Aparecida,,2025-10-12,Nova Castilho - SP,-20.7615415,-50.3407195
SP,07/09/2025 - Independência do Brasil,Independência do Brasil,,2025-09-07,Nova Castilho - SP,-20.7615415,-50.3407195
SP,09/07/2025 - Revolução Constitucionalista,Revolução Constitucionalista,,2025-07-09,Nova Castilho - SP,-20.7615415,-50.3407195
SP,01/05/2025 - Dia do Trabalho,Dia do Trabalho,,2025-05-01,Nova Castilho - SP,-20.7615415,-50.3407195
SP,21/04/2025 - Dia de Tiradentes,Dia de Tiradentes,,2025-04-21,Nova Castilho - SP,-20.7615415,-50.3407195
SP,18/04/2025 - Sexta-Feira Santa,Sexta-Feira Santa,,2025-04-18,Nova Castilho - SP,-20.7615415,-50.3407195
SP,01/01/2025 - Ano Novo,Ano Novo,,2025-01-01,Nova Castilho - SP,-20.7615415,-50.3407195
SP,25/12/2025 - Natal,Natal,,2025-12-25,Nova Campina - SP,-24.1866859,-48.9430722
SP,15/11/2025 - Proclamação da República,Proclamação da República,,2025-11-15,Nova Campina - SP,-24.1866859,-48.9430722
SP,02/11/2025 - Dia de Finados,Dia de Finados,,2025-11-02,Nova Campina - SP,-24.1866859,-48.9430722
SP,12/10/2025 - Nossa Senhora Aparecida,Nossa Senhora Aparecida,,2025-10-12,Nova Campina - SP,-24.1866859,-48.9430722
SP,07/09/2025 - Independência do Brasil,Independência do Brasil,,2025-09-07,Nova Campina - SP,-24.1866859,-48.9430722
SP,09/07/2025 - Revolução Constitucionalista,Revolução Constitucionalista,,2025-07-09,Nova Campina - SP,-24.1866859,-48.9430722
SP,01/05/2025 - Dia do Trabalho,Dia do Trabalho,,2025-05-01,Nova Campina - SP,-24.1866859,-48.9430722
SP,21/04/2025 - Dia de Tiradentes,Dia de Tiradentes,,2025-04-21,Nova Campina - SP,-24.1866859,-48.9430722
SP,18/04/2025 - Sexta-Feira Santa,Sexta-Feira Santa,,2025-04-18,Nova Campina - SP,-24.1866859,-48.9430722
SP,01/01/2025 - Ano Novo,Ano Novo,,2025-01-01,Nova Campina - SP,-24.1866859,-48.9430722
SP,25/12/2025 - Natal,Natal,,2025-12-25,Nhandeara - SP,-20.6943324,-50.0406028
SP,15/11/2025 - Proclamação da República,Proclamação da República,,2025-11-15,Nhandeara - SP,-20.6943324,-50.0406028
SP,02/11/2025 - Dia de Finados,Dia de Finados,,2025-11-02,Nhandeara - SP,-20.6943324,-50.0406028
SP,12/10/2025 - Nossa Senhora Aparecida,Nossa Senhora Aparecida,,2025-10-12,Nhandeara - SP,-20.6943324,-50.0406028
SP,07/09/2025 - Independência do Brasil,Independência do Brasil,,2025-09-07,Nhandeara - SP,-20.6943324,-50.0406028
SP,09/07/2025 - Revolução Constitucionalista,Revolução Constitucionalista,,2025-07-09,Nhandeara - SP,-20.6943324,-50.0406028
SP,24/06/2025 - Feriado Municipal,Feriado Municipal,,2025-06-24,Nhandeara - SP,-20.6943324,-50.0406028
SP,01/05/2025 - Dia do Trabalho,Dia do Trabalho,,2025-05-01,Nhandeara - SP,-20.6943324,-50.0406028
SP,21/04/2025 - Dia de Tiradentes,Dia de Tiradentes,,2025-04-21,Nhandeara - SP,-20.6943324,-50.0406028
SP,18/04/2025 - Sexta-Feira Santa,Sexta-Feira Santa,,2025-04-18,Nhandeara - SP,-20.6943324,-50.0406028
SP,06/01/2025 - Feriado Municipal,Feriado Municipal,,2025-01-06,Nhandeara - SP,-20.6943324,-50.0406028
SP,01/01/2025 - Ano Novo,Ano Novo,,2025-01-01,Nhandeara - SP,-20.6943324,-50.0406028
SP,25/12/2025 - Natal,Natal,,2025-12-25,Neves Paulista - SP,-20.8455832,-49.6286134
SP,30/11/2025 - Feriado Municipal,Feriado Municipal,,2025-11-30,Neves Paulista - SP,-20.8455832,-49.6286134
SP,15/11/2025 - Proclamação da República,Proclamação da República,,2025-11-15,Neves Paulista - SP,-20.8455832,-49.6286134
SP,02/11/2025 - Dia de Finados,Dia de Finados,,2025-11-02,Neves Paulista - SP,-20.8455832,-49.6286134
SP,12/10/2025 - Nossa Senhora Aparecida,Nossa Senhora Aparecida,,2025-10-12,Neves Paulista - SP,-20.8455832,-49.6286134
SP,07/09/2025 - Independência do Brasil,Independência do Brasil,,2025-09-07,Neves Paulista - SP,-20.8455832,-49.6286134
SP,09/07/2025 - Revolução Constitucionalista,Revolução Constitucionalista,,2025-07-09,Neves Paulista - SP,-20.8455832,-49.6286134
SP,22/05/2025 - Feriado Municipal,Feriado Municipal,,2025-05-22,Neves Paulista - SP,-20.8455832,-49.6286134
SP,01/05/2025 - Dia do Trabalho,Dia do Trabalho,,2025-05-01,Neves Paulista - SP,-20.8455832,-49.6286134
SP,21/04/2025 - Dia de Tiradentes,Dia de Tiradentes,,2025-04-21,Neves Paulista - SP,-20.8455832,-49.6286134
SP,18/04/2025 - Sexta-Feira Santa,Sexta-Feira Santa,,2025-04-18,Neves Paulista - SP,-20.8455832,-49.6286134
SP,01/01/2025 - Ano Novo,Ano Novo,,2025-01-01,Neves Paulista - SP,-20.8455832,-49.6286134
SP,25/12/2025 - Natal,Natal,,2025-12-25,Natividade da Serra - SP,-23.3784274,-45.4453293
SP,15/11/2025 - Proclamação da República,Proclamação da República,,2025-11-15,Natividade da Serra - SP,-23.3784274,-45.4453293
SP,02/11/2025 - Dia de Finados,Dia de Finados,,2025-11-02,Natividade da Serra - SP,-23.3784274,-45.4453293
SP,12/10/2025 - Nossa Senhora Aparecida,Nossa Senhora Aparecida,,2025-10-12,Natividade da Serra - SP,-23.3784274,-45.4453293
SP,08/09/2025 - Feriado Municipal,Feriado Municipal,,2025-09-08,Natividade da Serra - SP,-23.3784274,-45.4453293
SP,07/09/2025 - Independência do Brasil,Independência do Brasil,,2025-09-07,Natividade da Serra - SP,-23.3784274,-45.4453293
SP,13/08/2025 - Feriado Municipal,Feriado Municipal,,2025-08-13,Natividade da Serra - SP,-23.3784274,-45.4453293
SP,09/07/2025 - Revolução Constitucionalista,Revolução Constitucionalista,,2025-07-09,Natividade da Serra - SP,-23.3784274,-45.4453293
SP,29/05/2025 - Feriado Municipal,Feriado Municipal,,2025-05-29,Natividade da Serra - SP,-23.3784274,-45.4453293
SP,01/05/2025 - Dia do Trabalho,Dia do Trabalho,,2025-05-01,Natividade da Serra - SP,-23.3784274,-45.4453293
SP,21/04/2025 - Dia de Tiradentes,Dia de Tiradentes,,2025-04-21,Natividade da Serra - SP,-23.3784274,-45.4453293
SP,18/04/2025 - Sexta-Feira Santa,Sexta-Feira Santa,,2025-04-18,Natividade da Serra - SP,-23.3784274,-45.4453293
SP,01/01/2025 - Ano Novo,Ano Novo,,2025-01-01,Natividade da Serra - SP,-23.3784274,-45.4453293
SP,25/12/2025 - Natal,Natal,,2025-12-25,Nuporanga - SP,-20.731219,-47.7532013
SP,15/11/2025 - Proclamação da República,Proclamação da República,,2025-11-15,Nuporanga - SP,-20.731219,-47.7532013
SP,02/11/2025 - Dia de Finados,Dia de Finados,,2025-11-02,Nuporanga - SP,-20.731219,-47.7532013
SP,12/10/2025 - Nossa Senhora Aparecida,Nossa Senhora Aparecida,,2025-10-12,Nuporanga - SP,-20.731219,-47.7532013
SP,09/09/2025 - Feriado Municipal,Feriado Municipal,,2025-09-09,Nuporanga - SP,-20.731219,-47.7532013
SP,07/09/2025 - Independência do Brasil,Independência do Brasil,,2025-09-07,Nuporanga - SP,-20.731219,-47.7532013
SP,15/08/2025 - Feriado Municipal,Feriado Municipal,,2025-08-15,Nuporanga - SP,-20.731219,-47.7532013
SP,09/07/2025 - Revolução Constitucionalista,Revolução Constitucionalista,,2025-07-09,Nuporanga - SP,-20.731219,-47.7532013
SP,03/05/2025 - Feriado Municipal,Feriado Municipal,,2025-05-03,Nuporanga - SP,-20.731219,-47.7532013
SP,01/05/2025 - Dia do Trabalho,Dia do Trabalho,,2025-05-01,Nuporanga - SP,-20.731219,-47.7532013
SP,21/04/2025 - Dia de Tiradentes,Dia de Tiradentes,,2025-04-21,Nuporanga - SP,-20.731219,-47.7532013
SP,18/04/2025 - Sexta-Feira Santa,Sexta-Feira Santa,,2025-04-18,Nuporanga - SP,-20.731219,-47.7532013
SP,01/01/2025 - Ano Novo,Ano Novo,,2025-01-01,Nuporanga - SP,-20.731219,-47.7532013
SP,25/12/2025 - Natal,Natal,,2025-12-25,Ouro Verde - SP,-23.0025721,-47.1186156
SP,08/12/2025 - Feriado Municipal,Feriado Municipal,,2025-12-08,Ouro Verde - SP,-23.0025721,-47.1186156
SP,15/11/2025 - Proclamação da República,Proclamação da República,,2025-11-15,Ouro Verde - SP,-23.0025721,-47.1186156
SP,02/11/2025 - Dia de Finados,Dia de Finados,,2025-11-02,Ouro Verde - SP,-23.0025721,-47.1186156
SP,12/10/2025 - Nossa Senhora Aparecida,Nossa Senhora Aparecida,,2025-10-12,Ouro Verde - SP,-23.0025721,-47.1186156
SP,07/09/2025 - Independência do Brasil,Independência do Brasil,,2025-09-07,Ouro Verde - SP,-23.0025721,-47.1186156
SP,09/07/2025 - Revolução Constitucionalista,Revolução Constitucionalista,,2025-07-09,Ouro Verde - SP,-23.0025721,-47.1186156
SP,29/06/2025 - Feriado Municipal,Feriado Municipal,,2025-06-29,Ouro Verde - SP,-23.0025721,-47.1186156
SP,01/05/2025 - Dia do Trabalho,Dia do Trabalho,,2025-05-01,Ouro Verde - SP,-23.0025721,-47.1186156
SP,21/04/2025 - Dia de Tiradentes,Dia de Tiradentes,,2025-04-21,Ouro Verde - SP,-23.0025721,-47.1186156
SP,18/04/2025 - Sexta-Feira Santa,Sexta-Feira Santa,,2025-04-18,Ouro Verde - SP,-23.0025721,-47.1186156
SP,01/01/2025 - Ano Novo,Ano Novo,,2025-01-01,Ouro Verde - SP,-23.0025721,-47.1186156
SP,25/12/2025 - Natal,Natal,,2025-12-25,Panorama - SP,-21.3611651,-51.8574008
SP,20/11/2025 - Dia da Consciência Negra,Dia da Consciência Negra,,2025-11-20,Panorama - SP,-21.3611651,-51.8574008
SP,15/11/2025 - Proclamação da República,Proclamação da República,,2025-11-15,Panorama - SP,-21.3611651,-51.8574008
SP,02/11/2025 - Dia de Finados,Dia de Finados,,2025-11-02,Panorama - SP,-21.3611651,-51.8574008
SP,12/10/2025 - Nossa Senhora Aparecida,Nossa Senhora Aparecida,,2025-10-12,Panorama - SP,-21.3611651,-51.8574008
SP,07/09/2025 - Independência do Brasil,Independência do Brasil,,2025-09-07,Panorama - SP,-21.3611651,-51.8574008
SP,09/07/2025 - Revolução Constitucionalista,Revolução Constitucionalista,,2025-07-09,Panorama - SP,-21.3611651,-51.8574008
SP,01/05/2025 - Dia do Trabalho,Dia do Trabalho,,2025-05-01,Panorama - SP,-21.3611651,-51.8574008
SP,21/04/2025 - Dia de Tiradentes,Dia de Tiradentes,,2025-04-21,Panorama - SP,-21.3611651,-51.8574008
SP,18/04/2025 - Sexta-Feira Santa,Sexta-Feira Santa,,2025-04-18,Panorama - SP,-21.3611651,-51.8574008
SP,19/03/2025 - São José,São José,,2025-03-19,Panorama - SP,-21.3611651,-51.8574008
SP,01/01/2025 - Ano Novo,Ano Novo,,2025-01-01,Panorama - SP,-21.3611651,-51.8574008
SP,25/12/2025 - Natal,Natal,,2025-12-25,Palmital - SP,-22.2150118,-49.9473525
SP,20/11/2025 - Dia da Consciência Negra,Dia da Consciência Negra,,2025-11-20,Palmital - SP,-22.2150118,-49.9473525
SP,15/11/2025 - Proclamação da República,Proclamação da República,,2025-11-15,Palmital - SP,-22.2150118,-49.9473525
SP,02/11/2025 - Dia de Finados,Dia de Finados,,2025-11-02,Palmital - SP,-22.2150118,-49.9473525
SP,12/10/2025 - Nossa Senhora Aparecida,Nossa Senhora Aparecida,,2025-10-12,Palmital - SP,-22.2150118,-49.9473525
SP,07/09/2025 - Independência do Brasil,Independência do Brasil,,2025-09-07,Palmital - SP,-22.2150118,-49.9473525
SP,09/07/2025 - Revolução Constitucionalista,Revolução Constitucionalista,,2025-07-09,Palmital - SP,-22.2150118,-49.9473525
SP,19/06/2025 - Corpus Christi,Corpus Christi,,2025-06-19,Palmital - SP,-22.2150118,-49.9473525
SP,01/05/2025 - Dia do Trabalho,Dia do Trabalho,,2025-05-01,Palmital - SP,-22.2150118,-49.9473525
SP,21/04/2025 - Dia de Tiradentes,Dia de Tiradentes,,2025-04-21,Palmital - SP,-22.2150118,-49.9473525
SP,18/04/2025 - Sexta-feira da Paixão,Sexta-feira da Paixão,,2025-04-18,Palmital - SP,-22.2150118,-49.9473525
SP,18/04/2025 - Sexta-Feira Santa,Sexta-Feira Santa,,2025-04-18,Palmital - SP,-22.2150118,-49.9473525
SP,"20/01/2025 - Fundação da cidade de Palmital e dia de São Sebastião, padroeiro da cidade","Fundação da cidade de Palmital e dia de São Sebastião, padroeiro da cidade",,2025-01-20,Palmital - SP,-22.2150118,-49.9473525
SP,01/01/2025 - Ano Novo,Ano Novo,,2025-01-01,Palmital - SP,-22.2150118,-49.9473525
SP,25/12/2025 - Natal,Natal,,2025-12-25,Palmares Paulista - SP,-21.1768796,-47.7913156
SP,08/12/2025 - Feriado Municipal,Feriado Municipal,,2025-12-08,Palmares Paulista - SP,-21.1768796,-47.7913156
SP,20/11/2025 - Dia da Consciência Negra,Dia da Consciência Negra,,2025-11-20,Palmares Paulista - SP,-21.1768796,-47.7913156
SP,15/11/2025 - Proclamação da República,Proclamação da República,,2025-11-15,Palmares Paulista - SP,-21.1768796,-47.7913156
SP,02/11/2025 - Dia de Finados,Dia de Finados,,2025-11-02,Palmares Paulista - SP,-21.1768796,-47.7913156
SP,12/10/2025 - Nossa Senhora Aparecida,Nossa Senhora Aparecida,,2025-10-12,Palmares Paulista - SP,-21.1768796,-47.7913156
SP,07/09/2025 - Independência do Brasil,Independência do Brasil,,2025-09-07,Palmares Paulista - SP,-21.1768796,-47.7913156
SP,09/07/2025 - Revolução Constitucionalista,Revolução Constitucionalista,,2025-07-09,Palmares Paulista - SP,-21.1768796,-47.7913156
SP,01/05/2025 - Dia do Trabalho,Dia do Trabalho,,2025-05-01,Palmares Paulista - SP,-21.1768796,-47.7913156
SP,21/04/2025 - Dia de Tiradentes,Dia de Tiradentes,,2025-04-21,Palmares Paulista - SP,-21.1768796,-47.7913156
SP,18/04/2025 - Sexta-Feira Santa,Sexta-Feira Santa,,2025-04-18,Palmares Paulista - SP,-21.1768796,-47.7913156
SP,01/01/2025 - Ano Novo,Ano Novo,,2025-01-01,Palmares Paulista - SP,-21.1768796,-47.7913156
SP,25/12/2025 - Natal,Natal,,2025-12-25,Palestina - SP,-20.3884278,-49.4298856
SP,15/11/2025 - Proclamação da República,Proclamação da República,,2025-11-15,Palestina - SP,-20.3884278,-49.4298856
SP,02/11/2025 - Dia de Finados,Dia de Finados,,2025-11-02,Palestina - SP,-20.3884278,-49.4298856
SP,12/10/2025 - Nossa Senhora Aparecida,Nossa Senhora Aparecida,,2025-10-12,Palestina - SP,-20.3884278,-49.4298856
SP,07/09/2025 - Independência do Brasil,Independência do Brasil,,2025-09-07,Palestina - SP,-20.3884278,-49.4298856
SP,09/07/2025 - Revolução Constitucionalista,Revolução Constitucionalista,,2025-07-09,Palestina - SP,-20.3884278,-49.4298856
SP,24/06/2025 - Feriado Municipal,Feriado Municipal,,2025-06-24,Palestina - SP,-20.3884278,-49.4298856
SP,01/05/2025 - Dia do Trabalho,Dia do Trabalho,,2025-05-01,Palestina - SP,-20.3884278,-49.4298856
SP,21/04/2025 - Dia de Tiradentes,Dia de Tiradentes,,2025-04-21,Palestina - SP,-20.3884278,-49.4298856
SP,18/04/2025 - Sexta-Feira Santa,Sexta-Feira Santa,,2025-04-18,Palestina - SP,-20.3884278,-49.4298856
SP,01/01/2025 - Ano Novo,Ano Novo,,2025-01-01,Palestina - SP,-20.3884278,-49.4298856
SP,25/12/2025 - Natal,Natal,,2025-12-25,Pacaembu - SP,-23.5598291,-46.6574264
SP,27/11/2025 - Feriado Municipal,Feriado Municipal,,2025-11-27,Pacaembu - SP,-23.5598291,-46.6574264
SP,15/11/2025 - Proclamação da República,Proclamação da República,,2025-11-15,Pacaembu - SP,-23.5598291,-46.6574264
SP,02/11/2025 - Dia de Finados,Dia de Finados,,2025-11-02,Pacaembu - SP,-23.5598291,-46.6574264
SP,12/10/2025 - Nossa Senhora Aparecida,Nossa Senhora Aparecida,,2025-10-12,Pacaembu - SP,-23.5598291,-46.6574264
SP,07/09/2025 - Independência do Brasil,Independência do Brasil,,2025-09-07,Pacaembu - SP,-23.5598291,-46.6574264
SP,09/07/2025 - Revolução Constitucionalista,Revolução Constitucionalista,,2025-07-09,Pacaembu - SP,-23.5598291,-46.6574264
SP,01/05/2025 - Dia do Trabalho,Dia do Trabalho,,2025-05-01,Pacaembu - SP,-23.5598291,-46.6574264
SP,21/04/2025 - Dia de Tiradentes,Dia de Tiradentes,,2025-04-21,Pacaembu - SP,-23.5598291,-46.6574264
SP,18/04/2025 - Sexta-Feira Santa,Sexta-Feira Santa,,2025-04-18,Pacaembu - SP,-23.5598291,-46.6574264
SP,02/04/2025 - Feriado Municipal,Feriado Municipal,,2025-04-02,Pacaembu - SP,-23.5598291,-46.6574264
SP,06/01/2025 - Feriado Municipal,Feriado Municipal,,2025-01-06,Pacaembu - SP,-23.5598291,-46.6574264
SP,01/01/2025 - Ano Novo,Ano Novo,,2025-01-01,Pacaembu - SP,-23.5598291,-46.6574264
SP,27/12/2025 - Feriado Municipal,Feriado Municipal,,2025-12-27,Ouroeste - SP,-20.0078169,-50.3651498
SP,25/12/2025 - Natal,Natal,,2025-12-25,Ouroeste - SP,-20.0078169,-50.3651498
SP,15/11/2025 - Proclamação da República,Proclamação da República,,2025-11-15,Ouroeste - SP,-20.0078169,-50.3651498
SP,02/11/2025 - Dia de Finados,Dia de Finados,,2025-11-02,Ouroeste - SP,-20.0078169,-50.3651498
SP,12/10/2025 - Nossa Senhora Aparecida,Nossa Senhora Aparecida,,2025-10-12,Ouroeste - SP,-20.0078169,-50.3651498
SP,07/09/2025 - Independência do Brasil,Independência do Brasil,,2025-09-07,Ouroeste - SP,-20.0078169,-50.3651498
SP,09/07/2025 - Revolução Constitucionalista,Revolução Constitucionalista,,2025-07-09,Ouroeste - SP,-20.0078169,-50.3651498
SP,24/06/2025 - Feriado Municipal,Feriado Municipal,,2025-06-24,Ouroeste - SP,-20.0078169,-50.3651498
SP,01/05/2025 - Dia do Trabalho,Dia do Trabalho,,2025-05-01,Ouroeste - SP,-20.0078169,-50.3651498
SP,21/04/2025 - Dia de Tiradentes,Dia de Tiradentes,,2025-04-21,Ouroeste - SP,-20.0078169,-50.3651498
SP,18/04/2025 - Sexta-Feira Santa,Sexta-Feira Santa,,2025-04-18,Ouroeste - SP,-20.0078169,-50.3651498
SP,01/01/2025 - Ano Novo,Ano Novo,,2025-01-01,Ouroeste - SP,-20.0078169,-50.3651498
SP,25/12/2025 - Natal,Natal,,2025-12-25,Ourinhos - SP,-22.9725203,-49.8727837
SP,13/12/2025 - Feriado Municipal,Feriado Municipal,,2025-12-13,Ourinhos - SP,-22.9725203,-49.8727837
SP,15/11/2025 - Proclamação da República,Proclamação da República,,2025-11-15,Ourinhos - SP,-22.9725203,-49.8727837
SP,02/11/2025 - Dia de Finados,Dia de Finados,,2025-11-02,Ourinhos - SP,-22.9725203,-49.8727837
SP,12/10/2025 - Nossa Senhora Aparecida,Nossa Senhora Aparecida,,2025-10-12,Ourinhos - SP,-22.9725203,-49.8727837
SP,07/09/2025 - Independência do Brasil,Independência do Brasil,,2025-09-07,Ourinhos - SP,-22.9725203,-49.8727837
SP,06/08/2025 - Feriado Municipal,Feriado Municipal,,2025-08-06,Ourinhos - SP,-22.9725203,-49.8727837
SP,09/07/2025 - Revolução Constitucionalista,Revolução Constitucionalista,,2025-07-09,Ourinhos - SP,-22.9725203,-49.8727837
SP,01/05/2025 - Dia do Trabalho,Dia do Trabalho,,2025-05-01,Ourinhos - SP,-22.9725203,-49.8727837
SP,21/04/2025 - Dia de Tiradentes,Dia de Tiradentes,,2025-04-21,Ourinhos - SP,-22.9725203,-49.8727837
SP,18/04/2025 - Sexta-Feira Santa,Sexta-Feira Santa,,2025-04-18,Ourinhos - SP,-22.9725203,-49.8727837
SP,01/01/2025 - Ano Novo,Ano Novo,,2025-01-01,Ourinhos - SP,-22.9725203,-49.8727837
SP,25/12/2025 - Natal,Natal,,2025-12-25,Osvaldo Cruz - SP,-21.7929427,-50.8903569
SP,15/11/2025 - Proclamação da República,Proclamação da República,,2025-11-15,Osvaldo Cruz - SP,-21.7929427,-50.8903569
SP,02/11/2025 - Dia de Finados,Dia de Finados,,2025-11-02,Osvaldo Cruz - SP,-21.7929427,-50.8903569
SP,12/10/2025 - Nossa Senhora Aparecida,Nossa Senhora Aparecida,,2025-10-12,Osvaldo Cruz - SP,-21.7929427,-50.8903569
SP,07/09/2025 - Independência do Brasil,Independência do Brasil,,2025-09-07,Osvaldo Cruz - SP,-21.7929427,-50.8903569
SP,09/07/2025 - Revolução Constitucionalista,Revolução Constitucionalista,,2025-07-09,Osvaldo Cruz - SP,-21.7929427,-50.8903569
SP,06/06/2025 - Feriado Municipal,Feriado Municipal,,2025-06-06,Osvaldo Cruz - SP,-21.7929427,-50.8903569
SP,01/05/2025 - Dia do Trabalho,Dia do Trabalho,,2025-05-01,Osvaldo Cruz - SP,-21.7929427,-50.8903569
SP,21/04/2025 - Dia de Tiradentes,Dia de Tiradentes,,2025-04-21,Osvaldo Cruz - SP,-21.7929427,-50.8903569
SP,18/04/2025 - Sexta-Feira Santa,Sexta-Feira Santa,,2025-04-18,Osvaldo Cruz - SP,-21.7929427,-50.8903569
SP,19/03/2025 - São José,São José,,2025-03-19,Osvaldo Cruz - SP,-21.7929427,-50.8903569
SP,01/01/2025 - Ano Novo,Ano Novo,,2025-01-01,Osvaldo Cruz - SP,-21.7929427,-50.8903569
SP,25/12/2025 - Natal,Natal,,2025-12-25,Oscar Bressane - SP,-22.314874,-50.281118
SP,15/11/2025 - Proclamação da República,Proclamação da República,,2025-11-15,Oscar Bressane - SP,-22.314874,-50.281118
SP,02/11/2025 - Dia de Finados,Dia de Finados,,2025-11-02,Oscar Bressane - SP,-22.314874,-50.281118
SP,12/10/2025 - Nossa Senhora Aparecida,Nossa Senhora Aparecida,,2025-10-12,Oscar Bressane - SP,-22.314874,-50.281118
SP,07/09/2025 - Independência do Brasil,Independência do Brasil,,2025-09-07,Oscar Bressane - SP,-22.314874,-50.281118
SP,16/07/2025 - Feriado Municipal,Feriado Municipal,,2025-07-16,Oscar Bressane - SP,-22.314874,-50.281118
SP,09/07/2025 - Revolução Constitucionalista,Revolução Constitucionalista,,2025-07-09,Oscar Bressane - SP,-22.314874,-50.281118
SP,01/05/2025 - Dia do Trabalho,Dia do Trabalho,,2025-05-01,Oscar Bressane - SP,-22.314874,-50.281118
SP,24/04/2025 - Feriado Municipal,Feriado Municipal,,2025-04-24,Oscar Bressane - SP,-22.314874,-50.281118
SP,21/04/2025 - Dia de Tiradentes,Dia de Tiradentes,,2025-04-21,Oscar Bressane - SP,-22.314874,-50.281118
SP,18/04/2025 - Sexta-Feira Santa,Sexta-Feira Santa,,2025-04-18,Oscar Bressane - SP,-22.314874,-50.281118
SP,01/01/2025 - Ano Novo,Ano Novo,,2025-01-01,Oscar Bressane - SP,-22.314874,-50.281118
SP,25/12/2025 - Natal,Natal,,2025-12-25,Osasco - SP,-23.5299744,-46.7825411
SP,15/11/2025 - Proclamação da República,Proclamação da República,,2025-11-15,Osasco - SP,-23.5299744,-46.7825411
SP,02/11/2025 - Dia de Finados,Dia de Finados,,2025-11-02,Osasco - SP,-23.5299744,-46.7825411
SP,12/10/2025 - Nossa Senhora Aparecida,Nossa Senhora Aparecida,,2025-10-12,Osasco - SP,-23.5299744,-46.7825411
SP,07/09/2025 - Independência do Brasil,Independência do Brasil,,2025-09-07,Osasco - SP,-23.5299744,-46.7825411
SP,09/07/2025 - Revolução Constitucionalista,Revolução Constitucionalista,,2025-07-09,Osasco - SP,-23.5299744,-46.7825411
SP,19/06/2025 - Corpus Christi,Corpus Christi,,2025-06-19,Osasco - SP,-23.5299744,-46.7825411
SP,13/06/2025 - Dia de Santo Antônio,Dia de Santo Antônio,,2025-06-13,Osasco - SP,-23.5299744,-46.7825411
SP,01/05/2025 - Dia do Trabalho,Dia do Trabalho,,2025-05-01,Osasco - SP,-23.5299744,-46.7825411
SP,21/04/2025 - Dia de Tiradentes,Dia de Tiradentes,,2025-04-21,Osasco - SP,-23.5299744,-46.7825411
SP,18/04/2025 - Sexta-feira Santa,Sexta-feira Santa,,2025-04-18,Osasco - SP,-23.5299744,-46.7825411
SP,18/04/2025 - Sexta-Feira Santa,Sexta-Feira Santa,,2025-04-18,Osasco - SP,-23.5299744,-46.7825411
SP,19/02/2025 - Emancipação de Osasco,Emancipação de Osasco,,2025-02-19,Osasco - SP,-23.5299744,-46.7825411
SP,01/01/2025 - Ano Novo,Ano Novo,,2025-01-01,Osasco - SP,-23.5299744,-46.7825411
SP,25/12/2025 - Natal,Natal,,2025-12-25,Oriente - SP,-22.1525442,-50.0935645
SP,13/12/2025 - Feriado Municipal,Feriado Municipal,,2025-12-13,Oriente - SP,-22.1525442,-50.0935645
SP,30/11/2025 - Feriado Municipal,Feriado Municipal,,2025-11-30,Oriente - SP,-22.1525442,-50.0935645
SP,15/11/2025 - Proclamação da República,Proclamação da República,,2025-11-15,Oriente - SP,-22.1525442,-50.0935645
SP,02/11/2025 - Dia de Finados,Dia de Finados,,2025-11-02,Oriente - SP,-22.1525442,-50.0935645
SP,12/10/2025 - Nossa Senhora Aparecida,Nossa Senhora Aparecida,,2025-10-12,Oriente - SP,-22.1525442,-50.0935645
SP,07/09/2025 - Independência do Brasil,Independência do Brasil,,2025-09-07,Oriente - SP,-22.1525442,-50.0935645
SP,09/07/2025 - Revolução Constitucionalista,Revolução Constitucionalista,,2025-07-09,Oriente - SP,-22.1525442,-50.0935645
SP,01/05/2025 - Dia do Trabalho,Dia do Trabalho,,2025-05-01,Oriente - SP,-22.1525442,-50.0935645
SP,21/04/2025 - Dia de Tiradentes,Dia de Tiradentes,,2025-04-21,Oriente - SP,-22.1525442,-50.0935645
SP,18/04/2025 - Sexta-Feira Santa,Sexta-Feira Santa,,2025-04-18,Oriente - SP,-22.1525442,-50.0935645
SP,01/01/2025 - Ano Novo,Ano Novo,,2025-01-01,Oriente - SP,-22.1525442,-50.0935645
SP,25/12/2025 - Natal,Natal,,2025-12-25,Narandiba - SP,-22.4056239,-51.5259862
SP,08/12/2025 - Feriado Municipal,Feriado Municipal,,2025-12-08,Narandiba - SP,-22.4056239,-51.5259862
SP,20/11/2025 - Dia da Consciência Negra,Dia da Consciência Negra,,2025-11-20,Narandiba - SP,-22.4056239,-51.5259862
SP,15/11/2025 - Proclamação da República,Proclamação da República,,2025-11-15,Narandiba - SP,-22.4056239,-51.5259862
SP,02/11/2025 - Dia de Finados,Dia de Finados,,2025-11-02,Narandiba - SP,-22.4056239,-51.5259862
SP,12/10/2025 - Nossa Senhora Aparecida,Nossa Senhora Aparecida,,2025-10-12,Narandiba - SP,-22.4056239,-51.5259862
SP,07/09/2025 - Independência do Brasil,Independência do Brasil,,2025-09-07,Narandiba - SP,-22.4056239,-51.5259862
SP,09/07/2025 - Revolução Constitucionalista,Revolução Constitucionalista,,2025-07-09,Narandiba - SP,-22.4056239,-51.5259862
SP,29/06/2025 - Feriado Municipal,Feriado Municipal,,2025-06-29,Narandiba - SP,-22.4056239,-51.5259862
SP,01/05/2025 - Dia do Trabalho,Dia do Trabalho,,2025-05-01,Narandiba - SP,-22.4056239,-51.5259862
SP,21/04/2025 - Dia de Tiradentes,Dia de Tiradentes,,2025-04-21,Narandiba - SP,-22.4056239,-51.5259862
SP,18/04/2025 - Sexta-Feira Santa,Sexta-Feira Santa,,2025-04-18,Narandiba - SP,-22.4056239,-51.5259862
SP,02/04/2025 - Feriado Municipal,Feriado Municipal,,2025-04-02,Narandiba - SP,-22.4056239,-51.5259862
SP,21/03/2025 - Feriado Municipal,Feriado Municipal,,2025-03-21,Narandiba - SP,-22.4056239,-51.5259862
SP,01/01/2025 - Ano Novo,Ano Novo,,2025-01-01,Narandiba - SP,-22.4056239,-51.5259862
SP,25/12/2025 - Natal,Natal,,2025-12-25,Nantes - SP,-22.6191472,-51.2382255
SP,15/11/2025 - Proclamação da República,Proclamação da República,,2025-11-15,Nantes - SP,-22.6191472,-51.2382255
SP,02/11/2025 - Dia de Finados,Dia de Finados,,2025-11-02,Nantes - SP,-22.6191472,-51.2382255
SP,12/10/2025 - Nossa Senhora Aparecida,Nossa Senhora Aparecida,,2025-10-12,Nantes - SP,-22.6191472,-51.2382255
SP,07/09/2025 - Independência do Brasil,Independência do Brasil,,2025-09-07,Nantes - SP,-22.6191472,-51.2382255
SP,09/07/2025 - Revolução Constitucionalista,Revolução Constitucionalista,,2025-07-09,Nantes - SP,-22.6191472,-51.2382255
SP,01/05/2025 - Dia do Trabalho,Dia do Trabalho,,2025-05-01,Nantes - SP,-22.6191472,-51.2382255
SP,21/04/2025 - Dia de Tiradentes,Dia de Tiradentes,,2025-04-21,Nantes - SP,-22.6191472,-51.2382255
SP,18/04/2025 - Sexta-Feira Santa,Sexta-Feira Santa,,2025-04-18,Nantes - SP,-22.6191472,-51.2382255
SP,01/01/2025 - Ano Novo,Ano Novo,,2025-01-01,Nantes - SP,-22.6191472,-51.2382255
SP,25/12/2025 - Natal,Natal,,2025-12-25,Murutinga do Sul - SP,-20.9913722,-51.2782237
SP,15/11/2025 - Proclamação da República,Proclamação da República,,2025-11-15,Murutinga do Sul - SP,-20.9913722,-51.2782237
SP,02/11/2025 - Dia de Finados,Dia de Finados,,2025-11-02,Murutinga do Sul - SP,-20.9913722,-51.2782237
SP,12/10/2025 - Nossa Senhora Aparecida,Nossa Senhora Aparecida,,2025-10-12,Murutinga do Sul - SP,-20.9913722,-51.2782237
SP,07/09/2025 - Independência do Brasil,Independência do Brasil,,2025-09-07,Murutinga do Sul - SP,-20.9913722,-51.2782237
SP,09/07/2025 - Revolução Constitucionalista,Revolução Constitucionalista,,2025-07-09,Murutinga do Sul - SP,-20.9913722,-51.2782237
SP,01/05/2025 - Dia do Trabalho,Dia do Trabalho,,2025-05-01,Murutinga do Sul - SP,-20.9913722,-51.2782237
SP,21/04/2025 - Dia de Tiradentes,Dia de Tiradentes,,2025-04-21,Murutinga do Sul - SP,-20.9913722,-51.2782237
SP,18/04/2025 - Sexta-Feira Santa,Sexta-Feira Santa,,2025-04-18,Murutinga do Sul - SP,-20.9913722,-51.2782237
SP,19/03/2025 - São José,São José,,2025-03-19,Murutinga do Sul - SP,-20.9913722,-51.2782237
SP,01/01/2025 - Ano Novo,Ano Novo,,2025-01-01,Murutinga do Sul - SP,-20.9913722,-51.2782237
SP,25/12/2025 - Natal,Natal,,2025-12-25,Miracatu - SP,-24.2503143,-47.3742035
SP,30/11/2025 - Feriado Municipal,Feriado Municipal,,2025-11-30,Miracatu - SP,-24.2503143,-47.3742035
SP,15/11/2025 - Proclamação da República,Proclamação da República,,2025-11-15,Miracatu - SP,-24.2503143,-47.3742035
SP,02/11/2025 - Dia de Finados,Dia de Finados,,2025-11-02,Miracatu - SP,-24.2503143,-47.3742035
SP,12/10/2025 - Nossa Senhora Aparecida,Nossa Senhora Aparecida,,2025-10-12,Miracatu - SP,-24.2503143,-47.3742035
SP,15/09/2025 - Feriado Municipal,Feriado Municipal,,2025-09-15,Miracatu - SP,-24.2503143,-47.3742035
SP,07/09/2025 - Independência do Brasil,Independência do Brasil,,2025-09-07,Miracatu - SP,-24.2503143,-47.3742035
SP,09/07/2025 - Revolução Constitucionalista,Revolução Constitucionalista,,2025-07-09,Miracatu - SP,-24.2503143,-47.3742035
SP,01/05/2025 - Dia do Trabalho,Dia do Trabalho,,2025-05-01,Miracatu - SP,-24.2503143,-47.3742035
SP,21/04/2025 - Dia de Tiradentes,Dia de Tiradentes,,2025-04-21,Miracatu - SP,-24.2503143,-47.3742035
SP,18/04/2025 - Sexta-Feira Santa,Sexta-Feira Santa,,2025-04-18,Miracatu - SP,-24.2503143,-47.3742035
SP,01/01/2025 - Ano Novo,Ano Novo,,2025-01-01,Miracatu - SP,-24.2503143,-47.3742035
SP,25/12/2025 - Natal,Natal,,2025-12-25,Mira Estrela - SP,-19.980582,-50.1377983
SP,15/11/2025 - Proclamação da República,Proclamação da República,,2025-11-15,Mira Estrela - SP,-19.980582,-50.1377983
SP,02/11/2025 - Dia de Finados,Dia de Finados,,2025-11-02,Mira Estrela - SP,-19.980582,-50.1377983
SP,01/11/2025 - Feriado Municipal,Feriado Municipal,,2025-11-01,Mira Estrela - SP,-19.980582,-50.1377983
SP,12/10/2025 - Nossa Senhora Aparecida,Nossa Senhora Aparecida,,2025-10-12,Mira Estrela - SP,-19.980582,-50.1377983
SP,07/09/2025 - Independência do Brasil,Independência do Brasil,,2025-09-07,Mira Estrela - SP,-19.980582,-50.1377983
SP,06/08/2025 - Feriado Municipal,Feriado Municipal,,2025-08-06,Mira Estrela - SP,-19.980582,-50.1377983
SP,09/07/2025 - Revolução Constitucionalista,Revolução Constitucionalista,,2025-07-09,Mira Estrela - SP,-19.980582,-50.1377983
SP,01/05/2025 - Dia do Trabalho,Dia do Trabalho,,2025-05-01,Mira Estrela - SP,-19.980582,-50.1377983
SP,21/04/2025 - Dia de Tiradentes,Dia de Tiradentes,,2025-04-21,Mira Estrela - SP,-19.980582,-50.1377983
SP,18/04/2025 - Sexta-Feira Santa,Sexta-Feira Santa,,2025-04-18,Mira Estrela - SP,-19.980582,-50.1377983
SP,21/03/2025 - Feriado Municipal,Feriado Municipal,,2025-03-21,Mira Estrela - SP,-19.980582,-50.1377983
SP,01/01/2025 - Ano Novo,Ano Novo,,2025-01-01,Mira Estrela - SP,-19.980582,-50.1377983
SP,25/12/2025 - Natal,Natal,,2025-12-25,Meridiano - SP,-20.3547223,-50.172574
SP,15/11/2025 - Proclamação da República,Proclamação da República,,2025-11-15,Meridiano - SP,-20.3547223,-50.172574
SP,02/11/2025 - Dia de Finados,Dia de Finados,,2025-11-02,Meridiano - SP,-20.3547223,-50.172574
SP,12/10/2025 - Nossa Senhora Aparecida,Nossa Senhora Aparecida,,2025-10-12,Meridiano - SP,-20.3547223,-50.172574
SP,07/09/2025 - Independência do Brasil,Independência do Brasil,,2025-09-07,Meridiano - SP,-20.3547223,-50.172574
SP,09/07/2025 - Revolução Constitucionalista,Revolução Constitucionalista,,2025-07-09,Meridiano - SP,-20.3547223,-50.172574
SP,01/05/2025 - Dia do Trabalho,Dia do Trabalho,,2025-05-01,Meridiano - SP,-20.3547223,-50.172574
SP,21/04/2025 - Dia de Tiradentes,Dia de Tiradentes,,2025-04-21,Meridiano - SP,-20.3547223,-50.172574
SP,18/04/2025 - Sexta-Feira Santa,Sexta-Feira Santa,,2025-04-18,Meridiano - SP,-20.3547223,-50.172574
SP,19/03/2025 - São José,São José,,2025-03-19,Meridiano - SP,-20.3547223,-50.172574
SP,01/01/2025 - Ano Novo,Ano Novo,,2025-01-01,Meridiano - SP,-20.3547223,-50.172574
SP,25/12/2025 - Natal,Natal,,2025-12-25,Mirante do Paranapanema - SP,-22.2888663,-51.906114
SP,29/11/2025 - Aniversário do município,Aniversário do município,,2025-11-29,Mirante do Paranapanema - SP,-22.2888663,-51.906114
SP,15/11/2025 - Proclamação da República,Proclamação da República,,2025-11-15,Mirante do Paranapanema - SP,-22.2888663,-51.906114
SP,02/11/2025 - Dia de Finados,Dia de Finados,,2025-11-02,Mirante do Paranapanema - SP,-22.2888663,-51.906114
SP,12/10/2025 - Nossa Senhora Aparecida,Nossa Senhora Aparecida,,2025-10-12,Mirante do Paranapanema - SP,-22.2888663,-51.906114
SP,01/10/2025 - Santa Terezinha,Santa Terezinha,,2025-10-01,Mirante do Paranapanema - SP,-22.2888663,-51.906114
SP,07/09/2025 - Independência do Brasil,Independência do Brasil,,2025-09-07,Mirante do Paranapanema - SP,-22.2888663,-51.906114
SP,09/07/2025 - Revolução Constitucionalista,Revolução Constitucionalista,,2025-07-09,Mirante do Paranapanema - SP,-22.2888663,-51.906114
SP,19/06/2025 - Corpus Christi,Corpus Christi,,2025-06-19,Mirante do Paranapanema - SP,-22.2888663,-51.906114
SP,01/05/2025 - Dia do Trabalho,Dia do Trabalho,,2025-05-01,Mirante do Paranapanema - SP,-22.2888663,-51.906114
SP,21/04/2025 - Dia de Tiradentes,Dia de Tiradentes,,2025-04-21,Mirante do Paranapanema - SP,-22.2888663,-51.906114
SP,18/04/2025 - Paixão de Cristo,Paixão de Cristo,,2025-04-18,Mirante do Paranapanema - SP,-22.2888663,-51.906114
SP,18/04/2025 - Sexta-Feira Santa,Sexta-Feira Santa,,2025-04-18,Mirante do Paranapanema - SP,-22.2888663,-51.906114
SP,01/01/2025 - Ano Novo,Ano Novo,,2025-01-01,Mirante do Paranapanema - SP,-22.2888663,-51.906114
SP,25/12/2025 - Natal,Natal,,2025-12-25,Marapoama - SP,-21.2583193,-49.1301686
SP,15/11/2025 - Proclamação da República,Proclamação da República,,2025-11-15,Marapoama - SP,-21.2583193,-49.1301686
SP,02/11/2025 - Dia de Finados,Dia de Finados,,2025-11-02,Marapoama - SP,-21.2583193,-49.1301686
SP,12/10/2025 - Nossa Senhora Aparecida,Nossa Senhora Aparecida,,2025-10-12,Marapoama - SP,-21.2583193,-49.1301686
SP,07/09/2025 - Independência do Brasil,Independência do Brasil,,2025-09-07,Marapoama - SP,-21.2583193,-49.1301686
SP,09/07/2025 - Revolução Constitucionalista,Revolução Constitucionalista,,2025-07-09,Marapoama - SP,-21.2583193,-49.1301686
SP,08/06/2025 - Feriado Municipal,Feriado Municipal,,2025-06-08,Marapoama - SP,-21.2583193,-49.1301686
SP,01/05/2025 - Dia do Trabalho,Dia do Trabalho,,2025-05-01,Marapoama - SP,-21.2583193,-49.1301686
SP,21/04/2025 - Dia de Tiradentes,Dia de Tiradentes,,2025-04-21,Marapoama - SP,-21.2583193,-49.1301686
SP,18/04/2025 - Sexta-Feira Santa,Sexta-Feira Santa,,2025-04-18,Marapoama - SP,-21.2583193,-49.1301686
SP,01/01/2025 - Ano Novo,Ano Novo,,2025-01-01,Marapoama - SP,-21.2583193,-49.1301686
SP,25/12/2025 - Natal,Natal,,2025-12-25,Ribeira - SP,-24.6577435,-49.0086372
SP,15/11/2025 - Proclamação da República,Proclamação da República,,2025-11-15,Ribeira - SP,-24.6577435,-49.0086372
SP,02/11/2025 - Dia de Finados,Dia de Finados,,2025-11-02,Ribeira - SP,-24.6577435,-49.0086372
SP,12/10/2025 - Nossa Senhora Aparecida,Nossa Senhora Aparecida,,2025-10-12,Ribeira - SP,-24.6577435,-49.0086372
SP,07/09/2025 - Independência do Brasil,Independência do Brasil,,2025-09-07,Ribeira - SP,-24.6577435,-49.0086372
SP,06/08/2025 - Feriado Municipal,Feriado Municipal,,2025-08-06,Ribeira - SP,-24.6577435,-49.0086372
SP,09/07/2025 - Revolução Constitucionalista,Revolução Constitucionalista,,2025-07-09,Ribeira - SP,-24.6577435,-49.0086372
SP,24/06/2025 - Feriado Municipal,Feriado Municipal,,2025-06-24,Ribeira - SP,-24.6577435,-49.0086372
SP,01/05/2025 - Dia do Trabalho,Dia do Trabalho,,2025-05-01,Ribeira - SP,-24.6577435,-49.0086372
SP,21/04/2025 - Dia de Tiradentes,Dia de Tiradentes,,2025-04-21,Ribeira - SP,-24.6577435,-49.0086372
SP,18/04/2025 - Sexta-Feira Santa,Sexta-Feira Santa,,2025-04-18,Ribeira - SP,-24.6577435,-49.0086372
SP,01/01/2025 - Ano Novo,Ano Novo,,2025-01-01,Ribeira - SP,-24.6577435,-49.0086372
SP,25/12/2025 - Natal,Natal,,2025-12-25,Mirassol - SP,-20.8138169,-49.5009944
SP,15/11/2025 - Proclamação da República,Proclamação da República,,2025-11-15,Mirassol - SP,-20.8138169,-49.5009944
SP,02/11/2025 - Dia de Finados,Dia de Finados,,2025-11-02,Mirassol - SP,-20.8138169,-49.5009944
SP,12/10/2025 - Nossa Senhora Aparecida,Nossa Senhora Aparecida,,2025-10-12,Mirassol - SP,-20.8138169,-49.5009944
SP,08/09/2025 - Feriado Municipal,Feriado Municipal,,2025-09-08,Mirassol - SP,-20.8138169,-49.5009944
SP,07/09/2025 - Independência do Brasil,Independência do Brasil,,2025-09-07,Mirassol - SP,-20.8138169,-49.5009944
SP,09/07/2025 - Revolução Constitucionalista,Revolução Constitucionalista,,2025-07-09,Mirassol - SP,-20.8138169,-49.5009944
SP,29/06/2025 - Feriado Municipal,Feriado Municipal,,2025-06-29,Mirassol - SP,-20.8138169,-49.5009944
SP,01/05/2025 - Dia do Trabalho,Dia do Trabalho,,2025-05-01,Mirassol - SP,-20.8138169,-49.5009944
SP,21/04/2025 - Dia de Tiradentes,Dia de Tiradentes,,2025-04-21,Mirassol - SP,-20.8138169,-49.5009944
SP,18/04/2025 - Sexta-Feira Santa,Sexta-Feira Santa,,2025-04-18,Mirassol - SP,-20.8138169,-49.5009944
SP,01/01/2025 - Ano Novo,Ano Novo,,2025-01-01,Mirassol - SP,-20.8138169,-49.5009944
SP,25/12/2025 - Natal,Natal,,2025-12-25,Motuca - SP,-21.5657097,-48.1866059
SP,15/11/2025 - Proclamação da República,Proclamação da República,,2025-11-15,Motuca - SP,-21.5657097,-48.1866059
SP,02/11/2025 - Dia de Finados,Dia de Finados,,2025-11-02,Motuca - SP,-21.5657097,-48.1866059
SP,12/10/2025 - Nossa Senhora Aparecida,Nossa Senhora Aparecida,,2025-10-12,Motuca - SP,-21.5657097,-48.1866059
SP,07/09/2025 - Independência do Brasil,Independência do Brasil,,2025-09-07,Motuca - SP,-21.5657097,-48.1866059
SP,09/07/2025 - Revolução Constitucionalista,Revolução Constitucionalista,,2025-07-09,Motuca - SP,-21.5657097,-48.1866059
SP,01/05/2025 - Dia do Trabalho,Dia do Trabalho,,2025-05-01,Motuca - SP,-21.5657097,-48.1866059
SP,21/04/2025 - Dia de Tiradentes,Dia de Tiradentes,,2025-04-21,Motuca - SP,-21.5657097,-48.1866059
SP,18/04/2025 - Sexta-Feira Santa,Sexta-Feira Santa,,2025-04-18,Motuca - SP,-21.5657097,-48.1866059
SP,01/01/2025 - Ano Novo,Ano Novo,,2025-01-01,Motuca - SP,-21.5657097,-48.1866059
SP,25/12/2025 - Natal,Natal,,2025-12-25,Monte Alto - SP,-21.265545,-48.497066
SP,15/11/2025 - Proclamação da República,Proclamação da República,,2025-11-15,Monte Alto - SP,-21.265545,-48.497066
SP,02/11/2025 - Finados,Finados,,2025-11-02,Monte Alto - SP,-21.265545,-48.497066
SP,02/11/2025 - Dia de Finados,Dia de Finados,,2025-11-02,Monte Alto - SP,-21.265545,-48.497066
SP,12/10/2025 - Nossa Senhora Aparecida,Nossa Senhora Aparecida,,2025-10-12,Monte Alto - SP,-21.265545,-48.497066
SP,07/09/2025 - Independência do Brasil,Independência do Brasil,,2025-09-07,Monte Alto - SP,-21.265545,-48.497066
SP,06/08/2025 - Dia do Padroeiro,Dia do Padroeiro,,2025-08-06,Monte Alto - SP,-21.265545,-48.497066
SP,09/07/2025 - Revolução Constitucionalista,Revolução Constitucionalista,,2025-07-09,Monte Alto - SP,-21.265545,-48.497066
SP,15/05/2025 - Aniversário da Cidade,Aniversário da Cidade,,2025-05-15,Monte Alto - SP,-21.265545,-48.497066
SP,01/05/2025 - Dia do Trabalho,Dia do Trabalho,,2025-05-01,Monte Alto - SP,-21.265545,-48.497066
SP,21/04/2025 - Dia de Tiradentes,Dia de Tiradentes,,2025-04-21,Monte Alto - SP,-21.265545,-48.497066
SP,18/04/2025 - Sexta-Feira Santa,Sexta-Feira Santa,,2025-04-18,Monte Alto - SP,-21.265545,-48.497066
SP,18/04/2025 - Sexta-Feira Santa,Sexta-Feira Santa,,2025-04-18,Monte Alto - SP,-21.265545,-48.497066
SP,01/01/2025 - Ano Novo,Ano Novo,,2025-01-01,Monte Alto - SP,-21.265545,-48.497066
SP,25/12/2025 - Natal,Natal,,2025-12-25,Morungaba - SP,-22.88,-46.79167
SP,08/12/2025 - Feriado Municipal,Feriado Municipal,,2025-12-08,Morungaba - SP,-22.88,-46.79167
SP,15/11/2025 - Proclamação da República,Proclamação da República,,2025-11-15,Morungaba - SP,-22.88,-46.79167
SP,02/11/2025 - Dia de Finados,Dia de Finados,,2025-11-02,Morungaba - SP,-22.88,-46.79167
SP,12/10/2025 - Nossa Senhora Aparecida,Nossa Senhora Aparecida,,2025-10-12,Morungaba - SP,-22.88,-46.79167
SP,07/09/2025 - Independência do Brasil,Independência do Brasil,,2025-09-07,Morungaba - SP,-22.88,-46.79167
SP,09/07/2025 - Revolução Constitucionalista,Revolução Constitucionalista,,2025-07-09,Morungaba - SP,-22.88,-46.79167
SP,29/06/2025 - Feriado Municipal,Feriado Municipal,,2025-06-29,Morungaba - SP,-22.88,-46.79167
SP,01/05/2025 - Dia do Trabalho,Dia do Trabalho,,2025-05-01,Morungaba - SP,-22.88,-46.79167
SP,21/04/2025 - Dia de Tiradentes,Dia de Tiradentes,,2025-04-21,Morungaba - SP,-22.88,-46.79167
SP,18/04/2025 - Sexta-Feira Santa,Sexta-Feira Santa,,2025-04-18,Morungaba - SP,-22.88,-46.79167
SP,01/01/2025 - Ano Novo,Ano Novo,,2025-01-01,Morungaba - SP,-22.88,-46.79167
SP,25/12/2025 - Natal,Natal,,2025-12-25,Morro Agudo - SP,-20.7246704,-48.0453808
SP,15/11/2025 - Proclamação da República,Proclamação da República,,2025-11-15,Morro Agudo - SP,-20.7246704,-48.0453808
SP,02/11/2025 - Dia de Finados,Dia de Finados,,2025-11-02,Morro Agudo - SP,-20.7246704,-48.0453808
SP,12/10/2025 - Nossa Senhora Aparecida,Nossa Senhora Aparecida,,2025-10-12,Morro Agudo - SP,-20.7246704,-48.0453808
SP,07/09/2025 - Independência do Brasil,Independência do Brasil,,2025-09-07,Morro Agudo - SP,-20.7246704,-48.0453808
SP,09/07/2025 - Revolução Constitucionalista,Revolução Constitucionalista,,2025-07-09,Morro Agudo - SP,-20.7246704,-48.0453808
SP,01/05/2025 - Dia do Trabalho,Dia do Trabalho,,2025-05-01,Morro Agudo - SP,-20.7246704,-48.0453808
SP,21/04/2025 - Dia de Tiradentes,Dia de Tiradentes,,2025-04-21,Morro Agudo - SP,-20.7246704,-48.0453808
SP,18/04/2025 - Sexta-Feira Santa,Sexta-Feira Santa,,2025-04-18,Morro Agudo - SP,-20.7246704,-48.0453808
SP,19/03/2025 - São José,São José,,2025-03-19,Morro Agudo - SP,-20.7246704,-48.0453808
SP,06/01/2025 - Feriado Municipal,Feriado Municipal,,2025-01-06,Morro Agudo - SP,-20.7246704,-48.0453808
SP,01/01/2025 - Ano Novo,Ano Novo,,2025-01-01,Morro Agudo - SP,-20.7246704,-48.0453808
SP,25/12/2025 - Natal,Natal,,2025-12-25,Monteiro Lobato - SP,-22.9562721,-45.8386262
SP,15/11/2025 - Proclamação da República,Proclamação da República,,2025-11-15,Monteiro Lobato - SP,-22.9562721,-45.8386262
SP,02/11/2025 - Dia de Finados,Dia de Finados,,2025-11-02,Monteiro Lobato - SP,-22.9562721,-45.8386262
SP,12/10/2025 - Nossa Senhora Aparecida,Nossa Senhora Aparecida,,2025-10-12,Monteiro Lobato - SP,-22.9562721,-45.8386262
SP,08/09/2025 - Feriado Municipal,Feriado Municipal,,2025-09-08,Monteiro Lobato - SP,-22.9562721,-45.8386262
SP,07/09/2025 - Independência do Brasil,Independência do Brasil,,2025-09-07,Monteiro Lobato - SP,-22.9562721,-45.8386262
SP,09/07/2025 - Revolução Constitucionalista,Revolução Constitucionalista,,2025-07-09,Monteiro Lobato - SP,-22.9562721,-45.8386262
SP,01/05/2025 - Dia do Trabalho,Dia do Trabalho,,2025-05-01,Monteiro Lobato - SP,-22.9562721,-45.8386262
SP,26/04/2025 - Feriado Municipal,Feriado Municipal,,2025-04-26,Monteiro Lobato - SP,-22.9562721,-45.8386262
SP,21/04/2025 - Dia de Tiradentes,Dia de Tiradentes,,2025-04-21,Monteiro Lobato - SP,-22.9562721,-45.8386262
SP,18/04/2025 - Sexta-Feira Santa,Sexta-Feira Santa,,2025-04-18,Monteiro Lobato - SP,-22.9562721,-45.8386262
SP,20/01/2025 - Feriado Municipal,Feriado Municipal,,2025-01-20,Monteiro Lobato - SP,-22.9562721,-45.8386262
SP,01/01/2025 - Ano Novo,Ano Novo,,2025-01-01,Monteiro Lobato - SP,-22.9562721,-45.8386262
SP,25/12/2025 - Natal,Natal,,2025-12-25,Monte Mor - SP,-22.945043,-47.312182
SP,20/11/2025 - Consciência Negra,Consciência Negra,,2025-11-20,Monte Mor - SP,-22.945043,-47.312182
SP,15/11/2025 - Proclamação da República,Proclamação da República,,2025-11-15,Monte Mor - SP,-22.945043,-47.312182
SP,02/11/2025 - Finados,Finados,,2025-11-02,Monte Mor - SP,-22.945043,-47.312182
SP,02/11/2025 - Dia de Finados,Dia de Finados,,2025-11-02,Monte Mor - SP,-22.945043,-47.312182
SP,12/10/2025 - Nossa Senhora Aparecida,Nossa Senhora Aparecida,,2025-10-12,Monte Mor - SP,-22.945043,-47.312182
SP,07/09/2025 - Independência do Brasil,Independência do Brasil,,2025-09-07,Monte Mor - SP,-22.945043,-47.312182
SP,15/08/2025 - N. Sra. do Patrocínio,N. Sra. do Patrocínio,,2025-08-15,Monte Mor - SP,-22.945043,-47.312182
SP,09/07/2025 - Revolução Constitucionalista,Revolução Constitucionalista,,2025-07-09,Monte Mor - SP,-22.945043,-47.312182
SP,19/06/2025 - Corpus Christi,Corpus Christi,,2025-06-19,Monte Mor - SP,-22.945043,-47.312182
SP,01/05/2025 - Dia do Trabalho,Dia do Trabalho,,2025-05-01,Monte Mor - SP,-22.945043,-47.312182
SP,21/04/2025 - Dia de Tiradentes,Dia de Tiradentes,,2025-04-21,Monte Mor - SP,-22.945043,-47.312182
SP,18/04/2025 - Sexta-feira da Paixão,Sexta-feira da Paixão,,2025-04-18,Monte Mor - SP,-22.945043,-47.312182
SP,18/04/2025 - Sexta-Feira Santa,Sexta-Feira Santa,,2025-04-18,Monte Mor - SP,-22.945043,-47.312182
SP,01/01/2025 - Ano Novo,Ano Novo,,2025-01-01,Monte Mor - SP,-22.945043,-47.312182
SP,25/12/2025 - Natal,Natal,,2025-12-25,Monte Castelo - SP,-23.1839653,-45.8741086
SP,22/11/2025 - Feriado Municipal,Feriado Municipal,,2025-11-22,Monte Castelo - SP,-23.1839653,-45.8741086
SP,15/11/2025 - Proclamação da República,Proclamação da República,,2025-11-15,Monte Castelo - SP,-23.1839653,-45.8741086
SP,02/11/2025 - Dia de Finados,Dia de Finados,,2025-11-02,Monte Castelo - SP,-23.1839653,-45.8741086
SP,12/10/2025 - Nossa Senhora Aparecida,Nossa Senhora Aparecida,,2025-10-12,Monte Castelo - SP,-23.1839653,-45.8741086
SP,07/09/2025 - Independência do Brasil,Independência do Brasil,,2025-09-07,Monte Castelo - SP,-23.1839653,-45.8741086
SP,15/08/2025 - Feriado Municipal,Feriado Municipal,,2025-08-15,Monte Castelo - SP,-23.1839653,-45.8741086
SP,09/07/2025 - Revolução Constitucionalista,Revolução Constitucionalista,,2025-07-09,Monte Castelo - SP,-23.1839653,-45.8741086
SP,13/06/2025 - Dia de Santo Antônio,Dia de Santo Antônio,,2025-06-13,Monte Castelo - SP,-23.1839653,-45.8741086
SP,01/05/2025 - Dia do Trabalho,Dia do Trabalho,,2025-05-01,Monte Castelo - SP,-23.1839653,-45.8741086
SP,21/04/2025 - Dia de Tiradentes,Dia de Tiradentes,,2025-04-21,Monte Castelo - SP,-23.1839653,-45.8741086
SP,18/04/2025 - Sexta-Feira Santa,Sexta-Feira Santa,,2025-04-18,Monte Castelo - SP,-23.1839653,-45.8741086
SP,01/01/2025 - Ano Novo,Ano Novo,,2025-01-01,Monte Castelo - SP,-23.1839653,-45.8741086
SP,25/12/2025 - Natal,Natal,,2025-12-25,Monte Azul Paulista - SP,-20.9078519,-48.6396511
SP,15/11/2025 - Proclamação da República,Proclamação da República,,2025-11-15,Monte Azul Paulista - SP,-20.9078519,-48.6396511
SP,02/11/2025 - Dia de Finados,Dia de Finados,,2025-11-02,Monte Azul Paulista - SP,-20.9078519,-48.6396511
SP,12/10/2025 - Nossa Senhora Aparecida,Nossa Senhora Aparecida,,2025-10-12,Monte Azul Paulista - SP,-20.9078519,-48.6396511
SP,07/09/2025 - Independência do Brasil,Independência do Brasil,,2025-09-07,Monte Azul Paulista - SP,-20.9078519,-48.6396511
SP,06/08/2025 - Feriado Municipal,Feriado Municipal,,2025-08-06,Monte Azul Paulista - SP,-20.9078519,-48.6396511
SP,09/07/2025 - Revolução Constitucionalista,Revolução Constitucionalista,,2025-07-09,Monte Azul Paulista - SP,-20.9078519,-48.6396511
SP,29/06/2025 - Feriado Municipal,Feriado Municipal,,2025-06-29,Monte Azul Paulista - SP,-20.9078519,-48.6396511
SP,01/05/2025 - Dia do Trabalho,Dia do Trabalho,,2025-05-01,Monte Azul Paulista - SP,-20.9078519,-48.6396511
SP,21/04/2025 - Dia de Tiradentes,Dia de Tiradentes,,2025-04-21,Monte Azul Paulista - SP,-20.9078519,-48.6396511
SP,18/04/2025 - Sexta-Feira Santa,Sexta-Feira Santa,,2025-04-18,Monte Azul Paulista - SP,-20.9078519,-48.6396511
SP,01/01/2025 - Ano Novo,Ano Novo,,2025-01-01,Monte Azul Paulista - SP,-20.9078519,-48.6396511
SP,25/12/2025 - Natal,Natal,,2025-12-25,Monte Alegre do Sul - SP,-22.681861,-46.6798783
SP,24/12/2025 - Feriado Municipal,Feriado Municipal,,2025-12-24,Monte Alegre do Sul - SP,-22.681861,-46.6798783
SP,20/11/2025 - Dia da Consciência Negra,Dia da Consciência Negra,,2025-11-20,Monte Alegre do Sul - SP,-22.681861,-46.6798783
SP,15/11/2025 - Proclamação da República,Proclamação da República,,2025-11-15,Monte Alegre do Sul - SP,-22.681861,-46.6798783
SP,02/11/2025 - Dia de Finados,Dia de Finados,,2025-11-02,Monte Alegre do Sul - SP,-22.681861,-46.6798783
SP,12/10/2025 - Nossa Senhora Aparecida,Nossa Senhora Aparecida,,2025-10-12,Monte Alegre do Sul - SP,-22.681861,-46.6798783
SP,07/09/2025 - Independência do Brasil,Independência do Brasil,,2025-09-07,Monte Alegre do Sul - SP,-22.681861,-46.6798783
SP,06/08/2025 - Feriado Municipal,Feriado Municipal,,2025-08-06,Monte Alegre do Sul - SP,-22.681861,-46.6798783
SP,09/07/2025 - Revolução Constitucionalista,Revolução Constitucionalista,,2025-07-09,Monte Alegre do Sul - SP,-22.681861,-46.6798783
SP,01/05/2025 - Dia do Trabalho,Dia do Trabalho,,2025-05-01,Monte Alegre do Sul - SP,-22.681861,-46.6798783
SP,21/04/2025 - Dia de Tiradentes,Dia de Tiradentes,,2025-04-21,Monte Alegre do Sul - SP,-22.681861,-46.6798783
SP,18/04/2025 - Sexta-Feira Santa,Sexta-Feira Santa,,2025-04-18,Monte Alegre do Sul - SP,-22.681861,-46.6798783
SP,01/01/2025 - Ano Novo,Ano Novo,,2025-01-01,Monte Alegre do Sul - SP,-22.681861,-46.6798783
SP,25/12/2025 - Natal,Natal,,2025-12-25,Mombuca - SP,-22.9293093,-47.5650724
SP,15/11/2025 - Proclamação da República,Proclamação da República,,2025-11-15,Mombuca - SP,-22.9293093,-47.5650724
SP,02/11/2025 - Dia de Finados,Dia de Finados,,2025-11-02,Mombuca - SP,-22.9293093,-47.5650724
SP,01/11/2025 - Feriado Municipal,Feriado Municipal,,2025-11-01,Mombuca - SP,-22.9293093,-47.5650724
SP,12/10/2025 - Nossa Senhora Aparecida,Nossa Senhora Aparecida,,2025-10-12,Mombuca - SP,-22.9293093,-47.5650724
SP,07/09/2025 - Independência do Brasil,Independência do Brasil,,2025-09-07,Mombuca - SP,-22.9293093,-47.5650724
SP,09/07/2025 - Revolução Constitucionalista,Revolução Constitucionalista,,2025-07-09,Mombuca - SP,-22.9293093,-47.5650724
SP,29/06/2025 - Feriado Municipal,Feriado Municipal,,2025-06-29,Mombuca - SP,-22.9293093,-47.5650724
SP,01/05/2025 - Dia do Trabalho,Dia do Trabalho,,2025-05-01,Mombuca - SP,-22.9293093,-47.5650724
SP,21/04/2025 - Dia de Tiradentes,Dia de Tiradentes,,2025-04-21,Mombuca - SP,-22.9293093,-47.5650724
SP,18/04/2025 - Sexta-Feira Santa,Sexta-Feira Santa,,2025-04-18,Mombuca - SP,-22.9293093,-47.5650724
SP,21/03/2025 - Feriado Municipal,Feriado Municipal,,2025-03-21,Mombuca - SP,-22.9293093,-47.5650724
SP,01/01/2025 - Ano Novo,Ano Novo,,2025-01-01,Mombuca - SP,-22.9293093,-47.5650724
SP,25/12/2025 - Natal,Natal,,2025-12-25,Mogi Mirim - SP,-22.4151612,-46.9554573
SP,15/11/2025 - Proclamação da República,Proclamação da República,,2025-11-15,Mogi Mirim - SP,-22.4151612,-46.9554573
SP,02/11/2025 - Dia de Finados,Dia de Finados,,2025-11-02,Mogi Mirim - SP,-22.4151612,-46.9554573
SP,12/10/2025 - Nossa Senhora Aparecida,Nossa Senhora Aparecida,,2025-10-12,Mogi Mirim - SP,-22.4151612,-46.9554573
SP,07/09/2025 - Independência do Brasil,Independência do Brasil,,2025-09-07,Mogi Mirim - SP,-22.4151612,-46.9554573
SP,09/07/2025 - Revolução Constitucionalista,Revolução Constitucionalista,,2025-07-09,Mogi Mirim - SP,-22.4151612,-46.9554573
SP,01/05/2025 - Dia do Trabalho,Dia do Trabalho,,2025-05-01,Mogi Mirim - SP,-22.4151612,-46.9554573
SP,21/04/2025 - Dia de Tiradentes,Dia de Tiradentes,,2025-04-21,Mogi Mirim - SP,-22.4151612,-46.9554573
SP,18/04/2025 - Sexta-Feira Santa,Sexta-Feira Santa,,2025-04-18,Mogi Mirim - SP,-22.4151612,-46.9554573
SP,01/01/2025 - Ano Novo,Ano Novo,,2025-01-01,Mogi Mirim - SP,-22.4151612,-46.9554573
SP,25/12/2025 - Natal,Natal,,2025-12-25,Mogi das Cruzes - SP,-23.5521163,-46.2342052
SP,15/11/2025 - Proclamação da República,Proclamação da República,,2025-11-15,Mogi das Cruzes - SP,-23.5521163,-46.2342052
SP,02/11/2025 - Dia de Finados,Dia de Finados,,2025-11-02,Mogi das Cruzes - SP,-23.5521163,-46.2342052
SP,12/10/2025 - Nossa Senhora Aparecida,Nossa Senhora Aparecida,,2025-10-12,Mogi das Cruzes - SP,-23.5521163,-46.2342052
SP,07/09/2025 - Independência do Brasil,Independência do Brasil,,2025-09-07,Mogi das Cruzes - SP,-23.5521163,-46.2342052
SP,01/09/2025 - Aniversário da cidade,Aniversário da cidade,,2025-09-01,Mogi das Cruzes - SP,-23.5521163,-46.2342052
SP,26/07/2025 - Padroeira,Padroeira,,2025-07-26,Mogi das Cruzes - SP,-23.5521163,-46.2342052
SP,09/07/2025 - Revolução Constitucionalista,Revolução Constitucionalista,,2025-07-09,Mogi das Cruzes - SP,-23.5521163,-46.2342052
SP,19/06/2025 - Corpus Christi,Corpus Christi,,2025-06-19,Mogi das Cruzes - SP,-23.5521163,-46.2342052
SP,01/05/2025 - Dia do Trabalho,Dia do Trabalho,,2025-05-01,Mogi das Cruzes - SP,-23.5521163,-46.2342052
SP,21/04/2025 - Dia de Tiradentes,Dia de Tiradentes,,2025-04-21,Mogi das Cruzes - SP,-23.5521163,-46.2342052
SP,18/04/2025 - Sexta-feira Santa,Sexta-feira Santa,,2025-04-18,Mogi das Cruzes - SP,-23.5521163,-46.2342052
SP,18/04/2025 - Sexta-Feira Santa,Sexta-Feira Santa,,2025-04-18,Mogi das Cruzes - SP,-23.5521163,-46.2342052
SP,01/01/2025 - Ano Novo,Ano Novo,,2025-01-01,Mogi das Cruzes - SP,-23.5521163,-46.2342052
SP,25/12/2025 - Natal,Natal,,2025-12-25,Mococa - SP,-21.4740123,-47.0064214
SP,20/11/2025 - Dia da Consciência Negra,Dia da Consciência Negra,,2025-11-20,Mococa - SP,-21.4740123,-47.0064214
SP,15/11/2025 - Proclamação da República,Proclamação da República,,2025-11-15,Mococa - SP,-21.4740123,-47.0064214
SP,02/11/2025 - Dia de Finados,Dia de Finados,,2025-11-02,Mococa - SP,-21.4740123,-47.0064214
SP,12/10/2025 - Nossa Senhora Aparecida,Nossa Senhora Aparecida,,2025-10-12,Mococa - SP,-21.4740123,-47.0064214
SP,07/09/2025 - Independência do Brasil,Independência do Brasil,,2025-09-07,Mococa - SP,-21.4740123,-47.0064214
SP,09/07/2025 - Revolução Constitucionalista,Revolução Constitucionalista,,2025-07-09,Mococa - SP,-21.4740123,-47.0064214
SP,01/05/2025 - Dia do Trabalho,Dia do Trabalho,,2025-05-01,Mococa - SP,-21.4740123,-47.0064214
SP,21/04/2025 - Dia de Tiradentes,Dia de Tiradentes,,2025-04-21,Mococa - SP,-21.4740123,-47.0064214
SP,18/04/2025 - Sexta-Feira Santa,Sexta-Feira Santa,,2025-04-18,Mococa - SP,-21.4740123,-47.0064214
SP,05/04/2025 - Feriado Municipal,Feriado Municipal,,2025-04-05,Mococa - SP,-21.4740123,-47.0064214
SP,20/01/2025 - Feriado Municipal,Feriado Municipal,,2025-01-20,Mococa - SP,-21.4740123,-47.0064214
SP,01/01/2025 - Ano Novo,Ano Novo,,2025-01-01,Mococa - SP,-21.4740123,-47.0064214
SP,25/12/2025 - Natal,Natal,,2025-12-25,Onda Verde - SP,-20.6090078,-49.297112
SP,20/11/2025 - Dia da Consciência Negra,Dia da Consciência Negra,,2025-11-20,Onda Verde - SP,-20.6090078,-49.297112
SP,15/11/2025 - Proclamação da República,Proclamação da República,,2025-11-15,Onda Verde - SP,-20.6090078,-49.297112
SP,02/11/2025 - Dia de Finados,Dia de Finados,,2025-11-02,Onda Verde - SP,-20.6090078,-49.297112
SP,12/10/2025 - Nossa Senhora Aparecida,Nossa Senhora Aparecida,,2025-10-12,Onda Verde - SP,-20.6090078,-49.297112
SP,07/09/2025 - Independência do Brasil,Independência do Brasil,,2025-09-07,Onda Verde - SP,-20.6090078,-49.297112
SP,06/08/2025 - Feriado Municipal,Feriado Municipal,,2025-08-06,Onda Verde - SP,-20.6090078,-49.297112
SP,09/07/2025 - Revolução Constitucionalista,Revolução Constitucionalista,,2025-07-09,Onda Verde - SP,-20.6090078,-49.297112
SP,24/06/2025 - Feriado Municipal,Feriado Municipal,,2025-06-24,Onda Verde - SP,-20.6090078,-49.297112
SP,01/05/2025 - Dia do Trabalho,Dia do Trabalho,,2025-05-01,Onda Verde - SP,-20.6090078,-49.297112
SP,21/04/2025 - Dia de Tiradentes,Dia de Tiradentes,,2025-04-21,Onda Verde - SP,-20.6090078,-49.297112
SP,18/04/2025 - Sexta-Feira Santa,Sexta-Feira Santa,,2025-04-18,Onda Verde - SP,-20.6090078,-49.297112
SP,22/03/2025 - Feriado Municipal,Feriado Municipal,,2025-03-22,Onda Verde - SP,-20.6090078,-49.297112
SP,01/01/2025 - Ano Novo,Ano Novo,,2025-01-01,Onda Verde - SP,-20.6090078,-49.297112
SP,25/12/2025 - Natal,Natal,,2025-12-25,Piratininga - SP,-23.5383214,-46.6391624
SP,15/11/2025 - Proclamação da República,Proclamação da República,,2025-11-15,Piratininga - SP,-23.5383214,-46.6391624
SP,02/11/2025 - Dia de Finados,Dia de Finados,,2025-11-02,Piratininga - SP,-23.5383214,-46.6391624
SP,12/10/2025 - Nossa Senhora Aparecida,Nossa Senhora Aparecida,,2025-10-12,Piratininga - SP,-23.5383214,-46.6391624
SP,07/09/2025 - Independência do Brasil,Independência do Brasil,,2025-09-07,Piratininga - SP,-23.5383214,-46.6391624
SP,09/07/2025 - Revolução Constitucionalista,Revolução Constitucionalista,,2025-07-09,Piratininga - SP,-23.5383214,-46.6391624
SP,18/05/2025 - Feriado Municipal,Feriado Municipal,,2025-05-18,Piratininga - SP,-23.5383214,-46.6391624
SP,01/05/2025 - Dia do Trabalho,Dia do Trabalho,,2025-05-01,Piratininga - SP,-23.5383214,-46.6391624
SP,21/04/2025 - Dia de Tiradentes,Dia de Tiradentes,,2025-04-21,Piratininga - SP,-23.5383214,-46.6391624
SP,18/04/2025 - Sexta-Feira Santa,Sexta-Feira Santa,,2025-04-18,Piratininga - SP,-23.5383214,-46.6391624
SP,01/01/2025 - Ano Novo,Ano Novo,,2025-01-01,Piratininga - SP,-23.5383214,-46.6391624
SP,25/12/2025 - Natal,Natal,,2025-12-25,Paranapanema - SP,-23.4564966,-48.8232217
SP,15/11/2025 - Proclamação da República,Proclamação da República,,2025-11-15,Paranapanema - SP,-23.4564966,-48.8232217
SP,02/11/2025 - Dia de Finados,Dia de Finados,,2025-11-02,Paranapanema - SP,-23.4564966,-48.8232217
SP,12/10/2025 - Nossa Senhora Aparecida,Nossa Senhora Aparecida,,2025-10-12,Paranapanema - SP,-23.4564966,-48.8232217
SP,07/09/2025 - Independência do Brasil,Independência do Brasil,,2025-09-07,Paranapanema - SP,-23.4564966,-48.8232217
SP,15/08/2025 - Feriado Municipal,Feriado Municipal,,2025-08-15,Paranapanema - SP,-23.4564966,-48.8232217
SP,09/07/2025 - Revolução Constitucionalista,Revolução Constitucionalista,,2025-07-09,Paranapanema - SP,-23.4564966,-48.8232217
SP,09/05/2025 - Feriado Municipal,Feriado Municipal,,2025-05-09,Paranapanema - SP,-23.4564966,-48.8232217
SP,01/05/2025 - Dia do Trabalho,Dia do Trabalho,,2025-05-01,Paranapanema - SP,-23.4564966,-48.8232217
SP,21/04/2025 - Dia de Tiradentes,Dia de Tiradentes,,2025-04-21,Paranapanema - SP,-23.4564966,-48.8232217
SP,20/04/2025 - Feriado Municipal,Feriado Municipal,,2025-04-20,Paranapanema - SP,-23.4564966,-48.8232217
SP,18/04/2025 - Sexta-Feira Santa,Sexta-Feira Santa,,2025-04-18,Paranapanema - SP,-23.4564966,-48.8232217
SP,01/01/2025 - Ano Novo,Ano Novo,,2025-01-01,Paranapanema - SP,-23.4564966,-48.8232217
SP,25/12/2025 - Natal,Natal,,2025-12-25,Potirendaba - SP,-21.0420536,-49.3746094
SP,15/11/2025 - Proclamação da República,Proclamação da República,,2025-11-15,Potirendaba - SP,-21.0420536,-49.3746094
SP,02/11/2025 - Dia de Finados,Dia de Finados,,2025-11-02,Potirendaba - SP,-21.0420536,-49.3746094
SP,12/10/2025 - Nossa Senhora Aparecida,Nossa Senhora Aparecida,,2025-10-12,Potirendaba - SP,-21.0420536,-49.3746094
SP,07/09/2025 - Independência do Brasil,Independência do Brasil,,2025-09-07,Potirendaba - SP,-21.0420536,-49.3746094
SP,06/08/2025 - Feriado Municipal,Feriado Municipal,,2025-08-06,Potirendaba - SP,-21.0420536,-49.3746094
SP,09/07/2025 - Revolução Constitucionalista,Revolução Constitucionalista,,2025-07-09,Potirendaba - SP,-21.0420536,-49.3746094
SP,01/05/2025 - Dia do Trabalho,Dia do Trabalho,,2025-05-01,Potirendaba - SP,-21.0420536,-49.3746094
SP,21/04/2025 - Dia de Tiradentes,Dia de Tiradentes,,2025-04-21,Potirendaba - SP,-21.0420536,-49.3746094
SP,18/04/2025 - Sexta-Feira Santa,Sexta-Feira Santa,,2025-04-18,Potirendaba - SP,-21.0420536,-49.3746094
SP,21/03/2025 - Feriado Municipal,Feriado Municipal,,2025-03-21,Potirendaba - SP,-21.0420536,-49.3746094
SP,01/01/2025 - Ano Novo,Ano Novo,,2025-01-01,Potirendaba - SP,-21.0420536,-49.3746094
SP,25/12/2025 - Natal,Natal,,2025-12-25,Potim - SP,-22.8348497,-45.2487753
SP,15/11/2025 - Proclamação da República,Proclamação da República,,2025-11-15,Potim - SP,-22.8348497,-45.2487753
SP,02/11/2025 - Dia de Finados,Dia de Finados,,2025-11-02,Potim - SP,-22.8348497,-45.2487753
SP,12/10/2025 - Nossa Senhora Aparecida,Nossa Senhora Aparecida,,2025-10-12,Potim - SP,-22.8348497,-45.2487753
SP,07/09/2025 - Independência do Brasil,Independência do Brasil,,2025-09-07,Potim - SP,-22.8348497,-45.2487753
SP,06/08/2025 - Feriado Municipal,Feriado Municipal,,2025-08-06,Potim - SP,-22.8348497,-45.2487753
SP,09/07/2025 - Revolução Constitucionalista,Revolução Constitucionalista,,2025-07-09,Potim - SP,-22.8348497,-45.2487753
SP,19/05/2025 - Feriado Municipal,Feriado Municipal,,2025-05-19,Potim - SP,-22.8348497,-45.2487753
SP,01/05/2025 - Dia do Trabalho,Dia do Trabalho,,2025-05-01,Potim - SP,-22.8348497,-45.2487753
SP,21/04/2025 - Dia de Tiradentes,Dia de Tiradentes,,2025-04-21,Potim - SP,-22.8348497,-45.2487753
SP,18/04/2025 - Sexta-Feira Santa,Sexta-Feira Santa,,2025-04-18,Potim - SP,-22.8348497,-45.2487753
SP,01/01/2025 - Ano Novo,Ano Novo,,2025-01-01,Potim - SP,-22.8348497,-45.2487753
SP,25/12/2025 - Natal,Natal,,2025-12-25,Porto Ferreira - SP,-21.853814,-47.4787764
SP,15/11/2025 - Proclamação da República,Proclamação da República,,2025-11-15,Porto Ferreira - SP,-21.853814,-47.4787764
SP,02/11/2025 - Dia de Finados,Dia de Finados,,2025-11-02,Porto Ferreira - SP,-21.853814,-47.4787764
SP,12/10/2025 - Nossa Senhora Aparecida,Nossa Senhora Aparecida,,2025-10-12,Porto Ferreira - SP,-21.853814,-47.4787764
SP,07/09/2025 - Independência do Brasil,Independência do Brasil,,2025-09-07,Porto Ferreira - SP,-21.853814,-47.4787764
SP,29/07/2025 - Feriado Municipal,Feriado Municipal,,2025-07-29,Porto Ferreira - SP,-21.853814,-47.4787764
SP,09/07/2025 - Revolução Constitucionalista,Revolução Constitucionalista,,2025-07-09,Porto Ferreira - SP,-21.853814,-47.4787764
SP,01/05/2025 - Dia do Trabalho,Dia do Trabalho,,2025-05-01,Porto Ferreira - SP,-21.853814,-47.4787764
SP,21/04/2025 - Dia de Tiradentes,Dia de Tiradentes,,2025-04-21,Porto Ferreira - SP,-21.853814,-47.4787764
SP,18/04/2025 - Sexta-Feira Santa,Sexta-Feira Santa,,2025-04-18,Porto Ferreira - SP,-21.853814,-47.4787764
SP,20/01/2025 - Feriado Municipal,Feriado Municipal,,2025-01-20,Porto Ferreira - SP,-21.853814,-47.4787764
SP,01/01/2025 - Ano Novo,Ano Novo,,2025-01-01,Porto Ferreira - SP,-21.853814,-47.4787764
SP,25/12/2025 - Natal,Natal,,2025-12-25,Porto Feliz - SP,-23.2342137,-47.5227418
SP,20/11/2025 - Dia da Consciência Negra,Dia da Consciência Negra,,2025-11-20,Porto Feliz - SP,-23.2342137,-47.5227418
SP,15/11/2025 - Proclamação da República,Proclamação da República,,2025-11-15,Porto Feliz - SP,-23.2342137,-47.5227418
SP,02/11/2025 - Dia de Finados,Dia de Finados,,2025-11-02,Porto Feliz - SP,-23.2342137,-47.5227418
SP,13/10/2025 - Aniversário da Cidade,Aniversário da Cidade,,2025-10-13,Porto Feliz - SP,-23.2342137,-47.5227418
SP,12/10/2025 - Nossa Senhora Aparecida,Nossa Senhora Aparecida,,2025-10-12,Porto Feliz - SP,-23.2342137,-47.5227418
SP,07/09/2025 - Independência do Brasil,Independência do Brasil,,2025-09-07,Porto Feliz - SP,-23.2342137,-47.5227418
SP,15/08/2025 - Dia de Nossa Senhora Mãe dos Homens - Padroeira da Cidade,Dia de Nossa Senhora Mãe dos Homens,Padroeira da Cidade,2025-08-15,Porto Feliz - SP,-23.2342137,-47.5227418
SP,09/07/2025 - Revolução Constitucionalista,Revolução Constitucionalista,,2025-07-09,Porto Feliz - SP,-23.2342137,-47.5227418
SP,01/05/2025 - Dia do Trabalho,Dia do Trabalho,,2025-05-01,Porto Feliz - SP,-23.2342137,-47.5227418
SP,21/04/2025 - Dia de Tiradentes,Dia de Tiradentes,,2025-04-21,Porto Feliz - SP,-23.2342137,-47.5227418
SP,18/04/2025 - Sexta-Feira Santa,Sexta-Feira Santa,,2025-04-18,Porto Feliz - SP,-23.2342137,-47.5227418
SP,01/01/2025 - Ano Novo,Ano Novo,,2025-01-01,Porto Feliz - SP,-23.2342137,-47.5227418
SP,25/12/2025 - Natal,Natal,,2025-12-25,Porangaba - SP,-22.5987344,-47.8772083
SP,20/11/2025 - Dia da Consciência Negra,Dia da Consciência Negra,,2025-11-20,Porangaba - SP,-22.5987344,-47.8772083
SP,15/11/2025 - Proclamação da República,Proclamação da República,,2025-11-15,Porangaba - SP,-22.5987344,-47.8772083
SP,02/11/2025 - Dia de Finados,Dia de Finados,,2025-11-02,Porangaba - SP,-22.5987344,-47.8772083
SP,12/10/2025 - Nossa Senhora Aparecida,Nossa Senhora Aparecida,,2025-10-12,Porangaba - SP,-22.5987344,-47.8772083
SP,07/09/2025 - Independência do Brasil,Independência do Brasil,,2025-09-07,Porangaba - SP,-22.5987344,-47.8772083
SP,21/07/2025 - Feriado Municipal,Feriado Municipal,,2025-07-21,Porangaba - SP,-22.5987344,-47.8772083
SP,09/07/2025 - Revolução Constitucionalista,Revolução Constitucionalista,,2025-07-09,Porangaba - SP,-22.5987344,-47.8772083
SP,13/06/2025 - Dia de Santo Antônio,Dia de Santo Antônio,,2025-06-13,Porangaba - SP,-22.5987344,-47.8772083
SP,04/06/2025 - Feriado Municipal,Feriado Municipal,,2025-06-04,Porangaba - SP,-22.5987344,-47.8772083
SP,01/05/2025 - Dia do Trabalho,Dia do Trabalho,,2025-05-01,Porangaba - SP,-22.5987344,-47.8772083
SP,21/04/2025 - Dia de Tiradentes,Dia de Tiradentes,,2025-04-21,Porangaba - SP,-22.5987344,-47.8772083
SP,18/04/2025 - Sexta-Feira Santa,Sexta-Feira Santa,,2025-04-18,Porangaba - SP,-22.5987344,-47.8772083
SP,01/01/2025 - Ano Novo,Ano Novo,,2025-01-01,Porangaba - SP,-22.5987344,-47.8772083
SP,25/12/2025 - Natal,Natal,,2025-12-25,Populina - SP,-19.9926832,-50.4599613
SP,15/11/2025 - Proclamação da República,Proclamação da República,,2025-11-15,Populina - SP,-19.9926832,-50.4599613
SP,02/11/2025 - Dia de Finados,Dia de Finados,,2025-11-02,Populina - SP,-19.9926832,-50.4599613
